condition_key_id,name,reference_url,description,type
739,ec2:VolumeSize,https://docs.aws.amazon.com/AWSEC2/latest/UserGuide/iam-policy-structure.html#amazon-ec2-keys,"Filters access by the size of the volume, in GiB",Numeric
740,ec2:VolumeThroughput,https://docs.aws.amazon.com/AWSEC2/latest/UserGuide/iam-policy-structure.html#amazon-ec2-keys,"Filters access by the throughput of the volume, in MiBps",Numeric
741,ec2:VolumeType,https://docs.aws.amazon.com/AWSEC2/latest/UserGuide/iam-policy-structure.html#amazon-ec2-keys,"Filters access by the type of volume (gp2, gp3, io1, io2, st1, sc1, or standard)",String
742,ec2:Vpc,https://docs.aws.amazon.com/AWSEC2/latest/UserGuide/iam-policy-structure.html#amazon-ec2-keys,Filters access by the ARN of the VPC,ARN
743,ec2:VpcID,iam-policy-structure.html#imageId-key,Filters access by the ID of a virtual private cloud (VPC),String
744,ec2:VpcPeeringConnectionID,iam-policy-structure.html#imageId-key,Filters access by the ID of a VPC peering connection,String
745,ec2:VpceServiceName,https://docs.aws.amazon.com/vpc/latest/userguide/vpc-endpoints-iam.html,Filters access by the name of the VPC endpoint service,String
746,ec2:VpceServiceOwner,https://docs.aws.amazon.com/vpc/latest/userguide/vpc-endpoints-iam.html,"Filters access by the service owner of the VPC endpoint service (amazon, aws-marketplace, or an AWS account ID)",String
747,ec2:VpceServicePrivateDnsName,https://docs.aws.amazon.com/vpc/latest/userguide/vpc-endpoints-iam.html,Filters access by the private DNS name of the VPC endpoint service,String
748,ec2:osuser,https://docs.aws.amazon.com/ec2-instance-connect/latest/APIReference/API_SendSSHPublicKey.html,Filters access by specifying the default user name for the AMI that you used to launch your instance,String
749,ec2:transitGatewayAttachmentId,iam-policy-structure.html#imageId-key,Filters access by the ID of a transit gateway attachment,String
750,ec2:transitGatewayConnectPeerId,iam-policy-structure.html#imageId-key,Filters access by the ID of a transit gateway connect peer,String
751,ec2:transitGatewayId,iam-policy-structure.html#imageId-key,Filters access by the ID of a transit gateway,String
752,ec2:transitGatewayMulticastDomainId,iam-policy-structure.html#imageId-key,Filters access by the ID of a transit gateway multicast domain,String
753,ec2:transitGatewayPolicyTableId,iam-policy-structure.html#imageId-key,Filters access by the ID of a transit gateway policy table,String
754,s3tables:tableName,https://docs.aws.amazon.com/AmazonS3/latest/userguide/s3-tables-setting-up.htmls3-tables-setting-up.html,Filters access by the name of the tables in the table bucket,String
755,sagemaker:AcceleratorTypes,https://docs.aws.amazon.com/IAM/latest/UserGuide/list_amazonsagemaker.html#amazonsagemaker-policy-keys,Filters access by the list of all accelerator types associated with the resource in the request,ArrayOfString
756,sagemaker:AppNetworkAccessType,https://docs.aws.amazon.com/IAM/latest/UserGuide/list_amazonsagemaker.html#amazonsagemaker-policy-keys,Filters access by the app network access type associated with the resource in the request,String
757,sagemaker:CustomerMetadataProperties/${MetadataKey},https://docs.aws.amazon.com/IAM/latest/UserGuide/list_amazonsagemaker.html#amazonsagemaker-policy-keys,Filters access by a metadata key and value pair,String
758,sagemaker:CustomerMetadataPropertiesToRemove,https://docs.aws.amazon.com/IAM/latest/UserGuide/list_amazonsagemaker.html#amazonsagemaker-policy-keys,Filters access by the list of metadata properties associated with the model-package resource in the request,ArrayOfString
759,sagemaker:DirectInternetAccess,https://docs.aws.amazon.com/IAM/latest/UserGuide/list_amazonsagemaker.html#amazonsagemaker-policy-keys,Filters access by the direct internet access associated with the resource in the request,String
760,ec2:transitGatewayRouteTableAnnouncementId,iam-policy-structure.html#imageId-key,Filters access by the ID of a transit gateway route table announcement,String
761,ec2:transitGatewayRouteTableId,iam-policy-structure.html#imageId-key,Filters access by the ID of a transit gateway route table,String
762,ec2:vpceMultiRegion,https://docs.aws.amazon.com/vpc/latest/userguide/vpc-endpoints-iam.html,Filters access by multi region of the VPC endpoint service,String
763,ec2:vpceServiceRegion,https://docs.aws.amazon.com/vpc/latest/userguide/vpc-endpoints-iam.html,Filters access by the region of the VPC endpoint service,String
764,ec2:vpceSupportedRegion,https://docs.aws.amazon.com/vpc/latest/userguide/vpc-endpoints-iam.html,Filters access by the supported region of the VPC endpoint service,String
765,ecr-public:ResourceTag/${TagKey},https://docs.aws.amazon.com/AmazonECR/latest/userguide/security_iam_service-with-iam.html#security_iam_service-with-iam-id-based-policies-conditionkeys,Filters actions based on tag-value associated with the resource,String
766,ecr:AccountSetting,https://docs.aws.amazon.com/AmazonECR/latest/userguide/security_iam_service-with-iam.html#security_iam_service-with-iam-id-based-policies-conditionkeys,Filters access by the ECR account setting name,String
767,ecr:ResourceTag/${TagKey},https://docs.aws.amazon.com/AmazonECR/latest/userguide/security_iam_service-with-iam.html#security_iam_service-with-iam-id-based-policies-conditionkeys,Filters access by tag-value associated with the resource,String
768,ecs:CreateAction,https://docs.aws.amazon.com/IAM/latest/UserGuide/reference_policies_condition-keys.html#condition-keys-createaction,Filters access by the name of a resource-creating API action,String
769,ecs:ResourceTag/${TagKey},https://docs.aws.amazon.com/AmazonECS/latest/developerguide/security_iam_service-with-iam.html#security_iam_service-with-iam-id-based-policies,Filters access by the tag key-value pairs attached to the resource,String
770,ecs:account-setting,https://docs.aws.amazon.com/AmazonECS/latest/developerguide/security_iam_service-with-iam.html#security_iam_service-with-iam-id-based-policies-conditionkeys,Filters access by the Amazon ECS account setting name,String
771,ecs:capacity-provider,https://docs.aws.amazon.com/AmazonECS/latest/developerguide/security_iam_service-with-iam.html#security_iam_service-with-iam-id-based-policies-conditionkeys,Filters access by the ARN of an Amazon ECS capacity provider,ARN
772,ecs:cluster,https://docs.aws.amazon.com/AmazonECS/latest/developerguide/security_iam_service-with-iam.html#security_iam_service-with-iam-id-based-policies-conditionkeys,Filters access by the ARN of an Amazon ECS cluster,ARN
773,ecs:container-instances,https://docs.aws.amazon.com/AmazonECS/latest/developerguide/security_iam_service-with-iam.html#security_iam_service-with-iam-id-based-policies-conditionkeys,Filters access by the ARN of an Amazon ECS container instance,ARN
774,ecs:container-name,https://docs.aws.amazon.com/AmazonECS/latest/developerguide/security_iam_service-with-iam.html#security_iam_service-with-iam-id-based-policies-conditionkeys,Filters access by the name of an Amazon ECS container which is defined in the ECS task definition,String
775,ecs:enable-ebs-volumes,https://docs.aws.amazon.com/AmazonECS/latest/developerguide/security_iam_service-with-iam.html#security_iam_service-with-iam-id-based-policies-conditionkeys,Filters access by the Amazon ECS managed Amazon EBS volume capability of your ECS task or service,String
776,ecs:enable-execute-command,https://docs.aws.amazon.com/AmazonECS/latest/developerguide/security_iam_service-with-iam.html#security_iam_service-with-iam-id-based-policies-conditionkeys,Filters access by the execute-command capability of your Amazon ECS task or Amazon ECS service,String
777,ecs:enable-service-connect,https://docs.aws.amazon.com/AmazonECS/latest/developerguide/security_iam_service-with-iam.html#security_iam_service-with-iam-id-based-policies-conditionkeys,Filters access by the enable field value in the Service Connect configuration,String
778,ecs:enable-vpc-lattice,https://docs.aws.amazon.com/AmazonECS/latest/developerguide/security_iam_service-with-iam.html#security_iam_service-with-iam-id-based-policies-conditionkeys,Filters access by the VPC lattice capability of your Amazon ECS service,String
779,ecs:fargate-ephemeral-storage-kms-key,https://docs.aws.amazon.com/AmazonECS/latest/developerguide/security_iam_service-with-iam.html#security_iam_service-with-iam-id-based-policies-conditionkeys,Filters access by the AWS KMS key id provided in the request,String
780,sagemaker:DomainId,https://docs.aws.amazon.com/IAM/latest/UserGuide/list_amazonsagemaker.html#amazonsagemaker-policy-keys,You can use the domainId as a policy variable to filter requests from specific SageMaker Domains,String
781,ecs:namespace,https://docs.aws.amazon.com/AmazonECS/latest/developerguide/security_iam_service-with-iam.html#security_iam_service-with-iam-id-based-policies-conditionkeys,Filters access by the ARN of AWS Cloud Map namespace which is defined in the Service Connect Configuration,ARN
782,ecs:service,https://docs.aws.amazon.com/AmazonECS/latest/developerguide/security_iam_service-with-iam.html#security_iam_service-with-iam-id-based-policies-conditionkeys,Filters access by the ARN of an Amazon ECS service,ARN
783,ecs:task,https://docs.aws.amazon.com/AmazonECS/latest/developerguide/security_iam_service-with-iam.html#security_iam_service-with-iam-id-based-policies-conditionkeys,Filters access by the ARN of an Amazon ECS task,ARN
784,ecs:task-definition,https://docs.aws.amazon.com/AmazonECS/latest/developerguide/security_iam_service-with-iam.html#security_iam_service-with-iam-id-based-policies-conditionkeys,Filters access by the ARN of an Amazon ECS task definition,ARN
785,eks:accessEntryType,https://docs.aws.amazon.com/eks/latest/userguide/security_iam_service-with-iam.html#security_iam_service-with-iam-id-based-policies,Filters access by the access entry type present in the access entry requests the user makes to the EKS service,String
786,eks:accessScope,https://docs.aws.amazon.com/eks/latest/userguide/security_iam_service-with-iam.html#security_iam_service-with-iam-id-based-policies,Filters access by the accessScope present in the associate / disassociate access policy requests the user makes to the EKS service,String
787,eks:authenticationMode,https://docs.aws.amazon.com/eks/latest/userguide/security_iam_service-with-iam.html#security_iam_service-with-iam-id-based-policies,Filters access by the authenticationMode present in the create / update cluster request,String
788,eks:blockStorageEnabled,https://docs.aws.amazon.com/eks/latest/userguide/security_iam_service-with-iam.html#security_iam_service-with-iam-id-based-policies,Filters access by the block storage enabled parameter in the create / update cluster request,Bool
789,sagemaker:DomainSharingOutputKmsKey,https://docs.aws.amazon.com/IAM/latest/UserGuide/list_amazonsagemaker.html#amazonsagemaker-policy-keys,Filters access by the Domain sharing output KMS key associated with the resource in the request,ARN
790,eks:bootstrapClusterCreatorAdminPermissions,https://docs.aws.amazon.com/eks/latest/userguide/security_iam_service-with-iam.html#security_iam_service-with-iam-id-based-policies,Filters access by the bootstrapClusterCreatorAdminPermissions present in the create cluster request,Bool
791,sagemaker:EnableRemoteDebug,https://docs.aws.amazon.com/IAM/latest/UserGuide/list_amazonsagemaker.html#amazonsagemaker-policy-keys,Filters access by the remote debug config in the request,Bool
792,sagemaker:FeatureGroupDisableGlueTableCreation,https://docs.aws.amazon.com/IAM/latest/UserGuide/list_amazonsagemaker.html#amazonsagemaker-policy-keys,Filters access by the DisableGlueTableCreation flag associated with the feature group resource in the request,Bool
793,sagemaker:FeatureGroupEnableOnlineStore,https://docs.aws.amazon.com/IAM/latest/UserGuide/list_amazonsagemaker.html#amazonsagemaker-policy-keys,Filters access by the EnableOnlineStore flag associated with feature group in the request,Bool
794,sagemaker:FeatureGroupOfflineStoreConfig,https://docs.aws.amazon.com/IAM/latest/UserGuide/list_amazonsagemaker.html#amazonsagemaker-policy-keys,Filters access by the presence of an OfflineStoreConfig in the feature group resource in the request. This access filter only supports the null-conditional operator,Bool
795,sagemaker:FeatureGroupOfflineStoreKmsKey,https://docs.aws.amazon.com/IAM/latest/UserGuide/list_amazonsagemaker.html#amazonsagemaker-policy-keys,Filters access by the offline store kms key associated with the feature group resource in the request,ARN
796,sagemaker:FeatureGroupOfflineStoreS3Uri,https://docs.aws.amazon.com/IAM/latest/UserGuide/list_amazonsagemaker.html#amazonsagemaker-policy-keys,Filters access by the offline store s3 uri associated with the feature group resource in the request,String
797,sagemaker:FeatureGroupOnlineStoreKmsKey,https://docs.aws.amazon.com/IAM/latest/UserGuide/list_amazonsagemaker.html#amazonsagemaker-policy-keys,Filters access by the online store kms key associated with the feature group resource in the request,ARN
798,sagemaker:FileSystemAccessMode,https://docs.aws.amazon.com/IAM/latest/UserGuide/list_amazonsagemaker.html#amazonsagemaker-policy-keys,Filters access by a file system access mode associated with the resource in the request,String
799,eks:bootstrapSelfManagedAddons,https://docs.aws.amazon.com/eks/latest/userguide/security_iam_service-with-iam.html#security_iam_service-with-iam-id-based-policies,Filters access by the bootstrapSelfManagedAddons present in the create cluster request,Bool
800,eks:clientId,https://docs.aws.amazon.com/eks/latest/userguide/security_iam_service-with-iam.html#security_iam_service-with-iam-id-based-policies,Filters access by the clientId present in the associateIdentityProviderConfig request the user makes to the EKS service,String
801,eks:clusterName,https://docs.aws.amazon.com/eks/latest/userguide/security_iam_service-with-iam.html#security_iam_service-with-iam-id-based-policies,Filters access by the clusterName present in the access entry requests the user makes to the EKS service,String
802,sagemaker:FileSystemDirectoryPath,https://docs.aws.amazon.com/IAM/latest/UserGuide/list_amazonsagemaker.html#amazonsagemaker-policy-keys,Filters access by a file system directory path associated with the resource in the request,String
803,eks:computeConfigEnabled,https://docs.aws.amazon.com/eks/latest/userguide/security_iam_service-with-iam.html#security_iam_service-with-iam-id-based-policies,Filters access by the compute config enabled parameter in the create / update cluster request,Bool
804,sagemaker:FileSystemId,https://docs.aws.amazon.com/IAM/latest/UserGuide/list_amazonsagemaker.html#amazonsagemaker-policy-keys,Filters access by a file system ID associated with the resource in the request,String
805,sagemaker:FileSystemType,https://docs.aws.amazon.com/IAM/latest/UserGuide/list_amazonsagemaker.html#amazonsagemaker-policy-keys,Filters access by a file system type associated with the resource in the request,String
806,sagemaker:HomeEfsFileSystemKmsKey,https://docs.aws.amazon.com/IAM/latest/UserGuide/list_amazonsagemaker.html#amazonsagemaker-policy-keys,Filters access by a key that is present in the request the user makes to the SageMaker service. This key is deprecated. It has been replaced by sagemaker:VolumeKmsKey,ARN
807,sagemaker:ImageArns,https://docs.aws.amazon.com/IAM/latest/UserGuide/list_amazonsagemaker.html#amazonsagemaker-policy-keys,Filters access by the list of all image arns associated with the resource in the request,ArrayOfARN
808,sagemaker:ImageVersionArns,https://docs.aws.amazon.com/IAM/latest/UserGuide/list_amazonsagemaker.html#amazonsagemaker-policy-keys,Filters access by the list of all image version arns associated with the resource in the request,ArrayOfARN
809,sagemaker:InstanceTypes,https://docs.aws.amazon.com/IAM/latest/UserGuide/list_amazonsagemaker.html#amazonsagemaker-policy-keys,Filters access by the list of all instance types associated with the resource in the request,ArrayOfString
810,sagemaker:InterContainerTrafficEncryption,https://docs.aws.amazon.com/IAM/latest/UserGuide/list_amazonsagemaker.html#amazonsagemaker-policy-keys,Filters access by the inter container traffic encryption associated with the resource in the request,Bool
811,sagemaker:KeepAlivePeriod,https://docs.aws.amazon.com/IAM/latest/UserGuide/list_amazonsagemaker.html#amazonsagemaker-policy-keys,Filters access by the keep-alive period associated with the resource in the request,Numeric
812,eks:elasticLoadBalancingEnabled,https://docs.aws.amazon.com/eks/latest/userguide/security_iam_service-with-iam.html#security_iam_service-with-iam-id-based-policies,Filters access by the elastic load balancing enabled parameter in the create / update cluster request,Bool
813,eks:issuerUrl,https://docs.aws.amazon.com/eks/latest/userguide/security_iam_service-with-iam.html#security_iam_service-with-iam-id-based-policies,Filters access by the issuerUrl present in the associateIdentityProviderConfig request the user makes to the EKS service,String
814,eks:kubernetesGroups,https://docs.aws.amazon.com/eks/latest/userguide/security_iam_service-with-iam.html#security_iam_service-with-iam-id-based-policies,Filters access by the kubernetesGroups present in the access entry requests the user makes to the EKS service,ArrayOfString
815,sagemaker:MaxRuntimeInSeconds,https://docs.aws.amazon.com/IAM/latest/UserGuide/list_amazonsagemaker.html#amazonsagemaker-policy-keys,Filters access by the max runtime in seconds associated with the resource in the request,Numeric
816,eks:namespaces,https://docs.aws.amazon.com/eks/latest/userguide/security_iam_service-with-iam.html#security_iam_service-with-iam-id-based-policies,Filters access by the namespaces present in the associate / disassociate access policy requests the user makes to the EKS service,ArrayOfString
817,eks:policyArn,https://docs.aws.amazon.com/eks/latest/userguide/security_iam_service-with-iam.html#security_iam_service-with-iam-id-based-policies,Filters access by the policyArn present in the access entry requests the user makes to the EKS service,ARN
818,eks:principalArn,https://docs.aws.amazon.com/eks/latest/userguide/security_iam_service-with-iam.html#security_iam_service-with-iam-id-based-policies,Filters access by the principalArn present in the access entry requests requests the user makes to the EKS service,ARN
819,eks:supportType,https://docs.aws.amazon.com/eks/latest/userguide/security_iam_service-with-iam.html#security_iam_service-with-iam-id-based-policies,Filters access by the supportType present in the create / update cluster request,String
820,eks:username,https://docs.aws.amazon.com/eks/latest/userguide/security_iam_service-with-iam.html#security_iam_service-with-iam-id-based-policies,Filters access by the Kubernetes username present in the access entry requests the user makes to the EKS service,String
821,elasticache:AtRestEncryptionEnabled,,,
822,sagemaker:MinimumInstanceMetadataServiceVersion,https://docs.aws.amazon.com/IAM/latest/UserGuide/list_amazonsagemaker.html#amazonsagemaker-policy-keys,Filters access by the minimum instance metadata service version used by the resource in the request,String
823,elasticache:AuthTokenEnabled,,,
824,sagemaker:ModelApprovalStatus,https://docs.aws.amazon.com/IAM/latest/UserGuide/list_amazonsagemaker.html#amazonsagemaker-policy-keys,Filters access by the model approval status with the model-package in the request,String
825,sagemaker:ModelArn,https://docs.aws.amazon.com/IAM/latest/UserGuide/list_amazonsagemaker.html#amazonsagemaker-policy-keys,Filters access by the model arn associated with the resource in the request,ARN
826,sagemaker:NetworkIsolation,https://docs.aws.amazon.com/IAM/latest/UserGuide/list_amazonsagemaker.html#amazonsagemaker-policy-keys,Filters access by the network isolation associated with the resource in the request,Bool
827,sagemaker:OutputKmsKey,https://docs.aws.amazon.com/IAM/latest/UserGuide/list_amazonsagemaker.html#amazonsagemaker-policy-keys,Filters access by the output kms key associated with the resource in the request,ARN
828,sagemaker:OwnerUserProfileArn,https://docs.aws.amazon.com/IAM/latest/UserGuide/list_amazonsagemaker.html#amazonsagemaker-policy-keys,Filters access by the OwnerUserProfile arn associated with the space in the request,ARN
829,sagemaker:ResourceTag/,https://docs.aws.amazon.com/IAM/latest/UserGuide/list_amazonsagemaker.html#amazonsagemaker-policy-keys,Filters access by the preface string for a tag key and value pair attached to a resource,String
830,sagemaker:ResourceTag/${TagKey},https://docs.aws.amazon.com/IAM/latest/UserGuide/list_amazonsagemaker.html#amazonsagemaker-policy-keys,Filters access by a tag key and value pair,String
831,sagemaker:RootAccess,https://docs.aws.amazon.com/IAM/latest/UserGuide/list_amazonsagemaker.html#amazonsagemaker-policy-keys,Filters access by the root access associated with the resource in the request,String
832,sagemaker:SearchVisibilityCondition/${FilterKey},https://docs.aws.amazon.com/IAM/latest/UserGuide/list_amazonsagemaker.html#amazonsagemaker-policy-keys,Limits the results of your search request to the resources that you can access. ${FilterKey} is a key that the VisibilityConditions configuration presents in the Search request,String
833,sagemaker:ServerlessMaxConcurrency,https://docs.aws.amazon.com/IAM/latest/UserGuide/list_amazonsagemaker.html#amazonsagemaker-policy-keys,Filters access by limiting maximum concurrency used for Serverless inference in the request,Numeric
834,sagemaker:ServerlessMemorySize,https://docs.aws.amazon.com/IAM/latest/UserGuide/list_amazonsagemaker.html#amazonsagemaker-policy-keys,Filters access by limiting memory size used for Serverless inference in the request,Numeric
835,sagemaker:SpaceSharingType,https://docs.aws.amazon.com/IAM/latest/UserGuide/list_amazonsagemaker.html#amazonsagemaker-policy-keys,Filters access by the sharing type associated with the space in the request,String
836,sagemaker:TaggingAction,https://docs.aws.amazon.com/IAM/latest/UserGuide/list_amazonsagemaker.html#amazonsagemaker-policy-keys,Filters access by the API actions to which a user can apply tags. Uses the name of the API operation that creates a taggable resource to filter access,String
837,elasticache:AutomaticFailoverEnabled,,,
838,elasticache:CacheNodeType,,,
839,elasticache:CacheParameterGroupName,,,
840,sagemaker:TargetModel,https://docs.aws.amazon.com/IAM/latest/UserGuide/list_amazonsagemaker.html#amazonsagemaker-policy-keys,Filters access by the target model associated with the Multi-Model Endpoint in the request,String
841,ec2:InsideTunnelCidr,https://docs.aws.amazon.com/vpn/latest/s2svpn/vpn-authentication-access-control.html,Filters access by the range of inside IP addresses for a VPN tunnel,String
842,sagemaker:UserProfileName,https://docs.aws.amazon.com/IAM/latest/UserGuide/list_amazonsagemaker.html#amazonsagemaker-policy-keys,You can use the UserProfileName as a policy variable to filter requests from specific user profiles within a SageMaker Domain. This context key is not applicable to user profiles within shared spaces,String
843,sagemaker:VolumeKmsKey,https://docs.aws.amazon.com/IAM/latest/UserGuide/list_amazonsagemaker.html#amazonsagemaker-policy-keys,Filters access by the volume kms key associated with the resource in the request,ARN
844,ec2:InsideTunnelIpv6Cidr,https://docs.aws.amazon.com/vpn/latest/s2svpn/vpn-authentication-access-control.html,Filters access by a range of inside IPv6 addresses for a VPN tunnel,String
845,elasticache:ClusterModeEnabled,,,
846,elasticache:DataStorageUnit,,,
847,elasticache:EngineType,,,
848,elasticache:EngineVersion,,,
849,elasticache:KmsKeyId,,,
850,elasticache:MaximumDataStorage,,,
851,sagemaker:VpcSecurityGroupIds,https://docs.aws.amazon.com/IAM/latest/UserGuide/list_amazonsagemaker.html#amazonsagemaker-policy-keys,Filters access by the list of all VPC security group ids associated with the resource in the request,ArrayOfString
852,elasticache:MaximumECPUPerSecond,,,
853,elasticache:MinimumDataStorage,,,
854,elasticache:MinimumECPUPerSecond,,,
855,elasticache:MultiAZEnabled,,,
856,elasticache:NumNodeGroups,,,
857,elasticache:ReplicasPerNodeGroup,,,
858,elasticache:SnapshotRetentionLimit,,,
859,elasticache:TransitEncryptionEnabled,,,
860,elasticache:UserAuthenticationMode,,,
861,sagemaker:VpcSubnets,https://docs.aws.amazon.com/IAM/latest/UserGuide/list_amazonsagemaker.html#amazonsagemaker-policy-keys,Filters access by the list of all VPC subnets associated with the resource in the request,ArrayOfString
862,elasticbeanstalk:FromApplication,https://docs.aws.amazon.com/elasticbeanstalk/latest/dg/AWSHowTo.iam.policies.actions.html#AWSHowTo.iam.policies.conditions,Filters access by an application as a dependency or a constraint on an input parameter,ARN
863,elasticbeanstalk:FromApplicationVersion,https://docs.aws.amazon.com/elasticbeanstalk/latest/dg/AWSHowTo.iam.policies.actions.html#AWSHowTo.iam.policies.conditions,Filters access by an application version as a dependency or a constraint on an input parameter,ARN
864,elasticbeanstalk:FromConfigurationTemplate,https://docs.aws.amazon.com/elasticbeanstalk/latest/dg/AWSHowTo.iam.policies.actions.html#AWSHowTo.iam.policies.conditions,Filters access by a configuration template as a dependency or a constraint on an input parameter,ARN
865,elasticbeanstalk:FromEnvironment,https://docs.aws.amazon.com/elasticbeanstalk/latest/dg/AWSHowTo.iam.policies.actions.html#AWSHowTo.iam.policies.conditions,Filters access by an environment as a dependency or a constraint on an input parameter,ARN
866,elasticbeanstalk:FromPlatform,https://docs.aws.amazon.com/elasticbeanstalk/latest/dg/AWSHowTo.iam.policies.actions.html#AWSHowTo.iam.policies.conditions,Filters access by a platform as a dependency or a constraint on an input parameter,ARN
