condition_key_id,name,reference_url,description,type
245,backup:MaxRetentionDays,https://docs.aws.amazon.com/aws-backup/latest/devguide/access-control.html#amazon-backup-keys,Filters access by the value of the MaxRetentionDays parameter,Numeric
246,backup:MinRetentionDays,https://docs.aws.amazon.com/aws-backup/latest/devguide/access-control.html#amazon-backup-keys,Filters access by the value of the MinRetentionDays parameter,Numeric
247,batch:AWSLogsCreateGroup,https://docs.aws.amazon.com/service-authorization/latest/reference/list_awsbatch.html#awsbatch-policy-keys,Filters access by the specified logging driver to determine whether awslogs group will be created for the logs,Bool
248,batch:AWSLogsGroup,https://docs.aws.amazon.com/service-authorization/latest/reference/list_awsbatch.html#awsbatch-policy-keys,Filters access by the awslogs group where the logs are located,String
249,batch:AWSLogsRegion,https://docs.aws.amazon.com/service-authorization/latest/reference/list_awsbatch.html#awsbatch-policy-keys,Filters access by the region where the logs are sent to,String
250,batch:AWSLogsStreamPrefix,https://docs.aws.amazon.com/service-authorization/latest/reference/list_awsbatch.html#awsbatch-policy-keys,Filters access by the awslogs log stream prefix,String
251,batch:EKSImage,https://docs.aws.amazon.com/service-authorization/latest/reference/list_awsbatch.html#awsbatch-policy-keys,Filters access by the image used to start a container for an Amazon EKS job,String
252,batch:EKSNamespace,https://docs.aws.amazon.com/service-authorization/latest/reference/list_awsbatch.html#awsbatch-policy-keys,Filters access by the namespace of a cluster used to run the pod for an Amazon EKS job,String
253,batch:EKSPrivileged,https://docs.aws.amazon.com/service-authorization/latest/reference/list_awsbatch.html#awsbatch-policy-keys,Filters access by the specified privileged parameter value that determines whether the container is given elevated privileges on the host container instance (similar to the root user) for an Amazon EKS job,Bool
254,batch:EKSRunAsGroup,https://docs.aws.amazon.com/service-authorization/latest/reference/list_awsbatch.html#awsbatch-policy-keys,Filters access by the specified group numeric ID (gid) used to start a container in an Amazon EKS job,Numeric
255,batch:EKSRunAsUser,https://docs.aws.amazon.com/service-authorization/latest/reference/list_awsbatch.html#awsbatch-policy-keys,Filters access by the specified user numeric ID (uid) used to start a a container in an Amazon EKS job,Numeric
256,batch:EKSServiceAccountName,https://docs.aws.amazon.com/service-authorization/latest/reference/list_awsbatch.html#awsbatch-policy-keys,Filters access by the name of the service account used to run the pod for an Amazon EKS job,String
257,batch:Image,https://docs.aws.amazon.com/service-authorization/latest/reference/list_awsbatch.html#awsbatch-policy-keys,Filters access by the image used to start a container,String
258,batch:LogDriver,https://docs.aws.amazon.com/service-authorization/latest/reference/list_awsbatch.html#awsbatch-policy-keys,Filters access by the log driver used for the container,String
259,batch:Privileged,https://docs.aws.amazon.com/service-authorization/latest/reference/list_awsbatch.html#awsbatch-policy-keys,Filters access by the specified privileged parameter value that determines whether the container is given elevated privileges on the host container instance (similar to the root user),Bool
260,batch:ShareIdentifier,https://docs.aws.amazon.com/service-authorization/latest/reference/list_awsbatch.html#awsbatch-policy-keys,Filters access by the shareIdentifier used inside submit job,String
261,batch:User,https://docs.aws.amazon.com/service-authorization/latest/reference/list_awsbatch.html#awsbatch-policy-keys,Filters access by user name or numeric uid used inside the container,String
262,bedrock:InferenceProfileArn,https://docs.aws.amazon.com/IAM/latest/UserGuide/reference_policies_condition-keys.html#condition-keys-globally-available,Filters access by the specified inference profile,ARN
263,bedrock:PromptRouterArn,https://docs.aws.amazon.com/IAM/latest/UserGuide/reference_policies_condition-keys.html#condition-keys-globally-available,Filters access by the specified prompt router,ARN
264,bedrock:ThirdPartyKnowledgeBaseCredentialsSecretArn,https://docs.aws.amazon.com/IAM/latest/UserGuide/reference_policies_condition-keys.html#condition-keys-globally-available,Filters access by the secretArn containing the credentials of the third party platform,ARN
265,catalog:ChangeType,https://docs.aws.amazon.com/marketplace-catalog/latest/api-reference/api-access-control.html,Filters access by the change type in the StartChangeSet request,String
266,cleanrooms-ml:CollaborationId,https://docs.aws.amazon.com/TBD,Filters access by Clean rooms collaboration id,String
267,cloud9:EnvironmentId,https://docs.aws.amazon.com/IAM/latest/UserGuide/list_awscloud9.html##awscloud9-cloud9_EnvironmentId,Filters access by the AWS Cloud9 environment ID,String
268,cloud9:EnvironmentName,https://docs.aws.amazon.com/IAM/latest/UserGuide/list_awscloud9.html##awscloud9-cloud9_EnvironmentName,Filters access by the AWS Cloud9 environment name,String
269,cloud9:InstanceType,https://docs.aws.amazon.com/IAM/latest/UserGuide/list_awscloud9.html##awscloud9-cloud9_InstanceType,Filters access by the instance type of the AWS Cloud9 environment's Amazon EC2 instance,String
270,cloud9:OwnerArn,https://docs.aws.amazon.com/IAM/latest/UserGuide/list_awscloud9.html##awscloud9-cloud9_OwnerArn,Filters access by the owner ARN specified,ARN
271,cloud9:Permissions,https://docs.aws.amazon.com/IAM/latest/UserGuide/list_awscloud9.html##awscloud9-cloud9_Permissions,Filters access by the type of AWS Cloud9 permissions,String
272,cloud9:SubnetId,https://docs.aws.amazon.com/IAM/latest/UserGuide/list_awscloud9.html##awscloud9-cloud9_SubnetId,Filters access by the subnet ID that the AWS Cloud9 environment will be created in,String
273,cloud9:UserArn,https://docs.aws.amazon.com/IAM/latest/UserGuide/list_awscloud9.html##awscloud9-cloud9_UserArn,Filters access by the user ARN specified,ARN
274,cloudformation:ChangeSetName,https://docs.aws.amazon.com/AWSCloudFormation/latest/UserGuide/using-iam-template.html#using-iam-template-conditions,Filters access by an AWS CloudFormation change set name. Use to control which change sets IAM users can execute or delete,String
275,cloudformation:CreateAction,https://docs.aws.amazon.com/AWSCloudFormation/latest/UserGuide/using-iam-template.html#using-iam-template-conditions,Filters access by the name of a resource-mutating API action. Use to control which APIs IAM users can use to add or remove tags on a stack or stack set,String
276,cloudformation:ImportResourceTypes,https://docs.aws.amazon.com/AWSCloudFormation/latest/UserGuide/using-iam-template.html#using-iam-template-conditions,"Filters access by the template resource types, such as AWS::EC2::Instance. Use to control which resource types IAM users can work with when they want to import a resource into a stack",String
277,cloudformation:ResourceTypes,https://docs.aws.amazon.com/AWSCloudFormation/latest/UserGuide/using-iam-template.html#using-iam-template-conditions,"Filters access by the template resource types, such as AWS::EC2::Instance. Use to control which resource types IAM users can work with when they create or update a stack",ArrayOfString
278,cloudformation:RoleArn,https://docs.aws.amazon.com/AWSCloudFormation/latest/UserGuide/using-iam-template.html#using-iam-template-conditions,Filters access by the ARN of an IAM service role. Use to control which service role IAM users can use to work with stacks or change sets,ARN
279,cloudformation:StackPolicyUrl,https://docs.aws.amazon.com/AWSCloudFormation/latest/UserGuide/using-iam-template.html#using-iam-template-conditions,Filters access by an Amazon S3 stack policy URL. Use to control which stack policies IAM users can associate with a stack during a create or update stack action,String
280,cloudformation:TargetRegion,https://docs.aws.amazon.com/AWSCloudFormation/latest/UserGuide/using-iam-template.html#using-iam-template-conditions,Filters access by stack set target region. Use to control which regions IAM users can use when they create or update stack sets,ArrayOfString
281,cloudformation:TemplateUrl,https://docs.aws.amazon.com/AWSCloudFormation/latest/UserGuide/using-iam-template.html#using-iam-template-conditions,Filters access by an Amazon S3 template URL. Use to control which templates IAM users can use when they create or update stacks,String
282,cloudshell:SecurityGroupIds,https://docs.aws.amazon.com/cloudshell/latest/userguide/aws-cloudshell-vpc-permissions-1.html#vpc-condition-keys-examples-1,Filters access by security group ids. Available during CreateEnvironment operation,ArrayOfString
283,cloudshell:SubnetIds,https://docs.aws.amazon.com/cloudshell/latest/userguide/aws-cloudshell-vpc-permissions-1.html#vpc-condition-keys-examples-1,Filters access by subnet ids. Available during CreateEnvironment operation,ArrayOfString
284,cloudshell:VpcIds,https://docs.aws.amazon.com/cloudshell/latest/userguide/aws-cloudshell-vpc-permissions-1.html#vpc-condition-keys-examples-1,Filters access by vpc ids. Available during CreateEnvironment operation,ArrayOfString
285,cloudwatch:AlarmActions,https://docs.aws.amazon.com/AmazonCloudWatch/latest/monitoring/iam-cw-condition-keys-alarm-actions.html,Filters actions based on defined alarm actions,ArrayOfString
286,cloudwatch:namespace,https://docs.aws.amazon.com/AmazonCloudWatch/latest/monitoring/iam-cw-condition-keys-namespace.html,Filters actions based on the presence of optional namespace values,String
287,cloudwatch:requestInsightRuleLogGroups,https://docs.aws.amazon.com/AmazonCloudWatch/latest/monitoring/iam-cw-condition-keys-contributor.html,Filters actions based on the Log Groups specified in an Insight Rule,ArrayOfString
288,cloudwatch:requestManagedResourceARNs,https://docs.aws.amazon.com/AmazonCloudWatch/latest/monitoring/iam-cw-condition-keys-contributor.html,Filters access by the Resource ARNs specified in a managed Insight Rule,ArrayOfARN
289,codebuild:buildArn,https://docs.aws.amazon.com/codebuild/latest/userguide/auth-and-access-control-permissions-reference.html,Filters access by the ARN of the AWS CodeBuild build from which the request originated,ARN
290,codebuild:projectArn,https://docs.aws.amazon.com/codebuild/latest/userguide/auth-and-access-control-permissions-reference.html,Filters access by the ARN of the AWS CodeBuild project from which the request originated,ARN
291,codecommit:References,https://docs.aws.amazon.com/codecommit/latest/userguide/how-to-conditional-branch.html,Filters access by Git reference to specified AWS CodeCommit actions,String
292,codeconnections:Branch,https://docs.aws.amazon.com/dtconsole/latest/userguide/security-iam.html#permissions-reference-connections-handshake,Filters access by the branch name that is passed in the request,String
293,codeconnections:BranchName,https://docs.aws.amazon.com/dtconsole/latest/userguide/security-iam.html#permissions-reference-connections-use,Filters access by the branch name that is passed in the request. Applies only to UseConnection requests for access to a specific repository branch,String
294,codeconnections:FullRepositoryId,https://docs.aws.amazon.com/dtconsole/latest/userguide/security-iam.html#permissions-reference-connections-use,Filters access by the repository that is passed in the request. Applies only to UseConnection requests for access to a specific repository,String
295,codeconnections:HostArn,https://docs.aws.amazon.com/dtconsole/latest/userguide/security-iam.html#permissions-reference-connections-hosts,Filters access by the host resource associated with the connection used in the request,ARN
296,codeconnections:InstallationId,https://docs.aws.amazon.com/dtconsole/latest/userguide/security-iam.html#permissions-reference-connections-handshake,Filters access by the third-party ID (such as the Bitbucket App installation ID for CodeConnections) that is used to update a Connection. Allows you to restrict which third-party App installations can be used to make a Connection,String
297,codeconnections:OwnerId,https://docs.aws.amazon.com/dtconsole/latest/userguide/security-iam.html#permissions-reference-connections-use,Filters access by the owner of the third-party repository. Applies only to UseConnection requests for access to repositories owned by a specific user,String
298,codeconnections:PassedToService,https://docs.aws.amazon.com/dtconsole/latest/userguide/security-iam.html#permissions-reference-connections-passconnection,Filters access by the service to which the principal is allowed to pass a Connection or RepositoryLink,String
299,codeconnections:ProviderAction,https://docs.aws.amazon.com/dtconsole/latest/userguide/security-iam.html#permissions-reference-connections-access,Filters access by the provider action in a UseConnection request such as ListRepositories. See documentation for all valid values,ArrayOfString
300,codeconnections:ProviderPermissionsRequired,https://docs.aws.amazon.com/dtconsole/latest/userguide/security-iam.html#permissions-reference-connections-use,Filters access by the write permissions of a provider action in a UseConnection request. Valid types include read_only and read_write,String
301,codeconnections:ProviderType,https://docs.aws.amazon.com/dtconsole/latest/userguide/security-iam.html#permissions-reference-connections-managing,Filters access by the type of third-party provider passed in the request,String
302,codeconnections:ProviderTypeFilter,https://docs.aws.amazon.com/dtconsole/latest/userguide/security-iam.html#permissions-reference-connections-managing,Filters access by the type of third-party provider used to filter results,String
303,codeconnections:RepositoryName,https://docs.aws.amazon.com/dtconsole/latest/userguide/security-iam.html#permissions-reference-connections-use,Filters access by the repository name that is passed in the request. Applies only to UseConnection requests for access to repositories owned by a specific user,String
304,codestar-connections:Branch,https://docs.aws.amazon.com/dtconsole/latest/userguide/security-iam.html#permissions-reference-connections-handshake,Filters access by the branch name that is passed in the request,String
305,codestar-connections:BranchName,https://docs.aws.amazon.com/dtconsole/latest/userguide/security-iam.html#permissions-reference-connections-use,Filters access by the branch name that is passed in the request. Applies only to UseConnection requests for access to a specific repository branch,String
306,codestar-connections:FullRepositoryId,https://docs.aws.amazon.com/dtconsole/latest/userguide/security-iam.html#permissions-reference-connections-use,Filters access by the repository that is passed in the request. Applies only to UseConnection requests for access to a specific repository,String
307,codestar-connections:HostArn,https://docs.aws.amazon.com/dtconsole/latest/userguide/security-iam.html#permissions-reference-connections-hosts,Filters access by the host resource associated with the connection used in the request,ARN
308,codestar-connections:InstallationId,https://docs.aws.amazon.com/dtconsole/latest/userguide/security-iam.html#permissions-reference-connections-handshake,Filters access by the third-party ID (such as the Bitbucket App installation ID for CodeStar Connections) that is used to update a Connection. Allows you to restrict which third-party App installations can be used to make a Connection,String
309,codestar-connections:OwnerId,https://docs.aws.amazon.com/dtconsole/latest/userguide/security-iam.html#permissions-reference-connections-use,Filters access by the owner of the third-party repository. Applies only to UseConnection requests for access to repositories owned by a specific user,String
310,codestar-connections:PassedToService,https://docs.aws.amazon.com/dtconsole/latest/userguide/security-iam.html#permissions-reference-connections-passconnection,Filters access by the service to which the principal is allowed to pass a Connection or RepositoryLink,String
311,codestar-connections:ProviderAction,https://docs.aws.amazon.com/dtconsole/latest/userguide/security-iam.html#permissions-reference-connections-access,Filters access by the provider action in a UseConnection request such as ListRepositories. See documentation for all valid values,ArrayOfString
312,codestar-connections:ProviderPermissionsRequired,https://docs.aws.amazon.com/dtconsole/latest/userguide/security-iam.html#permissions-reference-connections-use,Filters access by the write permissions of a provider action in a UseConnection request. Valid types include read_only and read_write,String
313,codestar-connections:ProviderType,https://docs.aws.amazon.com/dtconsole/latest/userguide/security-iam.html#permissions-reference-connections-managing,Filters access by the type of third-party provider passed in the request,String
314,codestar-connections:ProviderTypeFilter,https://docs.aws.amazon.com/dtconsole/latest/userguide/security-iam.html#permissions-reference-connections-managing,Filters access by the type of third-party provider used to filter results,String
315,codestar-connections:RepositoryName,https://docs.aws.amazon.com/dtconsole/latest/userguide/security-iam.html#permissions-reference-connections-use,Filters access by the repository name that is passed in the request. Applies only to UseConnection requests for access to repositories owned by a specific user,String
316,codestar-notifications:NotificationsForResource,https://docs.aws.amazon.com/codestar-notifications/latest/userguide/security_iam_id-based-policy-examples.html,Filters access based on the ARN of the resource for which notifications are configured,ARN
317,cognito-identity.amazonaws.com:amr,https://docs.aws.amazon.com/IAM/latest/UserGuide/reference_policies_iam-condition-keys.html#ck_amr,Filters access by the login information for Amazon Cognito,String
318,cognito-identity.amazonaws.com:aud,https://docs.aws.amazon.com/IAM/latest/UserGuide/reference_policies_iam-condition-keys.html#ck_aud,Filters access by the Amazon Cognito identity pool ID,String
319,cognito-identity.amazonaws.com:sub,https://docs.aws.amazon.com/IAM/latest/UserGuide/reference_policies_iam-condition-keys.html#ck_sub,Filters access by the subject of the claim (the Amazon Cognito user ID),String
320,comprehend:DataLakeKmsKey,https://docs.aws.amazon.com/IAM/latest/UserGuide/list_amazoncomprehend.html#amazoncomprehend-policy-keys,Filters access by the DataLake Kms Key associated with the flywheel resource in the request,ARN
321,comprehend:FlywheelIterationId,https://docs.aws.amazon.com/IAM/latest/UserGuide/list_amazoncomprehend.html#amazoncomprehend-policy-keys,Filters access by particular Iteration Id for a flywheel,String
322,comprehend:ModelKmsKey,https://docs.aws.amazon.com/IAM/latest/UserGuide/list_amazoncomprehend.html#amazoncomprehend-policy-keys,Filters access by the model KMS key associated with the resource in the request,ARN
323,comprehend:OutputKmsKey,https://docs.aws.amazon.com/IAM/latest/UserGuide/list_amazoncomprehend.html#amazoncomprehend-policy-keys,Filters access by the output KMS key associated with the resource in the request,ARN
324,comprehend:VolumeKmsKey,https://docs.aws.amazon.com/IAM/latest/UserGuide/list_amazoncomprehend.html#amazoncomprehend-policy-keys,Filters access by the volume KMS key associated with the resource in the request,ARN
325,comprehend:VpcSecurityGroupIds,https://docs.aws.amazon.com/IAM/latest/UserGuide/list_amazoncomprehend.html#amazoncomprehend-policy-keys,Filters access by the list of all VPC security group ids associated with the resource in the request,ArrayOfString
326,comprehend:VpcSubnets,https://docs.aws.amazon.com/IAM/latest/UserGuide/list_amazoncomprehend.html#amazoncomprehend-policy-keys,Filters access by the list of all VPC subnets associated with the resource in the request,ArrayOfString
327,compute-optimizer:ResourceType,https://docs.aws.amazon.com/compute-optimizer/latest/ug/security-iam.html,Filters access by the resource type,String
328,config:ConfigurationRecorderServicePrincipal,https://docs.aws.amazon.com/config/latest/developerguide/security_iam_service-with-iam.html#security_iam_service-with-iam-id-based-policies-conditionkeys,Filters access by service principal of the configuration recorder,String
329,connect:AssignmentType,https://docs.aws.amazon.com/connect/latest/adminguide/security_iam_service-with-iam.html,Filters access by restricting access to create contacts based on Assignment Type,String
330,connect:AttributeType,https://docs.aws.amazon.com/connect/latest/adminguide/security_iam_service-with-iam.html,Filters access by the attribute type of the Amazon Connect instance,String
331,connect:FlowType,https://docs.aws.amazon.com/connect/latest/adminguide/security_iam_service-with-iam.html,Filters access by Flow type,ArrayOfString
332,connect:InstanceId,https://docs.aws.amazon.com/connect/latest/adminguide/security_iam_service-with-iam.html,Filters access by restricting federation into specified Amazon Connect instances,String
333,connect:MonitorCapabilities,https://docs.aws.amazon.com/connect/latest/adminguide/security_iam_service-with-iam.html,Filters access by restricting the monitor capabilities of the user in the request,ArrayOfString
334,connect:SearchContactsByContactAnalysis,https://docs.aws.amazon.com/connect/latest/adminguide/security_iam_service-with-iam.html,Filters access by restricting searches using analysis outputs from Amazon Connect Contact Lens,ArrayOfString
335,connect:SearchTag/${TagKey},https://docs.aws.amazon.com/connect/latest/adminguide/security_iam_service-with-iam.html,Filters access by TagFilter condition passed in the search request,String
336,connect:StorageResourceType,https://docs.aws.amazon.com/connect/latest/adminguide/security_iam_service-with-iam.html,Filters access by restricting the storage resource type of the Amazon Connect instance storage configuration,String
337,connect:Subtype,https://docs.aws.amazon.com/connect/latest/adminguide/security_iam_service-with-iam.html,Filters access by restricting creation of a contact for specific subtypes,String
338,connect:UserArn,https://docs.aws.amazon.com/connect/latest/APIReference/API_User.html,Filters access by UserArn,ARN
339,dataexchange:JobType,https://docs.aws.amazon.com/data-exchange/latest/userguide/access-control.html,Filters access by the specified job type,String
340,datapipeline:PipelineCreator,https://docs.aws.amazon.com/datapipeline/latest/DeveloperGuide/dp-example-tag-policies.html#ex3,Filters access by the IAM user that created the pipeline,ArrayOfString
341,datapipeline:Tag,https://docs.aws.amazon.com/datapipeline/latest/DeveloperGuide/dp-iam-resourcebased-access.html#dp-control-access-tags,Filters access by customer-specified key/value pair that can be attached to a resource,ArrayOfString
342,datapipeline:workerGroup,https://docs.aws.amazon.com/datapipeline/latest/DeveloperGuide/dp-iam-resourcebased-access.html#dp-control-access-workergroup,Filters access by the name of a worker group for which a Task Runner retrieves work,ArrayOfString
343,datazone:domainId,https://docs.aws.amazon.com/IAM/latest/UserGuide/reference_policies_condition-keys.html#amazondatazone-policy-keys,Filters access by the domain ID passed in the request,String
344,datazone:projectId,https://docs.aws.amazon.com/IAM/latest/UserGuide/reference_policies_condition-keys.html#amazondatazone-policy-keys,Filters access by the project ID passed in the request,String
345,datazone:userId,https://docs.aws.amazon.com/IAM/latest/UserGuide/reference_policies_condition-keys.html#amazondatazone-policy-keys,Filters access by the user ID passed in the request,String
346,dax:EnclosingOperation,https://docs.aws.amazon.com/amazondynamodb/latest/developerguide/DAX.access-control.htmlspecifying-conditions.html#FGAC_DDB.ConditionKeys,Used to block Transactions APIs calls and allow the non-Transaction APIs calls and vice-versa,String
347,deadline:AssociatedMembershipLevel,https://docs.aws.amazon.com/deadline-cloud/latest/userguide/security-iam-service-with-iam.html,Filters access by the associated membership level of the principal provided in the request,String
348,deadline:FarmMembershipLevels,https://docs.aws.amazon.com/deadline-cloud/latest/userguide/security-iam-service-with-iam.html,Filters access by membership levels on the farm,ArrayOfString
349,deadline:FleetMembershipLevels,https://docs.aws.amazon.com/deadline-cloud/latest/userguide/security-iam-service-with-iam.html,Filters access by membership levels on the fleet,ArrayOfString
350,deadline:JobMembershipLevels,https://docs.aws.amazon.com/deadline-cloud/latest/userguide/security-iam-service-with-iam.html,Filters access by membership levels on the job,ArrayOfString
351,deadline:MembershipLevel,https://docs.aws.amazon.com/deadline-cloud/latest/userguide/security-iam-service-with-iam.html,Filters access by the membership level passed in the request,String
352,deadline:PrincipalId,https://docs.aws.amazon.com/deadline-cloud/latest/userguide/security-iam-service-with-iam.html,Filters access by the principle ID provided in the request,String
353,deadline:QueueMembershipLevels,https://docs.aws.amazon.com/deadline-cloud/latest/userguide/security-iam-service-with-iam.html,Filters access by membership levels on the queue,ArrayOfString
354,deadline:RequesterPrincipalId,https://docs.aws.amazon.com/deadline-cloud/latest/userguide/security-iam-service-with-iam.html,Filters access by the user calling the Deadline Cloud API,String
355,deepracer:MultiUser,https://docs.aws.amazon.com/deepracer/latest/developerguide/reference_policies_iam-condition-keys.html#condition-keys-multiuser,Filters access by multiuser flag,Bool
