condition_key_id,name,reference_url,description,type
958,secretsmanager:KmsKeyArn,https://docs.aws.amazon.com/IAM/latest/UserGuide/reference_policies_condition-keys.html,Filters access by the key ARN of the KMS key in the request,ARN
959,secretsmanager:KmsKeyId,https://docs.aws.amazon.com/IAM/latest/UserGuide/reference_policies_condition-keys.html,Filters access by the key identifier of the KMS key in the request. Deprecated: Use secretsmanager:KmsKeyArn,String
960,secretsmanager:ModifyRotationRules,https://docs.aws.amazon.com/IAM/latest/UserGuide/reference_policies_condition-keys.html,Filters access by whether the rotation rules of the secret are to be modified,Bool
961,secretsmanager:Name,https://docs.aws.amazon.com/IAM/latest/UserGuide/reference_policies_condition-keys.html,Filters access by the friendly name of the secret in the request,String
962,rds:TenantDatabaseName,https://docs.aws.amazon.com/AmazonRDS/latest/UserGuide/security_iam_service-with-iam.html#UsingWithRDS.IAM.Conditions,Filters access by the tenant database name in CreateTenantDatabase and by the new tenant database name in ModifyTenantDatabase,String
963,rds:Vpc,https://docs.aws.amazon.com/AmazonRDS/latest/UserGuide/security_iam_service-with-iam.html#UsingWithRDS.IAM.Conditions,"Filters access by the value that specifies whether the DB instance runs in an Amazon Virtual Private Cloud (Amazon VPC). To indicate that the DB instance runs in an Amazon VPC, specify true",Bool
964,rds:cluster-pg-tag/${TagKey},https://docs.aws.amazon.com/AmazonRDS/latest/UserGuide/security_iam_service-with-iam.html#UsingWithRDS.IAM.Conditions,Filters access by the tag attached to a DB cluster parameter group,String
965,rds:cluster-snapshot-tag/${TagKey},https://docs.aws.amazon.com/AmazonRDS/latest/UserGuide/security_iam_service-with-iam.html#UsingWithRDS.IAM.Conditions,Filters access by the tag attached to a DB cluster snapshot,String
966,rds:cluster-tag/${TagKey},https://docs.aws.amazon.com/AmazonRDS/latest/UserGuide/security_iam_service-with-iam.html#UsingWithRDS.IAM.Conditions,Filters access by the tag attached to a DB cluster,String
967,rds:db-tag/${TagKey},https://docs.aws.amazon.com/AmazonRDS/latest/UserGuide/security_iam_service-with-iam.html#UsingWithRDS.IAM.Conditions,Filters access by the tag attached to a DB instance,String
968,rds:es-tag/${TagKey},https://docs.aws.amazon.com/AmazonRDS/latest/UserGuide/security_iam_service-with-iam.html#UsingWithRDS.IAM.Conditions,Filters access by the tag attached to an event subscription,String
969,rds:og-tag/${TagKey},https://docs.aws.amazon.com/AmazonRDS/latest/UserGuide/security_iam_service-with-iam.html#UsingWithRDS.IAM.Conditions,Filters access by the tag attached to a DB option group,String
970,elasticbeanstalk:FromEnvironment,https://docs.aws.amazon.com/elasticbeanstalk/latest/dg/AWSHowTo.iam.policies.actions.html#AWSHowTo.iam.policies.conditions,Filters access by an environment as a dependency or a constraint on an input parameter,ARN
971,secretsmanager:RecoveryWindowInDays,https://docs.aws.amazon.com/IAM/latest/UserGuide/reference_policies_condition-keys.html,Filters access by the number of days that Secrets Manager waits before it can delete the secret,Numeric
972,rds:pg-tag/${TagKey},https://docs.aws.amazon.com/AmazonRDS/latest/UserGuide/security_iam_service-with-iam.html#UsingWithRDS.IAM.Conditions,Filters access by the tag attached to a DB parameter group,String
973,elasticbeanstalk:FromPlatform,https://docs.aws.amazon.com/elasticbeanstalk/latest/dg/AWSHowTo.iam.policies.actions.html#AWSHowTo.iam.policies.conditions,Filters access by a platform as a dependency or a constraint on an input parameter,ARN
974,rds:req-tag/${TagKey},https://docs.aws.amazon.com/AmazonRDS/latest/UserGuide/security_iam_service-with-iam.html#UsingWithRDS.IAM.Conditions,Filters access by the set of tag keys and values that can be used to tag a resource,String
975,rds:ri-tag/${TagKey},https://docs.aws.amazon.com/AmazonRDS/latest/UserGuide/security_iam_service-with-iam.html#UsingWithRDS.IAM.Conditions,Filters access by the tag attached to a reserved DB instance,String
976,rds:secgrp-tag/${TagKey},https://docs.aws.amazon.com/AmazonRDS/latest/UserGuide/security_iam_service-with-iam.html#UsingWithRDS.IAM.Conditions,Filters access by the tag attached to a DB security group,String
977,rds:snapshot-tag/${TagKey},https://docs.aws.amazon.com/AmazonRDS/latest/UserGuide/security_iam_service-with-iam.html#UsingWithRDS.IAM.Conditions,Filters access by the tag attached to a DB snapshot,String
978,rds:subgrp-tag/${TagKey},https://docs.aws.amazon.com/AmazonRDS/latest/UserGuide/security_iam_service-with-iam.html#UsingWithRDS.IAM.Conditions,Filters access by the tag attached to a DB subnet group,String
979,redshift-data:glue-catalog-arn,https://docs.aws.amazon.com/redshift/latest/mgmt/redshift-iam-access-control-overview.html#redshift-policy-resources.conditions,Filters access by glue catalog arn,ARN
980,redshift-data:session-owner-iam-userid,https://docs.aws.amazon.com/redshift/latest/mgmt/redshift-iam-access-control-overview.html#redshift-policy-resources.conditions,Filters access by session owner iam userid,String
981,redshift-data:statement-owner-iam-userid,https://docs.aws.amazon.com/redshift/latest/mgmt/redshift-iam-access-control-overview.html#redshift-policy-resources.conditions,Filters access by statement owner iam userid,String
982,secretsmanager:ResourceTag/tag-key,https://docs.aws.amazon.com/IAM/latest/UserGuide/reference_policies_condition-keys.html,Filters access by a tag key and value pair,String
983,redshift-serverless:endpointAccessId,https://docs.aws.amazon.com/redshift/latest/mgmt/redshift-policy-resources.resource-permissions.html,Filters access by the endpoint access identifier,String
984,redshift-serverless:managedWorkgroupName,https://docs.aws.amazon.com/redshift/latest/mgmt/redshift-policy-resources.resource-permissions.html,Filters access by the managed workgroup identifier,String
985,redshift-serverless:namespaceId,https://docs.aws.amazon.com/redshift/latest/mgmt/redshift-policy-resources.resource-permissions.html,Filters access by the namespace identifier,String
986,redshift-serverless:recoveryPointId,https://docs.aws.amazon.com/redshift/latest/mgmt/redshift-policy-resources.resource-permissions.html,Filters access by the recovery point identifier,String
987,redshift-serverless:snapshotId,https://docs.aws.amazon.com/redshift/latest/mgmt/redshift-policy-resources.resource-permissions.html,Filters access by the snapshot identifier,String
988,elasticbeanstalk:FromSolutionStack,https://docs.aws.amazon.com/elasticbeanstalk/latest/dg/AWSHowTo.iam.policies.actions.html#AWSHowTo.iam.policies.conditions,Filters access by a solution stack as a dependency or a constraint on an input parameter,ARN
989,secretsmanager:RotateImmediately,https://docs.aws.amazon.com/IAM/latest/UserGuide/reference_policies_condition-keys.html,Filters access by whether the secret is to be rotated immediately,Bool
990,elasticbeanstalk:InApplication,https://docs.aws.amazon.com/elasticbeanstalk/latest/dg/AWSHowTo.iam.policies.actions.html#AWSHowTo.iam.policies.conditions,Filters access by the application that contains the resource that the action operates on,ARN
991,elasticfilesystem:AccessPointArn,https://docs.aws.amazon.com/efs/latest/ug/efs-access-points.html,Filters access by the ARN of the access point used to mount the file system,ARN
992,elasticfilesystem:AccessedViaMountTarget,https://docs.aws.amazon.com/efs/latest/ug/mounting-fs.html,Filters access by whether the file system is accessed via mount targets,Bool
993,elasticfilesystem:CreateAction,https://docs.aws.amazon.com/efs/latest/ug/using-tags-efs.html,Filters access by the name of a resource-creating API action,String
994,elasticfilesystem:Encrypted,https://docs.aws.amazon.com/efs/latest/ug/encryption.html,Filters access by whether users can create only encrypted or unencrypted file systems,Bool
995,elasticloadbalancing:CreateAction,https://docs.aws.amazon.com/elasticloadbalancing/latest/userguide/tagging-resources-during-creation.html,Filters access by the name of a resource-creating API action,String
996,elasticloadbalancing:ListenerProtocol,https://docs.aws.amazon.com/elasticloadbalancing/latest/userguide/security_iam_service-with-iam.html#listenerprotocol-condition,Filters access by the listener protocol that is allowed in the request,ArrayOfString
997,redshift-serverless:tableRestoreRequestId,https://docs.aws.amazon.com/redshift/latest/mgmt/redshift-policy-resources.resource-permissions.html,Filters access by the table restore request identifier,String
998,secretsmanager:RotationLambdaARN,https://docs.aws.amazon.com/IAM/latest/UserGuide/reference_policies_condition-keys.html,Filters access by the ARN of the rotation Lambda function in the request,ARN
999,redshift-serverless:workgroupId,https://docs.aws.amazon.com/redshift/latest/mgmt/redshift-policy-resources.resource-permissions.html,Filters access by the workgroup identifier,String
1000,redshift:AllowWrites,https://docs.aws.amazon.com/redshift/latest/mgmt/redshift-iam-access-control-overview.html#redshift-policy-resources.conditions,Filters access by the allowWrites input parameter,Bool
1001,redshift:ConsumerArn,https://docs.aws.amazon.com/redshift/latest/mgmt/redshift-iam-access-control-overview.html#redshift-policy-resources.conditions,Filters access by the datashare consumer arn,ARN
1002,redshift:ConsumerIdentifier,https://docs.aws.amazon.com/redshift/latest/mgmt/redshift-iam-access-control-overview.html#redshift-policy-resources.conditions,Filters access by the datashare consumer,String
1003,redshift:DbName,https://docs.aws.amazon.com/redshift/latest/mgmt/redshift-iam-access-control-overview.html#redshift-policy-resources.conditions,Filters access by the database name,String
1004,redshift:DbUser,https://docs.aws.amazon.com/redshift/latest/mgmt/redshift-iam-access-control-overview.html#redshift-policy-resources.conditions,Filters access by the database user name,String
1005,secretsmanager:SecretId,https://docs.aws.amazon.com/IAM/latest/UserGuide/reference_policies_condition-keys.html,Filters access by the SecretID value in the request,ARN
1006,secretsmanager:SecretPrimaryRegion,https://docs.aws.amazon.com/IAM/latest/UserGuide/reference_policies_condition-keys.html,Filters access by primary region in which the secret is created if the secret is a multi-Region secret,String
1007,secretsmanager:VersionId,https://docs.aws.amazon.com/IAM/latest/UserGuide/reference_policies_condition-keys.html,Filters access by the unique identifier of the version of the secret in the request,String
1008,secretsmanager:VersionStage,https://docs.aws.amazon.com/IAM/latest/UserGuide/reference_policies_condition-keys.html,Filters access by the list of version stages in the request,String
1009,elasticloadbalancing:ResourceTag/,https://docs.aws.amazon.com/IAM/latest/UserGuide/reference_policies_condition-keys.html#condition-keys-resourcetag,Filters access by the preface string for a tag key and value pair that are attached to a resource,String
1010,secretsmanager:resource/AllowRotationLambdaArn,https://docs.aws.amazon.com/IAM/latest/UserGuide/reference_policies_condition-keys.html,Filters access by the ARN of the rotation Lambda function associated with the secret,ARN
1011,securityhub:ASFFSyntaxPath/${ASFFSyntaxPath},https://docs.aws.amazon.com/IAM/latest/UserGuide/reference_policies_condition-keys.html#condition-keys-asffsyntaxpath,Filters access by the specified fields and values in the request,String
1012,elasticloadbalancing:ResourceTag/${TagKey},https://docs.aws.amazon.com/IAM/latest/UserGuide/reference_policies_condition-keys.html#condition-keys-resourcetag,Filters access by the preface string for a tag key and value pair that are attached to a resource,String
1013,elasticloadbalancing:Scheme,https://docs.aws.amazon.com/elasticloadbalancing/latest/userguide/security_iam_service-with-iam.html#scheme-condition,Filters access by the load balancer scheme that are allowed in the request,String
1014,elasticloadbalancing:SecurityGroup,https://docs.aws.amazon.com/elasticloadbalancing/latest/userguide/security_iam_service-with-iam.html#securitygroup-condition,Filters access by the security-group IDs that are allowed in the request,ArrayOfString
1015,elasticloadbalancing:SecurityPolicy,https://docs.aws.amazon.com/elasticloadbalancing/latest/userguide/security_iam_service-with-iam.html#securitypolicy-condition,Filters access by the SSL Security Policies that are allowed in the request,ArrayOfString
1016,elasticloadbalancing:Subnet,https://docs.aws.amazon.com/elasticloadbalancing/latest/userguide/security_iam_service-with-iam.html#subnet-condition,Filters access by the subnet IDs that are allowed in the request,ArrayOfString
1017,elasticmapreduce:ExecutionRoleArn,https://docs.aws.amazon.com/emr/latest/ManagementGuide/emr-plan-access-iam.html#emr-security,Filters access by whether the execution role ARN is provided with the action,ARN
1018,redshift:DurationSeconds,https://docs.aws.amazon.com/redshift/latest/mgmt/redshift-iam-access-control-overview.html#redshift-policy-resources.conditions,Filters access by the number of seconds until a temporary credential set expires,String
1019,securityhub:OCSFSyntaxPath/${OCSFSyntaxPath},https://docs.aws.amazon.com/IAM/latest/UserGuide/reference_policies_condition-keys.html#condition-keys-ocsfsyntaxpath,Filters access by the specified fields and values in the request,String
1020,elasticmapreduce:RequestTag/${TagKey},https://docs.aws.amazon.com/emr/latest/ManagementGuide/emr-plan-access-iam.html#emr-fine-grained-cluster-access,Filters access by whether the tag and value pair is provided with the action,String
1021,securityhub:TargetAccount,https://docs.aws.amazon.com/securityhub/latest/userguide/securityhub-access.html#conditions,Filters access by the AwsAccountId field that is specified in the request,String
1022,serverlessrepo:applicationType,https://docs.aws.amazon.com/IAM/latest/UserGuide/applications.html,Filters access by application type,String
1023,servicecatalog:Resource,,,
1024,servicecatalog:ResourceType,,,
1025,servicecatalog:accountLevel,,,
1026,servicecatalog:roleLevel,,,
1027,elasticmapreduce:ResourceTag/${TagKey},https://docs.aws.amazon.com/emr/latest/ManagementGuide/emr-plan-access-iam.html#emr-fine-grained-cluster-access,Filters access by the tag and value pair associated with an Amazon EMR resource,String
1028,emr-containers:ExecutionRoleArn,https://docs.aws.amazon.com/emr/latest/EMR-on-EKS-DevelopmentGuide/iam-execution-role.html,Filters access by the execution role arn present in the request,ARN
1029,emr-containers:JobTemplateArn,https://docs.aws.amazon.com/emr/latest/EMR-on-EKS-DevelopmentGuide/iam-job-template.html,Filters access by the job template arn present in the request,ARN
1030,events:EventBusArn,https://docs.aws.amazon.com/eventbridge/latest/userguide/policy-keys-eventbridge.html#limiting-access-to-event-buses,Filters access by the ARN of the event buses that can be associated with an endpoint to CreateEndpoint and UpdateEndpoint actions,ArrayOfARN
1031,events:ManagedBy,https://docs.aws.amazon.com/eventbridge/latest/userguide/policy-keys-eventbridge.html,"Filters access by AWS services. If a rule is created by an AWS service on your behalf, the value is the principal name of the service that created the rule",String
1032,events:TargetArn,https://docs.aws.amazon.com/eventbridge/latest/userguide/policy-keys-eventbridge.html#limiting-access-to-targets,Filters access by the ARN of a target that can be put to a rule to PutTargets actions. TargetARN doesn't include DeadLetterConfigArn,ArrayOfARN
1033,servicecatalog:userLevel,,,
1034,redshift:InboundIntegrationArn,https://docs.aws.amazon.com/redshift/latest/mgmt/redshift-iam-access-control-overview.html#redshift-policy-resources.conditions,Filters access by the ARN of an inbound zero-ETL Integration resource,ARN
1035,events:creatorAccount,https://docs.aws.amazon.com/eventbridge/latest/userguide/policy-keys-eventbridge.html#events-creator-account,Filters access by the account the rule was created in to rule actions,String
1036,redshift:IntegrationSourceArn,https://docs.aws.amazon.com/redshift/latest/mgmt/redshift-iam-access-control-overview.html#redshift-policy-resources.conditions,Filters access by the ARN of a zero-ETL Integration source,ARN
1037,redshift:IntegrationTargetArn,https://docs.aws.amazon.com/redshift/latest/mgmt/redshift-iam-access-control-overview.html#redshift-policy-resources.conditions,Filters access by the ARN of a zero-ETL Integration target,ARN
1038,refactor-spaces:ApplicationCreatedByAccount,https://docs.aws.amazon.com/migrationhub-refactor-spaces/latest/userguide/security_iam_service-with-iam.html#security_iam_service-with-iam-id-based-policies-conditionkeys,Filters access by restricting the action to only those accounts that created the application within an environment,String
1039,refactor-spaces:CreatedByAccountIds,https://docs.aws.amazon.com/migrationhub-refactor-spaces/latest/userguide/security_iam_service-with-iam.html#security_iam_service-with-iam-id-based-policies-conditionkeys,Filters access by the accounts that created the resource,ArrayOfString
1040,refactor-spaces:RouteCreatedByAccount,https://docs.aws.amazon.com/migrationhub-refactor-spaces/latest/userguide/security_iam_service-with-iam.html#security_iam_service-with-iam-id-based-policies-conditionkeys,Filters access by restricting the action to only those accounts that created the route within an application,String
1041,refactor-spaces:ServiceCreatedByAccount,https://docs.aws.amazon.com/migrationhub-refactor-spaces/latest/userguide/security_iam_service-with-iam.html#security_iam_service-with-iam-id-based-policies-conditionkeys,Filters access by restricting the action to only those accounts that created the service within an application,String
1042,refactor-spaces:SourcePath,https://docs.aws.amazon.com/migrationhub-refactor-spaces/latest/userguide/security_iam_service-with-iam.html#security_iam_service-with-iam-id-based-policies-conditionkeys,Filters access by the path of the route,String
1043,resource-explorer-2:Operation,https://docs.aws.amazon.com/service-authorization/latest/reference/list_awsresourceexplorer.html,"Filters access by the actual operation that is being invoked, available values: Search, ListResources",String
1044,route53-recovery-cluster:AllowSafetyRulesOverrides,https://docs.aws.amazon.com/routing-control/latest/APIReference/API_UpdateRoutingControlState.html,Override safety rules to allow routing control state updates,Bool
1045,route53:ChangeResourceRecordSetsActions,https://docs.aws.amazon.com/Route53/latest/DeveloperGuide/specifying-conditions-route53.html#route53_rrsetConditionKeys,"Filters access by the change actions, CREATE, UPSERT, or DELETE, in a ChangeResourceRecordSets request",ArrayOfString
1046,route53:ChangeResourceRecordSetsNormalizedRecordNames,https://docs.aws.amazon.com/Route53/latest/DeveloperGuide/specifying-conditions-route53.html#route53_rrsetConditionKeys,Filters access by the normalized DNS record names in a ChangeResourceRecordSets request,ArrayOfString
1047,route53:ChangeResourceRecordSetsRecordTypes,https://docs.aws.amazon.com/Route53/latest/DeveloperGuide/specifying-conditions-route53.html#route53_rrsetConditionKeys,Filters access by the DNS record types in a ChangeResourceRecordSets request,ArrayOfString
1048,route53:VPCs,https://docs.aws.amazon.com/Route53/latest/DeveloperGuide/specifying-conditions-route53.html#route53_rrsetConditionKeys,Filters access by VPCs in request,String
1049,s3-object-lambda:TlsVersion,https://docs.aws.amazon.com/AmazonS3/latest/API/bucket-policy-s3-sigv4-conditions.html,Filters access by the TLS version used by the client,Numeric
1050,s3-object-lambda:authType,https://docs.aws.amazon.com/AmazonS3/latest/API/bucket-policy-s3-sigv4-conditions.html,Filters access by authentication method,String
1051,s3-object-lambda:signatureAge,https://docs.aws.amazon.com/AmazonS3/latest/API/bucket-policy-s3-sigv4-conditions.html,Filters access by the age in milliseconds of the request signature,Numeric
1052,s3-object-lambda:versionid,https://docs.aws.amazon.com/AmazonS3/latest/dev/amazon-s3-policy-keys.html/#getobjectversion-limit-access-to-specific-version-3,Filters access by a specific object version,String
1053,s3-outposts:AccessPointNetworkOrigin,https://docs.aws.amazon.com/AmazonS3/latest/userguide/creating-access-points.html#access-points-policies,Filters access by the network origin (Internet or VPC),String
1054,s3-outposts:DataAccessPointAccount,https://docs.aws.amazon.com/AmazonS3/latest/userguide/creating-access-points.html#access-points-policies,Filters access by the AWS Account ID that owns the access point,String
1055,s3-outposts:DataAccessPointArn,"",Filters access by an access point Amazon Resource Name (ARN),ARN
1056,s3-outposts:ExistingObjectTag/<key>,https://docs.aws.amazon.com/AmazonS3/latest/userguide/object-tagging.html#tagging-and-policies,Filters access by requiring that an existing object tag has a specific tag key and value,String
1057,s3-outposts:RequestObjectTag/<key>,https://docs.aws.amazon.com/AmazonS3/latest/userguide/object-tagging.html#tagging-and-policies,Filters access by restricting the tag keys and values allowed on objects,String
1058,s3-outposts:RequestObjectTagKeys,https://docs.aws.amazon.com/AmazonS3/latest/userguide/object-tagging.html#tagging-and-policies,Filters access by restricting the tag keys allowed on objects,String
1059,s3-outposts:authType,https://docs.aws.amazon.com/AmazonS3/latest/API/bucket-policy-s3-sigv4-conditions.html,Filters access by restricting incoming requests to a specific authentication method,String
1060,s3-outposts:delimiter,https://docs.aws.amazon.com/AmazonS3/latest/userguide/walkthrough1.html,Filters access by requiring the delimiter parameter,String
1061,s3-outposts:max-keys,https://docs.aws.amazon.com/AmazonS3/latest/userguide/amazon-s3-policy-keys.html#example-numeric-condition-operators,Filters access by limiting the maximum number of keys returned in a ListBucket request,Numeric
1062,s3-outposts:prefix,https://docs.aws.amazon.com/AmazonS3/latest/userguide/amazon-s3-policy-keys.html#condition-key-bucket-ops-2,Filters access by key name prefix,String
1063,s3-outposts:signatureAge,https://docs.aws.amazon.com/AmazonS3/latest/API/bucket-policy-s3-sigv4-conditions.html,"Filters access by identifying the length of time, in milliseconds, that a signature is valid in an authenticated request",Numeric
1064,s3-outposts:signatureversion,https://docs.aws.amazon.com/AmazonS3/latest/API/bucket-policy-s3-sigv4-conditions.html,Filters access by identifying the version of AWS Signature that is supported for authenticated requests,String
1065,s3-outposts:versionid,https://docs.aws.amazon.com/AmazonS3/latest/userguide/amazon-s3-policy-keys.html#getobjectversion-limit-access-to-specific-version-3,Filters access by a specific object version,String
1066,s3-outposts:x-amz-acl,https://docs.aws.amazon.com/AmazonS3/latest/userguide/acl-overview.html#permissions,Filters access by requiring the x-amz-acl header with a specific canned ACL in a request,String
1067,s3-outposts:x-amz-content-sha256,https://docs.aws.amazon.com/AmazonS3/latest/API/bucket-policy-s3-sigv4-conditions.html,Filters access by disallowing unsigned content in your bucket,String
1068,s3-outposts:x-amz-copy-source,https://docs.aws.amazon.com/AmazonS3/latest/userguide/amazon-s3-policy-keys.html#putobject-limit-copy-source-3,"Filters access by restricting the copy source to a specific bucket, prefix, or object",String
1069,s3-outposts:x-amz-metadata-directive,https://docs.aws.amazon.com/AmazonS3/latest/API/API_CopyObject.html,Filters access by enabling enforcement of object metadata behavior (COPY or REPLACE) when objects are copied,String
1070,s3-outposts:x-amz-server-side-encryption,https://docs.aws.amazon.com/AmazonS3/latest/userguide/UsingServerSideEncryption.html,Filters access by requiring server-side encryption,String
1071,s3-outposts:x-amz-storage-class,https://docs.aws.amazon.com/AmazonS3/latest/userguide/storage-class-intro.html#sc-howtoset,Filters access by storage class,String
1072,s3:AccessGrantScope,https://docs.aws.amazon.com/AmazonS3/latest/userguide/access-grants-grant.html,Filters access by the grant scope of access grants grant,String
1073,s3:AccessGrantsInstanceArn,https://docs.aws.amazon.com/AmazonS3/latest/userguide/access-grants-instance.html,Filters access by access grants instance ARN,ARN
1074,s3:AccessGrantsLocationScope,https://docs.aws.amazon.com/AmazonS3/latest/userguide/access-grants-location.html,Filters access by the location scope of access grants location,String
1075,s3:AccessPointNetworkOrigin,https://docs.aws.amazon.com/AmazonS3/latest/userguide/creating-access-points.html#access-points-policies,Filters access by the network origin (Internet or VPC),String
1076,s3:AccessPointTag/${TagKey},https://docs.aws.amazon.com/AmazonS3/latest/userguide/access-point-tagging.html#tagging-and-policies,Filters access by existing access point tag key and value,String
1077,s3:DataAccessPointAccount,https://docs.aws.amazon.com/AmazonS3/latest/userguide/creating-access-points.html#access-points-policies,Filters access by the AWS Account ID that owns the access point,String
1078,s3:DataAccessPointArn,https://docs.aws.amazon.com/AmazonS3/latest/userguide/creating-access-points.html#access-points-policies,Filters access by an access point Amazon Resource Name (ARN),ARN
1079,s3:ExistingJobOperation,https://docs.aws.amazon.com/AmazonS3/latest/userguide/batch-ops-job-tags-examples.html,Filters access by operation to updating the job priority,String
1080,s3:ExistingJobPriority,https://docs.aws.amazon.com/AmazonS3/latest/userguide/batch-ops-job-tags-examples.html,Filters access by priority range to cancelling existing jobs,Numeric
