condition_key_id,name,reference_url,description,type
1,ec2:CloudwatchLogStreamArn,https://docs.aws.amazon.com/AWSEC2/latest/UserGuide/iam-policy-structure.html#amazon-ec2-keys,Filters access by the ARN of the CloudWatch Logs log stream,ARN
2,iot:JobId,https://docs.aws.amazon.com/service-authorization/latest/reference/list_awsiot.html,Filters access by jobId for iotjobsdata:DescribeJobExecution and iotjobsdata:UpdateJobExecution APIs,String
3,ec2:CpuOptionsAmdSevSnp,https://docs.aws.amazon.com/AWSEC2/latest/UserGuide/sev-snp.html,"Filters access by the state of AMD SEV-SNP CPU Options. Currently, only US East (Ohio) and Europe (Ireland) are supported",String
4,iot:ThingGroupArn,https://docs.aws.amazon.com/service-authorization/latest/reference/list_awsiot.html,Filters access by a list of IoT Thing Group ARNs that the destination IoT Thing belongs to for an IoT Tunnel,ArrayOfARN
5,ec2:CreateAction,https://docs.aws.amazon.com/AWSEC2/latest/UserGuide/supported-iam-actions-tagging.html,Filters access by the name of a resource-creating API action,String
6,ec2:CreateDate,https://docs.aws.amazon.com/AWSEC2/latest/UserGuide/iam-policy-structure.html#amazon-ec2-keys,Filters access by the date and time at which the Capacity Reservation was created,Date
7,ec2:DPDTimeoutSeconds,https://docs.aws.amazon.com/vpn/latest/s2svpn/vpn-authentication-access-control.html,Filters access by the duration after which DPD timeout occurs on a VPN tunnel,Numeric
8,ec2:DestinationCapacityReservationId,https://docs.aws.amazon.com/AWSEC2/latest/UserGuide/iam-policy-structure.html#amazon-ec2-keys,Filters access by the ID of the Capacity Reservation that you want to move capacity into,ARN
9,ec2:DhcpOptionsID,iam-policy-structure.html#imageId-key,Filters access by the ID of a dynamic host configuration protocol (DHCP) options set,String
10,ec2:DirectoryArn,https://docs.aws.amazon.com/AWSEC2/latest/UserGuide/iam-policy-structure.html#amazon-ec2-keys,Filters access by the ARN of the directory,ARN
11,ec2:Domain,https://docs.aws.amazon.com/AWSEC2/latest/UserGuide/iam-policy-structure.html#amazon-ec2-keys,Filters access by the domain of the Elastic IP address,String
12,ec2:EbsOptimized,https://docs.aws.amazon.com/AWSEC2/latest/UserGuide/iam-policy-structure.html#amazon-ec2-keys,Filters access by whether the instance is enabled for EBS optimization,Bool
13,ec2:ElasticGpuType,https://docs.aws.amazon.com/AWSEC2/latest/UserGuide/iam-policy-structure.html#amazon-ec2-keys,Filters access by the type of Elastic Graphics accelerator,String
14,ec2:Encrypted,https://docs.aws.amazon.com/AWSEC2/latest/UserGuide/iam-policy-structure.html#amazon-ec2-keys,Filters access by whether the EBS volume is encrypted,Bool
15,ec2:EndDate,https://docs.aws.amazon.com/AWSEC2/latest/UserGuide/iam-policy-structure.html#amazon-ec2-keys,Filters access by the date and time at which the Capacity Reservation ends,Date
16,iot:TunnelDestinationService,https://docs.aws.amazon.com/service-authorization/latest/reference/list_awsiot.html,Filters access by a list of destination services for an IoT Tunnel,ArrayOfString
17,ec2:EndDateType,https://docs.aws.amazon.com/AWSEC2/latest/UserGuide/iam-policy-structure.html#amazon-ec2-keys,Filters access by the way in which the Capacity Reservation ends,String
18,ec2:EphemeralStorage,https://docs.aws.amazon.com/AWSEC2/latest/UserGuide/iam-policy-structure.html#amazon-ec2-keys,Filters access by whether the instance is enabled for ephemeral storage,Bool
19,ec2:FisActionId,https://docs.aws.amazon.com/fis/latest/userguide/fis-actions-reference.html,Filters access by the ID of an AWS FIS action,String
20,ec2:FisTargetArns,https://docs.aws.amazon.com/fis/latest/userguide/fis-actions-reference.html,Filters access by the ARN of an AWS FIS target,ArrayOfARN
21,ec2:GatewayType,https://docs.aws.amazon.com/vpn/latest/s2svpn/vpn-authentication-access-control.html,Filters access by the gateway type for a VPN endpoint on the AWS side of a VPN connection,String
22,iot:thingArn,https://docs.aws.amazon.com/service-authorization/latest/reference/list_awsiot.html,Filters access by the ARN of an IoT Thing,ARN
23,ec2:HostRecovery,https://docs.aws.amazon.com/AWSEC2/latest/UserGuide/iam-policy-structure.html#amazon-ec2-keys,Filters access by whether host recovery is enabled for a Dedicated Host,String
24,ec2:IKEVersions,https://docs.aws.amazon.com/vpn/latest/s2svpn/vpn-authentication-access-control.html,Filters access by the internet key exchange (IKE) versions that are permitted for a VPN tunnel,ArrayOfString
25,ec2:ImageID,iam-policy-structure.html#imageId-key,Filters access by the ID of an image,String
26,ec2:ImageType,https://docs.aws.amazon.com/AWSEC2/latest/UserGuide/iam-policy-structure.html#amazon-ec2-keys,"Filters access by the type of image (machine, aki, or ari)",String
27,ec2:InsideTunnelCidr,https://docs.aws.amazon.com/vpn/latest/s2svpn/vpn-authentication-access-control.html,Filters access by the range of inside IP addresses for a VPN tunnel,String
28,ec2:InsideTunnelIpv6Cidr,https://docs.aws.amazon.com/vpn/latest/s2svpn/vpn-authentication-access-control.html,Filters access by a range of inside IPv6 addresses for a VPN tunnel,String
29,ec2:InstanceAutoRecovery,https://docs.aws.amazon.com/AWSEC2/latest/UserGuide/iam-policy-structure.html#amazon-ec2-keys,Filters access by whether the instance type supports auto recovery,String
30,ec2:InstanceBandwidthWeighting,iam-policy-structure.html#imageId-key,Filters access by the bandwidth weighting of an instance,String
31,ec2:InstanceCount,https://docs.aws.amazon.com/AWSEC2/latest/UserGuide/iam-policy-structure.html#amazon-ec2-keys,Filters access by the number of instances,Numeric
32,iotanalytics:ResourceTag/${TagKey},https://docs.aws.amazon.com/iotanalytics/latest/userguide/tagging.html#tagging-iam,Filters access by the tag key-value pairs attached to the resource,String
33,ec2:InstanceID,iam-policy-structure.html#imageId-key,Filters access by the ID of an instance,String
34,ec2:InstanceMarketType,https://docs.aws.amazon.com/AWSEC2/latest/UserGuide/iam-policy-structure.html#amazon-ec2-keys,"Filters access by the market or purchasing option of an instance (capacity-block, on-demand, or spot)",String
35,ec2:InstanceMatchCriteria,https://docs.aws.amazon.com/AWSEC2/latest/UserGuide/iam-policy-structure.html#amazon-ec2-keys,Filters access by the type of instance launches that the Capacity Reservation accepts,String
36,ec2:InstanceMetadataTags,https://docs.aws.amazon.com/AWSEC2/latest/UserGuide/iam-policy-structure.html#amazon-ec2-keys,Filters access by whether the instance allows access to instance tags from the instance metadata,String
37,ec2:InstancePlatform,https://docs.aws.amazon.com/AWSEC2/latest/UserGuide/iam-policy-structure.html#amazon-ec2-keys,Filters access by the type of operating system for which the Capacity Reservation reserves capacity,ARN
38,ec2:InstanceProfile,https://docs.aws.amazon.com/AWSEC2/latest/UserGuide/iam-policy-structure.html#amazon-ec2-keys,Filters access by the ARN of an instance profile,ARN
39,iotevents:keyValue,https://docs.aws.amazon.com/iotevents/latest/developerguide/security_iam_id-based-policy-examples.html#security_iam_service-with-iam-id-based-policies-conditionkeys,Filters access by the instanceId (key-value) of the message,String
40,ec2:InstanceType,https://docs.aws.amazon.com/AWSEC2/latest/UserGuide/iam-policy-structure.html#amazon-ec2-keys,Filters access by the type of instance,String
41,ec2:InternetGatewayID,iam-policy-structure.html#imageId-key,Filters access by the ID of an internet gateway,String
42,ec2:Ipv4IpamPoolId,iam-policy-structure.html#amazon-ec2-keys,Filters access by the ID of an IPAM pool provided for IPv4 CIDR block allocation,String
43,ec2:Ipv6IpamPoolId,iam-policy-structure.html#amazon-ec2-keys,Filters access by the ID of an IPAM pool provided for IPv6 CIDR block allocation,String
44,ec2:IsLaunchTemplateResource,https://docs.aws.amazon.com/AWSEC2/latest/UserGuide/iam-policy-structure.html#amazon-ec2-keys,Filters access by whether users are able to override resources that are specified in the launch template,Bool
45,ec2:KeyPairName,https://docs.aws.amazon.com/AWSEC2/latest/UserGuide/iam-policy-structure.html#amazon-ec2-keys,Filters access by the name of a key pair,String
46,ec2:KeyPairType,https://docs.aws.amazon.com/AWSEC2/latest/UserGuide/iam-policy-structure.html#amazon-ec2-keys,Filters access by the type of a key pair,String
47,iotfleetwise:DestinationArn,https://docs.aws.amazon.com/service-authorization/latest/reference/list_awsiotfleetwise.html,"Filters access by campaign destination ARN, eg. an S3 bucket ARN or a Timestream ARN",ARN
48,ec2:KmsKeyId,https://docs.aws.amazon.com/AWSEC2/latest/UserGuide/iam-policy-structure.html#amazon-ec2-keys,Filters access by the ID of an AWS KMS key provided in the request,String
49,ec2:LaunchTemplate,https://docs.aws.amazon.com/AWSEC2/latest/UserGuide/iam-policy-structure.html#amazon-ec2-keys,Filters access by the ARN of a launch template,ARN
50,ec2:Location,https://docs.aws.amazon.com/AWSEC2/latest/UserGuide/iam-policy-structure.html#amazon-ec2-keys,Filters access by the destination for the snapshot copy,String
51,ec2:ManagedResourceOperator,https://docs.aws.amazon.com/AWSEC2/latest/UserGuide/iam-policy-structure.html#amazon-ec2-keys,Filters access by the presence of an EC2 operator provisioning a managed resource,String
52,ec2:MetadataHttpEndpoint,https://docs.aws.amazon.com/AWSEC2/latest/UserGuide/iam-policy-structure.html#amazon-ec2-keys,Filters access by whether the HTTP endpoint is enabled for the instance metadata service,String
53,ec2:MetadataHttpPutResponseHopLimit,https://docs.aws.amazon.com/AWSEC2/latest/UserGuide/iam-policy-structure.html#amazon-ec2-keys,Filters access by the allowed number of hops when calling the instance metadata service,Numeric
54,iotfleetwise:Signals,https://docs.aws.amazon.com/service-authorization/latest/reference/list_awsiotfleetwise.html,Filters access by fully qualified signal names,ArrayOfString
55,a4b:amazonId,https://docs.aws.amazon.com/a4b/latest/APIReference/API_RegisterAVSDevice.html,Filters actions based on the Amazon Id in the request,String
56,iotfleetwise:UpdateToDecoderManifestArn,https://docs.aws.amazon.com/service-authorization/latest/reference/list_awsiotfleetwise.html,Filters access by a list of IoT FleetWise Decoder Manifest ARNs,ARN
57,iotfleetwise:UpdateToModelManifestArn,https://docs.aws.amazon.com/service-authorization/latest/reference/list_awsiotfleetwise.html,Filters access by a list of IoT FleetWise Model Manifest ARNs,ARN
58,iotsitewise:assetHierarchyPath,https://docs.aws.amazon.com/iot-sitewise/latest/userguide/security_iam_service-with-iam.html#security_iam_service-with-iam-id-based-policies-conditionkeys,"Filters access by an asset hierarchy path, which is the string of asset IDs in the asset's hierarchy, each separated by a forward slash",String
59,iotsitewise:childAssetId,https://docs.aws.amazon.com/iot-sitewise/latest/userguide/security_iam_service-with-iam.html#security_iam_service-with-iam-id-based-policies-conditionkeys,Filters access by the ID of a child asset being associated whith a parent asset,String
60,iotsitewise:group,https://docs.aws.amazon.com/iot-sitewise/latest/userguide/security_iam_service-with-iam.html#security_iam_service-with-iam-id-based-policies-conditionkeys,Filters access by the ID of an AWS Single Sign-On group,String
61,iotsitewise:iam,https://docs.aws.amazon.com/iot-sitewise/latest/userguide/security_iam_service-with-iam.html#security_iam_service-with-iam-id-based-policies-conditionkeys,Filters access by the ID of an AWS IAM identity,String
62,iotsitewise:isAssociatedWithAssetProperty,https://docs.aws.amazon.com/iot-sitewise/latest/userguide/security_iam_service-with-iam.html#security_iam_service-with-iam-id-based-policies-conditionkeys,Filters access by data streams associated with or not associated with asset properties,String
63,iotsitewise:portal,https://docs.aws.amazon.com/iot-sitewise/latest/userguide/security_iam_service-with-iam.html#security_iam_service-with-iam-id-based-policies-conditionkeys,Filters access by the ID of a portal,String
64,iotsitewise:project,https://docs.aws.amazon.com/iot-sitewise/latest/userguide/security_iam_service-with-iam.html#security_iam_service-with-iam-id-based-policies-conditionkeys,Filters access by the ID of a project,String
65,iotsitewise:propertyAlias,https://docs.aws.amazon.com/iot-sitewise/latest/userguide/security_iam_service-with-iam.html#security_iam_service-with-iam-id-based-policies-conditionkeys,Filters access by the property alias,String
66,iotsitewise:propertyId,https://docs.aws.amazon.com/iot-sitewise/latest/userguide/security_iam_service-with-iam.html#security_iam_service-with-iam-id-based-policies-conditionkeys,Filters access by the ID of an asset property,String
67,iotsitewise:user,https://docs.aws.amazon.com/iot-sitewise/latest/userguide/security_iam_service-with-iam.html#security_iam_service-with-iam-id-based-policies-conditionkeys,Filters access by the ID of an AWS Single Sign-On user,String
68,iottwinmaker:destinationType,https://docs.aws.amazon.com/service-authorization/latest/reference/list_awsiottwinmaker.html#awsiottwinmaker-policy-keys,Filters access by destination type of metadata transfer job,ArrayOfString
69,iottwinmaker:linkedServices,https://docs.aws.amazon.com/service-authorization/latest/reference/list_awsiottwinmaker.html#awsiottwinmaker-policy-keys,Filters access by workspace linked to services,ArrayOfString
70,iottwinmaker:sourceType,https://docs.aws.amazon.com/service-authorization/latest/reference/list_awsiottwinmaker.html#awsiottwinmaker-policy-keys,Filters access by source type of metadata transfer job,ArrayOfString
71,kafka:publicAccessEnabled,https://docs.aws.amazon.com/service-authorization/latest/reference/list_apachekafkaapisforamazonmskclusters.html#apachekafkaapisforamazonmskclusters-policy-keys,Filters access by the presence of public access enabled in the request,Bool
72,kms:BypassPolicyLockoutSafetyCheck,https://docs.aws.amazon.com/kms/latest/developerguide/conditions-kms.html#conditions-kms-bypass-policy-lockout-safety-check,Filters access to the CreateKey and PutKeyPolicy operations based on the value of the BypassPolicyLockoutSafetyCheck parameter in the request,Bool
73,kms:CallerAccount,https://docs.aws.amazon.com/kms/latest/developerguide/conditions-kms.html#conditions-kms-caller-account,Filters access to specified AWS KMS operations based on the AWS account ID of the caller. You can use this condition key to allow or deny access to all IAM users and roles in an AWS account in a single policy statement,String
74,kms:CustomerMasterKeySpec,https://docs.aws.amazon.com/kms/latest/developerguide/conditions-kms.html#conditions-kms-key-spec-replaced,"The kms:CustomerMasterKeySpec condition key is deprecated. Instead, use the kms:KeySpec condition key",String
75,kms:CustomerMasterKeyUsage,https://docs.aws.amazon.com/kms/latest/developerguide/conditions-kms.html#conditions-kms-key-usage-replaced,"The kms:CustomerMasterKeyUsage condition key is deprecated. Instead, use the kms:KeyUsage condition key",String
76,kms:DataKeyPairSpec,https://docs.aws.amazon.com/kms/latest/developerguide/conditions-kms.html#conditions-kms-data-key-pair-spec,Filters access to GenerateDataKeyPair and GenerateDataKeyPairWithoutPlaintext operations based on the value of the KeyPairSpec parameter in the request,String
77,kms:EncryptionAlgorithm,https://docs.aws.amazon.com/kms/latest/developerguide/conditions-kms.html#conditions-kms-encryption-algorithm,Filters access to encryption operations based on the value of the encryption algorithm in the request,String
78,kms:EncryptionContext:${EncryptionContextKey},https://docs.aws.amazon.com/kms/latest/developerguide/conditions-kms.html#conditions-kms-encryption-context,Filters access to a symmetric AWS KMS key based on the encryption context in a cryptographic operation. This condition evaluates the key and value in each key-value encryption context pair,String
79,kms:EncryptionContextKeys,https://docs.aws.amazon.com/kms/latest/developerguide/conditions-kms.html#conditions-kms-encryption-context-keys,Filters access to a symmetric AWS KMS key based on the encryption context in a cryptographic operation. This condition key evaluates only the key in each key-value encryption context pair,ArrayOfString
80,kms:ExpirationModel,https://docs.aws.amazon.com/kms/latest/developerguide/conditions-kms.html#conditions-kms-expiration-model,Filters access to the ImportKeyMaterial operation based on the value of the ExpirationModel parameter in the request,String
81,kms:GrantConstraintType,https://docs.aws.amazon.com/kms/latest/developerguide/conditions-kms.html#conditions-kms-grant-constraint-type,Filters access to the CreateGrant operation based on the grant constraint in the request,String
82,kms:GrantIsForAWSResource,https://docs.aws.amazon.com/kms/latest/developerguide/conditions-kms.html#conditions-kms-grant-is-for-aws-resource,Filters access to the CreateGrant operation when the request comes from a specified AWS service,Bool
83,kms:GrantOperations,https://docs.aws.amazon.com/kms/latest/developerguide/conditions-kms.html#conditions-kms-grant-operations,Filters access to the CreateGrant operation based on the operations in the grant,ArrayOfString
84,kms:GranteePrincipal,https://docs.aws.amazon.com/kms/latest/developerguide/conditions-kms.html#conditions-kms-grantee-principal,Filters access to the CreateGrant operation based on the grantee principal in the grant,String
85,kms:KeyAgreementAlgorithm,https://docs.aws.amazon.com/kms/latest/developerguide/conditions-kms.html#conditions-kms-key-agreement-algorithm,Filters access to the DeriveSharedSecret operation based on the value of the KeyAgreementAlgorithm parameter in the request,String
86,kms:KeyOrigin,https://docs.aws.amazon.com/kms/latest/developerguide/conditions-kms.html#conditions-kms-key-origin,Filters access to an API operation based on the Origin property of the AWS KMS key created by or used in the operation. Use it to qualify authorization of the CreateKey operation or any operation that is authorized for a KMS key,String
87,kms:KeySpec,https://docs.aws.amazon.com/kms/latest/developerguide/conditions-kms.html#conditions-kms-key-spec,Filters access to an API operation based on the KeySpec property of the AWS KMS key that is created by or used in the operation. Use it to qualify authorization of the CreateKey operation or any operation that is authorized for a KMS key resource,String
88,kms:KeyUsage,https://docs.aws.amazon.com/kms/latest/developerguide/conditions-kms.html#conditions-kms-key-usage,Filters access to an API operation based on the KeyUsage property of the AWS KMS key created by or used in the operation. Use it to qualify authorization of the CreateKey operation or any operation that is authorized for a KMS key resource,String
89,kms:MacAlgorithm,https://docs.aws.amazon.com/kms/latest/developerguide/conditions-kms.html#conditions-kms-mac-algorithm,Filters access to the GenerateMac and VerifyMac operations based on the MacAlgorithm parameter in the request,String
90,kms:MessageType,https://docs.aws.amazon.com/kms/latest/developerguide/conditions-kms.html#conditions-kms-message-type,Filters access to the Sign and Verify operations based on the value of the MessageType parameter in the request,String
91,kms:MultiRegion,https://docs.aws.amazon.com/kms/latest/developerguide/conditions-kms.html#conditions-kms-multi-region,Filters access to an API operation based on the MultiRegion property of the AWS KMS key created by or used in the operation. Use it to qualify authorization of the CreateKey operation or any operation that is authorized for a KMS key resource,Bool
92,kms:MultiRegionKeyType,https://docs.aws.amazon.com/kms/latest/developerguide/conditions-kms.html#conditions-kms-multi-region-key-type,Filters access to an API operation based on the MultiRegionKeyType property of the AWS KMS key created by or used in the operation. Use it to qualify authorization of the CreateKey operation or any operation that is authorized for a KMS key resource,String
93,kms:PrimaryRegion,https://docs.aws.amazon.com/kms/latest/developerguide/conditions-kms.html#conditions-kms-primary-region,Filters access to the UpdatePrimaryRegion operation based on the value of the PrimaryRegion parameter in the request,String
94,kms:ReEncryptOnSameKey,https://docs.aws.amazon.com/kms/latest/developerguide/conditions-kms.html#conditions-kms-reencrypt-on-same-key,Filters access to the ReEncrypt operation when it uses the same AWS KMS key that was used for the Encrypt operation,Bool
95,kms:RecipientAttestation:ImageSha384,https://docs.aws.amazon.com/kms/latest/developerguide/conditions-nitro-enclaves.html#conditions-kms-recipient-image-sha,Filters access to the API operations based on the image hash in the attestation document in the request,String
96,kms:RecipientAttestation:PCR0,https://docs.aws.amazon.com/kms/latest/developerguide/conditions-nitro-enclaves.html#conditions-kms-recipient-pcrs,"Filters access by the platform configuration register (PCR) 0 in the attestation document. PCR0 is a contiguous measure of the contents of the enclave image file, without the section data",String
97,s3:object-lock-legal-hold,https://docs.aws.amazon.com/AmazonS3/latest/userguide/object-lock-overview.html#object-lock-legal-holds,Filters access by object legal hold status,String
98,kms:RecipientAttestation:PCR1,https://docs.aws.amazon.com/kms/latest/developerguide/conditions-nitro-enclaves.html#conditions-kms-recipient-pcrs,Filters access by the platform configuration register (PCR) 1 in the attestation document. PCR1 is a contiguous measurement of the Linux kernel and bootstrap data,String
99,kms:RecipientAttestation:PCR10,https://docs.aws.amazon.com/kms/latest/developerguide/conditions-nitro-enclaves.html#conditions-kms-recipient-pcrs,Filters access by the platform configuration register (PCR) 10 in the attestation document in the request. PCR10 is a custom PCR that can be defined by the user for specific use cases,String
100,kms:RecipientAttestation:PCR11,https://docs.aws.amazon.com/kms/latest/developerguide/conditions-nitro-enclaves.html#conditions-kms-recipient-pcrs,Filters access by the platform configuration register (PCR) 11 in the attestation document in the request. PCR11 is a custom PCR that can be defined by the user for specific use cases,String
101,kms:RecipientAttestation:PCR12,https://docs.aws.amazon.com/kms/latest/developerguide/conditions-nitro-enclaves.html#conditions-kms-recipient-pcrs,Filters access by the platform configuration register (PCR) 12 in the attestation document in the request. PCR12 is a custom PCR that can be defined by the user for specific use cases,String
102,kms:RecipientAttestation:PCR13,https://docs.aws.amazon.com/kms/latest/developerguide/conditions-nitro-enclaves.html#conditions-kms-recipient-pcrs,Filters access by the platform configuration register (PCR) 13 in the attestation document in the request. PCR13 is a custom PCR that can be defined by the user for specific use cases,String
103,kms:RecipientAttestation:PCR14,https://docs.aws.amazon.com/kms/latest/developerguide/conditions-nitro-enclaves.html#conditions-kms-recipient-pcrs,Filters access by the platform configuration register (PCR) 14 in the attestation document in the request. PCR14 is a custom PCR that can be defined by the user for specific use cases,String
104,kms:RecipientAttestation:PCR15,https://docs.aws.amazon.com/kms/latest/developerguide/conditions-nitro-enclaves.html#conditions-kms-recipient-pcrs,Filters access by the platform configuration register (PCR) 15 in the attestation document in the request. PCR15 is a custom PCR that can be defined by the user for specific use cases,String
105,kms:RecipientAttestation:PCR16,https://docs.aws.amazon.com/kms/latest/developerguide/conditions-nitro-enclaves.html#conditions-kms-recipient-pcrs,Filters access by the platform configuration register (PCR) 16 in the attestation document in the request. PCR16 is a custom PCR that can be defined by the user for specific use cases,String
106,kms:RecipientAttestation:PCR17,https://docs.aws.amazon.com/kms/latest/developerguide/conditions-nitro-enclaves.html#conditions-kms-recipient-pcrs,Filters access by the platform configuration register (PCR) 17 in the attestation document in the request. PCR17 is a custom PCR that can be defined by the user for specific use cases,String
107,kms:RecipientAttestation:PCR18,https://docs.aws.amazon.com/kms/latest/developerguide/conditions-nitro-enclaves.html#conditions-kms-recipient-pcrs,Filters access by the platform configuration register (PCR) 18 in the attestation document in the request. PCR18 is a custom PCR that can be defined by the user for specific use cases,String
108,kms:RecipientAttestation:PCR19,https://docs.aws.amazon.com/kms/latest/developerguide/conditions-nitro-enclaves.html#conditions-kms-recipient-pcrs,Filters access by the platform configuration register (PCR) 19 in the attestation document in the request. PCR19 is a custom PCR that can be defined by the user for specific use cases,String
109,kms:RecipientAttestation:PCR2,https://docs.aws.amazon.com/kms/latest/developerguide/conditions-nitro-enclaves.html#conditions-kms-recipient-pcrs,"Filters access by the platform configuration register (PCR) 2 in the attestation document. PCR2 is a contiguous, in-order measurement of the user applications, without the boot ramfs",String
110,kms:RecipientAttestation:PCR20,https://docs.aws.amazon.com/kms/latest/developerguide/conditions-nitro-enclaves.html#conditions-kms-recipient-pcrs,Filters access by the platform configuration register (PCR) 20 in the attestation document in the request. PCR20 is a custom PCR that can be defined by the user for specific use cases,String
