condition_key_id,name,reference_url,description,type
251,transcribe:OutputBucketName,https://docs.aws.amazon.com/IAM/latest/UserGuide/list_amazontranscribe.html#amazontranscribe-policy-keys,Filters access based on the output bucket name included in the request,String
252,transcribe:OutputEncryptionKMSKeyId,https://docs.aws.amazon.com/IAM/latest/UserGuide/list_amazontranscribe.html#amazontranscribe-policy-keys,Filters access based on the KMS key id included in the request,String
253,transcribe:OutputKey,https://docs.aws.amazon.com/IAM/latest/UserGuide/list_amazontranscribe.html#amazontranscribe-policy-keys,Filters access based on the output key included in the request,String
254,transcribe:OutputLocation,https://docs.aws.amazon.com/IAM/latest/UserGuide/list_amazontranscribe.html#amazontranscribe-policy-keys,Filters access based on the output location included in the request,String
255,vpc-lattice-svcs:Port,https://docs.aws.amazon.com/vpc-lattice/latest/ug/auth-policies.html#auth-policies-condition-keys,Filters access by the destination port the request is made to,Numeric
256,vpc-lattice-svcs:RequestHeader/${HeaderName},https://docs.aws.amazon.com/vpc-lattice/latest/ug/auth-policies.html#auth-policies-condition-keys,Filters access by a header name-value pair in the request headers,String
257,vpc-lattice-svcs:RequestMethod,https://docs.aws.amazon.com/vpc-lattice/latest/ug/auth-policies.html#auth-policies-condition-keys,Filters access by the method of the request,String
258,vpc-lattice-svcs:RequestQueryString/${QueryStringKey},https://docs.aws.amazon.com/vpc-lattice/latest/ug/auth-policies.html#auth-policies-condition-keys,Filters access by the query string key-value pairs in the request URL,ArrayOfString
259,vpc-lattice-svcs:ServiceArn,https://docs.aws.amazon.com/vpc-lattice/latest/ug/auth-policies.html#auth-policies-condition-keys,Filters access by the ARN of the service receiving the request,ARN
260,acm:CertificateAuthority,https://docs.aws.amazon.com/acm/latest/userguide/security-iam.html,Filters access by certificateAuthority in the request. Can be used to restrict which Certificate Authorites certificates can be issued from,String
261,s3-object-lambda:signatureAge,https://docs.aws.amazon.com/AmazonS3/latest/API/bucket-policy-s3-sigv4-conditions.html,Filters access by the age in milliseconds of the request signature,Numeric
262,ec2:ProductCode,https://docs.aws.amazon.com/AWSEC2/latest/UserGuide/iam-policy-structure.html#amazon-ec2-keys,Filters access by the product code that is associated with the AMI,String
263,s3-object-lambda:versionid,https://docs.aws.amazon.com/AmazonS3/latest/dev/amazon-s3-policy-keys.html/#getobjectversion-limit-access-to-specific-version-3,Filters access by a specific object version,String
264,s3-outposts:AccessPointNetworkOrigin,https://docs.aws.amazon.com/AmazonS3/latest/userguide/creating-access-points.html#access-points-policies,Filters access by the network origin (Internet or VPC),String
265,s3-outposts:DataAccessPointAccount,https://docs.aws.amazon.com/AmazonS3/latest/userguide/creating-access-points.html#access-points-policies,Filters access by the AWS Account ID that owns the access point,String
266,s3-outposts:DataAccessPointArn,"",Filters access by an access point Amazon Resource Name (ARN),ARN
267,s3-outposts:ExistingObjectTag/<key>,https://docs.aws.amazon.com/AmazonS3/latest/userguide/object-tagging.html#tagging-and-policies,Filters access by requiring that an existing object tag has a specific tag key and value,String
268,s3-outposts:RequestObjectTag/<key>,https://docs.aws.amazon.com/AmazonS3/latest/userguide/object-tagging.html#tagging-and-policies,Filters access by restricting the tag keys and values allowed on objects,String
269,s3-outposts:RequestObjectTagKeys,https://docs.aws.amazon.com/AmazonS3/latest/userguide/object-tagging.html#tagging-and-policies,Filters access by restricting the tag keys allowed on objects,String
270,s3-outposts:authType,https://docs.aws.amazon.com/AmazonS3/latest/API/bucket-policy-s3-sigv4-conditions.html,Filters access by restricting incoming requests to a specific authentication method,String
271,s3-outposts:delimiter,https://docs.aws.amazon.com/AmazonS3/latest/userguide/walkthrough1.html,Filters access by requiring the delimiter parameter,String
272,ec2:Public,https://docs.aws.amazon.com/AWSEC2/latest/UserGuide/iam-policy-structure.html#amazon-ec2-keys,Filters access by whether the image has public launch permissions,Bool
273,s3-outposts:max-keys,https://docs.aws.amazon.com/AmazonS3/latest/userguide/amazon-s3-policy-keys.html#example-numeric-condition-operators,Filters access by limiting the maximum number of keys returned in a ListBucket request,Numeric
274,ec2:PublicIpAddress,https://docs.aws.amazon.com/AWSEC2/latest/UserGuide/iam-policy-structure.html#amazon-ec2-keys,Filters access by a public IP address,String
275,ec2:Quantity,https://docs.aws.amazon.com/AWSEC2/latest/UserGuide/iam-policy-structure.html#amazon-ec2-keys,Filters access by the number of Dedicated Hosts in a request,Numeric
276,ec2:Region,https://docs.aws.amazon.com/AWSEC2/latest/UserGuide/iam-policy-structure.html#amazon-ec2-keys,Filters access by the name of the AWS Region,String
277,ec2:RekeyFuzzPercentage,https://docs.aws.amazon.com/vpn/latest/s2svpn/vpn-authentication-access-control.html,Filters access by the percentage of increase of the rekey window (determined by the rekey margin time) within which the rekey time is randomly selected for a VPN tunnel,Numeric
278,ec2:RekeyMarginTimeSeconds,https://docs.aws.amazon.com/vpn/latest/s2svpn/vpn-authentication-access-control.html,Filters access by the margin time before the phase 2 lifetime expires for a VPN tunnel,Numeric
279,ec2:Remove/group,https://docs.aws.amazon.com/AWSEC2/latest/UserGuide/iam-policy-structure.html#amazon-ec2-keys,Filters access by the group being removed from a snapshot,String
280,ec2:Remove/userId,https://docs.aws.amazon.com/AWSEC2/latest/UserGuide/iam-policy-structure.html#amazon-ec2-keys,Filters access by the account id being removed from a snapshot,String
281,s3-outposts:prefix,https://docs.aws.amazon.com/AmazonS3/latest/userguide/amazon-s3-policy-keys.html#condition-key-bucket-ops-2,Filters access by key name prefix,String
282,s3-outposts:signatureAge,https://docs.aws.amazon.com/AmazonS3/latest/API/bucket-policy-s3-sigv4-conditions.html,"Filters access by identifying the length of time, in milliseconds, that a signature is valid in an authenticated request",Numeric
283,s3-outposts:signatureversion,https://docs.aws.amazon.com/AmazonS3/latest/API/bucket-policy-s3-sigv4-conditions.html,Filters access by identifying the version of AWS Signature that is supported for authenticated requests,String
284,acm:CertificateTransparencyLogging,https://docs.aws.amazon.com/acm/latest/userguide/security-iam.html,Filters access by certificateTransparencyLogging option in the request. Default 'ENABLED' if no key is present in the request,String
285,acm:DomainNames,https://docs.aws.amazon.com/acm/latest/userguide/security-iam.html,Filters access by domainNames in the request. This key can be used to restrict which domains can be in certificate requests,ArrayOfString
286,acm:KeyAlgorithm,https://docs.aws.amazon.com/acm/latest/userguide/security-iam.html,Filters access by keyAlgorithm in the request,String
287,ec2:ReplayWindowSizePackets,iam-policy-structure.html#amazon-ec2-keys,Filters access by the number of packets in an IKE replay window,String
288,s3-outposts:versionid,https://docs.aws.amazon.com/AmazonS3/latest/userguide/amazon-s3-policy-keys.html#getobjectversion-limit-access-to-specific-version-3,Filters access by a specific object version,String
289,acm:ValidationMethod,https://docs.aws.amazon.com/acm/latest/userguide/security-iam.html,Filters access by validationMethod in the request. Default 'EMAIL' if no key is present in the request,String
290,amplifyuibuilder:CodegenJobResourceAppId,https://docs.aws.amazon.com/amplify/latest/APIReference/API_App.html,Filters access by the app ID,String
291,amplifyuibuilder:CodegenJobResourceEnvironmentName,https://docs.aws.amazon.com/amplify/latest/APIReference/API_BackendEnvironment.html,Filters access by the backend environment name,String
292,amplifyuibuilder:CodegenJobResourceId,https://docs.aws.amazon.com/amplifyuibuilder/latest/APIReference/API_CodegenJob.html,Filters access by the codegen job ID,String
293,amplifyuibuilder:ComponentResourceAppId,https://docs.aws.amazon.com/amplify/latest/APIReference/API_App.html,Filters access by the app ID,String
294,s3-outposts:x-amz-acl,https://docs.aws.amazon.com/AmazonS3/latest/userguide/acl-overview.html#permissions,Filters access by requiring the x-amz-acl header with a specific canned ACL in a request,String
295,s3-outposts:x-amz-content-sha256,https://docs.aws.amazon.com/AmazonS3/latest/API/bucket-policy-s3-sigv4-conditions.html,Filters access by disallowing unsigned content in your bucket,String
296,amplifyuibuilder:ComponentResourceEnvironmentName,https://docs.aws.amazon.com/amplify/latest/APIReference/API_BackendEnvironment.html,Filters access by the backend environment name,String
297,s3-outposts:x-amz-copy-source,https://docs.aws.amazon.com/AmazonS3/latest/userguide/amazon-s3-policy-keys.html#putobject-limit-copy-source-3,"Filters access by restricting the copy source to a specific bucket, prefix, or object",String
298,s3-outposts:x-amz-metadata-directive,https://docs.aws.amazon.com/AmazonS3/latest/API/API_CopyObject.html,Filters access by enabling enforcement of object metadata behavior (COPY or REPLACE) when objects are copied,String
299,amplifyuibuilder:ComponentResourceId,https://docs.aws.amazon.com/amplifyuibuilder/latest/APIReference/API_Component.html,Filters access by the component ID,String
300,amplifyuibuilder:FormResourceAppId,https://docs.aws.amazon.com/amplify/latest/APIReference/API_App.html,Filters access by the app ID,String
301,amplifyuibuilder:FormResourceEnvironmentName,https://docs.aws.amazon.com/amplify/latest/APIReference/API_BackendEnvironment.html,Filters access by the backend environment name,String
302,amplifyuibuilder:FormResourceId,https://docs.aws.amazon.com/amplifyuibuilder/latest/APIReference/API_Form.html,Filters access by the form ID,String
303,ec2:RequesterVpc,https://docs.aws.amazon.com/vpc/latest/peering/security-iam.html,Filters access by the ARN of a requester VPC in a VPC peering connection,ARN
304,s3-outposts:x-amz-server-side-encryption,https://docs.aws.amazon.com/AmazonS3/latest/userguide/UsingServerSideEncryption.html,Filters access by requiring server-side encryption,String
305,ec2:ReservedInstancesOfferingType,https://docs.aws.amazon.com/AWSEC2/latest/UserGuide/ec2-reserved-instances.html#ri-payment-options,"Filters access by the payment option of the Reserved Instance offering (No Upfront, Partial Upfront, or All Upfront)",String
306,s3-outposts:x-amz-storage-class,https://docs.aws.amazon.com/AmazonS3/latest/userguide/storage-class-intro.html#sc-howtoset,Filters access by storage class,String
307,s3:AccessGrantsInstanceArn,https://docs.aws.amazon.com/IAM/latest/UserGuide/access-grants-instance.html,Filters access by access grants instance ARN,ARN
308,s3:AccessPointNetworkOrigin,https://docs.aws.amazon.com/AmazonS3/latest/userguide/creating-access-points.html#access-points-policies,Filters access by the network origin (Internet or VPC),String
309,s3:DataAccessPointAccount,https://docs.aws.amazon.com/AmazonS3/latest/userguide/creating-access-points.html#access-points-policies,Filters access by the AWS Account ID that owns the access point,String
310,s3:DataAccessPointArn,https://docs.aws.amazon.com/AmazonS3/latest/userguide/creating-access-points.html#access-points-policies,Filters access by an access point Amazon Resource Name (ARN),ARN
311,s3:ExistingJobOperation,https://docs.aws.amazon.com/AmazonS3/latest/userguide/batch-ops-job-tags-examples.html,Filters access by operation to updating the job priority,String
312,s3:ExistingJobPriority,https://docs.aws.amazon.com/AmazonS3/latest/userguide/batch-ops-job-tags-examples.html,Filters access by priority range to cancelling existing jobs,Numeric
313,ec2:ResourceTag/${TagKey},https://docs.aws.amazon.com/AWSEC2/latest/UserGuide/control-access-with-tags.html,Filters access by a tag key and value pair of a resource,String
314,s3:ExistingObjectTag/<key>,https://docs.aws.amazon.com/AmazonS3/latest/userguide/object-tagging.html#tagging-and-policies,Filters access by existing object tag key and value,String
315,s3:InventoryAccessibleOptionalFields,https://docs.aws.amazon.com/AmazonS3/latest/userguide/example-bucket-policies.html#example-bucket-policies-s3-inventory-2,Filters access by restricting which optional metadata fields a user can add when configuring S3 Inventory reports,ArrayOfString
316,s3:JobSuspendedCause,https://docs.aws.amazon.com/AmazonS3/latest/userguide/batch-ops-job-tags-examples.html,"Filters access by a specific job suspended cause (for example, AWAITING_CONFIRMATION) to cancelling suspended jobs",String
317,amplifyuibuilder:ThemeResourceAppId,https://docs.aws.amazon.com/amplify/latest/APIReference/API_App.html,Filters access by the app ID,String
318,amplifyuibuilder:ThemeResourceEnvironmentName,https://docs.aws.amazon.com/amplify/latest/APIReference/API_BackendEnvironment.html,Filters access by the backend environment name,String
319,amplifyuibuilder:ThemeResourceId,https://docs.aws.amazon.com/amplifyuibuilder/latest/APIReference/API_Theme.html,Filters access by the theme ID,String
320,ec2:RoleDelivery,https://docs.aws.amazon.com/AWSEC2/latest/UserGuide/iam-policy-structure.html#amazon-ec2-keys,Filters access by the version of the instance metadata service for retrieving IAM role credentials for EC2,Numeric
321,s3:RequestJobOperation,https://docs.aws.amazon.com/AmazonS3/latest/userguide/batch-ops-job-tags-examples.html,Filters access by operation to creating jobs,String
322,aoss:CollectionId,https://docs.aws.amazon.com/opensearch-service/latest/developerguide/security-iam-serverless.html#security_iam_serverless-conditionkeys,Filters access by the identifier of the collection,String
323,aoss:collection,https://docs.aws.amazon.com/opensearch-service/latest/developerguide/security-iam-serverless.html#security_iam_serverless-conditionkeys,Filters access by the collection name,String
324,s3:RequestJobPriority,https://docs.aws.amazon.com/AmazonS3/latest/userguide/batch-ops-job-tags-examples.html,Filters access by priority range to creating new jobs,Numeric
325,ec2:RootDeviceType,https://docs.aws.amazon.com/AWSEC2/latest/UserGuide/iam-policy-structure.html#amazon-ec2-keys,Filters access by the root device type of the instance (ebs or instance-store),String
326,aoss:index,https://docs.aws.amazon.com/opensearch-service/latest/developerguide/security-iam-serverless.html#security_iam_serverless-conditionkeys,Filters access by the index,String
327,ec2:RouteTableID,iam-policy-structure.html#imageId-key,Filters access by the ID of a route table,String
328,ec2:RoutingType,https://docs.aws.amazon.com/vpn/latest/s2svpn/vpn-authentication-access-control.html,Filters access by the routing type for the VPN connection,String
329,ec2:SamlProviderArn,https://docs.aws.amazon.com/AWSEC2/latest/UserGuide/iam-policy-structure.html#amazon-ec2-keys,Filters access by the ARN of the IAM SAML identity provider,ARN
330,ec2:SecurityGroupID,iam-policy-structure.html#imageId-key,Filters access by the ID of a security group,String
331,ec2:ServerCertificateArn,https://docs.aws.amazon.com/AWSEC2/latest/UserGuide/iam-policy-structure.html#amazon-ec2-keys,Filters access by the ARN of the server certificate,ARN
332,apigateway:Request/AccessLoggingDestination,https://docs.aws.amazon.com/apigateway/latest/developerguide/security_iam_service-with-iam.html,Filters access by access log destination. Available during the CreateStage and UpdateStage operations,String
333,apigateway:Request/AccessLoggingFormat,https://docs.aws.amazon.com/apigateway/latest/developerguide/security_iam_service-with-iam.html,Filters access by access log format. Available during the CreateStage and UpdateStage operations,String
334,apigateway:Request/ApiKeyRequired,https://docs.aws.amazon.com/apigateway/latest/developerguide/security_iam_service-with-iam.html,Filters access by the requirement of API. Available during the CreateRoute and UpdateRoute operations. Also available as a collection during import and reimport,ArrayOfBool
335,apigateway:Request/ApiName,https://docs.aws.amazon.com/apigateway/latest/developerguide/security_iam_service-with-iam.html,Filters access by API name. Available during the CreateApi and UpdateApi operations,String
336,vpc-lattice-svcs:ServiceNetworkArn,https://docs.aws.amazon.com/vpc-lattice/latest/ug/auth-policies.html#auth-policies-condition-keys,Filters access by the ARN of the service network receiving the request,ARN
337,s3:RequestObjectTag/<key>,https://docs.aws.amazon.com/AmazonS3/latest/userguide/object-tagging.html#tagging-and-policies,Filters access by the tag keys and values to be added to objects,String
338,vpc-lattice-svcs:SourceVpc,https://docs.aws.amazon.com/vpc-lattice/latest/ug/auth-policies.html#auth-policies-condition-keys,Filters access by the VPC the request is made from,String
339,s3:RequestObjectTagKeys,https://docs.aws.amazon.com/AmazonS3/latest/userguide/object-tagging.html#tagging-and-policies,Filters access by the tag keys to be added to objects,ArrayOfString
340,vpc-lattice-svcs:SourceVpcOwnerAccount,https://docs.aws.amazon.com/vpc-lattice/latest/ug/auth-policies.html#auth-policies-condition-keys,Filters access by the owning account of the VPC the request is made from,String
341,s3:ResourceAccount,https://docs.aws.amazon.com/AmazonS3/latest/userguide/amazon-s3-policy-keys.html#example-object-resource-account,Filters access by the resource owner AWS account ID,String
342,s3:TlsVersion,#example-object-tls-version,Filters access by the TLS version used by the client,Numeric
343,s3:authType,https://docs.aws.amazon.com/AmazonS3/latest/API/bucket-policy-s3-sigv4-conditions.html,Filters access by authentication method,String
344,s3:delimiter,https://docs.aws.amazon.com/AmazonS3/latest/userguide/walkthrough1.html,Filters access by delimiter parameter,String
345,s3:destinationRegion,https://docs.aws.amazon.com/AmazonS3/latest/userguide/replication.html,Filters access by a specific replication destination region for targeted buckets of the AWS FIS action aws:s3:bucket-pause-replication,String
346,s3:isReplicationPauseRequest,https://docs.aws.amazon.com/fis/latest/userguide/security_iam_id-based-policy-examples.html#security-iam-policy-examples-s3,Filters access by request made via AWS FIS action aws:s3:bucket-pause-replication,Bool
347,s3:locationconstraint,https://docs.aws.amazon.com/AmazonS3/latest/userguide/amazon-s3-policy-keys.html#condition-key-bucket-ops-1,Filters access by a specific Region,String
348,vpc-lattice:AuthType,https://docs.aws.amazon.com/vpc-lattice/latest/ug/,Filters access by the auth type specified in the request,String
349,apigateway:Request/AuthorizerType,https://docs.aws.amazon.com/apigateway/latest/developerguide/security_iam_service-with-iam.html,"Filters access by type of authorizer in the request, for example REQUEST or JWT. Available during CreateAuthorizer and UpdateAuthorizer. Also available during import and reimport as an ArrayOfString",ArrayOfString
350,vpc-lattice:Protocol,https://docs.aws.amazon.com/vpc-lattice/latest/ug/,Filters access by the protocol specified in the request,String
351,vpc-lattice:SecurityGroupIds,https://docs.aws.amazon.com/vpc-lattice/latest/ug/,Filters access by the IDs of security groups,ArrayOfString
352,vpc-lattice:ServiceArn,https://docs.aws.amazon.com/vpc-lattice/latest/ug/,Filters access by the ARN of a service,ARN
353,vpc-lattice:ServiceNetworkArn,https://docs.aws.amazon.com/vpc-lattice/latest/ug/,Filters access by the ARN of a service network,ARN
354,vpc-lattice:TargetGroupArns,https://docs.aws.amazon.com/vpc-lattice/latest/ug/,Filters access by the ARNs of target groups,ArrayOfARN
355,s3:max-keys,https://docs.aws.amazon.com/AmazonS3/latest/userguide/amazon-s3-policy-keys.html#example-numeric-condition-operators,Filters access by maximum number of keys returned in a ListBucket request,Numeric
356,vpc-lattice:VpcId,https://docs.aws.amazon.com/vpc-lattice/latest/ug/,Filters access by the ID of a virtual private cloud (VPC),String
357,apigateway:Request/AuthorizerUri,https://docs.aws.amazon.com/apigateway/latest/developerguide/security_iam_service-with-iam.html,Filters access by URI of a Lambda authorizer function. Available during CreateAuthorizer and UpdateAuthorizer. Also available during import and reimport as an ArrayOfString,ArrayOfString
358,s3:object-lock-legal-hold,https://docs.aws.amazon.com/AmazonS3/latest/userguide/object-lock-overview.html#object-lock-legal-holds,Filters access by object legal hold status,String
359,apigateway:Request/DisableExecuteApiEndpoint,https://docs.aws.amazon.com/apigateway/latest/developerguide/security_iam_service-with-iam.html,Filters access by status of the default execute-api endpoint. Available during the CreateApi and UpdateApi operations,Bool
360,apigateway:Request/EndpointType,https://docs.aws.amazon.com/apigateway/latest/developerguide/security_iam_service-with-iam.html,"Filters access by endpoint type. Available during the CreateDomainName, UpdateDomainName, CreateApi, and UpdateApi operations",ArrayOfString
361,apigateway:Request/MtlsTrustStoreUri,https://docs.aws.amazon.com/apigateway/latest/developerguide/security_iam_service-with-iam.html,Filters access by URI of the truststore used for mutual TLS authentication. Available during the CreateDomainName and UpdateDomainName operations,String
362,apigateway:Request/MtlsTrustStoreVersion,https://docs.aws.amazon.com/apigateway/latest/developerguide/security_iam_service-with-iam.html,Filters access by version of the truststore used for mutual TLS authentication. Available during the CreateDomainName and UpdateDomainName operations,String
363,apigateway:Request/RouteAuthorizationType,https://docs.aws.amazon.com/apigateway/latest/developerguide/security_iam_service-with-iam.html,"Filters access by authorization type, for example NONE, AWS_IAM, CUSTOM, JWT, COGNITO_USER_POOLS. Available during the CreateMethod and PutMethod operations Also available as a collection during import",ArrayOfString
364,apigateway:Request/SecurityPolicy,https://docs.aws.amazon.com/apigateway/latest/developerguide/security_iam_service-with-iam.html,Filters access by TLS version. Available during the CreateDomain and UpdateDomain operations,ArrayOfString
365,s3:object-lock-mode,https://docs.aws.amazon.com/AmazonS3/latest/userguide/object-lock-overview.html#object-lock-retention-modes,Filters access by object retention mode (COMPLIANCE or GOVERNANCE),String
366,s3:object-lock-remaining-retention-days,https://docs.aws.amazon.com/AmazonS3/latest/userguide/object-lock-managing.html#object-lock-managing-retention-limits,Filters access by remaining object retention days,Numeric
367,s3:object-lock-retain-until-date,https://docs.aws.amazon.com/AmazonS3/latest/userguide/object-lock-overview.html#object-lock-retention-periods,Filters access by object retain-until date,Date
368,s3:prefix,https://docs.aws.amazon.com/AmazonS3/latest/userguide/amazon-s3-policy-keys.html#condition-key-bucket-ops-2,Filters access by key name prefix,String
369,s3:signatureAge,https://docs.aws.amazon.com/AmazonS3/latest/API/bucket-policy-s3-sigv4-conditions.html,Filters access by the age in milliseconds of the request signature,Numeric
370,s3:signatureversion,https://docs.aws.amazon.com/AmazonS3/latest/API/bucket-policy-s3-sigv4-conditions.html,Filters access by the version of AWS Signature used on the request,String
371,wafv2:LogDestinationResource,https://docs.aws.amazon.com/waf/latest/developerguide/security_iam_service-with-iam.html#security_iam_service-with-iam-id-based-policies-conditionkeys,Filters access by log destination ARN for PutLoggingConfiguration API,ARN
372,ec2:SnapshotCoolOffPeriod,https://docs.aws.amazon.com/AWSEC2/latest/UserGuide/iam-policy-structure.html#amazon-ec2-keys,Filters access by the compliance mode cooling-off period,Numeric
373,s3:versionid,https://docs.aws.amazon.com/AmazonS3/latest/userguide/amazon-s3-policy-keys.html#getobjectversion-limit-access-to-specific-version-3,Filters access by a specific object version,String
374,s3:x-amz-acl,https://docs.aws.amazon.com/AmazonS3/latest/userguide/acl-overview.html#permissions,Filters access by canned ACL in the request's x-amz-acl header,String
375,s3:x-amz-content-sha256,https://docs.aws.amazon.com/AmazonS3/latest/API/bucket-policy-s3-sigv4-conditions.html,Filters access by unsigned content in your bucket,String
376,s3:x-amz-copy-source,https://docs.aws.amazon.com/AmazonS3/latest/userguide/amazon-s3-policy-keys.html#putobject-limit-copy-source-3,"Filters access by copy source bucket, prefix, or object in the copy object requests",String
377,s3:x-amz-grant-full-control,https://docs.aws.amazon.com/AmazonS3/latest/userguide/acl-overview.html#permissions,Filters access by x-amz-grant-full-control (full control) header,String
378,s3:x-amz-grant-read,https://docs.aws.amazon.com/AmazonS3/latest/userguide/acl-overview.html#permissions,Filters access by x-amz-grant-read (read access) header,String
379,wafv2:LogScope,https://docs.aws.amazon.com/waf/latest/developerguide/security_iam_service-with-iam.html#security_iam_service-with-iam-id-based-policies-conditionkeys,Filters access by log scope for Logging Configuration API,String
380,wellarchitected:JiraProjectKey,https://docs.aws.amazon.com/wellarchitected/latest/userguide/security_iam_id-based-policy-examples.html,Filters access by project key,String
