condition_key_id,name,reference_url,description,type
1,saml:eduorgsuperioruri,https://docs.aws.amazon.com/IAM/latest/UserGuide/reference_policies_iam-condition-keys.html#ck_eduorgsuperioruri,Filters access by the eduOrg attribute,ArrayOfString
2,saml:eduorgwhitepagesuri,https://docs.aws.amazon.com/IAM/latest/UserGuide/reference_policies_iam-condition-keys.html#ck_eduorgwhitepagesuri,Filters access by the eduOrg attribute,ArrayOfString
3,saml:edupersonaffiliation,https://docs.aws.amazon.com/IAM/latest/UserGuide/reference_policies_iam-condition-keys.html#ck_edupersonaffiliation,Filters access by the eduPerson attribute,ArrayOfString
4,saml:edupersonassurance,https://docs.aws.amazon.com/IAM/latest/UserGuide/reference_policies_iam-condition-keys.html#ck_edupersonassurance,Filters access by the eduPerson attribute,ArrayOfString
5,saml:edupersonentitlement,https://docs.aws.amazon.com/IAM/latest/UserGuide/reference_policies_iam-condition-keys.html#ck_edupersonentitlement,Filters access by the eduPerson attribute,ArrayOfString
6,saml:edupersonnickname,https://docs.aws.amazon.com/IAM/latest/UserGuide/reference_policies_iam-condition-keys.html#ck_edupersonnickname,Filters access by the eduPerson attribute,ArrayOfString
7,saml:edupersonorgdn,https://docs.aws.amazon.com/IAM/latest/UserGuide/reference_policies_iam-condition-keys.html#ck_edupersonorgdn,Filters access by the eduPerson attribute,String
8,saml:edupersonorgunitdn,https://docs.aws.amazon.com/IAM/latest/UserGuide/reference_policies_iam-condition-keys.html#ck_edupersonorgunitdn,Filters access by the eduPerson attribute,ArrayOfString
9,saml:edupersonprimaryaffiliation,https://docs.aws.amazon.com/IAM/latest/UserGuide/reference_policies_iam-condition-keys.html#ck_edupersonprimaryaffiliation,Filters access by the eduPerson attribute,String
10,saml:edupersonprimaryorgunitdn,https://docs.aws.amazon.com/IAM/latest/UserGuide/reference_policies_iam-condition-keys.html#ck_edupersonprimaryorgunitdn,Filters access by the eduPerson attribute,String
11,saml:edupersonprincipalname,https://docs.aws.amazon.com/IAM/latest/UserGuide/reference_policies_iam-condition-keys.html#ck_edupersonprincipalname,Filters access by the eduPerson attribute,String
12,saml:edupersonscopedaffiliation,https://docs.aws.amazon.com/IAM/latest/UserGuide/reference_policies_iam-condition-keys.html#ck_edupersonscopedaffiliation,Filters access by the eduPerson attribute,ArrayOfString
13,saml:edupersontargetedid,https://docs.aws.amazon.com/IAM/latest/UserGuide/reference_policies_iam-condition-keys.html#ck_edupersontargetedid,Filters access by the eduPerson attribute,ArrayOfString
14,saml:givenName,https://docs.aws.amazon.com/IAM/latest/UserGuide/reference_policies_iam-condition-keys.html#ck_givenname,Filters access by the givenName attribute,String
15,saml:iss,https://docs.aws.amazon.com/IAM/latest/UserGuide/reference_policies_iam-condition-keys.html#ck_iss,"Filters access by on the issuer, which is represented by a URN",String
16,saml:mail,https://docs.aws.amazon.com/IAM/latest/UserGuide/reference_policies_iam-condition-keys.html#ck_mail,Filters access by the mail attribute,String
17,saml:name,https://docs.aws.amazon.com/IAM/latest/UserGuide/reference_policies_iam-condition-keys.html#ck_name,Filters access by the name attribute,String
18,saml:namequalifier,https://docs.aws.amazon.com/IAM/latest/UserGuide/reference_policies_iam-condition-keys.html#ck_namequalifier,"Filters access by the hash value of the issuer, account ID, and friendly name",String
19,saml:organizationStatus,https://docs.aws.amazon.com/IAM/latest/UserGuide/reference_policies_iam-condition-keys.html#ck_organizationstatus,Filters access by the organizationStatus attribute,String
20,saml:primaryGroupSID,https://docs.aws.amazon.com/IAM/latest/UserGuide/reference_policies_iam-condition-keys.html#ck_primarygroupsid,Filters access by the primaryGroupSID attribute,String
21,saml:sub,https://docs.aws.amazon.com/IAM/latest/UserGuide/reference_policies_iam-condition-keys.html#ck_sub,Filters access by the subject of the claim (the SAML user ID),String
22,saml:sub_type,https://docs.aws.amazon.com/IAM/latest/UserGuide/reference_policies_iam-condition-keys.html#ck_subtype,"Filters access by the value persistent, transient, or the full Format URI",String
23,saml:surname,https://docs.aws.amazon.com/IAM/latest/UserGuide/reference_policies_iam-condition-keys.html#ck_surname,Filters access by the surname attribute,String
24,saml:uid,https://docs.aws.amazon.com/IAM/latest/UserGuide/reference_policies_iam-condition-keys.html#ck_uid,Filters access by the uid attribute,String
25,saml:x500UniqueIdentifier,https://docs.aws.amazon.com/IAM/latest/UserGuide/reference_policies_iam-condition-keys.html#ck_x500uniqueidentifier,Filters access by the uid attribute,String
26,secretsmanager:AddReplicaRegions,https://docs.aws.amazon.com/secretsmanager/latest/userguide/reference_iam-permissions.html#iam-contextkeys,Filters access by the list of Regions in which to replicate the secret,ArrayOfString
27,secretsmanager:BlockPublicPolicy,https://docs.aws.amazon.com/secretsmanager/latest/userguide/reference_iam-permissions.html#iam-contextkeys,Filters access by whether the resource policy blocks broad AWS account access,Bool
28,secretsmanager:Description,https://docs.aws.amazon.com/secretsmanager/latest/userguide/reference_iam-permissions.html#iam-contextkeys,Filters access by the description text in the request,String
29,secretsmanager:ForceDeleteWithoutRecovery,https://docs.aws.amazon.com/secretsmanager/latest/userguide/reference_iam-permissions.html#iam-contextkeys,Filters access by whether the secret is to be deleted immediately without any recovery window,Bool
30,secretsmanager:ForceOverwriteReplicaSecret,https://docs.aws.amazon.com/secretsmanager/latest/userguide/reference_iam-permissions.html#iam-contextkeys,Filters access by whether to overwrite a secret with the same name in the destination Region,Bool
31,secretsmanager:KmsKeyArn,https://docs.aws.amazon.com/secretsmanager/latest/userguide/reference_iam-permissions.html#iam-contextkeys,Filters access by the key ARN of the KMS key in the request,ARN
32,secretsmanager:KmsKeyId,https://docs.aws.amazon.com/secretsmanager/latest/userguide/reference_iam-permissions.html#iam-contextkeys,Filters access by the key identifier of the KMS key in the request. Deprecated: Use secretsmanager:KmsKeyArn,String
33,secretsmanager:ModifyRotationRules,https://docs.aws.amazon.com/secretsmanager/latest/userguide/reference_iam-permissions.html#iam-contextkeys,Filters access by whether the rotation rules of the secret are to be modified,Bool
34,secretsmanager:Name,https://docs.aws.amazon.com/secretsmanager/latest/userguide/reference_iam-permissions.html#iam-contextkeys,Filters access by the friendly name of the secret in the request,String
35,secretsmanager:RecoveryWindowInDays,https://docs.aws.amazon.com/secretsmanager/latest/userguide/reference_iam-permissions.html#iam-contextkeys,Filters access by the number of days that Secrets Manager waits before it can delete the secret,Numeric
36,secretsmanager:ResourceTag/tag-key,https://docs.aws.amazon.com/secretsmanager/latest/userguide/reference_iam-permissions.html#iam-contextkeys,Filters access by a tag key and value pair,String
37,secretsmanager:RotateImmediately,https://docs.aws.amazon.com/secretsmanager/latest/userguide/reference_iam-permissions.html#iam-contextkeys,Filters access by whether the secret is to be rotated immediately,Bool
38,secretsmanager:RotationLambdaARN,https://docs.aws.amazon.com/secretsmanager/latest/userguide/reference_iam-permissions.html#iam-contextkeys,Filters access by the ARN of the rotation Lambda function in the request,ARN
39,secretsmanager:SecretId,https://docs.aws.amazon.com/secretsmanager/latest/userguide/reference_iam-permissions.html#iam-contextkeys,Filters access by the SecretID value in the request,ARN
40,secretsmanager:SecretPrimaryRegion,https://docs.aws.amazon.com/secretsmanager/latest/userguide/reference_iam-permissions.html#iam-contextkeys,Filters access by primary region in which the secret is created,String
41,secretsmanager:VersionId,https://docs.aws.amazon.com/secretsmanager/latest/userguide/reference_iam-permissions.html#iam-contextkeys,Filters access by the unique identifier of the version of the secret in the request,String
42,secretsmanager:VersionStage,https://docs.aws.amazon.com/secretsmanager/latest/userguide/reference_iam-permissions.html#iam-contextkeys,Filters access by the list of version stages in the request,String
43,secretsmanager:resource/AllowRotationLambdaArn,https://docs.aws.amazon.com/secretsmanager/latest/userguide/reference_iam-permissions.html#iam-contextkeys,Filters access by the ARN of the rotation Lambda function associated with the secret,ARN
44,securityhub:ASFFSyntaxPath/${ASFFSyntaxPath},https://docs.aws.amazon.com/IAM/latest/UserGuide/reference_policies_condition-keys.html#condition-keys-asffsyntaxpath,Filters access by the specified fields and values in the request,String
45,securityhub:TargetAccount,https://docs.aws.amazon.com/securityhub/latest/userguide/securityhub-access.html#conditions,Filters access by the AwsAccountId field that is specified in the request,String
46,serverlessrepo:applicationType,https://docs.aws.amazon.com/IAM/latest/UserGuide/applications.html,Filters access by application type,String
47,servicecatalog:Resource,,,
48,servicecatalog:ResourceType,,,
49,servicecatalog:accountLevel,,,
50,servicecatalog:roleLevel,,,
51,servicecatalog:userLevel,,,
52,servicediscovery:NamespaceArn,https://docs.aws.amazon.com/cloud-map/latest/dg/access-control-overview.html#specifying-conditions,Filters access by specifying the Amazon Resource Name (ARN) for the related namespace,ARN
53,servicediscovery:NamespaceName,https://docs.aws.amazon.com/cloud-map/latest/dg/access-control-overview.html#specifying-conditions,Filters access by specifying the name of the related namespace,String
54,servicediscovery:ServiceArn,https://docs.aws.amazon.com/cloud-map/latest/dg/access-control-overview.html#specifying-conditions,Filters access by specifying the Amazon Resource Name (ARN) for the related service,ARN
55,servicediscovery:ServiceName,https://docs.aws.amazon.com/cloud-map/latest/dg/access-control-overview.html#specifying-conditions,Filters access by specifying the name of the related service,String
56,servicequotas:service,https://docs.aws.amazon.com/servicequotas/latest/userguide/identity-access-management.html#condition-keys,Filters access by the specified AWS service,String
57,ses:AddonSubscriptionArn,https://docs.aws.amazon.com/IAM/latest/UserGuide/list_amazonsesmailmanager.html#amazonsesmailmanager-policy-keys,Filters access by SES Addon Subscription ARN,ARN
58,ses:ApiVersion,https://docs.aws.amazon.com/IAM/latest/UserGuide/list_amazonses.html#amazonses-policy-keys,Filters access by the SES API version,String
59,ses:ExportSourceType,https://docs.aws.amazon.com/IAM/latest/UserGuide/list_amazonses.html#amazonses-policy-keys,Filters access by the export source type,String
60,ses:FeedbackAddress,https://docs.aws.amazon.com/IAM/latest/UserGuide/list_amazonses.html#amazonses-policy-keys,"Filters access by the ""Return-Path"" address, which specifies where bounces and complaints are sent by email feedback forwarding",String
61,ses:FromAddress,https://docs.aws.amazon.com/IAM/latest/UserGuide/list_amazonses.html#amazonses-policy-keys,"Filters access by the ""From"" address of a message",String
62,ses:FromDisplayName,https://docs.aws.amazon.com/IAM/latest/UserGuide/list_amazonses.html#amazonses-policy-keys,"Filters access by the ""From"" address that is used as the display name of a message",String
63,ses:MailManagerIngressPointType,https://docs.aws.amazon.com/IAM/latest/UserGuide/list_amazonsesmailmanager.html#amazonsesmailmanager-policy-keys,"Filters access by SES Mail Manager ingress point type, for example OPEN or AUTH",String
64,ses:MailManagerRuleSetArn,https://docs.aws.amazon.com/IAM/latest/UserGuide/list_amazonsesmailmanager.html#amazonsesmailmanager-policy-keys,Filters access by SES Mail Manager rule set ARN,ARN
65,ses:MailManagerTrafficPolicyArn,https://docs.aws.amazon.com/IAM/latest/UserGuide/list_amazonsesmailmanager.html#amazonsesmailmanager-policy-keys,Filters access by SES Mail Manager traffic policy ARN,ARN
66,ses:MultiRegionEndpointId,https://docs.aws.amazon.com/IAM/latest/UserGuide/list_amazonses.html#amazonses-policy-keys,Filters access by the multi-region endpoint ID that is used to send email,String
67,ses:Recipients,https://docs.aws.amazon.com/IAM/latest/UserGuide/list_amazonses.html#amazonses-policy-keys,"Filters access by the recipient addresses of a message, which include the ""To"", ""CC"", and ""BCC"" addresses",ArrayOfString
68,ses:ReplicaRegion,https://docs.aws.amazon.com/IAM/latest/UserGuide/list_amazonses.html#amazonses-policy-keys,Filters access by the replica regions for Replicating domain DKIM signing key,ArrayOfString
69,signer:ProfileVersion,https://docs.aws.amazon.com/signer/latest/developerguide/authen-apipermissions.html,Filters access by version of the Signing Profile,String
70,sns:Endpoint,https://docs.aws.amazon.com/sns/latest/dg/UsingIAMwithSNS.html#w2ab1c11c23c19,"Filters access by the URL, email address, or ARN from a Subscribe request or a previously confirmed subscription",String
71,sns:Protocol,https://docs.aws.amazon.com/sns/latest/dg/UsingIAMwithSNS.html#w2ab1c11c23c19,Filters access by the protocol value from a Subscribe request or a previously confirmed subscription,String
72,ssm:AutoApprove,https://docs.aws.amazon.com/systems-manager/latest/userguide/change-manager-auto-approval-access.html,Filters access by verifying that a user has permission to start Change Manager workflows without a review step (with the exception of change freeze events),Bool
73,ssm:DocumentCategories,https://docs.aws.amazon.com/systems-manager/latest/userguide/auth-and-access-control-iam-access-control-identity-based.html#policy-conditions,Filters access by verifying that a user has permission to access a document belonging to a specific category enum,ArrayOfString
74,ssm:Overwrite,https://docs.aws.amazon.com/systems-manager/latest/userguide/parameter-store-policy-conditions.html#overwrite-condition,Filters access by controling whether Systems Manager parameters can be overwritten,String
75,ssm:Policies,https://docs.aws.amazon.com/systems-manager/latest/userguide/parameter-store-policy-conditions.html#parameter-policies-condition,Filters access by controlling whether an IAM Entity (user or role) can create or update a parameter that includes a parameter policy,String
76,ssm:Recursive,https://docs.aws.amazon.com/systems-manager/latest/userguide/parameter-store-policy-conditions.html#recursive-condition,Filters access by Systems Manager parameters created in a hierarchical structure,String
77,ssm:SourceInstanceARN,https://docs.aws.amazon.com/service-authorization/latest/reference/list_awssystemsmanager.html#awssystemsmanager-policy-keys,Filters access by verifying the Amazon Resource Name (ARN) of the AWS Systems Manager's managed instance from which the request is made. This key is not present when the request comes from the managed instance authenticated with an IAM role associated with EC2 instance profile,ARN
78,ssm:SyncType,https://docs.aws.amazon.com/systems-manager/latest/userguide/auth-and-access-control-iam-access-control-identity-based.html#policy-conditions,Filters access by verifying that a user also has access to the ResourceDataSync SyncType specified in the request,String
79,ssm:resourceTag/${TagKey},https://docs.aws.amazon.com/systems-manager/latest/userguide/security_iam_service-with-iam.html#policy-conditions,Filters access by a tag key-value pair assigned to the Systems Manager resource,String
80,ssm:resourceTag/aws:ssmmessages:session-id,https://docs.aws.amazon.com/systems-manager/latest/userguide/auth-and-access-control-iam-access-control-identity-based.html#policy-conditions,Filters access by based on a tag key-value pair assigned to the Systems Manager session resource,String
81,ssm:resourceTag/aws:ssmmessages:target-id,https://docs.aws.amazon.com/systems-manager/latest/userguide/auth-and-access-control-iam-access-control-identity-based.html#policy-conditions,Filters access by based on a tag key-value pair assigned to the Systems Manager session resource,String
82,ssm:resourceTag/tag-key,https://docs.aws.amazon.com/systems-manager/latest/userguide/auth-and-access-control-iam-access-control-identity-based.html#policy-conditions,Filters access by based on a tag key-value pair assigned to the Systems Manager resource,String
83,sso:ApplicationAccount,https://docs.aws.amazon.com/singlesignon/latest/userguide/API_Application.html,Filters access by the account which creates the application,String
84,states:HTTPEndpoint,https://docs.aws.amazon.com/step-functions/latest/dg/connect-third-party-apis.html,Filters access by the endpoint that the HTTP Task state allows in the request,String
85,states:HTTPMethod,https://docs.aws.amazon.com/step-functions/latest/dg/connect-third-party-apis.html,Filters access by the method that the HTTP Task state allows in the request,String
86,states:StateMachineQualifier,https://docs.aws.amazon.com/step-functions/latest/dg/auth-version-alias.html,Filters access by the qualifier of a state machine ARN,ArrayOfString
87,sts:AWSServiceName,https://docs.aws.amazon.com/IAM/latest/UserGuide/reference_policies_iam-condition-keys.html#ck_awsservicename,Filters access by the service that is obtaining a bearer token,String
88,sts:DurationSeconds,https://docs.aws.amazon.com/IAM/latest/UserGuide/reference_policies_iam-condition-keys.html#ck_durationseconds,Filters access by the duration in seconds when getting a bearer token,String
89,sts:ExternalId,https://docs.aws.amazon.com/IAM/latest/UserGuide/reference_policies_iam-condition-keys.html#ck_externalid,Filters access by the unique identifier required when you assume a role in another account,String
90,sts:RequestContext/${ContextKey},https://docs.aws.amazon.com/IAM/latest/UserGuide/reference_policies_iam-condition-keys.html#condition-keys-sts,Filters access by the session context key-value pairs embedded in the signed context assertion retrieved from a trusted context provider,String
91,sts:RequestContextProviders,https://docs.aws.amazon.com/IAM/latest/UserGuide/reference_policies_iam-condition-keys.html#condition-keys-sts,Filters access by the context provider ARNs,ArrayOfARN
92,sts:RoleSessionName,https://docs.aws.amazon.com/IAM/latest/UserGuide/reference_policies_iam-condition-keys.html#ck_rolesessionname,Filters access by the role session name required when you assume a role,String
93,sts:SourceIdentity,https://docs.aws.amazon.com/IAM/latest/UserGuide/reference_policies_iam-condition-keys.html#ck_sourceidentity,Filters access by the source identity that is passed in the request,String
94,sts:TaskPolicyArn,https://docs.aws.amazon.com/IAM/latest/UserGuide/reference_policies_iam-condition-keys.html#condition-keys-sts,Filters access by TaskPolicyARN,String
95,sts:TransitiveTagKeys,https://docs.aws.amazon.com/IAM/latest/UserGuide/reference_policies_iam-condition-keys.html#ck_TransitiveTagKeys,Filters access by the transitive tag keys that are passed in the request,ArrayOfString
96,swf:activityType.name,https://docs.aws.amazon.com/amazonswf/latest/developerguide/swf-dev-iam.html##swf-dev-iam.api,Filters access by the name of the activity type,String
97,swf:activityType.version,https://docs.aws.amazon.com/amazonswf/latest/developerguide/swf-dev-iam.html##swf-dev-iam.api,Filters access by the version of the activity type,String
98,swf:defaultTaskList.name,https://docs.aws.amazon.com/amazonswf/latest/developerguide/swf-dev-iam.html##swf-dev-iam.api,Filters access by the name of the default task list,String
99,swf:name,https://docs.aws.amazon.com/amazonswf/latest/developerguide/swf-dev-iam.html##swf-dev-iam.api,Filters access by the name of activities or workflows,String
100,swf:tagFilter.tag,https://docs.aws.amazon.com/amazonswf/latest/developerguide/swf-dev-iam.html##swf-dev-iam.api,Filters access by the value of tagFilter.tag,String
101,swf:tagList.member.0,https://docs.aws.amazon.com/amazonswf/latest/developerguide/swf-dev-iam.html##swf-dev-iam.api,Filters access by the specified tag,String
102,swf:tagList.member.1,https://docs.aws.amazon.com/amazonswf/latest/developerguide/swf-dev-iam.html##swf-dev-iam.api,Filters access by the specified tag,String
103,swf:tagList.member.2,https://docs.aws.amazon.com/amazonswf/latest/developerguide/swf-dev-iam.html##swf-dev-iam.api,Filters access by the specified tag,String
104,swf:tagList.member.3,https://docs.aws.amazon.com/amazonswf/latest/developerguide/swf-dev-iam.html##swf-dev-iam.api,Filters access by the specified tag,String
105,swf:tagList.member.4,https://docs.aws.amazon.com/amazonswf/latest/developerguide/swf-dev-iam.html##swf-dev-iam.api,Filters access by the specified tag,String
106,swf:taskList.name,https://docs.aws.amazon.com/amazonswf/latest/developerguide/swf-dev-iam.html##swf-dev-iam.api,Filters access by the name of the tasklist,String
107,swf:typeFilter.name,https://docs.aws.amazon.com/amazonswf/latest/developerguide/swf-dev-iam.html##swf-dev-iam.api,Filters access by the name of the type filter,String
108,swf:typeFilter.version,https://docs.aws.amazon.com/amazonswf/latest/developerguide/swf-dev-iam.html##swf-dev-iam.api,Filters access by the version of the type filter,String
109,swf:version,https://docs.aws.amazon.com/amazonswf/latest/developerguide/swf-dev-iam.html##swf-dev-iam.api,Filters access by the version of activities or workflows,String
110,swf:workflowType.name,https://docs.aws.amazon.com/amazonswf/latest/developerguide/swf-dev-iam.html##swf-dev-iam.api,Filters access by the name of the workflow type,String
111,swf:workflowType.version,https://docs.aws.amazon.com/amazonswf/latest/developerguide/swf-dev-iam.html##swf-dev-iam.api,Filters access by the version of the workflow type,String
112,synthetics:Names,https://docs.aws.amazon.com/AmazonCloudWatch/latest/monitoring/CloudWatch_Synthetics_Canaries_Restricted.html,Filters access based on the name of the canary,ArrayOfString
113,transcribe:OutputBucketName,https://docs.aws.amazon.com/IAM/latest/UserGuide/list_amazontranscribe.html#amazontranscribe-policy-keys,Filters access based on the output bucket name included in the request,String
114,transcribe:OutputEncryptionKMSKeyId,https://docs.aws.amazon.com/IAM/latest/UserGuide/list_amazontranscribe.html#amazontranscribe-policy-keys,Filters access based on the KMS key id included in the request,String
115,transcribe:OutputKey,https://docs.aws.amazon.com/IAM/latest/UserGuide/list_amazontranscribe.html#amazontranscribe-policy-keys,Filters access based on the output key included in the request,String
116,transcribe:OutputLocation,https://docs.aws.amazon.com/IAM/latest/UserGuide/list_amazontranscribe.html#amazontranscribe-policy-keys,Filters access based on the output location included in the request,String
117,vpc-lattice-svcs:Port,https://docs.aws.amazon.com/vpc-lattice/latest/ug/auth-policies.html#auth-policies-condition-keys,Filters access by the destination port the request is made to,Numeric
118,vpc-lattice-svcs:RequestHeader/${HeaderName},https://docs.aws.amazon.com/vpc-lattice/latest/ug/auth-policies.html#auth-policies-condition-keys,Filters access by a header name-value pair in the request headers,String
119,vpc-lattice-svcs:RequestMethod,https://docs.aws.amazon.com/vpc-lattice/latest/ug/auth-policies.html#auth-policies-condition-keys,Filters access by the method of the request,String
120,vpc-lattice-svcs:RequestQueryString/${QueryStringKey},https://docs.aws.amazon.com/vpc-lattice/latest/ug/auth-policies.html#auth-policies-condition-keys,Filters access by the query string key-value pairs in the request URL,ArrayOfString
121,vpc-lattice-svcs:ServiceArn,https://docs.aws.amazon.com/vpc-lattice/latest/ug/auth-policies.html#auth-policies-condition-keys,Filters access by the ARN of the service receiving the request,ARN
122,vpc-lattice-svcs:ServiceNetworkArn,https://docs.aws.amazon.com/vpc-lattice/latest/ug/auth-policies.html#auth-policies-condition-keys,Filters access by the ARN of the service network receiving the request,ARN
123,vpc-lattice-svcs:SourceVpc,https://docs.aws.amazon.com/vpc-lattice/latest/ug/auth-policies.html#auth-policies-condition-keys,Filters access by the VPC the request is made from,String
124,vpc-lattice-svcs:SourceVpcOwnerAccount,https://docs.aws.amazon.com/vpc-lattice/latest/ug/auth-policies.html#auth-policies-condition-keys,Filters access by the owning account of the VPC the request is made from,String
125,vpc-lattice:AuthType,https://docs.aws.amazon.com/vpc-lattice/latest/ug/,Filters access by the auth type specified in the request,String
126,vpc-lattice:Protocol,https://docs.aws.amazon.com/vpc-lattice/latest/ug/,Filters access by the protocol specified in the request,String
127,vpc-lattice:ResourceConfigurationArn,https://docs.aws.amazon.com/vpc-lattice/latest/ug/,Filters access by the ARN of a resource configuration,ARN
128,vpc-lattice:SecurityGroupIds,https://docs.aws.amazon.com/vpc-lattice/latest/ug/,Filters access by the IDs of security groups,ArrayOfString
129,vpc-lattice:ServiceArn,https://docs.aws.amazon.com/vpc-lattice/latest/ug/,Filters access by the ARN of a service,ARN
130,vpc-lattice:ServiceNetworkArn,https://docs.aws.amazon.com/vpc-lattice/latest/ug/,Filters access by the ARN of a service network,ARN
131,vpc-lattice:TargetGroupArns,https://docs.aws.amazon.com/vpc-lattice/latest/ug/,Filters access by the ARNs of target groups,ArrayOfARN
132,vpc-lattice:VpcEndpointId,https://docs.aws.amazon.com/vpc-lattice/latest/ug/,Filters access by the ID of a VPC endpoint,String
133,vpc-lattice:VpcId,https://docs.aws.amazon.com/vpc-lattice/latest/ug/,Filters access by the ID of a virtual private cloud (VPC),String
