condition_key_id,name,reference_url,description,type
482,secretsmanager:KmsKeyId,https://docs.aws.amazon.com/secretsmanager/latest/userguide/reference_iam-permissions.html#iam-contextkeys,Filters access by the key identifier of the KMS key in the request. Deprecated: Use secretsmanager:KmsKeyArn,String
483,secretsmanager:ModifyRotationRules,https://docs.aws.amazon.com/secretsmanager/latest/userguide/reference_iam-permissions.html#iam-contextkeys,Filters access by whether the rotation rules of the secret are to be modified,Bool
484,secretsmanager:Name,https://docs.aws.amazon.com/secretsmanager/latest/userguide/reference_iam-permissions.html#iam-contextkeys,Filters access by the friendly name of the secret in the request,String
485,secretsmanager:RecoveryWindowInDays,https://docs.aws.amazon.com/secretsmanager/latest/userguide/reference_iam-permissions.html#iam-contextkeys,Filters access by the number of days that Secrets Manager waits before it can delete the secret,Numeric
486,secretsmanager:ResourceTag/tag-key,https://docs.aws.amazon.com/secretsmanager/latest/userguide/reference_iam-permissions.html#iam-contextkeys,Filters access by a tag key and value pair,String
487,amplifyuibuilder:CodegenJobResourceId,https://docs.aws.amazon.com/amplifyuibuilder/latest/APIReference/API_CodegenJob.html,Filters access by the codegen job ID,String
488,amplifyuibuilder:ComponentResourceAppId,https://docs.aws.amazon.com/amplify/latest/APIReference/API_App.html,Filters access by the app ID,String
489,amplifyuibuilder:ComponentResourceEnvironmentName,https://docs.aws.amazon.com/amplify/latest/APIReference/API_BackendEnvironment.html,Filters access by the backend environment name,String
490,amplifyuibuilder:ComponentResourceId,https://docs.aws.amazon.com/amplifyuibuilder/latest/APIReference/API_Component.html,Filters access by the component ID,String
491,amplifyuibuilder:FormResourceAppId,https://docs.aws.amazon.com/amplify/latest/APIReference/API_App.html,Filters access by the app ID,String
492,amplifyuibuilder:FormResourceEnvironmentName,https://docs.aws.amazon.com/amplify/latest/APIReference/API_BackendEnvironment.html,Filters access by the backend environment name,String
493,amplifyuibuilder:FormResourceId,https://docs.aws.amazon.com/amplifyuibuilder/latest/APIReference/API_Form.html,Filters access by the form ID,String
494,amplifyuibuilder:ThemeResourceAppId,https://docs.aws.amazon.com/amplify/latest/APIReference/API_App.html,Filters access by the app ID,String
495,amplifyuibuilder:ThemeResourceEnvironmentName,https://docs.aws.amazon.com/amplify/latest/APIReference/API_BackendEnvironment.html,Filters access by the backend environment name,String
496,amplifyuibuilder:ThemeResourceId,https://docs.aws.amazon.com/amplifyuibuilder/latest/APIReference/API_Theme.html,Filters access by the theme ID,String
497,aoss:CollectionId,https://docs.aws.amazon.com/opensearch-service/latest/developerguide/security-iam-serverless.html#security_iam_serverless-conditionkeys,Filters access by the identifier of the collection,String
498,aoss:collection,https://docs.aws.amazon.com/opensearch-service/latest/developerguide/security-iam-serverless.html#security_iam_serverless-conditionkeys,Filters access by the collection name,String
499,aoss:index,https://docs.aws.amazon.com/opensearch-service/latest/developerguide/security-iam-serverless.html#security_iam_serverless-conditionkeys,Filters access by the index,String
500,apigateway:Request/AccessAssociationSource,https://docs.aws.amazon.com/apigateway/latest/developerguide/security_iam_service-with-iam.html,Filters access by access association source. Available during the CreateDomainNameAccessAssociation operation,String
501,apigateway:Request/AccessLoggingDestination,https://docs.aws.amazon.com/apigateway/latest/developerguide/security_iam_service-with-iam.html,Filters access by access log destination. Available during the CreateStage and UpdateStage operations,String
502,apigateway:Request/AccessLoggingFormat,https://docs.aws.amazon.com/apigateway/latest/developerguide/security_iam_service-with-iam.html,Filters access by access log format. Available during the CreateStage and UpdateStage operations,String
503,apigateway:Request/ApiKeyRequired,https://docs.aws.amazon.com/apigateway/latest/developerguide/security_iam_service-with-iam.html,Filters access by the requirement of API. Available during the CreateRoute and UpdateRoute operations. Also available as a collection during import and reimport,ArrayOfBool
504,apigateway:Request/ApiName,https://docs.aws.amazon.com/apigateway/latest/developerguide/security_iam_service-with-iam.html,Filters access by API name. Available during the CreateApi and UpdateApi operations,String
505,apigateway:Request/AuthorizerType,https://docs.aws.amazon.com/apigateway/latest/developerguide/security_iam_service-with-iam.html,"Filters access by type of authorizer in the request, for example REQUEST or JWT. Available during CreateAuthorizer and UpdateAuthorizer. Also available during import and reimport as an ArrayOfString",ArrayOfString
506,apigateway:Request/AuthorizerUri,https://docs.aws.amazon.com/apigateway/latest/developerguide/security_iam_service-with-iam.html,Filters access by URI of a Lambda authorizer function. Available during CreateAuthorizer and UpdateAuthorizer. Also available during import and reimport as an ArrayOfString,ArrayOfString
507,apigateway:Request/CognitoUserPoolProviderArn,https://docs.aws.amazon.com/apigateway/latest/developerguide/security_iam_service-with-iam.html,Filters access by Cognito user pool provider ARN. Available during CreateAuthorizer and UpdateAuthorizer,ARN
508,apigateway:Request/DisableExecuteApiEndpoint,https://docs.aws.amazon.com/apigateway/latest/developerguide/security_iam_service-with-iam.html,Filters access by status of the default execute-api endpoint. Available during the CreateApi and UpdateApi operations,Bool
509,apigateway:Request/DomainNameArn,https://docs.aws.amazon.com/apigateway/latest/developerguide/security_iam_service-with-iam.html,Filters access by domain name ARN. Available during the CreateDomainNameAccessAssociation operation,ARN
510,apigateway:Request/EndpointType,https://docs.aws.amazon.com/apigateway/latest/developerguide/security_iam_service-with-iam.html,"Filters access by endpoint type. Available during the CreateDomainName, UpdateDomainName, CreateApi, and UpdateApi operations",ArrayOfString
511,apigateway:Request/MtlsTrustStoreUri,https://docs.aws.amazon.com/apigateway/latest/developerguide/security_iam_service-with-iam.html,Filters access by URI of the truststore used for mutual TLS authentication. Available during the CreateDomainName and UpdateDomainName operations,String
512,apigateway:Request/MtlsTrustStoreVersion,https://docs.aws.amazon.com/apigateway/latest/developerguide/security_iam_service-with-iam.html,Filters access by version of the truststore used for mutual TLS authentication. Available during the CreateDomainName and UpdateDomainName operations,String
513,apigateway:Request/RouteAuthorizationType,https://docs.aws.amazon.com/apigateway/latest/developerguide/security_iam_service-with-iam.html,"Filters access by authorization type, for example NONE, AWS_IAM, CUSTOM, JWT, COGNITO_USER_POOLS. Available during the CreateMethod and PutMethod operations Also available as a collection during import",ArrayOfString
514,apigateway:Request/SecurityPolicy,https://docs.aws.amazon.com/apigateway/latest/developerguide/security_iam_service-with-iam.html,Filters access by TLS version. Available during the CreateDomain and UpdateDomain operations,ArrayOfString
515,apigateway:Request/StageName,https://docs.aws.amazon.com/apigateway/latest/developerguide/security_iam_service-with-iam.html,Filters access by stage name of the deployment that you attempt to create. Available during the CreateDeployment operation,String
516,apigateway:Resource/AccessLoggingDestination,https://docs.aws.amazon.com/apigateway/latest/developerguide/security_iam_service-with-iam.html,Filters access by access log destination of the current Stage resource. Available during the UpdateStage and DeleteStage operations,String
517,apigateway:Resource/AccessLoggingFormat,https://docs.aws.amazon.com/apigateway/latest/developerguide/security_iam_service-with-iam.html,Filters access by access log format of the current Stage resource. Available during the UpdateStage and DeleteStage operations,String
518,apigateway:Resource/ApiKeyRequired,https://docs.aws.amazon.com/apigateway/latest/developerguide/security_iam_service-with-iam.html,Filters access by the requirement of API key for the existing Route resource. Available during the UpdateRoute and DeleteRoute operations. Also available as a collection during reimport,ArrayOfBool
519,apigateway:Resource/ApiName,https://docs.aws.amazon.com/apigateway/latest/developerguide/security_iam_service-with-iam.html,Filters access by API name of the existing RestApi resource. Available during UpdateRestApi and DeleteRestApi operations,String
520,apigateway:Resource/AuthorizerType,https://docs.aws.amazon.com/apigateway/latest/developerguide/security_iam_service-with-iam.html,"Filters access by the current type of authorizer, for example REQUEST or JWT. Available during UpdateAuthorizer and DeleteAuthorizer operations. Also available during import and reimport as an ArrayOfString",ArrayOfString
521,apigateway:Resource/AuthorizerUri,https://docs.aws.amazon.com/apigateway/latest/developerguide/security_iam_service-with-iam.html,Filters access by URI of a Lambda authorizer function. Available during UpdateAuthorizer and DeleteAuthorizer operations. Also available during reimport as an ArrayOfString,ArrayOfString
522,apigateway:Resource/CognitoUserPoolProviderArn,https://docs.aws.amazon.com/apigateway/latest/developerguide/security_iam_service-with-iam.html,Filters access by Cognito user pool provider ARN. Available during CreateAuthorizer and UpdateAuthorizer,ARN
523,apigateway:Resource/DisableExecuteApiEndpoint,https://docs.aws.amazon.com/apigateway/latest/developerguide/security_iam_service-with-iam.html,Filters access by status of the default execute-api endpoint of the current RestApi resource. Available during UpdateRestApi and DeleteRestApi operations,Bool
524,apigateway:Resource/EndpointType,https://docs.aws.amazon.com/apigateway/latest/developerguide/security_iam_service-with-iam.html,"Filters access by endpoint type. Available during the UpdateDomainName, DeleteDomainName, UpdateApi, and DeleteApi operations",ArrayOfString
525,apigateway:Resource/MtlsTrustStoreUri,https://docs.aws.amazon.com/apigateway/latest/developerguide/security_iam_service-with-iam.html,Filters access by URI of the truststore used for mutual TLS authentication. Available during UpdateDomainName and DeleteDomainName operations,String
526,apigateway:Resource/MtlsTrustStoreVersion,https://docs.aws.amazon.com/apigateway/latest/developerguide/security_iam_service-with-iam.html,Filters access by version of the truststore used for mutual TLS authentication. Available during UpdateDomainName and DeleteDomainName operations,String
527,apigateway:Resource/RouteAuthorizationType,https://docs.aws.amazon.com/apigateway/latest/developerguide/security_iam_service-with-iam.html,"Filters access by authorization type of the existing Method resource, for example NONE, AWS_IAM, CUSTOM, JWT, COGNITO_USER_POOLS. Available during the PutMethod and DeleteMethod operations. Also available as a collection during reimport",ArrayOfString
528,apigateway:Resource/SecurityPolicy,https://docs.aws.amazon.com/apigateway/latest/developerguide/security_iam_service-with-iam.html,Filters access by TLS version. Available during UpdateDomain and DeleteDomain operations,ArrayOfString
529,application-autoscaling:scalable-dimension,https://docs.aws.amazon.com/autoscaling/application/userguide/security_iam_service-with-iam.html#security_iam_service-with-iam-id-based-policies-conditionkeys,Filters access by the scalable dimension that is passed in the request,String
530,application-autoscaling:service-namespace,https://docs.aws.amazon.com/autoscaling/application/userguide/security_iam_service-with-iam.html#security_iam_service-with-iam-id-based-policies-conditionkeys,Filters access by the service namespace that is passed in the request,String
531,apprunner:AutoScalingConfigurationArn,${UserGuideDocPage}security_iam_service-with-iam.html#security_iam_service-with-iam-resource-based-policies,Filters access by the CreateService and UpdateService actions based on the ARN of an associated AutoScalingConfiguration resource,ARN
532,apprunner:ConnectionArn,${UserGuideDocPage}security_iam_service-with-iam.html#security_iam_service-with-iam-resource-based-policies,Filters access by the CreateService and UpdateService actions based on the ARN of an associated Connection resource,ARN
533,apprunner:ObservabilityConfigurationArn,${UserGuideDocPage}security_iam_service-with-iam.html#security_iam_service-with-iam-resource-based-policies,Filters access by the CreateService and UpdateService actions based on the ARN of an associated ObservabilityConfiguration resource,ARN
534,apprunner:ServiceArn,${UserGuideDocPage}security_iam_service-with-iam.html#security_iam_service-with-iam-resource-based-policies,Filters access by the CreateVpcIngressConnection action based on the ARN of an associated Service resource,ARN
535,apprunner:VpcConnectorArn,${UserGuideDocPage}security_iam_service-with-iam.html#security_iam_service-with-iam-resource-based-policies,Filters access by the CreateService and UpdateService actions based on the ARN of an associated VpcConnector resource,ARN
536,apprunner:VpcEndpointId,${UserGuideDocPage}security_iam_service-with-iam.html#security_iam_service-with-iam-resource-based-policies,Filters access by the CreateVpcIngressConnection and UpdateVpcIngressConnection actions based on the VPC Endpoint in the request,String
537,apprunner:VpcId,${UserGuideDocPage}security_iam_service-with-iam.html#security_iam_service-with-iam-resource-based-policies,Filters access by the CreateVpcIngressConnection and UpdateVpcIngressConnection actions based on the VPC in the request,String
538,appstream:userId,https://docs.aws.amazon.com/appstream2/latest/developerguide/external-identity-providers-setting-up-saml.html#external-identity-providers-embed-inline-policy-for-IAM-role,Filters access by the ID of the AppStream 2.0 user,String
539,appsync:Visibility,iam-policy-structure.html#amazon-appsync-keys,Filters access by the visibility of an API,String
540,arc-zonal-shift:ResourceIdentifier,https://docs.aws.amazon.com/service-authorization/latest/reference/list_amazonroute53applicationrecoverycontroller-zonalshift.html#amazonroute53applicationrecoverycontroller-zonalshift-policy-keys,Filters access by the resource identifier of the managed resource,String
541,artifact:ReportCategory,https://docs.aws.amazon.com/artifact/latest/ug/using-condition-keys.html,Filters access by which category reports are associated with,String
542,artifact:ReportSeries,https://docs.aws.amazon.com/artifact/latest/ug/using-condition-keys.html,Filters access by which series reports are associated with,String
543,autoscaling:CapacityReservationIds,https://docs.aws.amazon.com/autoscaling/latest/userguide/control-access-using-iam.html#policy-auto-scaling-condition-keys,Filters access based on the Capacity Reservation IDs,ArrayOfString
544,autoscaling:CapacityReservationResourceGroupArns,https://docs.aws.amazon.com/autoscaling/latest/userguide/control-access-using-iam.html#policy-auto-scaling-condition-keys,Filters access based on the ARN of a Capacity Reservation resource group,ArrayOfString
545,autoscaling:ImageId,https://docs.aws.amazon.com/autoscaling/latest/userguide/control-access-using-iam.html#policy-auto-scaling-condition-keys,Filters access based on the AMI ID for the launch configuration,String
546,autoscaling:InstanceType,https://docs.aws.amazon.com/autoscaling/latest/userguide/control-access-using-iam.html#policy-auto-scaling-condition-keys,Filters access based on the instance type for the launch configuration,String
547,autoscaling:InstanceTypes,https://docs.aws.amazon.com/autoscaling/latest/userguide/control-access-using-iam.html#policy-auto-scaling-condition-keys,Filters access based on the instance types present as overrides to a launch template for a mixed instances policy. Use it to qualify which instance types can be explicitly defined in the policy,String
548,autoscaling:LaunchConfigurationName,https://docs.aws.amazon.com/autoscaling/latest/userguide/control-access-using-iam.html#policy-auto-scaling-condition-keys,Filters access based on the name of a launch configuration,String
549,autoscaling:LaunchTemplateVersionSpecified,https://docs.aws.amazon.com/autoscaling/latest/userguide/control-access-using-iam.html#policy-auto-scaling-condition-keys,Filters access based on whether users can specify any version of a launch template or only the Latest or Default version,Bool
550,secretsmanager:RotateImmediately,https://docs.aws.amazon.com/secretsmanager/latest/userguide/reference_iam-permissions.html#iam-contextkeys,Filters access by whether the secret is to be rotated immediately,Bool
551,autoscaling:LoadBalancerNames,https://docs.aws.amazon.com/autoscaling/latest/userguide/control-access-using-iam.html#policy-auto-scaling-condition-keys,Filters access based on the name of the load balancer,ArrayOfString
552,autoscaling:MaxSize,https://docs.aws.amazon.com/autoscaling/latest/userguide/control-access-using-iam.html#policy-auto-scaling-condition-keys,Filters access based on the maximum scaling size in the request,Numeric
553,autoscaling:MetadataHttpEndpoint,https://docs.aws.amazon.com/autoscaling/latest/userguide/control-access-using-iam.html#policy-auto-scaling-condition-keys,Filters access based on whether the HTTP endpoint is enabled for the instance metadata service,String
554,secretsmanager:RotationLambdaARN,https://docs.aws.amazon.com/secretsmanager/latest/userguide/reference_iam-permissions.html#iam-contextkeys,Filters access by the ARN of the rotation Lambda function in the request,ARN
555,autoscaling:MetadataHttpPutResponseHopLimit,https://docs.aws.amazon.com/autoscaling/latest/userguide/control-access-using-iam.html#policy-auto-scaling-condition-keys,Filters access based on the allowed number of hops when calling the instance metadata service,Numeric
556,secretsmanager:SecretId,https://docs.aws.amazon.com/secretsmanager/latest/userguide/reference_iam-permissions.html#iam-contextkeys,Filters access by the SecretID value in the request,ARN
557,secretsmanager:SecretPrimaryRegion,https://docs.aws.amazon.com/secretsmanager/latest/userguide/reference_iam-permissions.html#iam-contextkeys,Filters access by primary region in which the secret is created,String
558,secretsmanager:VersionId,https://docs.aws.amazon.com/secretsmanager/latest/userguide/reference_iam-permissions.html#iam-contextkeys,Filters access by the unique identifier of the version of the secret in the request,String
559,secretsmanager:VersionStage,https://docs.aws.amazon.com/secretsmanager/latest/userguide/reference_iam-permissions.html#iam-contextkeys,Filters access by the list of version stages in the request,String
560,secretsmanager:resource/AllowRotationLambdaArn,https://docs.aws.amazon.com/secretsmanager/latest/userguide/reference_iam-permissions.html#iam-contextkeys,Filters access by the ARN of the rotation Lambda function associated with the secret,ARN
561,autoscaling:MetadataHttpTokens,https://docs.aws.amazon.com/autoscaling/latest/userguide/control-access-using-iam.html#policy-auto-scaling-condition-keys,Filters access based on whether tokens are required when calling the instance metadata service (optional or required),String
562,qapps:AppIsPublished,https://docs.aws.amazon.com/amazonq/latest/qbusiness-ug/security-iam.html,Filters access by whether Q App is published,String
563,qapps:SessionIsShared,https://docs.aws.amazon.com/amazonq/latest/qbusiness-ug/security-iam.html,Filters access by whether Q App Session is shared,String
564,qapps:UserIsAppOwner,https://docs.aws.amazon.com/amazonq/latest/qbusiness-ug/security-iam.html,Filters access by whether requester is Q App owner,String
565,qapps:UserIsSessionModerator,https://docs.aws.amazon.com/amazonq/latest/qbusiness-ug/security-iam.html,Filters access by whether requester is Q App Session moderator,String
566,qldb:Purge,https://docs.aws.amazon.com/IAM/latest/UserGuide/reference_policies_condition-keys.html#condition-keys-purge,Filters access by the value of purge that is specified in a PartiQL DROP statement,String
567,quicksight:AllowedEmbeddingDomains,https://docs.aws.amazon.com/quicksight/latest/user/embedded-dashboards-for-authenticated-users-step-1.html,Filters access by the allowed embedding domains,ArrayOfString
568,quicksight:DirectoryType,https://docs.aws.amazon.com/quicksight/latest/user/security-scp.html,Filters access by the user management options,String
569,quicksight:Edition,https://docs.aws.amazon.com/quicksight/latest/user/security-scp.html,Filters access by the edition of QuickSight,String
570,quicksight:Group,https://docs.aws.amazon.com/quicksight/latest/user/iam-actions.html,Filters access by QuickSight group ARN,ARN
571,quicksight:IamArn,https://docs.aws.amazon.com/quicksight/latest/user/iam-actions.html,Filters access by IAM user or role ARN,ARN
572,quicksight:KmsKeyArns,https://docs.aws.amazon.com/quicksight/latest/user/key-management.html,Filters access by KMS key ARNs,ArrayOfARN
573,quicksight:SessionName,https://docs.aws.amazon.com/quicksight/latest/user/iam-actions.html,Filters access by session name,String
574,quicksight:UserName,https://docs.aws.amazon.com/quicksight/latest/user/iam-actions.html,Filters access by user name,String
575,ram:AllowsExternalPrincipals,https://docs.aws.amazon.com/ram/latest/userguide/iam-policies.html#iam-policies-condition,"Filters access by resource shares that allow or deny sharing with external principals. For example, specify true if the action can only be performed on resource shares that allow sharing with external principals. External principals are AWS accounts that are outside of its AWS organization",Bool
576,ram:PermissionArn,https://docs.aws.amazon.com/ram/latest/userguide/iam-policies.html#iam-policies-condition,Filters access by the specified Permission ARN,ARN
577,ram:PermissionResourceType,https://docs.aws.amazon.com/ram/latest/userguide/iam-policies.html#iam-policies-condition,Filters access by permissions of specified resource type,String
578,ram:Principal,https://docs.aws.amazon.com/ram/latest/userguide/iam-policies.html#iam-policies-condition,Filters access by format of the specified principal,String
579,ram:RequestedAllowsExternalPrincipals,https://docs.aws.amazon.com/ram/latest/userguide/iam-policies.html#iam-policies-condition,Filters access by the specified value for 'allowExternalPrincipals'. External principals are AWS accounts that are outside of its AWS Organization,Bool
580,ram:RequestedResourceType,https://docs.aws.amazon.com/ram/latest/userguide/iam-policies.html#iam-policies-condition,Filters access by the specified resource type,String
581,ram:ResourceArn,https://docs.aws.amazon.com/ram/latest/userguide/iam-policies.html#iam-policies-condition,Filters access by  the specified ARN,ARN
582,ram:ResourceShareName,https://docs.aws.amazon.com/ram/latest/userguide/iam-policies.html#iam-policies-condition,Filters access by a resource share with the specified name,String
583,ram:ResourceTag/${TagKey},https://docs.aws.amazon.com/IAM/latest/UserGuide/reference_policies_condition-keys.html#condition-keys-resourcetag,Filters access by the tags associated with the resource,String
584,ram:ShareOwnerAccountId,https://docs.aws.amazon.com/ram/latest/userguide/iam-policies.html#iam-policies-condition,"Filters access by resource shares owned by a specific account. For example, you can use this condition key to specify which resource share invitations can be accepted or rejected based on the resource share owner's account ID",String
585,rbin:Attribute/ResourceType,https://docs.aws.amazon.com/AWSEC2/latest/UserGuide/recycle-bin-perms.html#rbin-condition-keys,Filters access by the resource type of the existing rule,String
586,rbin:Request/ResourceType,https://docs.aws.amazon.com/AWSEC2/latest/UserGuide/recycle-bin-perms.html#rbin-condition-keys,Filters access by the resource type in a request,String
587,rds:BackupTarget,https://docs.aws.amazon.com/AmazonRDS/latest/UserGuide/security_iam_service-with-iam.html#UsingWithRDS.IAM.Conditions,"Filters access by the type of backup target. One of: region, outposts",String
588,rds:CopyOptionGroup,https://docs.aws.amazon.com/AmazonRDS/latest/UserGuide/security_iam_service-with-iam.html#UsingWithRDS.IAM.Conditions,Filters access by the value that specifies whether the CopyDBSnapshot action requires copying the DB option group,Bool
589,rds:DatabaseClass,https://docs.aws.amazon.com/AmazonRDS/latest/UserGuide/security_iam_service-with-iam.html#UsingWithRDS.IAM.Conditions,Filters access by the type of DB instance class,String
590,rds:DatabaseEngine,https://docs.aws.amazon.com/AmazonRDS/latest/UserGuide/security_iam_service-with-iam.html#UsingWithRDS.IAM.Conditions,Filters access by the database engine. For possible values refer to the engine parameter in CreateDBInstance API,String
591,rds:DatabaseName,https://docs.aws.amazon.com/AmazonRDS/latest/UserGuide/security_iam_service-with-iam.html#UsingWithRDS.IAM.Conditions,Filters access by the user-defined name of the database on the DB instance,String
592,rds:EndpointType,https://docs.aws.amazon.com/AmazonRDS/latest/UserGuide/security_iam_service-with-iam.html#UsingWithRDS.IAM.Conditions,"Filters access by the type of the endpoint. One of: READER, WRITER, CUSTOM",String
