condition_key_id,name,reference_url,description,type
487,kms:KeyUsage,https://docs.aws.amazon.com/kms/latest/developerguide/conditions-kms.html#conditions-kms-key-usage,Filters access to an API operation based on the KeyUsage property of the AWS KMS key created by or used in the operation. Use it to qualify authorization of the CreateKey operation or any operation that is authorized for a KMS key resource,String
488,kms:MacAlgorithm,https://docs.aws.amazon.com/kms/latest/developerguide/conditions-kms.html#conditions-kms-mac-algorithm,Filters access to the GenerateMac and VerifyMac operations based on the MacAlgorithm parameter in the request,String
489,codeconnections:BranchName,https://docs.aws.amazon.com/dtconsole/latest/userguide/security-iam.html#permissions-reference-connections-use,Filters access by the branch name that is passed in the request. Applies only to UseConnection requests for access to a specific repository branch,String
490,kms:MessageType,https://docs.aws.amazon.com/kms/latest/developerguide/conditions-kms.html#conditions-kms-message-type,Filters access to the Sign and Verify operations based on the value of the MessageType parameter in the request,String
491,codeconnections:FullRepositoryId,https://docs.aws.amazon.com/dtconsole/latest/userguide/security-iam.html#permissions-reference-connections-use,Filters access by the repository that is passed in the request. Applies only to UseConnection requests for access to a specific repository,String
492,codeconnections:HostArn,https://docs.aws.amazon.com/dtconsole/latest/userguide/security-iam.html#permissions-reference-connections-hosts,Filters access by the host resource associated with the connection used in the request,ARN
493,codeconnections:InstallationId,https://docs.aws.amazon.com/dtconsole/latest/userguide/security-iam.html#permissions-reference-connections-handshake,Filters access by the third-party ID (such as the Bitbucket App installation ID for CodeConnections) that is used to update a Connection. Allows you to restrict which third-party App installations can be used to make a Connection,String
494,codeconnections:OwnerId,https://docs.aws.amazon.com/dtconsole/latest/userguide/security-iam.html#permissions-reference-connections-use,Filters access by the owner of the third-party repository. Applies only to UseConnection requests for access to repositories owned by a specific user,String
495,codeconnections:PassedToService,https://docs.aws.amazon.com/dtconsole/latest/userguide/security-iam.html#permissions-reference-connections-passconnection,Filters access by the service to which the principal is allowed to pass a Connection or RepositoryLink,String
496,codeconnections:ProviderAction,https://docs.aws.amazon.com/dtconsole/latest/userguide/security-iam.html#permissions-reference-connections-access,Filters access by the provider action in a UseConnection request such as ListRepositories. See documentation for all valid values,String
497,codeconnections:ProviderPermissionsRequired,https://docs.aws.amazon.com/dtconsole/latest/userguide/security-iam.html#permissions-reference-connections-use,Filters access by the write permissions of a provider action in a UseConnection request. Valid types include read_only and read_write,String
498,codeconnections:ProviderType,https://docs.aws.amazon.com/dtconsole/latest/userguide/security-iam.html#permissions-reference-connections-managing,Filters access by the type of third-party provider passed in the request,String
499,codeconnections:ProviderTypeFilter,https://docs.aws.amazon.com/dtconsole/latest/userguide/security-iam.html#permissions-reference-connections-managing,Filters access by the type of third-party provider used to filter results,String
500,codeconnections:RepositoryName,https://docs.aws.amazon.com/dtconsole/latest/userguide/security-iam.html#permissions-reference-connections-use,Filters access by the repository name that is passed in the request. Applies only to UseConnection requests for access to repositories owned by a specific user,String
501,codeconnections:VpcId,https://docs.aws.amazon.com/dtconsole/latest/userguide/security-iam.html#permissions-reference-connections-hosts,Filters access by the VpcId passed in the request,String
502,codestar-connections:Branch,https://docs.aws.amazon.com/dtconsole/latest/userguide/security-iam.html#permissions-reference-connections-handshake,Filters access by the branch name that is passed in the request,String
503,codestar-connections:BranchName,https://docs.aws.amazon.com/dtconsole/latest/userguide/security-iam.html#permissions-reference-connections-use,Filters access by the branch name that is passed in the request. Applies only to UseConnection requests for access to a specific repository branch,String
504,codestar-connections:FullRepositoryId,https://docs.aws.amazon.com/dtconsole/latest/userguide/security-iam.html#permissions-reference-connections-use,Filters access by the repository that is passed in the request. Applies only to UseConnection requests for access to a specific repository,String
505,codestar-connections:HostArn,https://docs.aws.amazon.com/dtconsole/latest/userguide/security-iam.html#permissions-reference-connections-hosts,Filters access by the host resource associated with the connection used in the request,ARN
506,codestar-connections:InstallationId,https://docs.aws.amazon.com/dtconsole/latest/userguide/security-iam.html#permissions-reference-connections-handshake,Filters access by the third-party ID (such as the Bitbucket App installation ID for CodeStar Connections) that is used to update a Connection. Allows you to restrict which third-party App installations can be used to make a Connection,String
507,codestar-connections:OwnerId,https://docs.aws.amazon.com/dtconsole/latest/userguide/security-iam.html#permissions-reference-connections-use,Filters access by the owner of the third-party repository. Applies only to UseConnection requests for access to repositories owned by a specific user,String
508,codestar-connections:PassedToService,https://docs.aws.amazon.com/dtconsole/latest/userguide/security-iam.html#permissions-reference-connections-passconnection,Filters access by the service to which the principal is allowed to pass a Connection or RepositoryLink,String
509,codestar-connections:ProviderAction,https://docs.aws.amazon.com/dtconsole/latest/userguide/security-iam.html#permissions-reference-connections-access,Filters access by the provider action in a UseConnection request such as ListRepositories. See documentation for all valid values,String
510,codestar-connections:ProviderPermissionsRequired,https://docs.aws.amazon.com/dtconsole/latest/userguide/security-iam.html#permissions-reference-connections-use,Filters access by the write permissions of a provider action in a UseConnection request. Valid types include read_only and read_write,String
511,codestar-connections:ProviderType,https://docs.aws.amazon.com/dtconsole/latest/userguide/security-iam.html#permissions-reference-connections-managing,Filters access by the type of third-party provider passed in the request,String
512,codestar-connections:ProviderTypeFilter,https://docs.aws.amazon.com/dtconsole/latest/userguide/security-iam.html#permissions-reference-connections-managing,Filters access by the type of third-party provider used to filter results,String
513,codestar-connections:RepositoryName,https://docs.aws.amazon.com/dtconsole/latest/userguide/security-iam.html#permissions-reference-connections-use,Filters access by the repository name that is passed in the request. Applies only to UseConnection requests for access to repositories owned by a specific user,String
514,codestar-connections:VpcId,https://docs.aws.amazon.com/dtconsole/latest/userguide/security-iam.html#permissions-reference-connections-hosts,Filters access by the VpcId passed in the request,String
515,codestar-notifications:NotificationsForResource,https://docs.aws.amazon.com/codestar-notifications/latest/userguide/security_iam_id-based-policy-examples.html,Filters access based on the ARN of the resource for which notifications are configured,ARN
516,s3:max-keys,https://docs.aws.amazon.com/AmazonS3/latest/userguide/amazon-s3-policy-keys.html#example-numeric-condition-operators,Filters access by maximum number of keys returned in a ListBucket request,Numeric
517,s3:object-lock-legal-hold,https://docs.aws.amazon.com/AmazonS3/latest/userguide/object-lock-overview.html#object-lock-legal-holds,Filters access by object legal hold status,String
518,s3:object-lock-mode,https://docs.aws.amazon.com/AmazonS3/latest/userguide/object-lock-overview.html#object-lock-retention-modes,Filters access by object retention mode (COMPLIANCE or GOVERNANCE),String
519,s3:object-lock-remaining-retention-days,https://docs.aws.amazon.com/AmazonS3/latest/userguide/object-lock-managing.html#object-lock-managing-retention-limits,Filters access by remaining object retention days,Numeric
520,cognito-identity.amazonaws.com:amr,https://docs.aws.amazon.com/IAM/latest/UserGuide/reference_policies_iam-condition-keys.html#ck_amr,Filters access by the login information for Amazon Cognito,String
521,s3:object-lock-retain-until-date,https://docs.aws.amazon.com/AmazonS3/latest/userguide/object-lock-overview.html#object-lock-retention-periods,Filters access by object retain-until date,Date
522,s3:prefix,https://docs.aws.amazon.com/AmazonS3/latest/userguide/amazon-s3-policy-keys.html#condition-key-bucket-ops-2,Filters access by key name prefix,String
523,s3:signatureAge,https://docs.aws.amazon.com/AmazonS3/latest/API/bucket-policy-s3-sigv4-conditions.html,Filters access by the age in milliseconds of the request signature,Numeric
524,s3:signatureversion,https://docs.aws.amazon.com/AmazonS3/latest/API/bucket-policy-s3-sigv4-conditions.html,Filters access by the version of AWS Signature used on the request,String
525,s3:versionid,https://docs.aws.amazon.com/AmazonS3/latest/userguide/amazon-s3-policy-keys.html#getobjectversion-limit-access-to-specific-version-3,Filters access by a specific object version,String
526,s3:x-amz-acl,https://docs.aws.amazon.com/AmazonS3/latest/userguide/acl-overview.html#permissions,Filters access by canned ACL in the request's x-amz-acl header,String
527,s3:x-amz-content-sha256,https://docs.aws.amazon.com/AmazonS3/latest/API/bucket-policy-s3-sigv4-conditions.html,Filters access by unsigned content in your bucket,String
528,cognito-identity.amazonaws.com:aud,https://docs.aws.amazon.com/IAM/latest/UserGuide/reference_policies_iam-condition-keys.html#ck_aud,Filters access by the Amazon Cognito identity pool ID,String
529,kms:MultiRegion,https://docs.aws.amazon.com/kms/latest/developerguide/conditions-kms.html#conditions-kms-multi-region,Filters access to an API operation based on the MultiRegion property of the AWS KMS key created by or used in the operation. Use it to qualify authorization of the CreateKey operation or any operation that is authorized for a KMS key resource,Bool
530,kms:MultiRegionKeyType,https://docs.aws.amazon.com/kms/latest/developerguide/conditions-kms.html#conditions-kms-multi-region-key-type,Filters access to an API operation based on the MultiRegionKeyType property of the AWS KMS key created by or used in the operation. Use it to qualify authorization of the CreateKey operation or any operation that is authorized for a KMS key resource,String
531,kms:PrimaryRegion,https://docs.aws.amazon.com/kms/latest/developerguide/conditions-kms.html#conditions-kms-primary-region,Filters access to the UpdatePrimaryRegion operation based on the value of the PrimaryRegion parameter in the request,String
532,kms:ReEncryptOnSameKey,https://docs.aws.amazon.com/kms/latest/developerguide/conditions-kms.html#conditions-kms-reencrypt-on-same-key,Filters access to the ReEncrypt operation when it uses the same AWS KMS key that was used for the Encrypt operation,Bool
533,kms:RecipientAttestation:ImageSha384,https://docs.aws.amazon.com/kms/latest/developerguide/conditions-nitro-enclaves.html#conditions-kms-recipient-image-sha,Filters access to the API operations based on the image hash in the attestation document in the request,String
534,kms:RecipientAttestation:PCR0,https://docs.aws.amazon.com/kms/latest/developerguide/conditions-nitro-enclaves.html#conditions-kms-recipient-pcrs,"Filters access by the platform configuration register (PCR) 0 in the attestation document. PCR0 is a contiguous measure of the contents of the enclave image file, without the section data",String
535,kms:RecipientAttestation:PCR1,https://docs.aws.amazon.com/kms/latest/developerguide/conditions-nitro-enclaves.html#conditions-kms-recipient-pcrs,Filters access by the platform configuration register (PCR) 1 in the attestation document. PCR1 is a contiguous measurement of the Linux kernel and bootstrap data,String
536,kms:RecipientAttestation:PCR10,https://docs.aws.amazon.com/kms/latest/developerguide/conditions-nitro-enclaves.html#conditions-kms-recipient-pcrs,Filters access by the platform configuration register (PCR) 10 in the attestation document in the request. PCR10 is a custom PCR that can be defined by the user for specific use cases,String
537,cognito-identity.amazonaws.com:sub,https://docs.aws.amazon.com/IAM/latest/UserGuide/reference_policies_iam-condition-keys.html#ck_sub,Filters access by the subject of the claim (the Amazon Cognito user ID),String
538,comprehend:DataLakeKmsKey,https://docs.aws.amazon.com/IAM/latest/UserGuide/list_amazoncomprehend.html#amazoncomprehend-policy-keys,Filters access by the DataLake Kms Key associated with the flywheel resource in the request,ARN
539,comprehend:FlywheelIterationId,https://docs.aws.amazon.com/IAM/latest/UserGuide/list_amazoncomprehend.html#amazoncomprehend-policy-keys,Filters access by particular Iteration Id for a flywheel,String
540,comprehend:ModelKmsKey,https://docs.aws.amazon.com/IAM/latest/UserGuide/list_amazoncomprehend.html#amazoncomprehend-policy-keys,Filters access by the model KMS key associated with the resource in the request,ARN
541,comprehend:OutputKmsKey,https://docs.aws.amazon.com/IAM/latest/UserGuide/list_amazoncomprehend.html#amazoncomprehend-policy-keys,Filters access by the output KMS key associated with the resource in the request,ARN
542,comprehend:VolumeKmsKey,https://docs.aws.amazon.com/IAM/latest/UserGuide/list_amazoncomprehend.html#amazoncomprehend-policy-keys,Filters access by the volume KMS key associated with the resource in the request,ARN
543,comprehend:VpcSecurityGroupIds,https://docs.aws.amazon.com/IAM/latest/UserGuide/list_amazoncomprehend.html#amazoncomprehend-policy-keys,Filters access by the list of all VPC security group ids associated with the resource in the request,ArrayOfString
544,kms:RecipientAttestation:PCR11,https://docs.aws.amazon.com/kms/latest/developerguide/conditions-nitro-enclaves.html#conditions-kms-recipient-pcrs,Filters access by the platform configuration register (PCR) 11 in the attestation document in the request. PCR11 is a custom PCR that can be defined by the user for specific use cases,String
545,comprehend:VpcSubnets,https://docs.aws.amazon.com/IAM/latest/UserGuide/list_amazoncomprehend.html#amazoncomprehend-policy-keys,Filters access by the list of all VPC subnets associated with the resource in the request,ArrayOfString
546,s3:x-amz-copy-source,https://docs.aws.amazon.com/AmazonS3/latest/userguide/amazon-s3-policy-keys.html#putobject-limit-copy-source-3,"Filters access by copy source bucket, prefix, or object in the copy object requests",String
547,compute-optimizer:ResourceType,https://docs.aws.amazon.com/compute-optimizer/latest/ug/security-iam.html,Filters access by the resource type,String
548,config:ConfigurationRecorderServicePrincipal,https://docs.aws.amazon.com/config/latest/developerguide/security_iam_service-with-iam.html#security_iam_service-with-iam-id-based-policies-conditionkeys,Filters access by service principal of the configuration recorder,String
549,connect:AssignmentType,https://docs.aws.amazon.com/connect/latest/adminguide/security_iam_service-with-iam.html,Filters access by restricting access to create contacts based on Assignment Type,String
550,connect:AttributeType,https://docs.aws.amazon.com/connect/latest/adminguide/security_iam_service-with-iam.html,Filters access by the attribute type of the Amazon Connect instance,String
551,connect:Channel,https://docs.aws.amazon.com/connect/latest/adminguide/security_iam_service-with-iam.html,Filters access by Channel,String
552,connect:ContactAssociationId,https://docs.aws.amazon.com/connect/latest/adminguide/security_iam_service-with-iam.html,Filters access by ContactAssociationId,String
553,s3:x-amz-grant-full-control,https://docs.aws.amazon.com/AmazonS3/latest/userguide/acl-overview.html#permissions,Filters access by x-amz-grant-full-control (full control) header,String
554,s3:x-amz-grant-read,https://docs.aws.amazon.com/AmazonS3/latest/userguide/acl-overview.html#permissions,Filters access by x-amz-grant-read (read access) header,String
555,s3:x-amz-grant-read-acp,https://docs.aws.amazon.com/AmazonS3/latest/userguide/acl-overview.html#permissions,Filters access by the x-amz-grant-read-acp (read permissions for the ACL) header,String
556,s3:x-amz-grant-write,https://docs.aws.amazon.com/AmazonS3/latest/userguide/acl-overview.html#permissions,Filters access by the x-amz-grant-write (write access) header,String
557,s3:x-amz-grant-write-acp,https://docs.aws.amazon.com/AmazonS3/latest/userguide/acl-overview.html#permissions,Filters access by the x-amz-grant-write-acp (write permissions for the ACL) header,String
558,s3:x-amz-metadata-directive,https://docs.aws.amazon.com/AmazonS3/latest/API/API_CopyObject.html,Filters access by object metadata behavior (COPY or REPLACE) when objects are copied,String
559,s3:x-amz-object-ownership,https://docs.aws.amazon.com/AmazonS3/latest/userguide/ensure-object-ownership.html#object-ownership-requiring-bucket-owner-enforced,Filters access by Object Ownership,String
560,s3:x-amz-server-side-encryption,https://docs.aws.amazon.com/AmazonS3/latest/userguide/UsingServerSideEncryption.html,Filters access by server-side encryption,String
561,connect:ContactInitiationMethod,https://docs.aws.amazon.com/connect/latest/adminguide/security_iam_service-with-iam.html,Filters access by restricting access to create contacts based on the initiation method of the contact,String
562,connect:FlowType,https://docs.aws.amazon.com/connect/latest/adminguide/security_iam_service-with-iam.html,Filters access by Flow type,ArrayOfString
563,s3:x-amz-server-side-encryption-aws-kms-key-id,https://docs.aws.amazon.com/AmazonS3/latest/userguide/UsingKMSEncryption.html#require-sse-kms,Filters access by AWS KMS customer managed CMK for server-side encryption,ARN
564,s3:x-amz-server-side-encryption-customer-algorithm,https://docs.aws.amazon.com/AmazonS3/latest/userguide/ServerSideEncryptionCustomerKeys.html,Filters access by customer specified algorithm for server-side encryption,String
565,s3:x-amz-storage-class,https://docs.aws.amazon.com/AmazonS3/latest/userguide/storage-class-intro.html#sc-howtoset,Filters access by storage class,String
566,s3:x-amz-website-redirect-location,https://docs.aws.amazon.com/AmazonS3/latest/userguide/how-to-page-redirect.html#page-redirect-using-rest-api,Filters access by a specific website redirect location for buckets that are configured as static websites,String
567,s3express:AccessPointNetworkOrigin,https://docs.aws.amazon.com/AmazonS3/latest/userguide/creating-access-points.html#access-points-policies,Filters access by the network origin (Internet or VPC),String
568,s3express:AllAccessRestrictedToLocalZoneGroup,#example-all-access-restricted-to-localzone-group,Filters access by AWS Local Zone network border group(s) provided in this condition key,String
569,s3express:DataAccessPointAccount,https://docs.aws.amazon.com/AmazonS3/latest/userguide/creating-access-points.html#access-points-policies,Filters access by the AWS Account ID that owns the access point,String
570,kms:RecipientAttestation:PCR12,https://docs.aws.amazon.com/kms/latest/developerguide/conditions-nitro-enclaves.html#conditions-kms-recipient-pcrs,Filters access by the platform configuration register (PCR) 12 in the attestation document in the request. PCR12 is a custom PCR that can be defined by the user for specific use cases,String
571,s3express:DataAccessPointArn,https://docs.aws.amazon.com/AmazonS3/latest/userguide/creating-access-points.html#access-points-policies,Filters access by an access point Amazon Resource Name (ARN),ARN
572,s3express:LocationName,https://docs.aws.amazon.com/AmazonS3/latest/userguide/amazon-s3-express-zonal-policy-keys.html#example-location-name,Filters access by a specific Availability Zone ID,String
573,s3express:Permissions,#example-permissions,"Filters access by the permission requested by Access Point Scope configuration, such as GetObject, PutObject",ArrayOfString
574,s3express:ResourceAccount,https://docs.aws.amazon.com/AmazonS3/latest/userguide/amazon-s3-express-zonal-policy-keys.html#example-object-resource-account,Filters access by the resource owner AWS account ID,String
575,s3express:SessionMode,https://docs.aws.amazon.com/AmazonS3/latest/userguide/amazon-s3-express-zonal-policy-keys.html#example-session-mode,"Filters access by the permission requested by CreateSession API, such as ReadOnly and ReadWrite",String
576,s3express:TlsVersion,#example-object-tls-version,Filters access by the TLS version used by the client,Numeric
577,s3express:authType,https://docs.aws.amazon.com/AmazonS3/latest/API/bucket-policy-s3-sigv4-conditions.html,Filters access by authentication method,String
578,s3express:signatureAge,https://docs.aws.amazon.com/AmazonS3/latest/API/bucket-policy-s3-sigv4-conditions.html,Filters access by the age in milliseconds of the request signature,Numeric
579,kms:RecipientAttestation:PCR13,https://docs.aws.amazon.com/kms/latest/developerguide/conditions-nitro-enclaves.html#conditions-kms-recipient-pcrs,Filters access by the platform configuration register (PCR) 13 in the attestation document in the request. PCR13 is a custom PCR that can be defined by the user for specific use cases,String
580,s3express:signatureversion,https://docs.aws.amazon.com/AmazonS3/latest/API/bucket-policy-s3-sigv4-conditions.html,Filters access by the AWS Signature Version used on the request,String
581,kms:RecipientAttestation:PCR14,https://docs.aws.amazon.com/kms/latest/developerguide/conditions-nitro-enclaves.html#conditions-kms-recipient-pcrs,Filters access by the platform configuration register (PCR) 14 in the attestation document in the request. PCR14 is a custom PCR that can be defined by the user for specific use cases,String
582,kms:RecipientAttestation:PCR15,https://docs.aws.amazon.com/kms/latest/developerguide/conditions-nitro-enclaves.html#conditions-kms-recipient-pcrs,Filters access by the platform configuration register (PCR) 15 in the attestation document in the request. PCR15 is a custom PCR that can be defined by the user for specific use cases,String
583,kms:RecipientAttestation:PCR16,https://docs.aws.amazon.com/kms/latest/developerguide/conditions-nitro-enclaves.html#conditions-kms-recipient-pcrs,Filters access by the platform configuration register (PCR) 16 in the attestation document in the request. PCR16 is a custom PCR that can be defined by the user for specific use cases,String
584,kms:RecipientAttestation:PCR17,https://docs.aws.amazon.com/kms/latest/developerguide/conditions-nitro-enclaves.html#conditions-kms-recipient-pcrs,Filters access by the platform configuration register (PCR) 17 in the attestation document in the request. PCR17 is a custom PCR that can be defined by the user for specific use cases,String
585,kms:RecipientAttestation:PCR18,https://docs.aws.amazon.com/kms/latest/developerguide/conditions-nitro-enclaves.html#conditions-kms-recipient-pcrs,Filters access by the platform configuration register (PCR) 18 in the attestation document in the request. PCR18 is a custom PCR that can be defined by the user for specific use cases,String
586,kms:RecipientAttestation:PCR19,https://docs.aws.amazon.com/kms/latest/developerguide/conditions-nitro-enclaves.html#conditions-kms-recipient-pcrs,Filters access by the platform configuration register (PCR) 19 in the attestation document in the request. PCR19 is a custom PCR that can be defined by the user for specific use cases,String
587,kms:RecipientAttestation:PCR2,https://docs.aws.amazon.com/kms/latest/developerguide/conditions-nitro-enclaves.html#conditions-kms-recipient-pcrs,"Filters access by the platform configuration register (PCR) 2 in the attestation document. PCR2 is a contiguous, in-order measurement of the user applications, without the boot ramfs",String
588,kms:RecipientAttestation:PCR20,https://docs.aws.amazon.com/kms/latest/developerguide/conditions-nitro-enclaves.html#conditions-kms-recipient-pcrs,Filters access by the platform configuration register (PCR) 20 in the attestation document in the request. PCR20 is a custom PCR that can be defined by the user for specific use cases,String
589,s3express:x-amz-content-sha256,https://docs.aws.amazon.com/AmazonS3/latest/API/bucket-policy-s3-sigv4-conditions.html,Filters access by unsigned content in your bucket,String
590,s3express:x-amz-server-side-encryption,https://docs.aws.amazon.com/AmazonS3/latest/userguide/s3-express-data-protection.html,Filters access by server-side encryption,String
591,s3express:x-amz-server-side-encryption-aws-kms-key-id,https://docs.aws.amazon.com/AmazonS3/latest/userguide/s3-express-UsingKMSEncryption.html#s3-express-require-sse-kms,Filters access by AWS KMS customer managed key for server-side encryption,ARN
592,s3tables:KMSKeyArn,https://docs.aws.amazon.com/AmazonS3/latest/userguide/s3-tables-setting-up.htmls3-tables-setting-up.html,Filters access by the AWS KMS key ARN for the key used to encrypt a table,ARN
