condition_key_id,name,reference_url,description,type
1,vpc-lattice-svcs:SourceVpc,https://docs.aws.amazon.com/vpc-lattice/latest/ug/auth-policies.html#auth-policies-condition-keys,Filters access by the VPC the request is made from,String
2,vpc-lattice-svcs:SourceVpcOwnerAccount,https://docs.aws.amazon.com/vpc-lattice/latest/ug/auth-policies.html#auth-policies-condition-keys,Filters access by the owning account of the VPC the request is made from,String
3,vpc-lattice:AuthType,https://docs.aws.amazon.com/vpc-lattice/latest/ug/,Filters access by the auth type specified in the request,String
4,vpc-lattice:Protocol,https://docs.aws.amazon.com/vpc-lattice/latest/ug/,Filters access by the protocol specified in the request,String
5,vpc-lattice:ResourceConfigurationArn,https://docs.aws.amazon.com/vpc-lattice/latest/ug/,Filters access by the ARN of a resource configuration,ARN
6,vpc-lattice:SecurityGroupIds,https://docs.aws.amazon.com/vpc-lattice/latest/ug/,Filters access by the IDs of security groups,ArrayOfString
7,vpc-lattice:ServiceArn,https://docs.aws.amazon.com/vpc-lattice/latest/ug/,Filters access by the ARN of a service,ARN
8,vpc-lattice:ServiceNetworkArn,https://docs.aws.amazon.com/vpc-lattice/latest/ug/,Filters access by the ARN of a service network,ARN
9,vpc-lattice:TargetGroupArns,https://docs.aws.amazon.com/vpc-lattice/latest/ug/,Filters access by the ARNs of target groups,ArrayOfARN
10,vpc-lattice:VpcEndpointId,https://docs.aws.amazon.com/vpc-lattice/latest/ug/,Filters access by the ID of a VPC endpoint,String
11,vpc-lattice:VpcId,https://docs.aws.amazon.com/vpc-lattice/latest/ug/,Filters access by the ID of a virtual private cloud (VPC),String
12,wafv2:LogDestinationResource,https://docs.aws.amazon.com/waf/latest/developerguide/security_iam_service-with-iam.html#security_iam_service-with-iam-id-based-policies-conditionkeys,Filters access by log destination ARN for PutLoggingConfiguration API,ARN
13,wafv2:LogScope,https://docs.aws.amazon.com/waf/latest/developerguide/security_iam_service-with-iam.html#security_iam_service-with-iam-id-based-policies-conditionkeys,Filters access by log scope for Logging Configuration API,String
14,wellarchitected:JiraProjectKey,https://docs.aws.amazon.com/wellarchitected/latest/userguide/security_iam_id-based-policy-examples.html,Filters access by project key,String
15,wisdom:MessageTemplate/RoutingProfileArn,https://docs.aws.amazon.com/IAM/latest/UserGuide/list_amazonconnectwisdom.html#amazonconnectwisdom-policy-keys,Filters access by the connect routing profile arns associated with the resource,ArrayOfARN
16,wisdom:SearchFilter/Qualifier,https://docs.aws.amazon.com/IAM/latest/UserGuide/list_amazonconnectwisdom.html#amazonconnectwisdom-policy-keys,Filters access by the qualifiers that are passed in the request,ArrayOfString
17,wisdom:SearchFilter/RoutingProfileArn,https://docs.aws.amazon.com/IAM/latest/UserGuide/list_amazonconnectwisdom.html#amazonconnectwisdom-policy-keys,Filters access by the connect routing profile arn that is passed in the request,ARN
18,workspaces:userId,https://docs.aws.amazon.com/workspaces/latest/adminguide/external-identity-providers-setting-up-saml.html#external-identity-providers-embed-inline-policy-for-IAM-role,Filters access by the ID of the Workspaces user,String
19,www.amazon.com:app_id,https://docs.aws.amazon.com/IAM/latest/UserGuide/reference_policies_iam-condition-keys.html#ck_id,Filters access by the Login with Amazon application ID,String
20,www.amazon.com:user_id,https://docs.aws.amazon.com/IAM/latest/UserGuide/reference_policies_iam-condition-keys.html#ck_id,Filters access by the Login with Amazon user ID,String
21,health:service,https://docs.aws.amazon.com/health/latest/ug/controlling-access.html,Filters access by impacted service,String
22,iam:AWSServiceName,https://docs.aws.amazon.com/IAM/latest/UserGuide/reference_policies_iam-condition-keys.html#ck_AWSServiceName,Filters access by the AWS service to which this role is attached,String
23,iam:AssociatedResourceArn,https://docs.aws.amazon.com/IAM/latest/UserGuide/reference_policies_iam-condition-keys.html#ck_AssociatedResourceArn,Filters access by the resource that the role will be used on behalf of,ARN
24,iam:FIDO-FIPS-140-2-certification,https://docs.aws.amazon.com/IAM/latest/UserGuide/reference_policies_iam-condition-keys.html#ck_FIDO-FIPS-140-2-certification,Filters access by the MFA device FIPS-140-2 validation certification level at the time of registration of a FIDO security key,String
25,iam:FIDO-FIPS-140-3-certification,https://docs.aws.amazon.com/IAM/latest/UserGuide/reference_policies_iam-condition-keys.html#ck_FIDO-FIPS-140-3-certification,Filters access by the MFA device FIPS-140-3 validation certification level at the time of registration of a FIDO security key,String
26,iam:FIDO-certification,https://docs.aws.amazon.com/IAM/latest/UserGuide/reference_policies_iam-condition-keys.html#ck_FIDO-certification,Filters access by the MFA device FIDO certification level at the time of registration of a FIDO security key,String
27,iam:OrganizationsPolicyId,https://docs.aws.amazon.com/IAM/latest/UserGuide/reference_policies_iam-condition-keys.html#ck_OrganizationsPolicyId,Filters access by the ID of an AWS Organizations policy,String
28,iam:PassedToService,https://docs.aws.amazon.com/IAM/latest/UserGuide/reference_policies_iam-condition-keys.html#ck_PassedToService,Filters access by the AWS service to which this role is passed,String
29,iam:PermissionsBoundary,https://docs.aws.amazon.com/IAM/latest/UserGuide/reference_policies_iam-condition-keys.html#ck_PermissionsBoundary,Filters access if the specified policy is set as the permissions boundary on the IAM entity (user or role),ARN
30,iam:PolicyARN,https://docs.aws.amazon.com/IAM/latest/UserGuide/reference_policies_iam-condition-keys.html#ck_PolicyARN,Filters access by the ARN of an IAM policy,ARN
31,iam:RegisterSecurityKey,https://docs.aws.amazon.com/IAM/latest/UserGuide/reference_policies_iam-condition-keys.html#ck_RegisterSecurityKey,Filters access by the current state of MFA device enablement,String
32,iam:ResourceTag/${TagKey},"",Filters access by actions based on tag-value associated with the resource,String
33,identitystore:GroupId,https://docs.aws.amazon.com/amazonq/latest/qbusiness-ug/security_iam_service-with-iam.html,Filters access by IAM Identity Center Group ID,ARN
34,identitystore:UserId,https://docs.aws.amazon.com/amazonq/latest/qbusiness-ug/security_iam_service-with-iam.html,Filters access by IAM Identity Center User ID,ArrayOfString
35,imagebuilder:CreatedResourceTag/<key>,https://docs.aws.amazon.com/imagebuilder/latest/userguide/security_iam_service-with-iam.html#image-builder-security-createdresourcetag,Filters access by the tag key-value pairs attached to the resource created by Image Builder,String
36,imagebuilder:CreatedResourceTagKeys,https://docs.aws.amazon.com/imagebuilder/latest/userguide/security_iam_service-with-iam.html#image-builder-security-createdresourcetagkeys,Filters access by the presence of tag keys in the request,ArrayOfString
37,imagebuilder:Ec2MetadataHttpTokens,https://docs.aws.amazon.com/imagebuilder/latest/userguide/security_iam_service-with-iam.html#image-builder-security-ec2metadatahttptokens,Filters access by the EC2 Instance Metadata HTTP Token Requirement specified in the request,String
38,imagebuilder:LifecyclePolicyResourceType,https://docs.aws.amazon.com/imagebuilder/latest/userguide/security_iam_service-with-iam.html#image-builder-security-ec2metadatahttptokens,Filters access by the Lifecycle Policy Resource Type specified in the request,String
39,imagebuilder:StatusTopicArn,https://docs.aws.amazon.com/imagebuilder/latest/userguide/security_iam_service-with-iam.html#image-builder-security-statustopicarn,Filters access by the SNS Topic Arn in the request to which terminal state notifications will be published,ARN
40,inspector2:Cis Scan Configuration,,,
41,inspector2:Filter,,,
42,iot:ClientMode,https://docs.aws.amazon.com/service-authorization/latest/reference/list_awsiot.html,Filters access by the mode of the client for IoT Tunnel,String
43,iot:CommandExecutionParameterBoolean/${CommandParameterName},https://docs.aws.amazon.com/service-authorization/latest/reference/list_awsiot.html,Filters access by the command parameter name and boolean value,Bool
44,iot:CommandExecutionParameterNumber/${CommandParameterName},https://docs.aws.amazon.com/service-authorization/latest/reference/list_awsiot.html,Filters access by the command parameter name and numeric value,Numeric
45,iot:CommandExecutionParameterString/${CommandParameterName},https://docs.aws.amazon.com/service-authorization/latest/reference/list_awsiot.html,Filters access by the command parameter name and string value,String
46,iot:Delete,https://docs.aws.amazon.com/service-authorization/latest/reference/list_awsiot.html,Filters access by a flag indicating whether or not to also delete an IoT Tunnel immediately when making iot:CloseTunnel request,Bool
47,iot:DomainName,https://docs.aws.amazon.com/service-authorization/latest/reference/list_awsiot.html,Filters access by based on the domain name of an IoT DomainConfiguration,String
48,iot:JobId,https://docs.aws.amazon.com/service-authorization/latest/reference/list_awsiot.html,Filters access by jobId for iotjobsdata:DescribeJobExecution and iotjobsdata:UpdateJobExecution APIs,String
49,iot:ThingGroupArn,https://docs.aws.amazon.com/service-authorization/latest/reference/list_awsiot.html,Filters access by a list of IoT Thing Group ARNs that the destination IoT Thing belongs to for an IoT Tunnel,ArrayOfARN
50,iot:TunnelDestinationService,https://docs.aws.amazon.com/service-authorization/latest/reference/list_awsiot.html,Filters access by a list of destination services for an IoT Tunnel,ArrayOfString
51,iot:thingArn,https://docs.aws.amazon.com/service-authorization/latest/reference/list_awsiot.html,Filters access by the ARN of an IoT Thing,ARN
52,iotanalytics:ResourceTag/${TagKey},https://docs.aws.amazon.com/iotanalytics/latest/userguide/tagging.html#tagging-iam,Filters access by the tag key-value pairs attached to the resource,String
53,iotevents:keyValue,https://docs.aws.amazon.com/iotevents/latest/developerguide/security_iam_id-based-policy-examples.html#security_iam_service-with-iam-id-based-policies-conditionkeys,Filters access by the instanceId (key-value) of the message,String
54,iotfleetwise:DestinationArn,https://docs.aws.amazon.com/service-authorization/latest/reference/list_awsiotfleetwise.html,"Filters access by campaign destination ARN, eg. an S3 bucket ARN or a Timestream ARN",ARN
55,iotfleetwise:Signals,https://docs.aws.amazon.com/service-authorization/latest/reference/list_awsiotfleetwise.html,Filters access by fully qualified signal names,ArrayOfString
56,iotfleetwise:UpdateToDecoderManifestArn,https://docs.aws.amazon.com/service-authorization/latest/reference/list_awsiotfleetwise.html,Filters access by a list of IoT FleetWise Decoder Manifest ARNs,ARN
57,iotfleetwise:UpdateToModelManifestArn,https://docs.aws.amazon.com/service-authorization/latest/reference/list_awsiotfleetwise.html,Filters access by a list of IoT FleetWise Model Manifest ARNs,ARN
58,iotsitewise:assetHierarchyPath,https://docs.aws.amazon.com/iot-sitewise/latest/userguide/security_iam_service-with-iam.html#security_iam_service-with-iam-id-based-policies-conditionkeys,"Filters access by an asset hierarchy path, which is the string of asset IDs in the asset's hierarchy, each separated by a forward slash",String
59,iotsitewise:childAssetId,https://docs.aws.amazon.com/iot-sitewise/latest/userguide/security_iam_service-with-iam.html#security_iam_service-with-iam-id-based-policies-conditionkeys,Filters access by the ID of a child asset being associated whith a parent asset,String
60,iotsitewise:group,https://docs.aws.amazon.com/iot-sitewise/latest/userguide/security_iam_service-with-iam.html#security_iam_service-with-iam-id-based-policies-conditionkeys,Filters access by the ID of an AWS Single Sign-On group,String
61,iotsitewise:iam,https://docs.aws.amazon.com/iot-sitewise/latest/userguide/security_iam_service-with-iam.html#security_iam_service-with-iam-id-based-policies-conditionkeys,Filters access by the ID of an AWS IAM identity,String
62,iotsitewise:isAssociatedWithAssetProperty,https://docs.aws.amazon.com/iot-sitewise/latest/userguide/security_iam_service-with-iam.html#security_iam_service-with-iam-id-based-policies-conditionkeys,Filters access by data streams associated with or not associated with asset properties,String
63,iotsitewise:portal,https://docs.aws.amazon.com/iot-sitewise/latest/userguide/security_iam_service-with-iam.html#security_iam_service-with-iam-id-based-policies-conditionkeys,Filters access by the ID of a portal,String
64,iotsitewise:project,https://docs.aws.amazon.com/iot-sitewise/latest/userguide/security_iam_service-with-iam.html#security_iam_service-with-iam-id-based-policies-conditionkeys,Filters access by the ID of a project,String
65,iotsitewise:propertyAlias,https://docs.aws.amazon.com/iot-sitewise/latest/userguide/security_iam_service-with-iam.html#security_iam_service-with-iam-id-based-policies-conditionkeys,Filters access by the property alias,String
66,iotsitewise:propertyId,https://docs.aws.amazon.com/iot-sitewise/latest/userguide/security_iam_service-with-iam.html#security_iam_service-with-iam-id-based-policies-conditionkeys,Filters access by the ID of an asset property,String
67,iotsitewise:user,https://docs.aws.amazon.com/iot-sitewise/latest/userguide/security_iam_service-with-iam.html#security_iam_service-with-iam-id-based-policies-conditionkeys,Filters access by the ID of an AWS Single Sign-On user,String
68,iottwinmaker:destinationType,https://docs.aws.amazon.com/service-authorization/latest/reference/list_awsiottwinmaker.html#awsiottwinmaker-policy-keys,Filters access by destination type of metadata transfer job,ArrayOfString
69,iottwinmaker:linkedServices,https://docs.aws.amazon.com/service-authorization/latest/reference/list_awsiottwinmaker.html#awsiottwinmaker-policy-keys,Filters access by workspace linked to services,ArrayOfString
70,iottwinmaker:sourceType,https://docs.aws.amazon.com/service-authorization/latest/reference/list_awsiottwinmaker.html#awsiottwinmaker-policy-keys,Filters access by source type of metadata transfer job,ArrayOfString
71,kafka:publicAccessEnabled,https://docs.aws.amazon.com/service-authorization/latest/reference/list_apachekafkaapisforamazonmskclusters.html#apachekafkaapisforamazonmskclusters-policy-keys,Filters access by the presence of public access enabled in the request,Bool
72,kms:BypassPolicyLockoutSafetyCheck,https://docs.aws.amazon.com/kms/latest/developerguide/conditions-kms.html#conditions-kms-bypass-policy-lockout-safety-check,Filters access to the CreateKey and PutKeyPolicy operations based on the value of the BypassPolicyLockoutSafetyCheck parameter in the request,Bool
73,kms:CallerAccount,https://docs.aws.amazon.com/kms/latest/developerguide/conditions-kms.html#conditions-kms-caller-account,Filters access to specified AWS KMS operations based on the AWS account ID of the caller. You can use this condition key to allow or deny access to all IAM users and roles in an AWS account in a single policy statement,String
74,kms:CustomerMasterKeySpec,https://docs.aws.amazon.com/kms/latest/developerguide/conditions-kms.html#conditions-kms-key-spec-replaced,"The kms:CustomerMasterKeySpec condition key is deprecated. Instead, use the kms:KeySpec condition key",String
75,kms:CustomerMasterKeyUsage,https://docs.aws.amazon.com/kms/latest/developerguide/conditions-kms.html#conditions-kms-key-usage-replaced,"The kms:CustomerMasterKeyUsage condition key is deprecated. Instead, use the kms:KeyUsage condition key",String
76,kms:DataKeyPairSpec,https://docs.aws.amazon.com/kms/latest/developerguide/conditions-kms.html#conditions-kms-data-key-pair-spec,Filters access to GenerateDataKeyPair and GenerateDataKeyPairWithoutPlaintext operations based on the value of the KeyPairSpec parameter in the request,String
77,kms:EncryptionAlgorithm,https://docs.aws.amazon.com/kms/latest/developerguide/conditions-kms.html#conditions-kms-encryption-algorithm,Filters access to encryption operations based on the value of the encryption algorithm in the request,String
78,kms:EncryptionContext:${EncryptionContextKey},https://docs.aws.amazon.com/kms/latest/developerguide/conditions-kms.html#conditions-kms-encryption-context,Filters access to a symmetric AWS KMS key based on the encryption context in a cryptographic operation. This condition evaluates the key and value in each key-value encryption context pair,String
79,kms:EncryptionContextKeys,https://docs.aws.amazon.com/kms/latest/developerguide/conditions-kms.html#conditions-kms-encryption-context-keys,Filters access to a symmetric AWS KMS key based on the encryption context in a cryptographic operation. This condition key evaluates only the key in each key-value encryption context pair,ArrayOfString
80,kms:ExpirationModel,https://docs.aws.amazon.com/kms/latest/developerguide/conditions-kms.html#conditions-kms-expiration-model,Filters access to the ImportKeyMaterial operation based on the value of the ExpirationModel parameter in the request,String
81,kms:GrantConstraintType,https://docs.aws.amazon.com/kms/latest/developerguide/conditions-kms.html#conditions-kms-grant-constraint-type,Filters access to the CreateGrant operation based on the grant constraint in the request,String
82,kms:GrantIsForAWSResource,https://docs.aws.amazon.com/kms/latest/developerguide/conditions-kms.html#conditions-kms-grant-is-for-aws-resource,Filters access to the CreateGrant operation when the request comes from a specified AWS service,Bool
83,kms:GrantOperations,https://docs.aws.amazon.com/kms/latest/developerguide/conditions-kms.html#conditions-kms-grant-operations,Filters access to the CreateGrant operation based on the operations in the grant,ArrayOfString
84,kms:GranteePrincipal,https://docs.aws.amazon.com/kms/latest/developerguide/conditions-kms.html#conditions-kms-grantee-principal,Filters access to the CreateGrant operation based on the grantee principal in the grant,String
85,kms:KeyAgreementAlgorithm,https://docs.aws.amazon.com/kms/latest/developerguide/conditions-kms.html#conditions-kms-key-agreement-algorithm,Filters access to the DeriveSharedSecret operation based on the value of the KeyAgreementAlgorithm parameter in the request,String
86,kms:KeyOrigin,https://docs.aws.amazon.com/kms/latest/developerguide/conditions-kms.html#conditions-kms-key-origin,Filters access to an API operation based on the Origin property of the AWS KMS key created by or used in the operation. Use it to qualify authorization of the CreateKey operation or any operation that is authorized for a KMS key,String
87,kms:KeySpec,https://docs.aws.amazon.com/kms/latest/developerguide/conditions-kms.html#conditions-kms-key-spec,Filters access to an API operation based on the KeySpec property of the AWS KMS key that is created by or used in the operation. Use it to qualify authorization of the CreateKey operation or any operation that is authorized for a KMS key resource,String
88,kms:KeyUsage,https://docs.aws.amazon.com/kms/latest/developerguide/conditions-kms.html#conditions-kms-key-usage,Filters access to an API operation based on the KeyUsage property of the AWS KMS key created by or used in the operation. Use it to qualify authorization of the CreateKey operation or any operation that is authorized for a KMS key resource,String
89,kms:MacAlgorithm,https://docs.aws.amazon.com/kms/latest/developerguide/conditions-kms.html#conditions-kms-mac-algorithm,Filters access to the GenerateMac and VerifyMac operations based on the MacAlgorithm parameter in the request,String
90,kms:MessageType,https://docs.aws.amazon.com/kms/latest/developerguide/conditions-kms.html#conditions-kms-message-type,Filters access to the Sign and Verify operations based on the value of the MessageType parameter in the request,String
91,kms:MultiRegion,https://docs.aws.amazon.com/kms/latest/developerguide/conditions-kms.html#conditions-kms-multi-region,Filters access to an API operation based on the MultiRegion property of the AWS KMS key created by or used in the operation. Use it to qualify authorization of the CreateKey operation or any operation that is authorized for a KMS key resource,Bool
92,kms:MultiRegionKeyType,https://docs.aws.amazon.com/kms/latest/developerguide/conditions-kms.html#conditions-kms-multi-region-key-type,Filters access to an API operation based on the MultiRegionKeyType property of the AWS KMS key created by or used in the operation. Use it to qualify authorization of the CreateKey operation or any operation that is authorized for a KMS key resource,String
93,kms:PrimaryRegion,https://docs.aws.amazon.com/kms/latest/developerguide/conditions-kms.html#conditions-kms-primary-region,Filters access to the UpdatePrimaryRegion operation based on the value of the PrimaryRegion parameter in the request,String
94,kms:ReEncryptOnSameKey,https://docs.aws.amazon.com/kms/latest/developerguide/conditions-kms.html#conditions-kms-reencrypt-on-same-key,Filters access to the ReEncrypt operation when it uses the same AWS KMS key that was used for the Encrypt operation,Bool
95,kms:RecipientAttestation:ImageSha384,https://docs.aws.amazon.com/kms/latest/developerguide/conditions-nitro-enclaves.html#conditions-kms-recipient-image-sha,Filters access to the API operations based on the image hash in the attestation document in the request,String
96,kms:RecipientAttestation:PCR0,https://docs.aws.amazon.com/kms/latest/developerguide/conditions-nitro-enclaves.html#conditions-kms-recipient-pcrs,"Filters access by the platform configuration register (PCR) 0 in the attestation document. PCR0 is a contiguous measure of the contents of the enclave image file, without the section data",String
97,kms:RecipientAttestation:PCR1,https://docs.aws.amazon.com/kms/latest/developerguide/conditions-nitro-enclaves.html#conditions-kms-recipient-pcrs,Filters access by the platform configuration register (PCR) 1 in the attestation document. PCR1 is a contiguous measurement of the Linux kernel and bootstrap data,String
98,kms:RecipientAttestation:PCR10,https://docs.aws.amazon.com/kms/latest/developerguide/conditions-nitro-enclaves.html#conditions-kms-recipient-pcrs,Filters access by the platform configuration register (PCR) 10 in the attestation document in the request. PCR10 is a custom PCR that can be defined by the user for specific use cases,String
99,kms:RecipientAttestation:PCR11,https://docs.aws.amazon.com/kms/latest/developerguide/conditions-nitro-enclaves.html#conditions-kms-recipient-pcrs,Filters access by the platform configuration register (PCR) 11 in the attestation document in the request. PCR11 is a custom PCR that can be defined by the user for specific use cases,String
100,kms:RecipientAttestation:PCR12,https://docs.aws.amazon.com/kms/latest/developerguide/conditions-nitro-enclaves.html#conditions-kms-recipient-pcrs,Filters access by the platform configuration register (PCR) 12 in the attestation document in the request. PCR12 is a custom PCR that can be defined by the user for specific use cases,String
101,kms:RecipientAttestation:PCR13,https://docs.aws.amazon.com/kms/latest/developerguide/conditions-nitro-enclaves.html#conditions-kms-recipient-pcrs,Filters access by the platform configuration register (PCR) 13 in the attestation document in the request. PCR13 is a custom PCR that can be defined by the user for specific use cases,String
102,kms:RecipientAttestation:PCR14,https://docs.aws.amazon.com/kms/latest/developerguide/conditions-nitro-enclaves.html#conditions-kms-recipient-pcrs,Filters access by the platform configuration register (PCR) 14 in the attestation document in the request. PCR14 is a custom PCR that can be defined by the user for specific use cases,String
103,kms:RecipientAttestation:PCR15,https://docs.aws.amazon.com/kms/latest/developerguide/conditions-nitro-enclaves.html#conditions-kms-recipient-pcrs,Filters access by the platform configuration register (PCR) 15 in the attestation document in the request. PCR15 is a custom PCR that can be defined by the user for specific use cases,String
104,kms:RecipientAttestation:PCR16,https://docs.aws.amazon.com/kms/latest/developerguide/conditions-nitro-enclaves.html#conditions-kms-recipient-pcrs,Filters access by the platform configuration register (PCR) 16 in the attestation document in the request. PCR16 is a custom PCR that can be defined by the user for specific use cases,String
105,kms:RecipientAttestation:PCR17,https://docs.aws.amazon.com/kms/latest/developerguide/conditions-nitro-enclaves.html#conditions-kms-recipient-pcrs,Filters access by the platform configuration register (PCR) 17 in the attestation document in the request. PCR17 is a custom PCR that can be defined by the user for specific use cases,String
106,kms:RecipientAttestation:PCR18,https://docs.aws.amazon.com/kms/latest/developerguide/conditions-nitro-enclaves.html#conditions-kms-recipient-pcrs,Filters access by the platform configuration register (PCR) 18 in the attestation document in the request. PCR18 is a custom PCR that can be defined by the user for specific use cases,String
107,kms:RecipientAttestation:PCR19,https://docs.aws.amazon.com/kms/latest/developerguide/conditions-nitro-enclaves.html#conditions-kms-recipient-pcrs,Filters access by the platform configuration register (PCR) 19 in the attestation document in the request. PCR19 is a custom PCR that can be defined by the user for specific use cases,String
108,kms:RecipientAttestation:PCR2,https://docs.aws.amazon.com/kms/latest/developerguide/conditions-nitro-enclaves.html#conditions-kms-recipient-pcrs,"Filters access by the platform configuration register (PCR) 2 in the attestation document. PCR2 is a contiguous, in-order measurement of the user applications, without the boot ramfs",String
