condition_key_id,name,reference_url,description,type
939,kms:SigningAlgorithm,https://docs.aws.amazon.com/kms/latest/developerguide/conditions-kms.html#conditions-kms-signing-algorithm,Filters access to the Sign and Verify operations based on the signing algorithm in the request,String
940,kms:ValidTo,https://docs.aws.amazon.com/kms/latest/developerguide/conditions-kms.html#conditions-kms-valid-to,Filters access to the ImportKeyMaterial operation based on the value of the ValidTo parameter in the request. You can use this condition key to allow users to import key material only when it expires by the specified date,Date
941,signer:ProfileVersion,https://docs.aws.amazon.com/signer/latest/developerguide/authen-apipermissions.html,Filters access by version of the Signing Profile,String
942,events:detail-type,https://docs.aws.amazon.com/eventbridge/latest/userguide/policy-keys-eventbridge.html#events-pattern-detail-type,Filters access by the literal string of the detail-type of the event to PutEvents and PutRule actions,String
943,sns:Endpoint,https://docs.aws.amazon.com/sns/latest/dg/UsingIAMwithSNS.html#w2ab1c11c23c19,"Filters access by the URL, email address, or ARN from a Subscribe request or a previously confirmed subscription",String
944,sns:Protocol,https://docs.aws.amazon.com/sns/latest/dg/UsingIAMwithSNS.html#w2ab1c11c23c19,Filters access by the protocol value from a Subscribe request or a previously confirmed subscription,String
945,events:detail.eventTypeCode,https://docs.aws.amazon.com/eventbridge/latest/userguide/policy-keys-eventbridge.html#limit-rule-by-type-code,Filters access by the literal string for the detail.eventTypeCode field of the event to PutRule actions,String
946,events:detail.service,https://docs.aws.amazon.com/eventbridge/latest/userguide/policy-keys-eventbridge.html#limit-rule-by-service,Filters access by the literal string for the detail.service field of the event to PutRule actions,String
947,events:detail.userIdentity.principalId,https://docs.aws.amazon.com/eventbridge/latest/userguide/policy-keys-eventbridge.html#consume-specific-events,Filters access by the literal string for the detail.useridentity.principalid field of the event to PutRule actions,String
948,events:eventBusInvocation,https://docs.aws.amazon.com/eventbridge/latest/userguide/policy-keys-eventbridge.html#events-bus-invocation,Filters access by whether the event was generated via API or cross-account bus invocation to PutEvents actions,String
949,events:source,https://docs.aws.amazon.com/eventbridge/latest/userguide/policy-keys-eventbridge.html#events-limit-access-control,Filters access by the AWS service or AWS partner event source that generated the event to PutEvents and PutRule actions. Matches the literal string of the source field of the event,ArrayOfString
950,execute-api:viaDomainArn,https://docs.aws.amazon.com/apigateway/latest/developerguide/security_iam_service-with-iam.html,Filters access by the domain name ARN the API is called from,String
951,kms:ViaService,https://docs.aws.amazon.com/kms/latest/developerguide/conditions-kms.html#conditions-kms-via-service,Filters access when a request made on the principal's behalf comes from a specified AWS service,String
952,ssm:AccessRequestId,https://docs.aws.amazon.com/systems-manager/latest/userguide/auth-and-access-control-iam-access-control-identity-based.html#policy-conditions,Filters access by verifying that a user has access to the access request ID specified in the request,String
953,fis:Operations,https://docs.aws.amazon.com/fis/latest/userguide/security_iam_service-with-iam.html,Filters access by the list of operations on the AWS service that is being affected by the AWS FIS action,ArrayOfString
954,kms:WrappingAlgorithm,https://docs.aws.amazon.com/kms/latest/developerguide/conditions-kms.html#conditions-kms-wrapping-algorithm,Filters access to the GetParametersForImport operation based on the value of the WrappingAlgorithm parameter in the request,String
955,kms:WrappingKeySpec,https://docs.aws.amazon.com/kms/latest/developerguide/conditions-kms.html#conditions-kms-wrapping-key-spec,Filters access to the GetParametersForImport operation based on the value of the WrappingKeySpec parameter in the request,String
956,lakeformation:EnabledOnlyForMetaDataAccess,https://docs.aws.amazon.com/service-authorization/latest/reference/list_awslakeformation.html#awslakeformation-policy-keys,Filters access by the presence of the key configured for role's identity-based policy,Bool
957,lambda:CodeSigningConfigArn,https://docs.aws.amazon.com/lambda/latest/dg/lambda-api-permissions-ref.html,Filters access by the ARN of an AWS Lambda code signing config,ARN
958,lambda:EventSourceToken,https://docs.aws.amazon.com/lambda/latest/dg/lambda-api-permissions-ref.html,Filters access by the ID from a non-AWS event source configured for the AWS Lambda function,String
959,lambda:FunctionArn,https://docs.aws.amazon.com/lambda/latest/dg/lambda-api-permissions-ref.html,Filters access by the ARN of an AWS Lambda function,ARN
960,lambda:FunctionUrlAuthType,https://docs.aws.amazon.com/lambda/latest/dg/lambda-api-permissions-ref.html,"Filters access by authorization type specified in request. Available during CreateFunctionUrlConfig, UpdateFunctionUrlConfig, DeleteFunctionUrlConfig, GetFunctionUrlConfig, ListFunctionUrlConfig, AddPermission and RemovePermission operations",String
961,lambda:Layer,https://docs.aws.amazon.com/lambda/latest/dg/lambda-api-permissions-ref.html,Filters access by the ARN of a version of an AWS Lambda layer,ArrayOfString
962,lambda:Principal,https://docs.aws.amazon.com/lambda/latest/dg/lambda-api-permissions-ref.html,Filters access by restricting the AWS service or account that can invoke a function,String
963,lambda:SecurityGroupIds,https://docs.aws.amazon.com/lambda/latest/dg/lambda-api-permissions-ref.html,Filters access by the ID of security groups configured for the AWS Lambda function,ArrayOfString
964,lambda:SourceFunctionArn,https://docs.aws.amazon.com/lambda/latest/dg/lambda-api-permissions-ref.html,Filters access by the ARN of the AWS Lambda function from which the request originated,ARN
965,lambda:SubnetIds,https://docs.aws.amazon.com/lambda/latest/dg/lambda-api-permissions-ref.html,Filters access by the ID of subnets configured for the AWS Lambda function,ArrayOfString
966,lambda:VpcIds,https://docs.aws.amazon.com/lambda/latest/dg/lambda-api-permissions-ref.html,Filters access by the ID of the VPC configured for the AWS Lambda function,String
967,lex:associatedIntents,https://docs.aws.amazon.com/lex/latest/dg/security_iam_service-with-iam.html,Enables you to control access based on the intents included in the request,ArrayOfString
968,lex:associatedSlotTypes,https://docs.aws.amazon.com/lex/latest/dg/security_iam_service-with-iam.html,Enables you to control access based on the slot types included in the request,ArrayOfString
969,lex:channelType,https://docs.aws.amazon.com/lex/latest/dg/security_iam_service-with-iam.html,Enables you to control access based on the channel type included in the request,String
970,license-manager:ResourceTag/${TagKey},https://docs.aws.amazon.com/license-manager/latest/userguide/identity-access-management.html,Filters access by the tag key-value pairs attached to the resource,String
971,logs:DeliveryDestinationResourceArn,https://docs.aws.amazon.com/AmazonCloudWatch/latest/logs/iam-identity-based-access-control-cwl.html,Filters access by the Log Destination ARN passed in the request,ARN
972,logs:LogGeneratingResourceArns,https://docs.aws.amazon.com/AmazonCloudWatch/latest/logs/iam-identity-based-access-control-cwl.html,Filters access by the Log Generating Resource ARNs passed in the request,ArrayOfARN
973,lookoutequipment:IsImportingData,https://docs.aws.amazon.com/IAM/latest/UserGuide/reference_policies_condition-keys.html#condition-keys-isimportingdata,Filters access by the import strategy of underlying data,Bool
974,mediaconvert:HttpInputsAllowed,https://docs.aws.amazon.com/mediaconvert/latest/apireference/input-policies.html,Filters access by an HTTP input policy present in the account,Bool
975,mediaconvert:HttpsInputsAllowed,https://docs.aws.amazon.com/mediaconvert/latest/apireference/input-policies.html,Filters access by an HTTPS input policy present in the account,Bool
976,mediaconvert:S3InputsAllowed,https://docs.aws.amazon.com/mediaconvert/latest/apireference/input-policies.html,Filters access by an S3 input policy present in the account,Bool
977,memorydb:TLSEnabled,https://docs.aws.amazon.com/memorydb/latest/devguide/IAM.ConditionKeys.html#IAM.SpecifyingConditions,Filters access by the TLSEnabled parameter present in the request or defaults to true value if parameter is not present,Bool
978,memorydb:UserAuthenticationMode,https://docs.aws.amazon.com/memorydb/latest/devguide/IAM.ConditionKeys.html#IAM.SpecifyingConditions,Filters access by the UserAuthenticationMode.Type parameter in the request,String
979,mgh:AutomationRunResourceRunID,https://docs.aws.amazon.com/migrationhub/latest/ug/ContextKeys_AutomationRunResourceRunID.html,AutomationRunResource resource runID identifier,String
980,mgh:AutomationUnitResourceAutomationUnitArn,https://docs.aws.amazon.com/migrationhub/latest/ug/ContextKeys_AutomationUnitResourceAutomationUnitArn.html,AutomationUnitResource resource automationUnitArn identifier,ARN
981,mgh:ConnectionResourceConnectionArn,https://docs.aws.amazon.com/migrationhub/latest/ug/security_iam_service-with-iam-id-based-policies-conditionkeys.html#condition-connectionresourceconnectionarn,ConnectionResource resource connectionArn identifier,String
982,mgn:CreateAction,https://docs.aws.amazon.com/mgn/latest/ug/supported-iam-actions-tagging.html,Filters access by the name of a resource-creating API action,String
983,mpa:ProtectedResourceAccount,https://docs.aws.amazon.com/mpa/latest/userguide/mpa-concepts.html,Filters access by the account that owns the resource that is the target of the operation that requires approval,String
984,mpa:RequestedOperation,https://docs.aws.amazon.com/mpa/latest/userguide/mpa-concepts.html,Filters access by a requested operation that requires team approval before it can be executed,String
985,neptune-db:QueryLanguage,https://docs.aws.amazon.com/neptune/latest/userguide/iam-data-condition-keys.html#iam-neptune-condition-keys,Filters access by graph model,String
986,neptune-graph:PublicConnectivity,https://docs.aws.amazon.com/neptune-analytics/latest/userguide/iam-condition-keys.html#publicconnectivity,"Filters access by the value of the public connectivity parameter provided in the request or its default value, if unspecified. All access to graphs is IAM authenticated",Bool
987,networkmanager:cgwArn,https://docs.aws.amazon.com/vpc/latest/tgw/nm-security-iam.html,Filters access by which customer gateways can be associated or disassociated,ARN
988,networkmanager:directConnectGatewayArn,https://docs.aws.amazon.com/vpc/latest/tgw/nm-security-iam.html,Filters access by which Direct Connect gateway can be used to a create/update attachment,ARN
989,networkmanager:edgeLocations,https://docs.aws.amazon.com/vpc/latest/tgw/nm-security-iam.html,Filters access by which edge locations can be added or removed from a Direct Connect gateway attachment,ArrayOfString
990,networkmanager:subnetArns,https://docs.aws.amazon.com/vpc/latest/tgw/nm-security-iam.html,Filters access by which VPC subnets can be added or removed from a VPC attachment,ArrayOfARN
991,networkmanager:tgwArn,https://docs.aws.amazon.com/vpc/latest/tgw/nm-security-iam.html,"Filters access by which transit gateways can be registered, deregistered, or peered",ARN
992,networkmanager:tgwConnectPeerArn,https://docs.aws.amazon.com/vpc/latest/tgw/nm-security-iam.html,Filters access by which transit gateway connect peers can be associated or disassociated,ARN
993,networkmanager:tgwRtbArn,https://docs.aws.amazon.com/vpc/latest/tgw/nm-security-iam.html,Filters access by which Transit Gateway Route Table can be used to create an attachment,ARN
994,networkmanager:vpcArn,https://docs.aws.amazon.com/vpc/latest/tgw/nm-security-iam.html,Filters access by which VPC can be used to a create/update attachment,ARN
995,networkmanager:vpnConnectionArn,https://docs.aws.amazon.com/vpc/latest/tgw/nm-security-iam.html,Filters access by which Site-to-Site VPN can be used to a create/update attachment,ARN
996,nimble:createdBy,https://docs.aws.amazon.com/nimble-studio/latest/userguide/security-iam-service-with-iam.html,Filters access by the createdBy request parameter or the ID of the creator of the resource,String
997,nimble:ownedBy,https://docs.aws.amazon.com/nimble-studio/latest/userguide/security-iam-service-with-iam.html,Filters access by the ownedBy request parameter or the ID of the owner of the resource,String
998,nimble:principalId,https://docs.aws.amazon.com/nimble-studio/latest/userguide/security-iam-service-with-iam.html,Filters access by the principalId request parameter,String
999,nimble:requesterPrincipalId,https://docs.aws.amazon.com/nimble-studio/latest/userguide/security-iam-service-with-iam.html,Filters access by the ID of the logged in user,String
1000,nimble:studioId,https://docs.aws.amazon.com/nimble-studio/latest/userguide/security-iam-service-with-iam.html,Filters access by a specific studio,ARN
1001,oam:ResourceTypes,https://docs.aws.amazon.com/IAM/latest/UserGuide/list_amazoncloudwatchobservabilityaccessmanager.html,Filters access by the presence of resource types in the request,ArrayOfString
1002,observabilityadmin:CentralizationBackupRegion,https://docs.aws.amazon.com/AmazonCloudWatch/latest/monitoring/reference_policies_condition-keys.htmlcondition-keys-observabilityadmin.html#condition-keys-centralizationbackupregion,Filters access by the backup region that is passed in the request,String
1003,observabilityadmin:CentralizationDestinationRegion,https://docs.aws.amazon.com/AmazonCloudWatch/latest/monitoring/reference_policies_condition-keys.htmlcondition-keys-observabilityadmin.html#condition-keys-centralizationdestinationregion,Filters access by the destination region that is passed in the request,String
1004,observabilityadmin:CentralizationSourceRegions,https://docs.aws.amazon.com/AmazonCloudWatch/latest/monitoring/reference_policies_condition-keys.htmlcondition-keys-observabilityadmin.html#condition-keys-centralizationsourceregions,Filters access by the source regions that are passed in the request,ArrayOfString
1005,organizations:PolicyType,https://docs.aws.amazon.com/organizations/latest/userguide/orgs_permissions_overview.html#orgs_permissions_conditionkeys,Filters access by the specified policy type names,String
1006,organizations:ServicePrincipal,https://docs.aws.amazon.com/organizations/latest/userguide/orgs_permissions_overview.html#orgs_permissions_conditionkeys,Filters access by the specified service principal names,String
1007,partnercentral:Catalog,https://docs.aws.amazon.com/partner-central/latest/APIReference/access-control.html#managing-permissions-with-condition-keyspage.html#Catalog,"Filters access by a specific Catalog. Accepted values: [AWS, Sandbox]",String
1008,partnercentral:RelatedEntityType,https://docs.aws.amazon.com/partner-central/latest/APIReference/access-control.html#managing-permissions-with-condition-keyspage.html#RelatedEntityType,"Filters access by entity types for Opportunity association. Accepted values: [Solutions, AwsProducts, AwsMarketplaceOffers]",String
1009,payment-cryptography:CertificateAuthorityPublicKeyIdentifier,{ActionsDocRoot}security-iam.html,"Filters access by the CertificateAuthorityPublicKeyIdentifier specified in the request or the ImportKey, and ExportKey operations",String
1010,payment-cryptography:ImportKeyMaterial,{ActionsDocRoot}security-iam.html,"Filters access by the type of key material being imported [RootCertificatePublicKey, TrustedCertificatePublicKey, Tr34KeyBlock, Tr31KeyBlock] for the ImportKey operation",String
1011,payment-cryptography:KeyAlgorithm,{ActionsDocRoot}security-iam.html,Filters access by KeyAlgorithm specified in the request for the CreateKey operation,String
1012,payment-cryptography:KeyClass,{ActionsDocRoot}security-iam.html,Filters access by KeyClass specified in the request for the CreateKey operation,String
1013,payment-cryptography:KeyUsage,{ActionsDocRoot}security-iam.html,Filters access by KeyClass specified in the request or associated with a key for the CreateKey operation,String
1014,fis:Percentage,https://docs.aws.amazon.com/fis/latest/userguide/security_iam_service-with-iam.html,Filters access by the percentage of calls being affected by the AWS FIS action,Numeric
1015,payment-cryptography:RequestAlias,{ActionsDocRoot}security-iam.html,Filters access by aliases in the request for the specified operation,String
1016,payment-cryptography:ResourceAliases,{ActionsDocRoot}security-iam.html,Filters access by aliases associated with a key for the specified operation,ArrayOfString
1017,payment-cryptography:WrappingKeyIdentifier,{ActionsDocRoot}security-iam.html,"Filters access by the WrappingKeyIdentifier specified in the request for the ImportKey, and ExportKey operations",String
1018,pi:Dimensions,#condition-keys-dimensions,Filters access by the requested dimensions,ArrayOfString
1019,proton:EnvironmentTemplate,https://docs.aws.amazon.com/IAM/latest/UserGuide/reference_policies_condition-keys.html,Filters access by specified environment template related to resource,String
1020,proton:ServiceTemplate,https://docs.aws.amazon.com/IAM/latest/UserGuide/reference_policies_condition-keys.html,Filters access by specified service template related to resource,String
1021,qapps:AppIsPublished,https://docs.aws.amazon.com/amazonq/latest/qbusiness-ug/security-iam.html,Filters access by whether Q App is published,String
1022,fis:Service,https://docs.aws.amazon.com/fis/latest/userguide/security_iam_service-with-iam.html,Filters access by the AWS service that is being affected by the AWS FIS action,String
1023,qapps:SessionIsShared,https://docs.aws.amazon.com/amazonq/latest/qbusiness-ug/security-iam.html,Filters access by whether Q App Session is shared,String
1024,qapps:UserIsAppOwner,https://docs.aws.amazon.com/amazonq/latest/qbusiness-ug/security-iam.html,Filters access by whether requester is Q App owner,String
1025,qapps:UserIsSessionModerator,https://docs.aws.amazon.com/amazonq/latest/qbusiness-ug/security-iam.html,Filters access by whether requester is Q App Session moderator,String
1026,qldb:Purge,https://docs.aws.amazon.com/IAM/latest/UserGuide/reference_policies_condition-keys.html#condition-keys-purge,Filters access by the value of purge that is specified in a PartiQL DROP statement,String
1027,fis:Targets,https://docs.aws.amazon.com/fis/latest/userguide/security_iam_service-with-iam.html,Filters access by the list of resource ARNs being targeted by the AWS FIS action,ArrayOfString
1028,quicksight:AllowedEmbeddingDomains,https://docs.aws.amazon.com/quicksight/latest/user/embedded-dashboards-for-authenticated-users-step-1.html,Filters access by the allowed embedding domains,ArrayOfString
1029,quicksight:DirectoryType,https://docs.aws.amazon.com/quicksight/latest/user/security-scp.html,Filters access by the user management options,String
1030,quicksight:Edition,https://docs.aws.amazon.com/quicksight/latest/user/security-scp.html,Filters access by the edition of QuickSight,String
1031,quicksight:Group,https://docs.aws.amazon.com/quicksight/latest/user/iam-actions.html,Filters access by QuickSight group ARN,ARN
1032,fsx:IsBackupCopyDestination,https://docs.aws.amazon.com/fsx/latest/WindowsGuide/using-backups.html#copy-backups,Filters access by whether the backup is a destination backup for a CopyBackup operation,Bool
1033,fsx:IsBackupCopySource,https://docs.aws.amazon.com/fsx/latest/WindowsGuide/using-backups.html#copy-backups,Filters access by whether the backup is a source backup for a CopyBackup operation,Bool
1034,fsx:NfsDataRepositoryAuthenticationEnabled,https://docs.aws.amazon.com/fsx/latest/FileCacheGuide/encryption-in-transit.html,Filters access by NFS data repositories which support authentication,Bool
1035,fsx:NfsDataRepositoryEncryptionInTransitEnabled,https://docs.aws.amazon.com/fsx/latest/FileCacheGuide/encryption-in-transit.html,Filters access by NFS data repositories which support encryption-in-transit,Bool
1036,fsx:ParentVolumeId,https://docs.aws.amazon.com/fsx/latest/OpenZFSGuide/creating-volumes.html,Filters access by the containing parent volume for mutating volume operations,String
1037,fsx:StorageVirtualMachineId,https://docs.aws.amazon.com/fsx/latest/ONTAPGuide/creating-volumes.html,Filters access by the containing storage virtual machine for a volume for mutating volume operations,String
1038,geo:DeviceIds,https://docs.aws.amazon.com/location/latest/developerguide/security_iam_service-with-iam.html#security_iam_service-with-iam-id-based-policies-conditionkeys,Filters access by the presence of device ids in the request,ArrayOfString
1039,quicksight:IamArn,https://docs.aws.amazon.com/quicksight/latest/user/iam-actions.html,Filters access by IAM user or role ARN,ARN
1040,geo:GeofenceIds,https://docs.aws.amazon.com/location/latest/developerguide/security_iam_service-with-iam.html#security_iam_service-with-iam-id-based-policies-conditionkeys,Filters access by the presence of geofence ids in the request,ArrayOfString
1041,glacier:ArchiveAgeInDays,https://docs.aws.amazon.com/amazonglacier/latest/dev/security_iam_service-with-iam.html#security_iam_service-with-iam-id-based-policies-conditionkeys,"Filters access by how long an archive has been stored in the vault, in days",String
1042,glacier:ResourceTag/,https://docs.aws.amazon.com/amazonglacier/latest/dev/security_iam_service-with-iam.html#security_iam_service-with-iam-tags,Filters access by a customer-defined tag,String
1043,glue:CredentialIssuingService,https://docs.aws.amazon.com/glue/latest/dg/using-identity-based-policies.html#glue-identity-based-policy-condition-keys,Filters access by the service from which the credentials of the request is issued,String
1044,glue:EnabledForRedshiftAutoDiscovery,https://docs.aws.amazon.com/glue/latest/dg/using-identity-based-policies.html#glue-identity-based-policy-condition-keys,Filters access by the presence of the key configured for role's identity-based policy,Bool
1045,glue:LakeFormationPermissions,https://docs.aws.amazon.com/glue/latest/dg/using-identity-based-policies.html#glue-identity-based-policy-condition-keys,Filters access by whether Lake Formation permission checks will be performed for a given caller and the Glue resource,String
1046,quicksight:KmsKeyArns,https://docs.aws.amazon.com/quicksight/latest/user/key-management.html,Filters access by KMS key ARNs,ArrayOfARN
1047,glue:RoleAssumedBy,https://docs.aws.amazon.com/glue/latest/dg/using-identity-based-policies.html#glue-identity-based-policy-condition-keys,Filters access by the service from which the credentials of the request is obtained by assuming the customer role,String
1048,glue:SecurityGroupIds,https://docs.aws.amazon.com/glue/latest/dg/using-identity-based-policies.html#glue-identity-based-policy-condition-keys,Filters access by the ID of security groups configured for the Glue job,ArrayOfString
1049,glue:SubnetIds,https://docs.aws.amazon.com/glue/latest/dg/using-identity-based-policies.html#glue-identity-based-policy-condition-keys,Filters access by the ID of subnets configured for the Glue job,ArrayOfString
1050,glue:VpcIds,https://docs.aws.amazon.com/glue/latest/dg/using-identity-based-policies.html#glue-identity-based-policy-condition-keys,Filters access by the ID of the VPC configured for the Glue job,ArrayOfString
1051,graph.facebook.com:app_id,https://docs.aws.amazon.com/IAM/latest/UserGuide/reference_policies_iam-condition-keys.html#ck_id,Filters access by the Facebook application ID,String
1052,quicksight:SessionName,https://docs.aws.amazon.com/quicksight/latest/user/iam-actions.html,Filters access by session name,String
1053,graph.facebook.com:id,https://docs.aws.amazon.com/IAM/latest/UserGuide/reference_policies_iam-condition-keys.html#ck_id,Filters access by the Facebook user ID,String
1054,groundstation:AgentId,https://docs.aws.amazon.com/ground-station/latest/APIReference/API_RegisterAgent.html#groundstation-RegisterAgent-response-agentId,Filters access by the ID of an agent,String
1055,groundstation:ConfigId,https://docs.aws.amazon.com/ground-station/latest/APIReference/API_CreateConfig.html#groundstation-CreateConfig-response-configId,Filters access by the ID of a config,String
1056,groundstation:ConfigType,https://docs.aws.amazon.com/ground-station/latest/APIReference/API_CreateConfig.html#groundstation-CreateConfig-response-configType,Filters access by the type of a config,String
1057,ssm:AutoApprove,https://docs.aws.amazon.com/systems-manager/latest/userguide/change-manager-auto-approval-access.html,Filters access by verifying that a user has permission to start Change Manager workflows without a review step (with the exception of change freeze events),Bool
1058,quicksight:UserName,https://docs.aws.amazon.com/quicksight/latest/user/iam-actions.html,Filters access by user name,String
1059,ssm:DocumentCategories,https://docs.aws.amazon.com/systems-manager/latest/userguide/auth-and-access-control-iam-access-control-identity-based.html#policy-conditions,Filters access by verifying that a user has permission to access a document belonging to a specific category enum,ArrayOfString
1060,ssm:DocumentType,https://docs.aws.amazon.com/systems-manager/latest/userguide/auth-and-access-control-iam-access-control-identity-based.html#policy-conditions,"Filters access by verifying that a user has permission to access a document belonging to a specific document type. Only available in ""aws"", ""aws-cn"", and ""aws-us-gov"" partitions",String
