condition_key_id,name,reference_url,description,type
481,ram:ResourceArn,https://docs.aws.amazon.com/ram/latest/userguide/iam-policies.html#iam-policies-condition,Filters access by  the specified ARN,ARN
482,ram:ResourceShareName,https://docs.aws.amazon.com/ram/latest/userguide/iam-policies.html#iam-policies-condition,Filters access by a resource share with the specified name,String
483,ebs:VolumeSize,https://docs.aws.amazon.com/IAM/latest/UserGuide/list_amazonelasticblockstore.html#amazonelasticblockstore-policy-keys,"Filters access by the size of the volume for the snapshot being created, in GiB",Numeric
484,ram:ResourceTag/${TagKey},https://docs.aws.amazon.com/IAM/latest/UserGuide/reference_policies_condition-keys.html#condition-keys-resourcetag,Filters access by the tags associated with the resource,String
485,ram:ShareOwnerAccountId,https://docs.aws.amazon.com/ram/latest/userguide/iam-policies.html#iam-policies-condition,"Filters access by resource shares owned by a specific account. For example, you can use this condition key to specify which resource share invitations can be accepted or rejected based on the resource share owner's account ID",String
486,rbin:Attribute/ResourceType,https://docs.aws.amazon.com/AWSEC2/latest/UserGuide/recycle-bin-perms.html#rbin-condition-keys,Filters access by the resource type of the existing rule,String
487,rbin:Request/ResourceType,https://docs.aws.amazon.com/AWSEC2/latest/UserGuide/recycle-bin-perms.html#rbin-condition-keys,Filters access by the resource type in a request,String
488,rds:BackupTarget,https://docs.aws.amazon.com/AmazonRDS/latest/UserGuide/security_iam_service-with-iam.html#UsingWithRDS.IAM.Conditions,"Filters access by the type of backup target. One of: region, outposts",String
489,rds:CopyOptionGroup,https://docs.aws.amazon.com/AmazonRDS/latest/UserGuide/security_iam_service-with-iam.html#UsingWithRDS.IAM.Conditions,Filters access by the value that specifies whether the CopyDBSnapshot action requires copying the DB option group,Bool
490,rds:DatabaseClass,https://docs.aws.amazon.com/AmazonRDS/latest/UserGuide/security_iam_service-with-iam.html#UsingWithRDS.IAM.Conditions,Filters access by the type of DB instance class,String
491,rds:DatabaseEngine,https://docs.aws.amazon.com/AmazonRDS/latest/UserGuide/security_iam_service-with-iam.html#UsingWithRDS.IAM.Conditions,Filters access by the database engine. For possible values refer to the engine parameter in CreateDBInstance API,String
492,ec2-instance-connect:MaxTunnelDuration,,,
493,ec2-instance-connect:maxTunnelDuration,https://docs.aws.amazon.com/AWSEC2/latest/UserGuide/permissions-for-ec2-instance-connect-endpoint.html#iam-OpenTunnel,Filters access by maximum session duration associated with the instance,Numeric
494,ec2-instance-connect:privateIpAddress,https://docs.aws.amazon.com/AWSEC2/latest/UserGuide/permissions-for-ec2-instance-connect-endpoint.html#iam-OpenTunnel,Filters access by private IP Address associated with the instance,IPAddress
495,ec2-instance-connect:remotePort,https://docs.aws.amazon.com/AWSEC2/latest/UserGuide/permissions-for-ec2-instance-connect-endpoint.html#iam-OpenTunnel,Filters access by port number associated with the instance,Numeric
496,ec2:AccepterVpc,https://docs.aws.amazon.com/vpc/latest/peering/security-iam.html,Filters access by the ARN of an accepter VPC in a VPC peering connection,ARN
497,rds:DatabaseName,https://docs.aws.amazon.com/AmazonRDS/latest/UserGuide/security_iam_service-with-iam.html#UsingWithRDS.IAM.Conditions,Filters access by the user-defined name of the database on the DB instance,String
498,ec2:Add/group,https://docs.aws.amazon.com/AWSEC2/latest/UserGuide/iam-policy-structure.html#amazon-ec2-keys,Filters access by the group being added to a snapshot,String
499,rds:EndpointType,https://docs.aws.amazon.com/AmazonRDS/latest/UserGuide/security_iam_service-with-iam.html#UsingWithRDS.IAM.Conditions,"Filters access by the type of the endpoint. One of: READER, WRITER, CUSTOM",String
500,rds:ManageMasterUserPassword,https://docs.aws.amazon.com/AmazonRDS/latest/UserGuide/security_iam_service-with-iam.html#UsingWithRDS.IAM.Conditions,Filters access by the value that specifies whether RDS manages master user password in AWS Secrets Manager for the DB instance or cluster,Bool
501,rds:MultiAz,https://docs.aws.amazon.com/AmazonRDS/latest/UserGuide/security_iam_service-with-iam.html#UsingWithRDS.IAM.Conditions,"Filters access by the value that specifies whether the DB instance runs in multiple Availability Zones. To indicate that the DB instance is using Multi-AZ, specify true",Bool
502,rds:Piops,https://docs.aws.amazon.com/AmazonRDS/latest/UserGuide/security_iam_service-with-iam.html#UsingWithRDS.IAM.Conditions,"Filters access by the value that contains the number of Provisioned IOPS (PIOPS) that the instance supports. To indicate a DB instance that does not have PIOPS enabled, specify 0",Numeric
503,rds:StorageEncrypted,https://docs.aws.amazon.com/AmazonRDS/latest/UserGuide/security_iam_service-with-iam.html#UsingWithRDS.IAM.Conditions,"Filters access by the value that specifies whether the DB instance storage should be encrypted. To enforce storage encryption, specify true",Bool
504,rds:StorageSize,https://docs.aws.amazon.com/AmazonRDS/latest/UserGuide/security_iam_service-with-iam.html#UsingWithRDS.IAM.Conditions,Filters access by the storage volume size (in GB),Numeric
505,rds:TenantDatabaseName,https://docs.aws.amazon.com/AmazonRDS/latest/UserGuide/security_iam_service-with-iam.html#UsingWithRDS.IAM.Conditions,Filters access by the tenant database name in CreateTenantDatabase and by the new tenant database name in ModifyTenantDatabase,String
506,ec2:Add/userId,https://docs.aws.amazon.com/AWSEC2/latest/UserGuide/iam-policy-structure.html#amazon-ec2-keys,Filters access by the account id being added to a snapshot,String
507,rds:Vpc,https://docs.aws.amazon.com/AmazonRDS/latest/UserGuide/security_iam_service-with-iam.html#UsingWithRDS.IAM.Conditions,"Filters access by the value that specifies whether the DB instance runs in an Amazon Virtual Private Cloud (Amazon VPC). To indicate that the DB instance runs in an Amazon VPC, specify true",Bool
508,rds:cluster-pg-tag/${TagKey},https://docs.aws.amazon.com/AmazonRDS/latest/UserGuide/security_iam_service-with-iam.html#UsingWithRDS.IAM.Conditions,Filters access by the tag attached to a DB cluster parameter group,String
509,rds:cluster-snapshot-tag/${TagKey},https://docs.aws.amazon.com/AmazonRDS/latest/UserGuide/security_iam_service-with-iam.html#UsingWithRDS.IAM.Conditions,Filters access by the tag attached to a DB cluster snapshot,String
510,ec2:AllocationId,https://docs.aws.amazon.com/AWSEC2/latest/UserGuide/iam-policy-structure.html#amazon-ec2-keys,Filters access by the allocation ID of the Elastic IP address,String
511,rds:cluster-tag/${TagKey},https://docs.aws.amazon.com/AmazonRDS/latest/UserGuide/security_iam_service-with-iam.html#UsingWithRDS.IAM.Conditions,Filters access by the tag attached to a DB cluster,String
512,rds:db-tag/${TagKey},https://docs.aws.amazon.com/AmazonRDS/latest/UserGuide/security_iam_service-with-iam.html#UsingWithRDS.IAM.Conditions,Filters access by the tag attached to a DB instance,String
513,rds:es-tag/${TagKey},https://docs.aws.amazon.com/AmazonRDS/latest/UserGuide/security_iam_service-with-iam.html#UsingWithRDS.IAM.Conditions,Filters access by the tag attached to an event subscription,String
514,rds:og-tag/${TagKey},https://docs.aws.amazon.com/AmazonRDS/latest/UserGuide/security_iam_service-with-iam.html#UsingWithRDS.IAM.Conditions,Filters access by the tag attached to a DB option group,String
515,rds:pg-tag/${TagKey},https://docs.aws.amazon.com/AmazonRDS/latest/UserGuide/security_iam_service-with-iam.html#UsingWithRDS.IAM.Conditions,Filters access by the tag attached to a DB parameter group,String
516,rds:req-tag/${TagKey},https://docs.aws.amazon.com/AmazonRDS/latest/UserGuide/security_iam_service-with-iam.html#UsingWithRDS.IAM.Conditions,Filters access by the set of tag keys and values that can be used to tag a resource,String
517,rds:ri-tag/${TagKey},https://docs.aws.amazon.com/AmazonRDS/latest/UserGuide/security_iam_service-with-iam.html#UsingWithRDS.IAM.Conditions,Filters access by the tag attached to a reserved DB instance,String
518,ec2:AssociatePublicIpAddress,https://docs.aws.amazon.com/AWSEC2/latest/UserGuide/iam-policy-structure.html#amazon-ec2-keys,Filters access by whether the user wants to associate a public IP address with the instance,Bool
519,rds:secgrp-tag/${TagKey},https://docs.aws.amazon.com/AmazonRDS/latest/UserGuide/security_iam_service-with-iam.html#UsingWithRDS.IAM.Conditions,Filters access by the tag attached to a DB security group,String
520,ec2:Attribute,https://docs.aws.amazon.com/AWSEC2/latest/UserGuide/iam-policies-for-amazon-ec2.html#attribute-key,Filters access by an attribute of a resource,String
521,rds:snapshot-tag/${TagKey},https://docs.aws.amazon.com/AmazonRDS/latest/UserGuide/security_iam_service-with-iam.html#UsingWithRDS.IAM.Conditions,Filters access by the tag attached to a DB snapshot,String
522,rds:subgrp-tag/${TagKey},https://docs.aws.amazon.com/AmazonRDS/latest/UserGuide/security_iam_service-with-iam.html#UsingWithRDS.IAM.Conditions,Filters access by the tag attached to a DB subnet group,String
523,redshift-data:glue-catalog-arn,https://docs.aws.amazon.com/redshift/latest/mgmt/redshift-iam-access-control-overview.html#redshift-policy-resources.conditions,Filters access by glue catalog arn,ARN
524,redshift-data:session-owner-iam-userid,https://docs.aws.amazon.com/redshift/latest/mgmt/redshift-iam-access-control-overview.html#redshift-policy-resources.conditions,Filters access by session owner iam userid,String
525,redshift-data:statement-owner-iam-userid,https://docs.aws.amazon.com/redshift/latest/mgmt/redshift-iam-access-control-overview.html#redshift-policy-resources.conditions,Filters access by statement owner iam userid,String
526,redshift-serverless:endpointAccessId,https://docs.aws.amazon.com/redshift/latest/mgmt/redshift-policy-resources.resource-permissions.html,Filters access by the endpoint access identifier,String
527,ec2:InstanceAutoRecovery,https://docs.aws.amazon.com/AWSEC2/latest/UserGuide/iam-policy-structure.html#amazon-ec2-keys,Filters access by whether the instance type supports auto recovery,String
528,redshift-serverless:managedWorkgroupName,https://docs.aws.amazon.com/redshift/latest/mgmt/redshift-policy-resources.resource-permissions.html,Filters access by the managed workgroup identifier,String
529,redshift-serverless:namespaceId,https://docs.aws.amazon.com/redshift/latest/mgmt/redshift-policy-resources.resource-permissions.html,Filters access by the namespace identifier,String
530,redshift-serverless:recoveryPointId,https://docs.aws.amazon.com/redshift/latest/mgmt/redshift-policy-resources.resource-permissions.html,Filters access by the recovery point identifier,String
531,redshift-serverless:snapshotId,https://docs.aws.amazon.com/redshift/latest/mgmt/redshift-policy-resources.resource-permissions.html,Filters access by the snapshot identifier,String
532,redshift-serverless:tableRestoreRequestId,https://docs.aws.amazon.com/redshift/latest/mgmt/redshift-policy-resources.resource-permissions.html,Filters access by the table restore request identifier,String
533,redshift-serverless:workgroupId,https://docs.aws.amazon.com/redshift/latest/mgmt/redshift-policy-resources.resource-permissions.html,Filters access by the workgroup identifier,String
534,ec2:Attribute/${AttributeName},https://docs.aws.amazon.com/AWSEC2/latest/UserGuide/iam-policies-for-amazon-ec2.html#attribute-key,Filters access by an attribute being set on a resource,String
535,redshift:AllowWrites,https://docs.aws.amazon.com/redshift/latest/mgmt/redshift-iam-access-control-overview.html#redshift-policy-resources.conditions,Filters access by the allowWrites input parameter,Bool
536,redshift:ConsumerArn,https://docs.aws.amazon.com/redshift/latest/mgmt/redshift-iam-access-control-overview.html#redshift-policy-resources.conditions,Filters access by the datashare consumer arn,ARN
537,redshift:ConsumerIdentifier,https://docs.aws.amazon.com/redshift/latest/mgmt/redshift-iam-access-control-overview.html#redshift-policy-resources.conditions,Filters access by the datashare consumer,String
538,redshift:DbName,https://docs.aws.amazon.com/redshift/latest/mgmt/redshift-iam-access-control-overview.html#redshift-policy-resources.conditions,Filters access by the database name,String
539,ec2:AuthenticationType,https://docs.aws.amazon.com/vpn/latest/s2svpn/vpn-authentication-access-control.html,Filters access by the authentication type for the VPN tunnel endpoints,String
540,ec2:AuthorizedService,https://docs.aws.amazon.com/AWSEC2/latest/UserGuide/iam-policy-structure.html#amazon-ec2-keys,Filters access by the AWS service that has permission to use a resource,String
541,ec2:AuthorizedUser,https://docs.aws.amazon.com/AWSEC2/latest/UserGuide/iam-policy-structure.html#amazon-ec2-keys,Filters access by an IAM principal that has permission to use a resource,String
542,ec2:AutoPlacement,https://docs.aws.amazon.com/AWSEC2/latest/UserGuide/iam-policy-structure.html#amazon-ec2-keys,Filters access by the Auto Placement properties of a Dedicated Host,String
543,ec2:AvailabilityZone,https://docs.aws.amazon.com/AWSEC2/latest/UserGuide/iam-policy-structure.html#amazon-ec2-keys,Filters access by the name of an Availability Zone in an AWS Region,String
544,redshift:DbUser,https://docs.aws.amazon.com/redshift/latest/mgmt/redshift-iam-access-control-overview.html#redshift-policy-resources.conditions,Filters access by the database user name,String
545,redshift:DurationSeconds,https://docs.aws.amazon.com/redshift/latest/mgmt/redshift-iam-access-control-overview.html#redshift-policy-resources.conditions,Filters access by the number of seconds until a temporary credential set expires,String
546,redshift:InboundIntegrationArn,https://docs.aws.amazon.com/redshift/latest/mgmt/redshift-iam-access-control-overview.html#redshift-policy-resources.conditions,Filters access by the ARN of an inbound zero-ETL Integration resource,ARN
547,redshift:IntegrationSourceArn,https://docs.aws.amazon.com/redshift/latest/mgmt/redshift-iam-access-control-overview.html#redshift-policy-resources.conditions,Filters access by the ARN of a zero-ETL Integration source,ARN
548,redshift:IntegrationTargetArn,https://docs.aws.amazon.com/redshift/latest/mgmt/redshift-iam-access-control-overview.html#redshift-policy-resources.conditions,Filters access by the ARN of a zero-ETL Integration target,ARN
549,refactor-spaces:ApplicationCreatedByAccount,https://docs.aws.amazon.com/migrationhub-refactor-spaces/latest/userguide/security_iam_service-with-iam.html#security_iam_service-with-iam-id-based-policies-conditionkeys,Filters access by restricting the action to only those accounts that created the application within an environment,String
550,refactor-spaces:CreatedByAccountIds,https://docs.aws.amazon.com/migrationhub-refactor-spaces/latest/userguide/security_iam_service-with-iam.html#security_iam_service-with-iam-id-based-policies-conditionkeys,Filters access by the accounts that created the resource,ArrayOfString
551,refactor-spaces:RouteCreatedByAccount,https://docs.aws.amazon.com/migrationhub-refactor-spaces/latest/userguide/security_iam_service-with-iam.html#security_iam_service-with-iam-id-based-policies-conditionkeys,Filters access by restricting the action to only those accounts that created the route within an application,String
552,refactor-spaces:ServiceCreatedByAccount,https://docs.aws.amazon.com/migrationhub-refactor-spaces/latest/userguide/security_iam_service-with-iam.html#security_iam_service-with-iam-id-based-policies-conditionkeys,Filters access by restricting the action to only those accounts that created the service within an application,String
553,refactor-spaces:SourcePath,https://docs.aws.amazon.com/migrationhub-refactor-spaces/latest/userguide/security_iam_service-with-iam.html#security_iam_service-with-iam-id-based-policies-conditionkeys,Filters access by the path of the route,String
554,resource-explorer-2:Operation,https://docs.aws.amazon.com/service-authorization/latest/reference/list_awsresourceexplorer.html,"Filters access by the actual operation that is being invoked, available values: Search, ListResources",String
555,route53-recovery-cluster:AllowSafetyRulesOverrides,https://docs.aws.amazon.com/routing-control/latest/APIReference/API_UpdateRoutingControlState.html,Override safety rules to allow routing control state updates,Bool
556,route53:ChangeResourceRecordSetsActions,https://docs.aws.amazon.com/Route53/latest/DeveloperGuide/specifying-conditions-route53.html#route53_rrsetConditionKeys,"Filters access by the change actions, CREATE, UPSERT, or DELETE, in a ChangeResourceRecordSets request",ArrayOfString
557,route53:ChangeResourceRecordSetsNormalizedRecordNames,https://docs.aws.amazon.com/Route53/latest/DeveloperGuide/specifying-conditions-route53.html#route53_rrsetConditionKeys,Filters access by the normalized DNS record names in a ChangeResourceRecordSets request,ArrayOfString
558,route53:ChangeResourceRecordSetsRecordTypes,https://docs.aws.amazon.com/Route53/latest/DeveloperGuide/specifying-conditions-route53.html#route53_rrsetConditionKeys,Filters access by the DNS record types in a ChangeResourceRecordSets request,ArrayOfString
559,route53:VPCs,https://docs.aws.amazon.com/Route53/latest/DeveloperGuide/specifying-conditions-route53.html#route53_rrsetConditionKeys,Filters access by VPCs in request,ArrayOfString
560,s3-object-lambda:TlsVersion,https://docs.aws.amazon.com/AmazonS3/latest/API/bucket-policy-s3-sigv4-conditions.html,Filters access by the TLS version used by the client,Numeric
561,s3-object-lambda:authType,https://docs.aws.amazon.com/AmazonS3/latest/API/bucket-policy-s3-sigv4-conditions.html,Filters access by authentication method,String
562,s3-object-lambda:signatureAge,https://docs.aws.amazon.com/AmazonS3/latest/API/bucket-policy-s3-sigv4-conditions.html,Filters access by the age in milliseconds of the request signature,Numeric
563,s3-object-lambda:versionid,https://docs.aws.amazon.com/AmazonS3/latest/dev/amazon-s3-policy-keys.html/#getobjectversion-limit-access-to-specific-version-3,Filters access by a specific object version,String
564,s3-outposts:AccessPointNetworkOrigin,https://docs.aws.amazon.com/AmazonS3/latest/userguide/creating-access-points.html#access-points-policies,Filters access by the network origin (Internet or VPC),String
565,s3-outposts:DataAccessPointAccount,https://docs.aws.amazon.com/AmazonS3/latest/userguide/creating-access-points.html#access-points-policies,Filters access by the AWS Account ID that owns the access point,String
566,s3-outposts:DataAccessPointArn,"",Filters access by an access point Amazon Resource Name (ARN),ARN
567,s3-outposts:ExistingObjectTag/<key>,https://docs.aws.amazon.com/AmazonS3/latest/userguide/object-tagging.html#tagging-and-policies,Filters access by requiring that an existing object tag has a specific tag key and value,String
568,s3-outposts:RequestObjectTag/<key>,https://docs.aws.amazon.com/AmazonS3/latest/userguide/object-tagging.html#tagging-and-policies,Filters access by restricting the tag keys and values allowed on objects,String
569,s3-outposts:RequestObjectTagKeys,https://docs.aws.amazon.com/AmazonS3/latest/userguide/object-tagging.html#tagging-and-policies,Filters access by restricting the tag keys allowed on objects,String
570,s3-outposts:authType,https://docs.aws.amazon.com/AmazonS3/latest/API/bucket-policy-s3-sigv4-conditions.html,Filters access by restricting incoming requests to a specific authentication method,String
571,s3-outposts:delimiter,https://docs.aws.amazon.com/AmazonS3/latest/userguide/walkthrough1.html,Filters access by requiring the delimiter parameter,String
572,s3-outposts:max-keys,https://docs.aws.amazon.com/AmazonS3/latest/userguide/amazon-s3-policy-keys.html#example-numeric-condition-operators,Filters access by limiting the maximum number of keys returned in a ListBucket request,Numeric
573,s3-outposts:prefix,https://docs.aws.amazon.com/AmazonS3/latest/userguide/amazon-s3-policy-keys.html#condition-key-bucket-ops-2,Filters access by key name prefix,String
574,s3-outposts:signatureAge,https://docs.aws.amazon.com/AmazonS3/latest/API/bucket-policy-s3-sigv4-conditions.html,"Filters access by identifying the length of time, in milliseconds, that a signature is valid in an authenticated request",Numeric
575,s3-outposts:signatureversion,https://docs.aws.amazon.com/AmazonS3/latest/API/bucket-policy-s3-sigv4-conditions.html,Filters access by identifying the version of AWS Signature that is supported for authenticated requests,String
576,s3-outposts:versionid,https://docs.aws.amazon.com/AmazonS3/latest/userguide/amazon-s3-policy-keys.html#getobjectversion-limit-access-to-specific-version-3,Filters access by a specific object version,String
577,s3-outposts:x-amz-acl,https://docs.aws.amazon.com/AmazonS3/latest/userguide/acl-overview.html#permissions,Filters access by requiring the x-amz-acl header with a specific canned ACL in a request,String
578,s3-outposts:x-amz-content-sha256,https://docs.aws.amazon.com/AmazonS3/latest/API/bucket-policy-s3-sigv4-conditions.html,Filters access by disallowing unsigned content in your bucket,String
579,s3-outposts:x-amz-copy-source,https://docs.aws.amazon.com/AmazonS3/latest/userguide/amazon-s3-policy-keys.html#putobject-limit-copy-source-3,"Filters access by restricting the copy source to a specific bucket, prefix, or object",String
580,s3-outposts:x-amz-metadata-directive,https://docs.aws.amazon.com/AmazonS3/latest/API/API_CopyObject.html,Filters access by enabling enforcement of object metadata behavior (COPY or REPLACE) when objects are copied,String
581,s3-outposts:x-amz-server-side-encryption,https://docs.aws.amazon.com/AmazonS3/latest/userguide/UsingServerSideEncryption.html,Filters access by requiring server-side encryption,String
582,s3-outposts:x-amz-storage-class,https://docs.aws.amazon.com/AmazonS3/latest/userguide/storage-class-intro.html#sc-howtoset,Filters access by storage class,String
583,s3:AccessGrantsInstanceArn,https://docs.aws.amazon.com/IAM/latest/UserGuide/access-grants-instance.html,Filters access by access grants instance ARN,ARN
584,s3:AccessPointNetworkOrigin,https://docs.aws.amazon.com/AmazonS3/latest/userguide/creating-access-points.html#access-points-policies,Filters access by the network origin (Internet or VPC),String
585,s3:DataAccessPointAccount,https://docs.aws.amazon.com/AmazonS3/latest/userguide/creating-access-points.html#access-points-policies,Filters access by the AWS Account ID that owns the access point,String
586,s3:DataAccessPointArn,https://docs.aws.amazon.com/AmazonS3/latest/userguide/creating-access-points.html#access-points-policies,Filters access by an access point Amazon Resource Name (ARN),ARN
587,s3:ExistingJobOperation,https://docs.aws.amazon.com/AmazonS3/latest/userguide/batch-ops-job-tags-examples.html,Filters access by operation to updating the job priority,String
588,s3:ExistingJobPriority,https://docs.aws.amazon.com/AmazonS3/latest/userguide/batch-ops-job-tags-examples.html,Filters access by priority range to cancelling existing jobs,Numeric
589,s3:ExistingObjectTag/<key>,https://docs.aws.amazon.com/AmazonS3/latest/userguide/object-tagging.html#tagging-and-policies,Filters access by existing object tag key and value,String
590,s3:InventoryAccessibleOptionalFields,https://docs.aws.amazon.com/AmazonS3/latest/userguide/example-bucket-policies.html#example-bucket-policies-s3-inventory-2,Filters access by restricting which optional metadata fields a user can add when configuring S3 Inventory reports,ArrayOfString
591,s3:JobSuspendedCause,https://docs.aws.amazon.com/AmazonS3/latest/userguide/batch-ops-job-tags-examples.html,"Filters access by a specific job suspended cause (for example, AWAITING_CONFIRMATION) to cancelling suspended jobs",String
592,s3:ObjectCreationOperation,https://docs.aws.amazon.com/AmazonS3/latest/userguide/conditional-writes-enforce.html,Filters access by whether or not the operation creates an object,Bool
593,s3:RequestJobOperation,https://docs.aws.amazon.com/AmazonS3/latest/userguide/batch-ops-job-tags-examples.html,Filters access by operation to creating jobs,String
594,s3:RequestJobPriority,https://docs.aws.amazon.com/AmazonS3/latest/userguide/batch-ops-job-tags-examples.html,Filters access by priority range to creating new jobs,Numeric
595,s3:RequestObjectTag/<key>,https://docs.aws.amazon.com/AmazonS3/latest/userguide/object-tagging.html#tagging-and-policies,Filters access by the tag keys and values to be added to objects,String
596,s3:RequestObjectTagKeys,https://docs.aws.amazon.com/AmazonS3/latest/userguide/object-tagging.html#tagging-and-policies,Filters access by the tag keys to be added to objects,ArrayOfString
597,s3:ResourceAccount,https://docs.aws.amazon.com/AmazonS3/latest/userguide/amazon-s3-policy-keys.html#example-object-resource-account,Filters access by the resource owner AWS account ID,String
598,s3:TlsVersion,https://docs.aws.amazon.com/AmazonS3/latest/userguide/amazon-s3-policy-keys.html#example-object-tls-version,Filters access by the TLS version used by the client,Numeric
599,s3:authType,https://docs.aws.amazon.com/AmazonS3/latest/API/bucket-policy-s3-sigv4-conditions.html,Filters access by authentication method,String
600,s3:delimiter,https://docs.aws.amazon.com/AmazonS3/latest/userguide/walkthrough1.html,Filters access by delimiter parameter,String
601,s3:destinationRegion,https://docs.aws.amazon.com/AmazonS3/latest/userguide/replication.html,Filters access by a specific replication destination region for targeted buckets of the AWS FIS action aws:s3:bucket-pause-replication,String
