condition_key_id,name,reference_url,description,type
1,a4b:amazonId,https://docs.aws.amazon.com/a4b/latest/APIReference/API_RegisterAVSDevice.html,Filters actions based on the Amazon Id in the request,String
2,a4b:filters_deviceType,https://docs.aws.amazon.com/a4b/latest/APIReference/API_SearchDevices.html,Filters actions based on the device type in the request,ArrayOfString
3,account:AccountResourceOrgPaths,https://docs.aws.amazon.com/accounts/latest/reference/security_iam_service-with-iam.html#security_iam_service-with-iam-id-based-policies-conditionkeys,Filters access by the resource path for an account in an organization,ArrayOfString
4,account:AccountResourceOrgTags/${TagKey},https://docs.aws.amazon.com/accounts/latest/reference/security_iam_service-with-iam.html#security_iam_service-with-iam-id-based-policies-conditionkeys,Filters access by resource tags for an account in an organization,String
5,account:AlternateContactTypes,https://docs.aws.amazon.com/accounts/latest/reference/security_iam_service-with-iam.html#security_iam_service-with-iam-id-based-policies-conditionkeys,Filters access by alternate contact types,ArrayOfString
6,account:EmailTargetDomain,https://docs.aws.amazon.com/accounts/latest/reference/security_iam_service-with-iam.html#security_iam_service-with-iam-id-based-policies-conditionkeys,Filters access by email domain of the target email address,String
7,account:TargetRegion,https://docs.aws.amazon.com/accounts/latest/reference/security_iam_service-with-iam.html#security_iam_service-with-iam-id-based-policies-conditionkeys,Filters access by a list of Regions. Enables or disables all the Regions specified here,String
8,accounts.google.com:aud,https://docs.aws.amazon.com/IAM/latest/UserGuide/reference_policies_iam-condition-keys.html#ck_aud,Filters access by the Google application ID,String
9,accounts.google.com:oaud,https://docs.aws.amazon.com/IAM/latest/UserGuide/reference_policies_iam-condition-keys.html#ck_oaud,Filters access by the Google audience,String
10,accounts.google.com:sub,https://docs.aws.amazon.com/IAM/latest/UserGuide/reference_policies_iam-condition-keys.html#ck_sub,Filters access by the subject of the claim (the Google user ID),String
11,acm-pca:TemplateArn,https://docs.aws.amazon.com/privateca/latest/userguide/UsingTemplates.html#template-varieties,Filters access by the arn of the certificate template used in Issue Certificate request,ARN
12,acm:CertificateAuthority,https://docs.aws.amazon.com/acm/latest/userguide/security-iam.html,Filters access by certificateAuthority in the request. Can be used to restrict which Certificate Authorites certificates can be issued from,String
13,acm:CertificateTransparencyLogging,https://docs.aws.amazon.com/acm/latest/userguide/security-iam.html,Filters access by certificateTransparencyLogging option in the request. Default 'ENABLED' if no key is present in the request,String
14,acm:DomainNames,https://docs.aws.amazon.com/acm/latest/userguide/security-iam.html,Filters access by domainNames in the request. This key can be used to restrict which domains can be in certificate requests,ArrayOfString
15,acm:Export,https://docs.aws.amazon.com/acm/latest/userguide/security-iam.html,Filters access by the export option in the request. Can be used to restrict creation of certificates that can be exported,String
16,acm:KeyAlgorithm,https://docs.aws.amazon.com/acm/latest/userguide/security-iam.html,Filters access by keyAlgorithm in the request,String
17,acm:ValidationMethod,https://docs.aws.amazon.com/acm/latest/userguide/security-iam.html,Filters access by validationMethod in the request. Default 'EMAIL' if no key is present in the request,String
18,aidevops:AgentSpaceResourceAgentSpaceId,https://docs.aws.amazon.com/devopsagent/latest/userguide/,Filters access by unique identifier for an AgentSpace,String
19,aidevops:AssociationResourceAgentSpaceId,https://docs.aws.amazon.com/devopsagent/latest/userguide/,Filters access by unique identifier for an AgentSpace,String
20,aidevops:AssociationResourceAssociationId,https://docs.aws.amazon.com/devopsagent/latest/userguide/,Filters access by unique identifier for a service association within an AgentSpace,String
21,aidevops:ServiceResourceServiceId,https://docs.aws.amazon.com/devopsagent/latest/userguide/,Filters access by unique identifier for a registered service,String
22,amplifyuibuilder:CodegenJobResourceAppId,https://docs.aws.amazon.com/amplify/latest/APIReference/API_App.html,Filters access by the app ID,String
23,amplifyuibuilder:CodegenJobResourceEnvironmentName,https://docs.aws.amazon.com/amplify/latest/APIReference/API_BackendEnvironment.html,Filters access by the backend environment name,String
24,amplifyuibuilder:CodegenJobResourceId,https://docs.aws.amazon.com/amplifyuibuilder/latest/APIReference/API_CodegenJob.html,Filters access by the codegen job ID,String
25,amplifyuibuilder:ComponentResourceAppId,https://docs.aws.amazon.com/amplify/latest/APIReference/API_App.html,Filters access by the app ID,String
26,amplifyuibuilder:ComponentResourceEnvironmentName,https://docs.aws.amazon.com/amplify/latest/APIReference/API_BackendEnvironment.html,Filters access by the backend environment name,String
27,amplifyuibuilder:ComponentResourceId,https://docs.aws.amazon.com/amplifyuibuilder/latest/APIReference/API_Component.html,Filters access by the component ID,String
28,amplifyuibuilder:FormResourceAppId,https://docs.aws.amazon.com/amplify/latest/APIReference/API_App.html,Filters access by the app ID,String
29,amplifyuibuilder:FormResourceEnvironmentName,https://docs.aws.amazon.com/amplify/latest/APIReference/API_BackendEnvironment.html,Filters access by the backend environment name,String
30,amplifyuibuilder:FormResourceId,https://docs.aws.amazon.com/amplifyuibuilder/latest/APIReference/API_Form.html,Filters access by the form ID,String
31,amplifyuibuilder:ThemeResourceAppId,https://docs.aws.amazon.com/amplify/latest/APIReference/API_App.html,Filters access by the app ID,String
32,amplifyuibuilder:ThemeResourceEnvironmentName,https://docs.aws.amazon.com/amplify/latest/APIReference/API_BackendEnvironment.html,Filters access by the backend environment name,String
33,amplifyuibuilder:ThemeResourceId,https://docs.aws.amazon.com/amplifyuibuilder/latest/APIReference/API_Theme.html,Filters access by the theme ID,String
34,aoss:CollectionId,https://docs.aws.amazon.com/opensearch-service/latest/developerguide/security-iam-serverless.html#security_iam_serverless-conditionkeys,Filters access by the identifier of the collection,String
35,aoss:collection,https://docs.aws.amazon.com/opensearch-service/latest/developerguide/security-iam-serverless.html#security_iam_serverless-conditionkeys,Filters access by the collection name,String
36,aoss:collection-group,https://docs.aws.amazon.com/opensearch-service/latest/developerguide/security-iam-serverless.html#security_iam_serverless-conditionkeys,Filters access by the collection group name,String
37,aoss:index,https://docs.aws.amazon.com/opensearch-service/latest/developerguide/security-iam-serverless.html#security_iam_serverless-conditionkeys,Filters access by the index,String
38,apigateway:Request/AccessAssociationSource,https://docs.aws.amazon.com/apigateway/latest/developerguide/security_iam_service-with-iam.html,Filters access by access association source. Available during the CreateDomainNameAccessAssociation operation,String
39,apigateway:Request/AccessLoggingDestination,https://docs.aws.amazon.com/apigateway/latest/developerguide/security_iam_service-with-iam.html,Filters access by access log destination. Available during the CreateStage and UpdateStage operations,String
40,apigateway:Request/AccessLoggingFormat,https://docs.aws.amazon.com/apigateway/latest/developerguide/security_iam_service-with-iam.html,Filters access by access log format. Available during the CreateStage and UpdateStage operations,String
41,apigateway:Request/ApiKeyRequired,https://docs.aws.amazon.com/apigateway/latest/developerguide/security_iam_service-with-iam.html,Filters access by the requirement of API. Available during the CreateRoute and UpdateRoute operations. Also available as a collection during import and reimport,ArrayOfBool
42,apigateway:Request/ApiName,https://docs.aws.amazon.com/apigateway/latest/developerguide/security_iam_service-with-iam.html,Filters access by API name. Available during the CreateApi and UpdateApi operations,String
43,apigateway:Request/AuthorizerType,https://docs.aws.amazon.com/apigateway/latest/developerguide/security_iam_service-with-iam.html,"Filters access by type of authorizer in the request, for example REQUEST or JWT. Available during CreateAuthorizer and UpdateAuthorizer. Also available during import and reimport as an ArrayOfString",ArrayOfString
44,apigateway:Request/AuthorizerUri,https://docs.aws.amazon.com/apigateway/latest/developerguide/security_iam_service-with-iam.html,Filters access by URI of a Lambda authorizer function. Available during CreateAuthorizer and UpdateAuthorizer. Also available during import and reimport as an ArrayOfString,ArrayOfString
45,apigateway:Request/CognitoUserPoolArn,https://docs.aws.amazon.com/apigateway/latest/developerguide/security_iam_service-with-iam.html,Filters access by a Portal's CognitoUserPoolArn that is passed in the request,ARN
46,apigateway:Request/ConditionBasePaths,https://docs.aws.amazon.com/apigateway/latest/developerguide/security_iam_id-based-policy-examples.html#security_iam_id-based-policy-examples-routing-mode,Filters access by base paths defined on the condition of a routing rule. Available during the CreateRoutingRule and UpdateRoutingRule operations,ArrayOfString
47,apigateway:Request/DisableExecuteApiEndpoint,https://docs.aws.amazon.com/apigateway/latest/developerguide/security_iam_service-with-iam.html,Filters access by status of the default execute-api endpoint. Available during the CreateApi and UpdateApi operations,Bool
48,apigateway:Request/DomainNameArn,https://docs.aws.amazon.com/apigateway/latest/developerguide/security_iam_service-with-iam.html,Filters access by domain name ARN. Available during the CreateDomainNameAccessAssociation operation,ARN
49,apigateway:Request/EndpointType,https://docs.aws.amazon.com/apigateway/latest/developerguide/security_iam_service-with-iam.html,"Filters access by endpoint type. Available during the CreateDomainName, UpdateDomainName, CreateApi, and UpdateApi operations",ArrayOfString
50,apigateway:Request/Method,https://docs.aws.amazon.com/apigateway/latest/developerguide/security_iam_service-with-iam.html,Filters access by a ProductRestEndpointPage's HTTP Method that is passed in the request,String
51,apigateway:Request/MtlsTrustStoreUri,https://docs.aws.amazon.com/apigateway/latest/developerguide/security_iam_service-with-iam.html,Filters access by URI of the truststore used for mutual TLS authentication. Available during the CreateDomainName and UpdateDomainName operations,String
52,apigateway:Request/MtlsTrustStoreVersion,https://docs.aws.amazon.com/apigateway/latest/developerguide/security_iam_service-with-iam.html,Filters access by version of the truststore used for mutual TLS authentication. Available during the CreateDomainName and UpdateDomainName operations,String
53,apigateway:Request/PortalDisplayName,https://docs.aws.amazon.com/apigateway/latest/developerguide/security_iam_service-with-iam.html,Filters access by a Portal's Display Name that is passed in the request,String
54,apigateway:Request/PortalDomainName,https://docs.aws.amazon.com/apigateway/latest/developerguide/security_iam_service-with-iam.html,Filters access by a Portal's vanity domain name that is passed in the request,String
55,apigateway:Request/PortalProductDisplayName,https://docs.aws.amazon.com/apigateway/latest/developerguide/security_iam_service-with-iam.html,Filters access by a PortalProduct's Display Name that is passed in the request,String
56,apigateway:Request/Priority,https://docs.aws.amazon.com/apigateway/latest/developerguide/security_iam_id-based-policy-examples.html#security_iam_id-based-policy-examples-routing-mode,Filters access by priority of the routing rule. Available during the CreateRoutingRule and UpdateRoutingRule operations,Numeric
57,apigateway:Request/ProductPageTitle,https://docs.aws.amazon.com/apigateway/latest/developerguide/security_iam_service-with-iam.html,Filters access by a ProductPage's Title that is passed in the request,String
58,apigateway:Request/ProductRestEndpointPageEndpointPrefix,https://docs.aws.amazon.com/apigateway/latest/developerguide/security_iam_service-with-iam.html,Filters access by a ProductRestEndpointPage's EndpointPrefix that is passed in the request,String
59,apigateway:Request/RestApiId,https://docs.aws.amazon.com/apigateway/latest/developerguide/security_iam_service-with-iam.html,Filters access by a ProductRestEndpointPage's Amazon API Gateway API ID that is passed in the request,String
60,apigateway:Request/RouteAuthorizationType,https://docs.aws.amazon.com/apigateway/latest/developerguide/security_iam_service-with-iam.html,"Filters access by authorization type, for example NONE, AWS_IAM, CUSTOM, JWT, COGNITO_USER_POOLS. Available during the CreateMethod and PutMethod operations Also available as a collection during import",ArrayOfString
61,apigateway:Request/RoutingMode,https://docs.aws.amazon.com/apigateway/latest/developerguide/security_iam_id-based-policy-examples.html#security_iam_id-based-policy-examples-routing-mode,Filters access by routing mode of the domain name. Available during the CreateDomainName and UpdateDomainName operations,String
62,apigateway:Request/SecurityPolicy,https://docs.aws.amazon.com/apigateway/latest/developerguide/security_iam_service-with-iam.html,Filters access by TLS version. Available during the CreateDomain and UpdateDomain operations,ArrayOfString
63,apigateway:Request/Stage,https://docs.aws.amazon.com/apigateway/latest/developerguide/security_iam_service-with-iam.html,Filters access by a ProductRestEndpointPage's Amazon API Gateway Stage Name that is passed in the request,String
64,apigateway:Request/StageName,https://docs.aws.amazon.com/apigateway/latest/developerguide/security_iam_service-with-iam.html,Filters access by stage name of the deployment that you attempt to create. Available during the CreateDeployment operation,String
65,apigateway:Resource/AccessLoggingDestination,https://docs.aws.amazon.com/apigateway/latest/developerguide/security_iam_service-with-iam.html,Filters access by access log destination of the current Stage resource. Available during the UpdateStage and DeleteStage operations,String
66,apigateway:Resource/AccessLoggingFormat,https://docs.aws.amazon.com/apigateway/latest/developerguide/security_iam_service-with-iam.html,Filters access by access log format of the current Stage resource. Available during the UpdateStage and DeleteStage operations,String
67,apigateway:Resource/ApiKeyRequired,https://docs.aws.amazon.com/apigateway/latest/developerguide/security_iam_service-with-iam.html,Filters access by the requirement of API key for the existing Route resource. Available during the UpdateRoute and DeleteRoute operations. Also available as a collection during reimport,ArrayOfBool
68,apigateway:Resource/ApiName,https://docs.aws.amazon.com/apigateway/latest/developerguide/security_iam_service-with-iam.html,Filters access by API name of the existing RestApi resource. Available during UpdateRestApi and DeleteRestApi operations,String
69,apigateway:Resource/AuthorizerType,https://docs.aws.amazon.com/apigateway/latest/developerguide/security_iam_service-with-iam.html,"Filters access by the current type of authorizer, for example REQUEST or JWT. Available during UpdateAuthorizer and DeleteAuthorizer operations. Also available during import and reimport as an ArrayOfString",ArrayOfString
70,apigateway:Resource/AuthorizerUri,https://docs.aws.amazon.com/apigateway/latest/developerguide/security_iam_service-with-iam.html,Filters access by the URI of the current Lambda authorizer associated with the current API. Available during UpdateAuthorizer and DeleteAuthorizer. Also available as a collection during reimport,ArrayOfString
71,apigateway:Resource/CognitoUserPoolArn,https://docs.aws.amazon.com/apigateway/latest/developerguide/security_iam_service-with-iam.html,Filters access by a Portal's CognitoUserPoolArn associated with the resource,ARN
72,apigateway:Resource/ConditionBasePaths,https://docs.aws.amazon.com/apigateway/latest/developerguide/security_iam_id-based-policy-examples.html#security_iam_id-based-policy-examples-routing-mode,Filters access by base paths defined on the condition of the existing routing rule. Available during the UpdateRoutingRule and DeleteRoutingRule operations,ArrayOfString
73,apigateway:Resource/DisableExecuteApiEndpoint,https://docs.aws.amazon.com/apigateway/latest/developerguide/security_iam_service-with-iam.html,Filters access by status of the default execute-api endpoint of the current RestApi resource. Available during UpdateRestApi and DeleteRestApi operations,Bool
74,apigateway:Resource/EndpointType,https://docs.aws.amazon.com/apigateway/latest/developerguide/security_iam_service-with-iam.html,"Filters access by endpoint type. Available during the UpdateDomainName, DeleteDomainName, UpdateApi, and DeleteApi operations",ArrayOfString
75,apigateway:Resource/Method,https://docs.aws.amazon.com/apigateway/latest/developerguide/security_iam_service-with-iam.html,Filters access by a ProductRestEndpointPage's HTTP Method associated with the resource,String
76,apigateway:Resource/MtlsTrustStoreUri,https://docs.aws.amazon.com/apigateway/latest/developerguide/security_iam_service-with-iam.html,Filters access by URI of the truststore used for mutual TLS authentication. Available during UpdateDomainName and DeleteDomainName operations,String
77,apigateway:Resource/MtlsTrustStoreVersion,https://docs.aws.amazon.com/apigateway/latest/developerguide/security_iam_service-with-iam.html,Filters access by version of the truststore used for mutual TLS authentication. Available during UpdateDomainName and DeleteDomainName operations,String
78,apigateway:Resource/PortalDisplayName,https://docs.aws.amazon.com/apigateway/latest/developerguide/security_iam_service-with-iam.html,Filters access by a Portal's Display Name associated with the resource,String
79,apigateway:Resource/PortalDomainName,https://docs.aws.amazon.com/apigateway/latest/developerguide/security_iam_service-with-iam.html,Filters access by a Portal's vanity domain name associated with the resource,String
80,apigateway:Resource/PortalProductDisplayName,https://docs.aws.amazon.com/apigateway/latest/developerguide/security_iam_service-with-iam.html,Filters access by a PortalProduct's Display Name associated with the resource,String
81,apigateway:Resource/PortalPublishStatus,https://docs.aws.amazon.com/apigateway/latest/developerguide/security_iam_service-with-iam.html,Filters access by a Portal's published status associated with the resource,String
82,apigateway:Resource/Priority,https://docs.aws.amazon.com/apigateway/latest/developerguide/security_iam_id-based-policy-examples.html#security_iam_id-based-policy-examples-routing-mode,Filters access by priority of the existing routing rule. Available during the UpdateRoutingRule and DeleteRoutingRule operations,Numeric
83,apigateway:Resource/ProductPageTitle,https://docs.aws.amazon.com/apigateway/latest/developerguide/security_iam_service-with-iam.html,Filters access by a ProductPage's Title associated with the resource,String
84,apigateway:Resource/ProductRestEndpointPageEndpointPrefix,https://docs.aws.amazon.com/apigateway/latest/developerguide/security_iam_service-with-iam.html,Filters access by a ProductRestEndpointPage's EndpointPrefix associated with the resource,String
85,apigateway:Resource/RestApiId,https://docs.aws.amazon.com/apigateway/latest/developerguide/security_iam_service-with-iam.html,Filters access by a ProductRestEndpointPage's Amazon API Gateway API ID associated with the resource,String
86,apigateway:Resource/RouteAuthorizationType,https://docs.aws.amazon.com/apigateway/latest/developerguide/security_iam_service-with-iam.html,"Filters access by authorization type of the existing Method resource, for example NONE, AWS_IAM, CUSTOM, JWT, COGNITO_USER_POOLS. Available during the PutMethod and DeleteMethod operations. Also available as a collection during reimport",ArrayOfString
87,apigateway:Resource/RoutingMode,https://docs.aws.amazon.com/apigateway/latest/developerguide/security_iam_id-based-policy-examples.html#security_iam_id-based-policy-examples-routing-mode,Filters access by routing mode of the domain name. Available during the UpdateDomainName and DeleteDomainName operations,String
88,apigateway:Resource/SecurityPolicy,https://docs.aws.amazon.com/apigateway/latest/developerguide/security_iam_service-with-iam.html,Filters access by TLS version. Available during UpdateDomain and DeleteDomain operations,ArrayOfString
89,apigateway:Resource/Stage,https://docs.aws.amazon.com/apigateway/latest/developerguide/security_iam_service-with-iam.html,Filters access by a ProductRestEndpointPage's Amazon API Gateway Stage Name associated with the resource,String
90,application-autoscaling:scalable-dimension,https://docs.aws.amazon.com/autoscaling/application/userguide/security_iam_service-with-iam.html#security_iam_service-with-iam-id-based-policies-conditionkeys,Filters access by the scalable dimension that is passed in the request,String
91,application-autoscaling:service-namespace,https://docs.aws.amazon.com/autoscaling/application/userguide/security_iam_service-with-iam.html#security_iam_service-with-iam-id-based-policies-conditionkeys,Filters access by the service namespace that is passed in the request,String
92,apprunner:AutoScalingConfigurationArn,${UserGuideDocPage}security_iam_service-with-iam.html#security_iam_service-with-iam-resource-based-policies,Filters access by the CreateService and UpdateService actions based on the ARN of an associated AutoScalingConfiguration resource,ARN
93,apprunner:ConnectionArn,${UserGuideDocPage}security_iam_service-with-iam.html#security_iam_service-with-iam-resource-based-policies,Filters access by the CreateService and UpdateService actions based on the ARN of an associated Connection resource,ARN
94,apprunner:ObservabilityConfigurationArn,${UserGuideDocPage}security_iam_service-with-iam.html#security_iam_service-with-iam-resource-based-policies,Filters access by the CreateService and UpdateService actions based on the ARN of an associated ObservabilityConfiguration resource,ARN
95,s3:InventoryAccessibleOptionalFields,https://docs.aws.amazon.com/AmazonS3/latest/userguide/example-bucket-policies.html#example-bucket-policies-s3-inventory-2,Filters access by restricting which optional metadata fields a user can add when configuring S3 Inventory reports,ArrayOfString
96,s3:JobSuspendedCause,https://docs.aws.amazon.com/AmazonS3/latest/userguide/batch-ops-job-tags-examples.html,"Filters access by a specific job suspended cause (for example, AWAITING_CONFIRMATION) to cancelling suspended jobs",String
97,apprunner:ServiceArn,${UserGuideDocPage}security_iam_service-with-iam.html#security_iam_service-with-iam-resource-based-policies,Filters access by the CreateVpcIngressConnection action based on the ARN of an associated Service resource,ARN
98,apprunner:VpcConnectorArn,${UserGuideDocPage}security_iam_service-with-iam.html#security_iam_service-with-iam-resource-based-policies,Filters access by the CreateService and UpdateService actions based on the ARN of an associated VpcConnector resource,ARN
99,iam:AssociatedResourceArn,https://docs.aws.amazon.com/IAM/latest/UserGuide/reference_policies_iam-condition-keys.html#ck_AssociatedResourceArn,Filters access by the resource that the role will be used on behalf of,ARN
100,iam:DelegationDuration,https://docs.aws.amazon.com/IAM/latest/UserGuide/reference_policies_iam-condition-keys.html#ck_DelegationDuration,Filters access based on the requested delegation duration,String
101,iam:DelegationRequestOwner,https://docs.aws.amazon.com/IAM/latest/UserGuide/reference_policies_iam-condition-keys.html#ck_DelegationRequestOwner,Filters access based on the delegation request owner,ARN
102,iam:FIDO-FIPS-140-2-certification,https://docs.aws.amazon.com/IAM/latest/UserGuide/reference_policies_iam-condition-keys.html#ck_FIDO-FIPS-140-2-certification,Filters access by the MFA device FIPS-140-2 validation certification level at the time of registration of a FIDO security key,String
103,iam:FIDO-FIPS-140-3-certification,https://docs.aws.amazon.com/IAM/latest/UserGuide/reference_policies_iam-condition-keys.html#ck_FIDO-FIPS-140-3-certification,Filters access by the MFA device FIPS-140-3 validation certification level at the time of registration of a FIDO security key,String
104,iam:FIDO-certification,https://docs.aws.amazon.com/IAM/latest/UserGuide/reference_policies_iam-condition-keys.html#ck_FIDO-certification,Filters access by the MFA device FIDO certification level at the time of registration of a FIDO security key,String
105,iam:NotificationChannel,https://docs.aws.amazon.com/IAM/latest/UserGuide/reference_policies_iam-condition-keys.html#ck_NotificationChannel,Filters access based on the requested notification channel,String
106,iam:OrganizationsPolicyId,https://docs.aws.amazon.com/IAM/latest/UserGuide/reference_policies_iam-condition-keys.html#ck_OrganizationsPolicyId,Filters access by the ID of an AWS Organizations policy,String
107,iam:PassedToService,https://docs.aws.amazon.com/IAM/latest/UserGuide/reference_policies_iam-condition-keys.html#ck_PassedToService,Filters access by the AWS service to which this role is passed,String
