condition_key_id,name,reference_url,description,type
696,cloudwatch:requestInsightRuleLogGroups,https://docs.aws.amazon.com/AmazonCloudWatch/latest/monitoring/iam-cw-condition-keys-contributor.html,Filters actions based on the Log Groups specified in an Insight Rule,ArrayOfString
697,cloudwatch:requestManagedResourceARNs,https://docs.aws.amazon.com/AmazonCloudWatch/latest/monitoring/iam-cw-condition-keys-contributor.html,Filters access by the Resource ARNs specified in a managed Insight Rule,ArrayOfARN
698,codebuild:buildArn,https://docs.aws.amazon.com/codebuild/latest/userguide/auth-and-access-control-permissions-reference.html,Filters access by the ARN of the AWS CodeBuild build from which the request originated,ARN
699,codebuild:projectArn,https://docs.aws.amazon.com/codebuild/latest/userguide/auth-and-access-control-permissions-reference.html,Filters access by the ARN of the AWS CodeBuild project from which the request originated,ARN
700,codecommit:References,https://docs.aws.amazon.com/codecommit/latest/userguide/how-to-conditional-branch.html,Filters access by Git reference to specified AWS CodeCommit actions,String
701,codeconnections:Branch,https://docs.aws.amazon.com/dtconsole/latest/userguide/security-iam.html#permissions-reference-connections-handshake,Filters access by the branch name that is passed in the request,String
702,codeconnections:BranchName,https://docs.aws.amazon.com/dtconsole/latest/userguide/security-iam.html#permissions-reference-connections-use,Filters access by the branch name that is passed in the request. Applies only to UseConnection requests for access to a specific repository branch,String
703,codeconnections:FullRepositoryId,https://docs.aws.amazon.com/dtconsole/latest/userguide/security-iam.html#permissions-reference-connections-use,Filters access by the repository that is passed in the request. Applies only to UseConnection requests for access to a specific repository,String
704,codeconnections:HostArn,https://docs.aws.amazon.com/dtconsole/latest/userguide/security-iam.html#permissions-reference-connections-hosts,Filters access by the host resource associated with the connection used in the request,ARN
705,codeconnections:InstallationId,https://docs.aws.amazon.com/dtconsole/latest/userguide/security-iam.html#permissions-reference-connections-handshake,Filters access by the third-party ID (such as the Bitbucket App installation ID for CodeConnections) that is used to update a Connection. Allows you to restrict which third-party App installations can be used to make a Connection,String
706,codeconnections:OwnerId,https://docs.aws.amazon.com/dtconsole/latest/userguide/security-iam.html#permissions-reference-connections-use,Filters access by the owner of the third-party repository. Applies only to UseConnection requests for access to repositories owned by a specific user,String
707,codeconnections:PassedToService,https://docs.aws.amazon.com/dtconsole/latest/userguide/security-iam.html#permissions-reference-connections-passconnection,Filters access by the service to which the principal is allowed to pass a Connection or RepositoryLink,String
708,codeconnections:ProviderAction,https://docs.aws.amazon.com/dtconsole/latest/userguide/security-iam.html#permissions-reference-connections-access,Filters access by the provider action in a UseConnection request such as ListRepositories. See documentation for all valid values,String
709,codeconnections:ProviderPermissionsRequired,https://docs.aws.amazon.com/dtconsole/latest/userguide/security-iam.html#permissions-reference-connections-use,Filters access by the write permissions of a provider action in a UseConnection request. Valid types include read_only and read_write,String
710,codeconnections:ProviderType,https://docs.aws.amazon.com/dtconsole/latest/userguide/security-iam.html#permissions-reference-connections-managing,Filters access by the type of third-party provider passed in the request,String
711,codeconnections:ProviderTypeFilter,https://docs.aws.amazon.com/dtconsole/latest/userguide/security-iam.html#permissions-reference-connections-managing,Filters access by the type of third-party provider used to filter results,String
712,codeconnections:RepositoryName,https://docs.aws.amazon.com/dtconsole/latest/userguide/security-iam.html#permissions-reference-connections-use,Filters access by the repository name that is passed in the request. Applies only to UseConnection requests for access to repositories owned by a specific user,String
713,codeconnections:VpcId,https://docs.aws.amazon.com/dtconsole/latest/userguide/security-iam.html#permissions-reference-connections-hosts,Filters access by the VpcId passed in the request,String
714,codestar-connections:Branch,https://docs.aws.amazon.com/dtconsole/latest/userguide/security-iam.html#permissions-reference-connections-handshake,Filters access by the branch name that is passed in the request,String
715,codestar-connections:BranchName,https://docs.aws.amazon.com/dtconsole/latest/userguide/security-iam.html#permissions-reference-connections-use,Filters access by the branch name that is passed in the request. Applies only to UseConnection requests for access to a specific repository branch,String
716,codestar-connections:FullRepositoryId,https://docs.aws.amazon.com/dtconsole/latest/userguide/security-iam.html#permissions-reference-connections-use,Filters access by the repository that is passed in the request. Applies only to UseConnection requests for access to a specific repository,String
717,codestar-connections:HostArn,https://docs.aws.amazon.com/dtconsole/latest/userguide/security-iam.html#permissions-reference-connections-hosts,Filters access by the host resource associated with the connection used in the request,ARN
718,codestar-connections:InstallationId,https://docs.aws.amazon.com/dtconsole/latest/userguide/security-iam.html#permissions-reference-connections-handshake,Filters access by the third-party ID (such as the Bitbucket App installation ID for CodeStar Connections) that is used to update a Connection. Allows you to restrict which third-party App installations can be used to make a Connection,String
719,codestar-connections:OwnerId,https://docs.aws.amazon.com/dtconsole/latest/userguide/security-iam.html#permissions-reference-connections-use,Filters access by the owner of the third-party repository. Applies only to UseConnection requests for access to repositories owned by a specific user,String
720,codestar-connections:PassedToService,https://docs.aws.amazon.com/dtconsole/latest/userguide/security-iam.html#permissions-reference-connections-passconnection,Filters access by the service to which the principal is allowed to pass a Connection or RepositoryLink,String
721,codestar-connections:ProviderAction,https://docs.aws.amazon.com/dtconsole/latest/userguide/security-iam.html#permissions-reference-connections-access,Filters access by the provider action in a UseConnection request such as ListRepositories. See documentation for all valid values,String
722,codestar-connections:ProviderPermissionsRequired,https://docs.aws.amazon.com/dtconsole/latest/userguide/security-iam.html#permissions-reference-connections-use,Filters access by the write permissions of a provider action in a UseConnection request. Valid types include read_only and read_write,String
723,codestar-connections:ProviderType,https://docs.aws.amazon.com/dtconsole/latest/userguide/security-iam.html#permissions-reference-connections-managing,Filters access by the type of third-party provider passed in the request,String
724,codestar-connections:ProviderTypeFilter,https://docs.aws.amazon.com/dtconsole/latest/userguide/security-iam.html#permissions-reference-connections-managing,Filters access by the type of third-party provider used to filter results,String
725,codestar-connections:RepositoryName,https://docs.aws.amazon.com/dtconsole/latest/userguide/security-iam.html#permissions-reference-connections-use,Filters access by the repository name that is passed in the request. Applies only to UseConnection requests for access to repositories owned by a specific user,String
726,codestar-connections:VpcId,https://docs.aws.amazon.com/dtconsole/latest/userguide/security-iam.html#permissions-reference-connections-hosts,Filters access by the VpcId passed in the request,String
727,codestar-notifications:NotificationsForResource,https://docs.aws.amazon.com/codestar-notifications/latest/userguide/security_iam_id-based-policy-examples.html,Filters access based on the ARN of the resource for which notifications are configured,ARN
728,cognito-identity.amazonaws.com:amr,https://docs.aws.amazon.com/IAM/latest/UserGuide/reference_policies_iam-condition-keys.html#ck_amr,Filters access by the login information for Amazon Cognito,String
729,cognito-identity.amazonaws.com:aud,https://docs.aws.amazon.com/IAM/latest/UserGuide/reference_policies_iam-condition-keys.html#ck_aud,Filters access by the Amazon Cognito identity pool ID,String
730,cognito-identity.amazonaws.com:sub,https://docs.aws.amazon.com/IAM/latest/UserGuide/reference_policies_iam-condition-keys.html#ck_sub,Filters access by the subject of the claim (the Amazon Cognito user ID),String
731,comprehend:DataLakeKmsKey,https://docs.aws.amazon.com/IAM/latest/UserGuide/list_amazoncomprehend.html#amazoncomprehend-policy-keys,Filters access by the DataLake Kms Key associated with the flywheel resource in the request,ARN
732,comprehend:FlywheelIterationId,https://docs.aws.amazon.com/IAM/latest/UserGuide/list_amazoncomprehend.html#amazoncomprehend-policy-keys,Filters access by particular Iteration Id for a flywheel,String
733,comprehend:ModelKmsKey,https://docs.aws.amazon.com/IAM/latest/UserGuide/list_amazoncomprehend.html#amazoncomprehend-policy-keys,Filters access by the model KMS key associated with the resource in the request,ARN
734,comprehend:OutputKmsKey,https://docs.aws.amazon.com/IAM/latest/UserGuide/list_amazoncomprehend.html#amazoncomprehend-policy-keys,Filters access by the output KMS key associated with the resource in the request,ARN
735,comprehend:VolumeKmsKey,https://docs.aws.amazon.com/IAM/latest/UserGuide/list_amazoncomprehend.html#amazoncomprehend-policy-keys,Filters access by the volume KMS key associated with the resource in the request,ARN
736,comprehend:VpcSecurityGroupIds,https://docs.aws.amazon.com/IAM/latest/UserGuide/list_amazoncomprehend.html#amazoncomprehend-policy-keys,Filters access by the list of all VPC security group ids associated with the resource in the request,ArrayOfString
737,comprehend:VpcSubnets,https://docs.aws.amazon.com/IAM/latest/UserGuide/list_amazoncomprehend.html#amazoncomprehend-policy-keys,Filters access by the list of all VPC subnets associated with the resource in the request,ArrayOfString
738,compute-optimizer:ResourceType,https://docs.aws.amazon.com/compute-optimizer/latest/ug/security-iam.html,Filters access by the resource type,String
739,config:ConfigurationRecorderServicePrincipal,https://docs.aws.amazon.com/config/latest/developerguide/security_iam_service-with-iam.html#security_iam_service-with-iam-id-based-policies-conditionkeys,Filters access by service principal of the configuration recorder,String
740,connect:AssignmentType,https://docs.aws.amazon.com/connect/latest/adminguide/security_iam_service-with-iam.html,Filters access by restricting access to create contacts based on Assignment Type,String
741,connect:AttributeType,https://docs.aws.amazon.com/connect/latest/adminguide/security_iam_service-with-iam.html,Filters access by the attribute type of the Amazon Connect instance,String
742,connect:Channel,https://docs.aws.amazon.com/connect/latest/adminguide/security_iam_service-with-iam.html,Filters access by Channel,String
743,connect:ContactAssociationId,https://docs.aws.amazon.com/connect/latest/adminguide/security_iam_service-with-iam.html,Filters access by ContactAssociationId,String
744,connect:ContactInitiationMethod,https://docs.aws.amazon.com/connect/latest/adminguide/security_iam_service-with-iam.html,Filters access by restricting access to create contacts based on the initiation method of the contact,String
745,connect:FlowType,https://docs.aws.amazon.com/connect/latest/adminguide/security_iam_service-with-iam.html,Filters access by Flow type,ArrayOfString
746,connect:InstanceId,https://docs.aws.amazon.com/connect/latest/adminguide/security_iam_service-with-iam.html,Filters access by restricting federation into specified Amazon Connect instances,String
747,connect:MonitorCapabilities,https://docs.aws.amazon.com/connect/latest/adminguide/security_iam_service-with-iam.html,Filters access by restricting the monitor capabilities of the user in the request,ArrayOfString
748,connect:SearchContactsByContactAnalysis,https://docs.aws.amazon.com/connect/latest/adminguide/security_iam_service-with-iam.html,Filters access by restricting searches using analysis outputs from Amazon Connect Contact Lens,ArrayOfString
749,connect:SearchTag/${TagKey},https://docs.aws.amazon.com/connect/latest/adminguide/security_iam_service-with-iam.html,Filters access by TagFilter condition passed in the search request,String
750,connect:StorageResourceType,https://docs.aws.amazon.com/connect/latest/adminguide/security_iam_service-with-iam.html,Filters access by restricting the storage resource type of the Amazon Connect instance storage configuration,String
751,connect:Subtype,https://docs.aws.amazon.com/connect/latest/adminguide/security_iam_service-with-iam.html,Filters access by restricting creation of a contact for specific subtypes,String
752,connect:UserArn,https://docs.aws.amazon.com/connect/latest/APIReference/API_User.html,Filters access by UserArn,ARN
753,dataexchange:JobType,https://docs.aws.amazon.com/data-exchange/latest/userguide/access-control.html,Filters access by the specified job type,String
754,datapipeline:PipelineCreator,https://docs.aws.amazon.com/datapipeline/latest/DeveloperGuide/dp-example-tag-policies.html#ex3,Filters access by the IAM user that created the pipeline,ArrayOfString
755,datapipeline:Tag/${TagKey},https://docs.aws.amazon.com/datapipeline/latest/DeveloperGuide/dp-iam-resourcebased-access.html#dp-control-access-tags,Filters access by customer-specified key/value pair that can be attached to a resource,String
756,datapipeline:workerGroup,https://docs.aws.amazon.com/datapipeline/latest/DeveloperGuide/dp-iam-resourcebased-access.html#dp-control-access-workergroup,Filters access by the name of a worker group for which a Task Runner retrieves work,ArrayOfString
757,datazone:domainId,https://docs.aws.amazon.com/IAM/latest/UserGuide/reference_policies_condition-keys.html#amazondatazone-policy-keys,Filters access by the domain ID passed in the request,String
758,datazone:projectId,https://docs.aws.amazon.com/IAM/latest/UserGuide/reference_policies_condition-keys.html#amazondatazone-policy-keys,Filters access by the project ID passed in the request,String
759,datazone:userId,https://docs.aws.amazon.com/IAM/latest/UserGuide/reference_policies_condition-keys.html#amazondatazone-policy-keys,Filters access by the user ID passed in the request,String
760,dax:EnclosingOperation,https://docs.aws.amazon.com/amazondynamodb/latest/developerguide/DAX.access-control.htmlspecifying-conditions.html#FGAC_DDB.ConditionKeys,Used to block Transactions APIs calls and allow the non-Transaction APIs calls and vice-versa,String
761,deadline:AssociatedMembershipLevel,https://docs.aws.amazon.com/deadline-cloud/latest/userguide/security-iam-service-with-iam.html,Filters access by the associated membership level of the principal provided in the request,String
762,deadline:CalledAction,https://docs.aws.amazon.com/deadline-cloud/latest/userguide/security-iam-service-with-iam.html,Filters access by the allowed action in the request,String
763,deadline:FarmMembershipLevels,https://docs.aws.amazon.com/deadline-cloud/latest/userguide/security-iam-service-with-iam.html,Filters access by membership levels on the farm,ArrayOfString
764,deadline:FleetMembershipLevels,https://docs.aws.amazon.com/deadline-cloud/latest/userguide/security-iam-service-with-iam.html,Filters access by membership levels on the fleet,ArrayOfString
765,deadline:JobMembershipLevels,https://docs.aws.amazon.com/deadline-cloud/latest/userguide/security-iam-service-with-iam.html,Filters access by membership levels on the job,ArrayOfString
766,deadline:MembershipLevel,https://docs.aws.amazon.com/deadline-cloud/latest/userguide/security-iam-service-with-iam.html,Filters access by the membership level passed in the request,String
767,deadline:PrincipalId,https://docs.aws.amazon.com/deadline-cloud/latest/userguide/security-iam-service-with-iam.html,Filters access by the principle ID provided in the request,String
768,deadline:QueueMembershipLevels,https://docs.aws.amazon.com/deadline-cloud/latest/userguide/security-iam-service-with-iam.html,Filters access by membership levels on the queue,ArrayOfString
769,deadline:RequesterPrincipalId,https://docs.aws.amazon.com/deadline-cloud/latest/userguide/security-iam-service-with-iam.html,Filters access by the user calling the Deadline Cloud API,String
770,deepracer:MultiUser,https://docs.aws.amazon.com/deepracer/latest/developerguide/reference_policies_iam-condition-keys.html#condition-keys-multiuser,Filters access by multiuser flag,Bool
771,deepracer:UserToken,https://docs.aws.amazon.com/deepracer/latest/developerguide/reference_policies_iam-condition-keys.html#condition-keys-usertoken,Filters access by user token in the request,String
772,devops-guru:ServiceNames,https://docs.aws.amazon.com/devops-guru/latest/APIReference/API_ServiceCollection.html,Filters access by API to restrict access to given AWS service names,ArrayOfString
773,dms:assessment-run-tag/${TagKey},https://docs.aws.amazon.com/service-authorization/latest/reference/list_awsdatabasemigrationservice.html#awsdatabasemigrationservice-dms_assessment-run-tag___TagKey_,Filters access by the presence of tag key-value pairs in the request for AssessmentRun,String
774,dms:cert-tag/${TagKey},https://docs.aws.amazon.com/service-authorization/latest/reference/list_awsdatabasemigrationservice.html#awsdatabasemigrationservice--dms_cert-tag___TagKey_,Filters access by the presence of tag key-value pairs in the request for Certificate,String
775,dms:data-migration-tag/${TagKey},https://docs.aws.amazon.com/service-authorization/latest/reference/list_awsdatabasemigrationservice.html#awsdatabasemigrationservice--dms_data-migration-tag___TagKey_,Filters access by the presence of tag key-value pairs in the request for DataMigration,String
776,dms:data-provider-tag/${TagKey},https://docs.aws.amazon.com/service-authorization/latest/reference/list_awsdatabasemigrationservice.html#awsdatabasemigrationservice--dms_dp-tag___TagKey_,Filters access by the presence of tag key-value pairs in the request for DataProvider,String
777,dms:endpoint-tag/${TagKey},https://docs.aws.amazon.com/service-authorization/latest/reference/list_awsdatabasemigrationservice.html#awsdatabasemigrationservice-dms_endpoint-tag___TagKey_,Filters access by the presence of tag key-value pairs in the request for Endpoint,String
778,dms:es-tag/${TagKey},https://docs.aws.amazon.com/service-authorization/latest/reference/list_awsdatabasemigrationservice.html#awsdatabasemigrationservice-dms_es-tag___TagKey_,Filters access by the presence of tag key-value pairs in the request for EventSubscription,String
779,dms:individual-assessment-tag/${TagKey},https://docs.aws.amazon.com/service-authorization/latest/reference/list_awsdatabasemigrationservice.html#awsdatabasemigrationservice-dms_individual-assessment-tag___TagKey_,Filters access by the presence of tag key-value pairs in the request for IndividualAssessment,String
780,dms:instance-profile-tag/${TagKey},https://docs.aws.amazon.com/service-authorization/latest/reference/list_awsdatabasemigrationservice.html#awsdatabasemigrationservice--dms_ip-tag___TagKey_,Filters access by the presence of tag key-value pairs in the request for InstanceProfile,String
781,dms:migration-project-tag/${TagKey},https://docs.aws.amazon.com/service-authorization/latest/reference/list_awsdatabasemigrationservice.html#awsdatabasemigrationservice--dms_mp-tag___TagKey_,Filters access by the presence of tag key-value pairs in the request for MigrationProject,String
782,dms:rep-tag/${TagKey},https://docs.aws.amazon.com/service-authorization/latest/reference/list_awsdatabasemigrationservice.html#awsdatabasemigrationservice-dms_rep-tag___TagKey_,Filters access by the presence of tag key-value pairs in the request for ReplicationInstance,String
783,dms:replication-config-tag/${TagKey},https://docs.aws.amazon.com/service-authorization/latest/reference/list_awsdatabasemigrationservice.html#awsdatabasemigrationservice-dms_replication-config-tag___TagKey_,Filters access by the presence of tag key-value pairs in the request for ReplicationConfig,String
784,dms:req-tag/${TagKey},https://docs.aws.amazon.com/service-authorization/latest/reference/list_awsdatabasemigrationservice.html#awsdatabasemigrationservice-dms_req-tag___TagKey_,Filters access by the presence of tag key-value pairs in the given request,String
785,dms:subgrp-tag/${TagKey},https://docs.aws.amazon.com/service-authorization/latest/reference/list_awsdatabasemigrationservice.html#awsdatabasemigrationservice-dms_subgrp-tag___TagKey_,Filters access by the presence of tag key-value pairs in the request for ReplicationSubnetGroup,String
786,dms:task-tag/${TagKey},https://docs.aws.amazon.com/service-authorization/latest/reference/list_awsdatabasemigrationservice.html#awsdatabasemigrationservice-dms_task-tag___TagKey_,Filters access by the presence of tag key-value pairs in the request for ReplicationTask,String
787,drs:CreateAction,https://docs.aws.amazon.com/drs/latest/userguide/supported-iam-actions-tagging.html,Filters access by the name of a resource-creating API action,String
788,drs:EC2InstanceARN,https://docs.aws.amazon.com/drs/latest/userguide/security_iam_authentication.html,Filters access by the EC2 instance the request originated from,ARN
789,ds-data:Identifier,https://docs.aws.amazon.com/directoryservice/latest/admin-guide/iam_dsdata-condition-keys.html#dsdata_condition-Identifier,Filters access by the type of identifier provided in the request (i.e. SAM Account Name),String
790,ds-data:MemberName,https://docs.aws.amazon.com/directoryservice/latest/admin-guide/iam_dsdata-condition-keys.html#dsdata_condition-MemberName,Filters access by the directory SAM Account Name included in the MemberName input of the request,String
791,ds-data:MemberRealm,https://docs.aws.amazon.com/directoryservice/latest/admin-guide/iam_dsdata-condition-keys.html#dsdata_condition-MemberRealm,Filters access by the directory realm name included in the MemberRealm input of the request,String
792,ds-data:Realm,https://docs.aws.amazon.com/directoryservice/latest/admin-guide/iam_dsdata-condition-keys.html#dsdata_condition-Realm,Filters access by the directory realm name for the request,String
793,ds-data:SAMAccountName,https://docs.aws.amazon.com/directoryservice/latest/admin-guide/iam_dsdata-condition-keys.html#dsdata_condition-SAMAccountName,Filters access by the directory SAM Account Name included in the SAMAccountName input of the request,String
794,dsql:WitnessRegion,https://docs.aws.amazon.com/aurora-dsql/latest/userguide/using-iam-condition-keys.html#witness-region,Filters access by the witness region of linked clusters,ArrayOfString
795,dynamodb:Attributes,,,
796,dynamodb:EnclosingOperation,,,
797,dynamodb:FullTableScan,,,
798,dynamodb:LeadingKeys,,,
799,dynamodb:ReturnConsumedCapacity,,,
800,dynamodb:ReturnValues,,,
801,dynamodb:Select,,,
802,ebs:Description,https://docs.aws.amazon.com/IAM/latest/UserGuide/list_amazonelasticblockstore.html#amazonelasticblockstore-policy-keys,Filters access by the description of the snapshot being created,String
803,ebs:ParentSnapshot,https://docs.aws.amazon.com/IAM/latest/UserGuide/list_amazonelasticblockstore.html#amazonelasticblockstore-policy-keys,Filters access by the ID of the parent snapshot,String
804,ebs:VolumeSize,https://docs.aws.amazon.com/IAM/latest/UserGuide/list_amazonelasticblockstore.html#amazonelasticblockstore-policy-keys,"Filters access by the size of the volume for the snapshot being created, in GiB",Numeric
805,ec2-instance-connect:MaxTunnelDuration,,,
806,ec2-instance-connect:maxTunnelDuration,https://docs.aws.amazon.com/AWSEC2/latest/UserGuide/permissions-for-ec2-instance-connect-endpoint.html#iam-OpenTunnel,Filters access by maximum session duration associated with the instance,Numeric
807,ec2-instance-connect:privateIpAddress,https://docs.aws.amazon.com/AWSEC2/latest/UserGuide/permissions-for-ec2-instance-connect-endpoint.html#iam-OpenTunnel,Filters access by private IP Address associated with the instance,IPAddress
808,ec2-instance-connect:remotePort,https://docs.aws.amazon.com/AWSEC2/latest/UserGuide/permissions-for-ec2-instance-connect-endpoint.html#iam-OpenTunnel,Filters access by port number associated with the instance,Numeric
809,ec2:AccepterVpc,https://docs.aws.amazon.com/vpc/latest/peering/security-iam.html,Filters access by the ARN of an accepter VPC in a VPC peering connection,ARN
810,ec2:Add/group,https://docs.aws.amazon.com/AWSEC2/latest/UserGuide/iam-policy-structure.html#amazon-ec2-keys,Filters access by the group being added to a snapshot,String
811,ec2:Add/userId,https://docs.aws.amazon.com/AWSEC2/latest/UserGuide/iam-policy-structure.html#amazon-ec2-keys,Filters access by the account id being added to a snapshot,String
812,ec2:AllocationId,https://docs.aws.amazon.com/AWSEC2/latest/UserGuide/iam-policy-structure.html#amazon-ec2-keys,Filters access by the allocation ID of the Elastic IP address,String
