condition_key_id,name,reference_url,description,type
817,swf:name,https://docs.aws.amazon.com/amazonswf/latest/developerguide/swf-dev-iam.html##swf-dev-iam.api,Filters access by the name of activities or workflows,String
818,swf:tagFilter.tag,https://docs.aws.amazon.com/amazonswf/latest/developerguide/swf-dev-iam.html##swf-dev-iam.api,Filters access by the value of tagFilter.tag,String
819,swf:tagList.member.0,https://docs.aws.amazon.com/amazonswf/latest/developerguide/swf-dev-iam.html##swf-dev-iam.api,Filters access by the specified tag,String
820,swf:tagList.member.1,https://docs.aws.amazon.com/amazonswf/latest/developerguide/swf-dev-iam.html##swf-dev-iam.api,Filters access by the specified tag,String
821,swf:tagList.member.2,https://docs.aws.amazon.com/amazonswf/latest/developerguide/swf-dev-iam.html##swf-dev-iam.api,Filters access by the specified tag,String
822,swf:tagList.member.3,https://docs.aws.amazon.com/amazonswf/latest/developerguide/swf-dev-iam.html##swf-dev-iam.api,Filters access by the specified tag,String
823,swf:tagList.member.4,https://docs.aws.amazon.com/amazonswf/latest/developerguide/swf-dev-iam.html##swf-dev-iam.api,Filters access by the specified tag,String
824,swf:taskList.name,https://docs.aws.amazon.com/amazonswf/latest/developerguide/swf-dev-iam.html##swf-dev-iam.api,Filters access by the name of the tasklist,String
825,swf:typeFilter.name,https://docs.aws.amazon.com/amazonswf/latest/developerguide/swf-dev-iam.html##swf-dev-iam.api,Filters access by the name of the type filter,String
826,swf:typeFilter.version,https://docs.aws.amazon.com/amazonswf/latest/developerguide/swf-dev-iam.html##swf-dev-iam.api,Filters access by the version of the type filter,String
827,swf:version,https://docs.aws.amazon.com/amazonswf/latest/developerguide/swf-dev-iam.html##swf-dev-iam.api,Filters access by the version of activities or workflows,String
828,swf:workflowType.name,https://docs.aws.amazon.com/amazonswf/latest/developerguide/swf-dev-iam.html##swf-dev-iam.api,Filters access by the name of the workflow type,String
829,swf:workflowType.version,https://docs.aws.amazon.com/amazonswf/latest/developerguide/swf-dev-iam.html##swf-dev-iam.api,Filters access by the version of the workflow type,String
830,synthetics:Names,https://docs.aws.amazon.com/AmazonCloudWatch/latest/monitoring/CloudWatch_Synthetics_Canaries_Restricted.html,Filters access based on the name of the canary,ArrayOfString
831,transcribe:OutputBucketName,https://docs.aws.amazon.com/IAM/latest/UserGuide/list_amazontranscribe.html#amazontranscribe-policy-keys,Filters access based on the output bucket name included in the request,String
832,transcribe:OutputEncryptionKMSKeyId,https://docs.aws.amazon.com/IAM/latest/UserGuide/list_amazontranscribe.html#amazontranscribe-policy-keys,Filters access based on the KMS key id included in the request,String
833,transcribe:OutputKey,https://docs.aws.amazon.com/IAM/latest/UserGuide/list_amazontranscribe.html#amazontranscribe-policy-keys,Filters access based on the output key included in the request,String
834,transcribe:OutputLocation,https://docs.aws.amazon.com/IAM/latest/UserGuide/list_amazontranscribe.html#amazontranscribe-policy-keys,Filters access based on the output location included in the request,String
835,user-subscriptions:CreateForSelf,https://docs.aws.amazon.com/amazonq/latest/qdeveloper-ug/security-iam-service-with-iam.html#security_iam_service-with-iam-id-based-policies-conditionkeys,Filters access by only allowing creation of User subscription Claims for the caller,Bool
836,vpc-lattice-svcs:Port,https://docs.aws.amazon.com/vpc-lattice/latest/ug/auth-policies.html#auth-policies-condition-keys,Filters access by the destination port the request is made to,Numeric
837,vpc-lattice-svcs:RequestHeader/${HeaderName},https://docs.aws.amazon.com/vpc-lattice/latest/ug/auth-policies.html#auth-policies-condition-keys,Filters access by a header name-value pair in the request headers,String
838,vpc-lattice-svcs:RequestMethod,https://docs.aws.amazon.com/vpc-lattice/latest/ug/auth-policies.html#auth-policies-condition-keys,Filters access by the method of the request,String
839,vpc-lattice-svcs:RequestQueryString/${QueryStringKey},https://docs.aws.amazon.com/vpc-lattice/latest/ug/auth-policies.html#auth-policies-condition-keys,Filters access by the query string key-value pairs in the request URL,ArrayOfString
840,vpc-lattice-svcs:ServiceArn,https://docs.aws.amazon.com/vpc-lattice/latest/ug/auth-policies.html#auth-policies-condition-keys,Filters access by the ARN of the service receiving the request,ARN
841,vpc-lattice-svcs:ServiceNetworkArn,https://docs.aws.amazon.com/vpc-lattice/latest/ug/auth-policies.html#auth-policies-condition-keys,Filters access by the ARN of the service network receiving the request,ARN
842,vpc-lattice-svcs:SourceVpc,https://docs.aws.amazon.com/vpc-lattice/latest/ug/auth-policies.html#auth-policies-condition-keys,Filters access by the VPC the request is made from,String
843,vpc-lattice-svcs:SourceVpcOwnerAccount,https://docs.aws.amazon.com/vpc-lattice/latest/ug/auth-policies.html#auth-policies-condition-keys,Filters access by the owning account of the VPC the request is made from,String
844,vpc-lattice:AuthType,https://docs.aws.amazon.com/vpc-lattice/latest/ug/,Filters access by the auth type specified in the request,String
845,vpc-lattice:Protocol,https://docs.aws.amazon.com/vpc-lattice/latest/ug/,Filters access by the protocol specified in the request,String
846,vpc-lattice:ResourceConfigurationArn,https://docs.aws.amazon.com/vpc-lattice/latest/ug/,Filters access by the ARN of a resource configuration,ARN
847,vpc-lattice:SecurityGroupIds,https://docs.aws.amazon.com/vpc-lattice/latest/ug/,Filters access by the IDs of security groups,ArrayOfString
848,vpc-lattice:ServiceArn,https://docs.aws.amazon.com/vpc-lattice/latest/ug/,Filters access by the ARN of a service,ARN
849,vpc-lattice:ServiceNetworkArn,https://docs.aws.amazon.com/vpc-lattice/latest/ug/,Filters access by the ARN of a service network,ARN
850,vpc-lattice:TargetGroupArns,https://docs.aws.amazon.com/vpc-lattice/latest/ug/,Filters access by the ARNs of target groups,ArrayOfARN
851,vpc-lattice:VpcEndpointId,https://docs.aws.amazon.com/vpc-lattice/latest/ug/,Filters access by the ID of a VPC endpoint,String
852,vpc-lattice:VpcId,https://docs.aws.amazon.com/vpc-lattice/latest/ug/,Filters access by the ID of a virtual private cloud (VPC),String
853,wafv2:LogDestinationResource,https://docs.aws.amazon.com/waf/latest/developerguide/security_iam_service-with-iam.html#security_iam_service-with-iam-id-based-policies-conditionkeys,Filters access by log destination ARN for PutLoggingConfiguration API,ARN
854,dms:cert-tag/${TagKey},https://docs.aws.amazon.com/service-authorization/latest/reference/list_awsdatabasemigrationservice.html#awsdatabasemigrationservice--dms_cert-tag___TagKey_,Filters access by the presence of tag key-value pairs in the request for Certificate,String
855,wafv2:LogScope,https://docs.aws.amazon.com/waf/latest/developerguide/security_iam_service-with-iam.html#security_iam_service-with-iam-id-based-policies-conditionkeys,Filters access by log scope for Logging Configuration API,String
856,dms:data-migration-tag/${TagKey},https://docs.aws.amazon.com/service-authorization/latest/reference/list_awsdatabasemigrationservice.html#awsdatabasemigrationservice--dms_data-migration-tag___TagKey_,Filters access by the presence of tag key-value pairs in the request for DataMigration,String
857,dms:data-provider-tag/${TagKey},https://docs.aws.amazon.com/service-authorization/latest/reference/list_awsdatabasemigrationservice.html#awsdatabasemigrationservice--dms_dp-tag___TagKey_,Filters access by the presence of tag key-value pairs in the request for DataProvider,String
858,dms:endpoint-tag/${TagKey},https://docs.aws.amazon.com/service-authorization/latest/reference/list_awsdatabasemigrationservice.html#awsdatabasemigrationservice-dms_endpoint-tag___TagKey_,Filters access by the presence of tag key-value pairs in the request for Endpoint,String
859,dms:es-tag/${TagKey},https://docs.aws.amazon.com/service-authorization/latest/reference/list_awsdatabasemigrationservice.html#awsdatabasemigrationservice-dms_es-tag___TagKey_,Filters access by the presence of tag key-value pairs in the request for EventSubscription,String
860,dms:individual-assessment-tag/${TagKey},https://docs.aws.amazon.com/service-authorization/latest/reference/list_awsdatabasemigrationservice.html#awsdatabasemigrationservice-dms_individual-assessment-tag___TagKey_,Filters access by the presence of tag key-value pairs in the request for IndividualAssessment,String
861,dms:instance-profile-tag/${TagKey},https://docs.aws.amazon.com/service-authorization/latest/reference/list_awsdatabasemigrationservice.html#awsdatabasemigrationservice--dms_ip-tag___TagKey_,Filters access by the presence of tag key-value pairs in the request for InstanceProfile,String
862,dms:migration-project-tag/${TagKey},https://docs.aws.amazon.com/service-authorization/latest/reference/list_awsdatabasemigrationservice.html#awsdatabasemigrationservice--dms_mp-tag___TagKey_,Filters access by the presence of tag key-value pairs in the request for MigrationProject,String
863,dms:rep-tag/${TagKey},https://docs.aws.amazon.com/service-authorization/latest/reference/list_awsdatabasemigrationservice.html#awsdatabasemigrationservice-dms_rep-tag___TagKey_,Filters access by the presence of tag key-value pairs in the request for ReplicationInstance,String
864,wellarchitected:JiraProjectKey,https://docs.aws.amazon.com/wellarchitected/latest/userguide/security_iam_id-based-policy-examples.html,Filters access by project key,String
865,dms:replication-config-tag/${TagKey},https://docs.aws.amazon.com/service-authorization/latest/reference/list_awsdatabasemigrationservice.html#awsdatabasemigrationservice-dms_replication-config-tag___TagKey_,Filters access by the presence of tag key-value pairs in the request for ReplicationConfig,String
866,dms:req-tag/${TagKey},https://docs.aws.amazon.com/service-authorization/latest/reference/list_awsdatabasemigrationservice.html#awsdatabasemigrationservice-dms_req-tag___TagKey_,Filters access by the presence of tag key-value pairs in the given request,String
867,dms:subgrp-tag/${TagKey},https://docs.aws.amazon.com/service-authorization/latest/reference/list_awsdatabasemigrationservice.html#awsdatabasemigrationservice-dms_subgrp-tag___TagKey_,Filters access by the presence of tag key-value pairs in the request for ReplicationSubnetGroup,String
868,dms:task-tag/${TagKey},https://docs.aws.amazon.com/service-authorization/latest/reference/list_awsdatabasemigrationservice.html#awsdatabasemigrationservice-dms_task-tag___TagKey_,Filters access by the presence of tag key-value pairs in the request for ReplicationTask,String
869,drs:CreateAction,https://docs.aws.amazon.com/drs/latest/userguide/supported-iam-actions-tagging.html,Filters access by the name of a resource-creating API action,String
870,drs:EC2InstanceARN,https://docs.aws.amazon.com/drs/latest/userguide/security_iam_authentication.html,Filters access by the EC2 instance the request originated from,ARN
871,ds-data:Identifier,https://docs.aws.amazon.com/directoryservice/latest/admin-guide/iam_dsdata-condition-keys.html#dsdata_condition-Identifier,Filters access by the type of identifier provided in the request (i.e. SAM Account Name),String
872,ds-data:MemberName,https://docs.aws.amazon.com/directoryservice/latest/admin-guide/iam_dsdata-condition-keys.html#dsdata_condition-MemberName,Filters access by the directory SAM Account Name included in the MemberName input of the request,String
873,ds-data:MemberRealm,https://docs.aws.amazon.com/directoryservice/latest/admin-guide/iam_dsdata-condition-keys.html#dsdata_condition-MemberRealm,Filters access by the directory realm name included in the MemberRealm input of the request,String
874,ds-data:Realm,https://docs.aws.amazon.com/directoryservice/latest/admin-guide/iam_dsdata-condition-keys.html#dsdata_condition-Realm,Filters access by the directory realm name for the request,String
875,wisdom:MessageTemplate/RoutingProfileArn,https://docs.aws.amazon.com/IAM/latest/UserGuide/list_amazonconnectwisdom.html#amazonconnectwisdom-policy-keys,Filters access by the connect routing profile arns associated with the resource,ArrayOfARN
876,wisdom:SearchFilter/Qualifier,https://docs.aws.amazon.com/IAM/latest/UserGuide/list_amazonconnectwisdom.html#amazonconnectwisdom-policy-keys,Filters access by the qualifiers that are passed in the request,ArrayOfString
877,wisdom:SearchFilter/RoutingProfileArn,https://docs.aws.amazon.com/IAM/latest/UserGuide/list_amazonconnectwisdom.html#amazonconnectwisdom-policy-keys,Filters access by the connect routing profile arn that is passed in the request,ARN
878,ds-data:SAMAccountName,https://docs.aws.amazon.com/directoryservice/latest/admin-guide/iam_dsdata-condition-keys.html#dsdata_condition-SAMAccountName,Filters access by the directory SAM Account Name included in the SAMAccountName input of the request,String
879,workspaces:userId,https://docs.aws.amazon.com/workspaces/latest/adminguide/external-identity-providers-setting-up-saml.html#external-identity-providers-embed-inline-policy-for-IAM-role,Filters access by the ID of the Workspaces user,String
880,www.amazon.com:app_id,https://docs.aws.amazon.com/IAM/latest/UserGuide/reference_policies_iam-condition-keys.html#ck_id,Filters access by the Login with Amazon application ID,String
881,www.amazon.com:user_id,https://docs.aws.amazon.com/IAM/latest/UserGuide/reference_policies_iam-condition-keys.html#ck_id,Filters access by the Login with Amazon user ID,String
882,dsql:WitnessRegion,https://docs.aws.amazon.com/aurora-dsql/latest/APIReference/using-iam-condition-keys.html#using-iam-condition-keys-create-mr-cluster-witness,Filters access by the witness region of multi-Region clusters,String
883,dynamodb:Attributes,,,
884,dynamodb:EnclosingOperation,,,
885,dynamodb:FullTableScan,,,
886,dynamodb:LeadingKeys,,,
887,dynamodb:ReturnConsumedCapacity,,,
888,dynamodb:ReturnValues,,,
889,dynamodb:Select,,,
890,ebs:Description,https://docs.aws.amazon.com/IAM/latest/UserGuide/list_amazonelasticblockstore.html#amazonelasticblockstore-policy-keys,Filters access by the description of the snapshot being created,String
891,ebs:ParentSnapshot,https://docs.aws.amazon.com/IAM/latest/UserGuide/list_amazonelasticblockstore.html#amazonelasticblockstore-policy-keys,Filters access by the ID of the parent snapshot,String
892,ebs:VolumeSize,https://docs.aws.amazon.com/IAM/latest/UserGuide/list_amazonelasticblockstore.html#amazonelasticblockstore-policy-keys,"Filters access by the size of the volume for the snapshot being created, in GiB",Numeric
893,ec2-instance-connect:MaxTunnelDuration,,,
894,ec2-instance-connect:maxTunnelDuration,https://docs.aws.amazon.com/AWSEC2/latest/UserGuide/permissions-for-ec2-instance-connect-endpoint.html#iam-OpenTunnel,Filters access by maximum session duration associated with the instance,Numeric
895,ec2-instance-connect:privateIpAddress,https://docs.aws.amazon.com/AWSEC2/latest/UserGuide/permissions-for-ec2-instance-connect-endpoint.html#iam-OpenTunnel,Filters access by private IP Address associated with the instance,IPAddress
896,ec2-instance-connect:remotePort,https://docs.aws.amazon.com/AWSEC2/latest/UserGuide/permissions-for-ec2-instance-connect-endpoint.html#iam-OpenTunnel,Filters access by port number associated with the instance,Numeric
897,ec2:AccepterVpc,https://docs.aws.amazon.com/vpc/latest/peering/security-iam.html,Filters access by the ARN of an accepter VPC in a VPC peering connection,ARN
898,ec2:Add/group,https://docs.aws.amazon.com/AWSEC2/latest/UserGuide/iam-policies-for-amazon-ec2.html#amazon-ec2-keys,Filters access by the group being added to a snapshot,String
899,ec2:Add/userId,https://docs.aws.amazon.com/AWSEC2/latest/UserGuide/iam-policies-for-amazon-ec2.html#amazon-ec2-keys,Filters access by the account id being added to a snapshot,String
900,ec2:AllocationId,https://docs.aws.amazon.com/AWSEC2/latest/UserGuide/iam-policies-for-amazon-ec2.html#amazon-ec2-keys,Filters access by the allocation ID of the Elastic IP address,String
901,ec2:AssociatePublicIpAddress,https://docs.aws.amazon.com/AWSEC2/latest/UserGuide/iam-policies-for-amazon-ec2.html#amazon-ec2-keys,Filters access by whether the user wants to associate a public IP address with the instance,Bool
902,ec2:Attribute,https://docs.aws.amazon.com/AWSEC2/latest/UserGuide/iam-policies-for-amazon-ec2.html#attribute-key,Filters access by an attribute of a resource,String
903,ec2:Attribute/${AttributeName},https://docs.aws.amazon.com/AWSEC2/latest/UserGuide/iam-policies-for-amazon-ec2.html#attribute-key,Filters access by an attribute being set on a resource,String
904,ec2:AuthenticationType,https://docs.aws.amazon.com/vpn/latest/s2svpn/vpn-authentication-access-control.html,Filters access by the authentication type for the VPN tunnel endpoints,String
905,ec2:AuthorizedService,https://docs.aws.amazon.com/AWSEC2/latest/UserGuide/iam-policies-for-amazon-ec2.html#amazon-ec2-keys,Filters access by the AWS service that has permission to use a resource,String
906,ec2:AuthorizedUser,https://docs.aws.amazon.com/AWSEC2/latest/UserGuide/iam-policies-for-amazon-ec2.html#amazon-ec2-keys,Filters access by an IAM principal that has permission to use a resource,String
907,ec2:AutoPlacement,https://docs.aws.amazon.com/AWSEC2/latest/UserGuide/iam-policies-for-amazon-ec2.html#amazon-ec2-keys,Filters access by the Auto Placement properties of a Dedicated Host,String
908,ec2:AvailabilityZone,https://docs.aws.amazon.com/AWSEC2/latest/UserGuide/iam-policies-for-amazon-ec2.html#amazon-ec2-keys,Filters access by the name of an Availability Zone in an AWS Region,String
909,ec2:AvailabilityZoneId,https://docs.aws.amazon.com/AWSEC2/latest/UserGuide/iam-policies-for-amazon-ec2.html#amazon-ec2-keys,Filters access by the ID of an Availability Zone in an AWS Region,String
910,ec2:CapacityReservationFleet,https://docs.aws.amazon.com/AWSEC2/latest/UserGuide/iam-policies-for-amazon-ec2.html#amazon-ec2-keys,Filters access by the ARN of the Capacity Reservation Fleet,ARN
911,ec2:ClientRootCertificateChainArn,https://docs.aws.amazon.com/AWSEC2/latest/UserGuide/iam-policies-for-amazon-ec2.html#amazon-ec2-keys,Filters access by the ARN of the client root certificate chain,ARN
912,ec2:CloudwatchLogGroupArn,https://docs.aws.amazon.com/AWSEC2/latest/UserGuide/iam-policies-for-amazon-ec2.html#amazon-ec2-keys,Filters access by the ARN of the CloudWatch Logs log group,ARN
913,ec2:CloudwatchLogStreamArn,https://docs.aws.amazon.com/AWSEC2/latest/UserGuide/iam-policies-for-amazon-ec2.html#amazon-ec2-keys,Filters access by the ARN of the CloudWatch Logs log stream,ARN
914,ec2:CpuOptionsAmdSevSnp,https://docs.aws.amazon.com/AWSEC2/latest/UserGuide/sev-snp.html,"Filters access by the state of AMD SEV-SNP CPU Options. Currently, only US East (Ohio) and Europe (Ireland) are supported",String
915,ec2:CreateAction,https://docs.aws.amazon.com/AWSEC2/latest/UserGuide/supported-iam-actions-tagging.html,Filters access by the name of a resource-creating API action,String
916,ec2:CreateDate,https://docs.aws.amazon.com/AWSEC2/latest/UserGuide/iam-policies-for-amazon-ec2.html#amazon-ec2-keys,Filters access by the date and time at which the Capacity Reservation was created,Date
917,ec2:DPDTimeoutSeconds,https://docs.aws.amazon.com/vpn/latest/s2svpn/vpn-authentication-access-control.html,Filters access by the duration after which DPD timeout occurs on a VPN tunnel,Numeric
918,ec2:DestinationCapacityReservationId,https://docs.aws.amazon.com/AWSEC2/latest/UserGuide/iam-policies-for-amazon-ec2.html#amazon-ec2-keys,Filters access by the ID of the Capacity Reservation that you want to move capacity into,ARN
919,ec2:DhcpOptionsID,iam-policies-for-amazon-ec2.html#imageId-key,Filters access by the ID of a dynamic host configuration protocol (DHCP) options set,String
920,ec2:DirectoryArn,https://docs.aws.amazon.com/AWSEC2/latest/UserGuide/iam-policies-for-amazon-ec2.html#amazon-ec2-keys,Filters access by the ARN of the directory,ARN
921,ec2:Domain,https://docs.aws.amazon.com/AWSEC2/latest/UserGuide/iam-policies-for-amazon-ec2.html#amazon-ec2-keys,Filters access by the domain of the Elastic IP address,String
922,ec2:EbsOptimized,https://docs.aws.amazon.com/AWSEC2/latest/UserGuide/iam-policies-for-amazon-ec2.html#amazon-ec2-keys,Filters access by whether the instance is enabled for EBS optimization,Bool
923,ec2:ElasticGpuType,https://docs.aws.amazon.com/AWSEC2/latest/UserGuide/iam-policies-for-amazon-ec2.html#amazon-ec2-keys,Filters access by the type of Elastic Graphics accelerator,String
924,ec2:Encrypted,https://docs.aws.amazon.com/AWSEC2/latest/UserGuide/iam-policies-for-amazon-ec2.html#amazon-ec2-keys,Filters access by whether the EBS volume is encrypted,Bool
925,ec2:EndDate,https://docs.aws.amazon.com/AWSEC2/latest/UserGuide/iam-policies-for-amazon-ec2.html#amazon-ec2-keys,Filters access by the date and time at which the Capacity Reservation ends,Date
926,ec2:EndDateType,https://docs.aws.amazon.com/AWSEC2/latest/UserGuide/iam-policies-for-amazon-ec2.html#amazon-ec2-keys,Filters access by the way in which the Capacity Reservation ends,String
927,ec2:EphemeralStorage,https://docs.aws.amazon.com/AWSEC2/latest/UserGuide/iam-policies-for-amazon-ec2.html#amazon-ec2-keys,Filters access by whether the instance is enabled for ephemeral storage,Bool
928,ec2:FisActionId,https://docs.aws.amazon.com/fis/latest/userguide/fis-actions-reference.html,Filters access by the ID of an AWS FIS action,String
929,ec2:FisTargetArns,https://docs.aws.amazon.com/fis/latest/userguide/fis-actions-reference.html,Filters access by the ARN of an AWS FIS target,ArrayOfARN
930,ec2:GatewayType,https://docs.aws.amazon.com/vpn/latest/s2svpn/vpn-authentication-access-control.html,Filters access by the gateway type for a VPN endpoint on the AWS side of a VPN connection,String
931,ec2:HostRecovery,https://docs.aws.amazon.com/AWSEC2/latest/UserGuide/iam-policies-for-amazon-ec2.html#amazon-ec2-keys,Filters access by whether host recovery is enabled for a Dedicated Host,String
932,ec2:IKEVersions,https://docs.aws.amazon.com/vpn/latest/s2svpn/vpn-authentication-access-control.html,Filters access by the internet key exchange (IKE) versions that are permitted for a VPN tunnel,ArrayOfString
933,ec2:ImageID,iam-policies-for-amazon-ec2.html#imageId-key,Filters access by the ID of an image,String
934,ec2:ImageType,https://docs.aws.amazon.com/AWSEC2/latest/UserGuide/iam-policies-for-amazon-ec2.html#amazon-ec2-keys,"Filters access by the type of image (machine, aki, or ari)",String
935,ec2:InsideTunnelCidr,https://docs.aws.amazon.com/vpn/latest/s2svpn/vpn-authentication-access-control.html,Filters access by the range of inside IP addresses for a VPN tunnel,String
936,ec2:InsideTunnelIpv6Cidr,https://docs.aws.amazon.com/vpn/latest/s2svpn/vpn-authentication-access-control.html,Filters access by a range of inside IPv6 addresses for a VPN tunnel,String
937,ec2:InstanceAutoRecovery,https://docs.aws.amazon.com/AWSEC2/latest/UserGuide/iam-policies-for-amazon-ec2.html#amazon-ec2-keys,Filters access by whether the instance type supports auto recovery,String
938,ec2:InstanceBandwidthWeighting,iam-policies-for-amazon-ec2.html#imageId-key,Filters access by the bandwidth weighting of an instance,String
939,ec2:InstanceCount,https://docs.aws.amazon.com/AWSEC2/latest/UserGuide/iam-policies-for-amazon-ec2.html#amazon-ec2-keys,Filters access by the number of instances,Numeric
940,ec2:InstanceID,iam-policies-for-amazon-ec2.html#imageId-key,Filters access by the ID of an instance,String
941,ec2:InstanceMarketType,https://docs.aws.amazon.com/AWSEC2/latest/UserGuide/iam-policies-for-amazon-ec2.html#amazon-ec2-keys,"Filters access by the market or purchasing option of an instance (capacity-block, on-demand, or spot)",String
942,ec2:InstanceMatchCriteria,https://docs.aws.amazon.com/AWSEC2/latest/UserGuide/iam-policies-for-amazon-ec2.html#amazon-ec2-keys,Filters access by the type of instance launches that the Capacity Reservation accepts,String
943,ec2:InstanceMetadataTags,https://docs.aws.amazon.com/AWSEC2/latest/UserGuide/iam-policies-for-amazon-ec2.html#amazon-ec2-keys,Filters access by whether the instance allows access to instance tags from the instance metadata,String
944,ec2:InstancePlatform,https://docs.aws.amazon.com/AWSEC2/latest/UserGuide/iam-policies-for-amazon-ec2.html#amazon-ec2-keys,Filters access by the type of operating system for which the Capacity Reservation reserves capacity,ARN
945,ec2:InstanceProfile,https://docs.aws.amazon.com/AWSEC2/latest/UserGuide/iam-policies-for-amazon-ec2.html#amazon-ec2-keys,Filters access by the ARN of an instance profile,ARN
946,ec2:InstanceType,https://docs.aws.amazon.com/AWSEC2/latest/UserGuide/iam-policies-for-amazon-ec2.html#amazon-ec2-keys,Filters access by the type of instance,String
947,ec2:InternetGatewayID,iam-policies-for-amazon-ec2.html#imageId-key,Filters access by the ID of an internet gateway,String
948,ec2:Ipv4IpamPoolId,iam-policies-for-amazon-ec2.html#amazon-ec2-keys,Filters access by the ID of an IPAM pool provided for IPv4 CIDR block allocation,String
949,ec2:Ipv6IpamPoolId,iam-policies-for-amazon-ec2.html#amazon-ec2-keys,Filters access by the ID of an IPAM pool provided for IPv6 CIDR block allocation,String
950,ec2:IsLaunchTemplateResource,https://docs.aws.amazon.com/AWSEC2/latest/UserGuide/iam-policies-for-amazon-ec2.html#amazon-ec2-keys,Filters access by whether users are able to override resources that are specified in the launch template,Bool
951,ec2:KeyPairName,https://docs.aws.amazon.com/AWSEC2/latest/UserGuide/iam-policies-for-amazon-ec2.html#amazon-ec2-keys,Filters access by the name of a key pair,String
