condition_key_id,name,reference_url,description,type
449,codebuild:logsConfig.s3Logs.bucketOwnerAccess,https://docs.aws.amazon.com/codebuild/latest/userguide/action-context-keys.html,Filters access by the API corresponding argument value,String
450,codebuild:logsConfig.s3Logs.encryptionDisabled,https://docs.aws.amazon.com/codebuild/latest/userguide/action-context-keys.html,Filters access by the API corresponding argument value,Bool
451,codebuild:logsConfig.s3Logs.location,https://docs.aws.amazon.com/codebuild/latest/userguide/action-context-keys.html,Filters access by the API corresponding argument value,String
452,codebuild:logsConfig.s3Logs.status,https://docs.aws.amazon.com/codebuild/latest/userguide/action-context-keys.html,Filters access by the API corresponding argument value,String
453,codebuild:manualCreation,https://docs.aws.amazon.com/codebuild/latest/userguide/action-context-keys.html,Filters access by the API corresponding argument value,Bool
454,codebuild:projectArn,https://docs.aws.amazon.com/codebuild/latest/userguide/auth-and-access-control-permissions-reference.html,Filters access by the ARN of the AWS CodeBuild project from which the request originated,ARN
455,codebuild:projectVisibility,https://docs.aws.amazon.com/codebuild/latest/userguide/action-context-keys.html,Filters access by the API corresponding argument value,String
456,codebuild:scopeConfiguration.domain,https://docs.aws.amazon.com/codebuild/latest/userguide/action-context-keys.html,Filters access by the API corresponding argument value,String
457,codebuild:scopeConfiguration.name,https://docs.aws.amazon.com/codebuild/latest/userguide/action-context-keys.html,Filters access by the API corresponding argument value,String
458,codebuild:scopeConfiguration.scope,https://docs.aws.amazon.com/codebuild/latest/userguide/action-context-keys.html,Filters access by the API corresponding argument value,String
459,codebuild:secondaryArtifacts,https://docs.aws.amazon.com/codebuild/latest/userguide/action-context-keys.html,Filters access by the API corresponding argument value,Bool
460,codebuild:secondaryArtifacts.artifactIdentifier,https://docs.aws.amazon.com/codebuild/latest/userguide/action-context-keys.html,Filters access by the API corresponding argument value,ArrayOfString
461,codebuild:secondaryArtifacts.bucketOwnerAccess,https://docs.aws.amazon.com/codebuild/latest/userguide/action-context-keys.html,Filters access by the API corresponding argument value,ArrayOfString
462,codebuild:secondaryArtifacts.encryptionDisabled,https://docs.aws.amazon.com/codebuild/latest/userguide/action-context-keys.html,Filters access by the API corresponding argument value,ArrayOfBool
463,codebuild:secondaryArtifacts.location,https://docs.aws.amazon.com/codebuild/latest/userguide/action-context-keys.html,Filters access by the API corresponding argument value,ArrayOfString
464,codebuild:secondaryArtifacts/${artifactIdentifier}.bucketOwnerAccess,https://docs.aws.amazon.com/codebuild/latest/userguide/action-context-keys.html,Filters access by the API corresponding argument value,String
465,deadline:FarmMembershipLevels,https://docs.aws.amazon.com/deadline-cloud/latest/userguide/security-iam-service-with-iam.html,Filters access by membership levels on the farm,ArrayOfString
466,codebuild:secondaryArtifacts/${artifactIdentifier}.encryptionDisabled,https://docs.aws.amazon.com/codebuild/latest/userguide/action-context-keys.html,Filters access by the API corresponding argument value,Bool
467,deadline:FleetMembershipLevels,https://docs.aws.amazon.com/deadline-cloud/latest/userguide/security-iam-service-with-iam.html,Filters access by membership levels on the fleet,ArrayOfString
468,deadline:JobMembershipLevels,https://docs.aws.amazon.com/deadline-cloud/latest/userguide/security-iam-service-with-iam.html,Filters access by membership levels on the job,ArrayOfString
469,deadline:MembershipLevel,https://docs.aws.amazon.com/deadline-cloud/latest/userguide/security-iam-service-with-iam.html,Filters access by the membership level passed in the request,String
470,deadline:PrincipalId,https://docs.aws.amazon.com/deadline-cloud/latest/userguide/security-iam-service-with-iam.html,Filters access by the principle ID provided in the request,String
471,deadline:QueueMembershipLevels,https://docs.aws.amazon.com/deadline-cloud/latest/userguide/security-iam-service-with-iam.html,Filters access by membership levels on the queue,ArrayOfString
472,deadline:RequesterPrincipalId,https://docs.aws.amazon.com/deadline-cloud/latest/userguide/security-iam-service-with-iam.html,Filters access by the user calling the Deadline Cloud API,String
473,deepracer:MultiUser,https://docs.aws.amazon.com/deepracer/latest/developerguide/reference_policies_iam-condition-keys.html#condition-keys-multiuser,Filters access by multiuser flag,Bool
474,kms:ViaService,https://docs.aws.amazon.com/kms/latest/developerguide/conditions-kms.html#conditions-kms-via-service,Filters access when a request made on the principal's behalf comes from a specified AWS service,String
475,kms:WrappingAlgorithm,https://docs.aws.amazon.com/kms/latest/developerguide/conditions-kms.html#conditions-kms-wrapping-algorithm,Filters access to the GetParametersForImport operation based on the value of the WrappingAlgorithm parameter in the request,String
476,kms:WrappingKeySpec,https://docs.aws.amazon.com/kms/latest/developerguide/conditions-kms.html#conditions-kms-wrapping-key-spec,Filters access to the GetParametersForImport operation based on the value of the WrappingKeySpec parameter in the request,String
477,lakeformation:EnabledOnlyForMetaDataAccess,https://docs.aws.amazon.com/service-authorization/latest/reference/list_awslakeformation.html#awslakeformation-policy-keys,Filters access by the presence of the key configured for role's identity-based policy,Bool
478,lambda:CodeSigningConfigArn,https://docs.aws.amazon.com/lambda/latest/dg/lambda-api-permissions-ref.html,Filters access by the ARN of an AWS Lambda code signing config,ARN
479,lambda:EventSourceToken,https://docs.aws.amazon.com/lambda/latest/dg/lambda-api-permissions-ref.html,Filters access by the ID from a non-AWS event source configured for the AWS Lambda function,String
480,lambda:FunctionArn,https://docs.aws.amazon.com/lambda/latest/dg/lambda-api-permissions-ref.html,Filters access by the ARN of an AWS Lambda function,ARN
481,lambda:FunctionUrlAuthType,https://docs.aws.amazon.com/lambda/latest/dg/lambda-api-permissions-ref.html,"Filters access by authorization type specified in request. Available during CreateFunctionUrlConfig, UpdateFunctionUrlConfig, DeleteFunctionUrlConfig, GetFunctionUrlConfig, ListFunctionUrlConfig, AddPermission and RemovePermission operations",String
482,lambda:Layer,https://docs.aws.amazon.com/lambda/latest/dg/lambda-api-permissions-ref.html,Filters access by the ARN of a version of an AWS Lambda layer,ArrayOfString
483,lambda:Principal,https://docs.aws.amazon.com/lambda/latest/dg/lambda-api-permissions-ref.html,Filters access by restricting the AWS service or account that can invoke a function,String
484,lambda:SecurityGroupIds,https://docs.aws.amazon.com/lambda/latest/dg/lambda-api-permissions-ref.html,Filters access by the ID of security groups configured for the AWS Lambda function,ArrayOfString
485,lambda:SourceFunctionArn,https://docs.aws.amazon.com/lambda/latest/dg/lambda-api-permissions-ref.html,Filters access by the ARN of the AWS Lambda function from which the request originated,ARN
486,lambda:SubnetIds,https://docs.aws.amazon.com/lambda/latest/dg/lambda-api-permissions-ref.html,Filters access by the ID of subnets configured for the AWS Lambda function,ArrayOfString
487,lambda:VpcIds,https://docs.aws.amazon.com/lambda/latest/dg/lambda-api-permissions-ref.html,Filters access by the ID of the VPC configured for the AWS Lambda function,String
488,lex:associatedIntents,https://docs.aws.amazon.com/lex/latest/dg/security_iam_service-with-iam.html,Enables you to control access based on the intents included in the request,ArrayOfString
489,lex:associatedSlotTypes,https://docs.aws.amazon.com/lex/latest/dg/security_iam_service-with-iam.html,Enables you to control access based on the slot types included in the request,ArrayOfString
490,lex:channelType,https://docs.aws.amazon.com/lex/latest/dg/security_iam_service-with-iam.html,Enables you to control access based on the channel type included in the request,String
491,license-manager:ResourceTag/${TagKey},https://docs.aws.amazon.com/license-manager/latest/userguide/identity-access-management.html,Filters access by the tag key-value pairs attached to the resource,String
492,logs:DeliveryDestinationResourceArn,https://docs.aws.amazon.com/AmazonCloudWatch/latest/logs/iam-identity-based-access-control-cwl.html,Filters access by the Log Destination ARN passed in the request,ARN
493,logs:LogGeneratingResourceArns,https://docs.aws.amazon.com/AmazonCloudWatch/latest/logs/iam-identity-based-access-control-cwl.html,Filters access by the Log Generating Resource ARNs passed in the request,ArrayOfARN
494,lookoutequipment:IsImportingData,https://docs.aws.amazon.com/IAM/latest/UserGuide/reference_policies_condition-keys.html#condition-keys-isimportingdata,Filters access by the import strategy of underlying data,Bool
495,mediaconvert:HttpInputsAllowed,https://docs.aws.amazon.com/mediaconvert/latest/apireference/input-policies.html,Filters access by an HTTP input policy present in the account,Bool
496,mediaconvert:HttpsInputsAllowed,https://docs.aws.amazon.com/mediaconvert/latest/apireference/input-policies.html,Filters access by an HTTPS input policy present in the account,Bool
497,mediaconvert:S3InputsAllowed,https://docs.aws.amazon.com/mediaconvert/latest/apireference/input-policies.html,Filters access by an S3 input policy present in the account,Bool
498,memorydb:TLSEnabled,https://docs.aws.amazon.com/memorydb/latest/devguide/IAM.ConditionKeys.html#IAM.SpecifyingConditions,Filters access by the TLSEnabled parameter present in the request or defaults to true value if parameter is not present,Bool
499,memorydb:UserAuthenticationMode,https://docs.aws.amazon.com/memorydb/latest/devguide/IAM.ConditionKeys.html#IAM.SpecifyingConditions,Filters access by the UserAuthenticationMode.Type parameter in the request,String
500,mgh:AutomationRunResourceRunID,https://docs.aws.amazon.com/migrationhub/latest/ug/ContextKeys_AutomationRunResourceRunID.html,AutomationRunResource resource runID identifier,String
501,mgh:AutomationUnitResourceAutomationUnitArn,https://docs.aws.amazon.com/migrationhub/latest/ug/ContextKeys_AutomationUnitResourceAutomationUnitArn.html,AutomationUnitResource resource automationUnitArn identifier,ARN
502,mgh:ConnectionResourceConnectionArn,https://docs.aws.amazon.com/migrationhub/latest/ug/security_iam_service-with-iam-id-based-policies-conditionkeys.html#condition-connectionresourceconnectionarn,ConnectionResource resource connectionArn identifier,String
503,mgn:CreateAction,https://docs.aws.amazon.com/mgn/latest/ug/supported-iam-actions-tagging.html,Filters access by the name of a resource-creating API action,String
504,mpa:ProtectedResourceAccount,https://docs.aws.amazon.com/mpa/latest/userguide/mpa-concepts.html,Filters access by the account that owns the resource that is the target of the operation that requires approval,String
505,mpa:RequestedOperation,https://docs.aws.amazon.com/mpa/latest/userguide/mpa-concepts.html,Filters access by a requested operation that requires team approval before it can be executed,String
506,neptune-db:QueryLanguage,https://docs.aws.amazon.com/neptune/latest/userguide/iam-data-condition-keys.html#iam-neptune-condition-keys,Filters access by graph model,String
507,neptune-graph:PublicConnectivity,https://docs.aws.amazon.com/neptune-analytics/latest/userguide/iam-condition-keys.html#publicconnectivity,"Filters access by the value of the public connectivity parameter provided in the request or its default value, if unspecified. All access to graphs is IAM authenticated",Bool
508,networkmanager:cgwArn,https://docs.aws.amazon.com/vpc/latest/tgw/nm-security-iam.html,Filters access by which customer gateways can be associated or disassociated,ARN
509,networkmanager:directConnectGatewayArn,https://docs.aws.amazon.com/vpc/latest/tgw/nm-security-iam.html,Filters access by which Direct Connect gateway can be used to a create/update attachment,ARN
510,networkmanager:edgeLocations,https://docs.aws.amazon.com/vpc/latest/tgw/nm-security-iam.html,Filters access by which edge locations can be added or removed from a Direct Connect gateway attachment,ArrayOfString
511,networkmanager:subnetArns,https://docs.aws.amazon.com/vpc/latest/tgw/nm-security-iam.html,Filters access by which VPC subnets can be added or removed from a VPC attachment,ArrayOfARN
512,networkmanager:tgwArn,https://docs.aws.amazon.com/vpc/latest/tgw/nm-security-iam.html,"Filters access by which transit gateways can be registered, deregistered, or peered",ARN
513,networkmanager:tgwConnectPeerArn,https://docs.aws.amazon.com/vpc/latest/tgw/nm-security-iam.html,Filters access by which transit gateway connect peers can be associated or disassociated,ARN
514,networkmanager:tgwRtbArn,https://docs.aws.amazon.com/vpc/latest/tgw/nm-security-iam.html,Filters access by which Transit Gateway Route Table can be used to create an attachment,ARN
515,networkmanager:vpcArn,https://docs.aws.amazon.com/vpc/latest/tgw/nm-security-iam.html,Filters access by which VPC can be used to a create/update attachment,ARN
516,networkmanager:vpnConnectionArn,https://docs.aws.amazon.com/vpc/latest/tgw/nm-security-iam.html,Filters access by which Site-to-Site VPN can be used to a create/update attachment,ARN
517,nimble:createdBy,https://docs.aws.amazon.com/nimble-studio/latest/userguide/security-iam-service-with-iam.html,Filters access by the createdBy request parameter or the ID of the creator of the resource,String
518,nimble:ownedBy,https://docs.aws.amazon.com/nimble-studio/latest/userguide/security-iam-service-with-iam.html,Filters access by the ownedBy request parameter or the ID of the owner of the resource,String
519,nimble:principalId,https://docs.aws.amazon.com/nimble-studio/latest/userguide/security-iam-service-with-iam.html,Filters access by the principalId request parameter,String
520,nimble:requesterPrincipalId,https://docs.aws.amazon.com/nimble-studio/latest/userguide/security-iam-service-with-iam.html,Filters access by the ID of the logged in user,String
521,nimble:studioId,https://docs.aws.amazon.com/nimble-studio/latest/userguide/security-iam-service-with-iam.html,Filters access by a specific studio,ARN
522,oam:ResourceTypes,https://docs.aws.amazon.com/IAM/latest/UserGuide/list_amazoncloudwatchobservabilityaccessmanager.html,Filters access by the presence of resource types in the request,ArrayOfString
523,organizations:PolicyType,https://docs.aws.amazon.com/organizations/latest/userguide/orgs_permissions_overview.html#orgs_permissions_conditionkeys,Filters access by the specified policy type names,String
524,organizations:ServicePrincipal,https://docs.aws.amazon.com/organizations/latest/userguide/orgs_permissions_overview.html#orgs_permissions_conditionkeys,Filters access by the specified service principal names,String
525,partnercentral:Catalog,https://docs.aws.amazon.com/partner-central/latest/APIReference/access-control.html#managing-permissions-with-condition-keyspage.html#Catalog,"Filters access by a specific Catalog. Accepted values: [AWS, Sandbox]",String
526,partnercentral:RelatedEntityType,https://docs.aws.amazon.com/partner-central/latest/APIReference/access-control.html#managing-permissions-with-condition-keyspage.html#RelatedEntityType,"Filters access by entity types for Opportunity association. Accepted values: [Solutions, AwsProducts, AwsMarketplaceOffers]",String
527,payment-cryptography:CertificateAuthorityPublicKeyIdentifier,{ActionsDocRoot}security-iam.html,"Filters access by the CertificateAuthorityPublicKeyIdentifier specified in the request or the ImportKey, and ExportKey operations",String
528,payment-cryptography:ImportKeyMaterial,{ActionsDocRoot}security-iam.html,"Filters access by the type of key material being imported [RootCertificatePublicKey, TrustedCertificatePublicKey, Tr34KeyBlock, Tr31KeyBlock] for the ImportKey operation",String
529,payment-cryptography:KeyAlgorithm,{ActionsDocRoot}security-iam.html,Filters access by KeyAlgorithm specified in the request for the CreateKey operation,String
530,payment-cryptography:KeyClass,{ActionsDocRoot}security-iam.html,Filters access by KeyClass specified in the request for the CreateKey operation,String
531,payment-cryptography:KeyUsage,{ActionsDocRoot}security-iam.html,Filters access by KeyClass specified in the request or associated with a key for the CreateKey operation,String
532,payment-cryptography:RequestAlias,{ActionsDocRoot}security-iam.html,Filters access by aliases in the request for the specified operation,String
533,payment-cryptography:ResourceAliases,{ActionsDocRoot}security-iam.html,Filters access by aliases associated with a key for the specified operation,ArrayOfString
534,payment-cryptography:WrappingKeyIdentifier,{ActionsDocRoot}security-iam.html,"Filters access by the WrappingKeyIdentifier specified in the request for the ImportKey, and ExportKey operations",String
535,pi:Dimensions,#condition-keys-dimensions,Filters access by the requested dimensions,ArrayOfString
536,proton:EnvironmentTemplate,https://docs.aws.amazon.com/IAM/latest/UserGuide/reference_policies_condition-keys.html,Filters access by specified environment template related to resource,String
537,proton:ServiceTemplate,https://docs.aws.amazon.com/IAM/latest/UserGuide/reference_policies_condition-keys.html,Filters access by specified service template related to resource,String
538,qapps:AppIsPublished,https://docs.aws.amazon.com/amazonq/latest/qbusiness-ug/security-iam.html,Filters access by whether Q App is published,String
539,qapps:SessionIsShared,https://docs.aws.amazon.com/amazonq/latest/qbusiness-ug/security-iam.html,Filters access by whether Q App Session is shared,String
540,qapps:UserIsAppOwner,https://docs.aws.amazon.com/amazonq/latest/qbusiness-ug/security-iam.html,Filters access by whether requester is Q App owner,String
541,qapps:UserIsSessionModerator,https://docs.aws.amazon.com/amazonq/latest/qbusiness-ug/security-iam.html,Filters access by whether requester is Q App Session moderator,String
542,qldb:Purge,https://docs.aws.amazon.com/IAM/latest/UserGuide/reference_policies_condition-keys.html#condition-keys-purge,Filters access by the value of purge that is specified in a PartiQL DROP statement,String
543,quicksight:AllowedEmbeddingDomains,https://docs.aws.amazon.com/quicksight/latest/user/embedded-dashboards-for-authenticated-users-step-1.html,Filters access by the allowed embedding domains,ArrayOfString
544,quicksight:DirectoryType,https://docs.aws.amazon.com/quicksight/latest/user/security-scp.html,Filters access by the user management options,String
545,quicksight:Edition,https://docs.aws.amazon.com/quicksight/latest/user/security-scp.html,Filters access by the edition of QuickSight,String
546,quicksight:Group,https://docs.aws.amazon.com/quicksight/latest/user/iam-actions.html,Filters access by QuickSight group ARN,ARN
547,quicksight:IamArn,https://docs.aws.amazon.com/quicksight/latest/user/iam-actions.html,Filters access by IAM user or role ARN,ARN
548,quicksight:KmsKeyArns,https://docs.aws.amazon.com/quicksight/latest/user/key-management.html,Filters access by KMS key ARNs,ArrayOfARN
549,quicksight:SessionName,https://docs.aws.amazon.com/quicksight/latest/user/iam-actions.html,Filters access by session name,String
550,quicksight:UserName,https://docs.aws.amazon.com/quicksight/latest/user/iam-actions.html,Filters access by user name,String
551,ram:AllowsExternalPrincipals,https://docs.aws.amazon.com/ram/latest/userguide/iam-policies.html#iam-policies-condition,"Filters access by resource shares that allow or deny sharing with external principals. For example, specify true if the action can only be performed on resource shares that allow sharing with external principals. External principals are AWS accounts that are outside of its AWS organization",Bool
552,ram:PermissionArn,https://docs.aws.amazon.com/ram/latest/userguide/iam-policies.html#iam-policies-condition,Filters access by the specified Permission ARN,ARN
553,ram:PermissionResourceType,https://docs.aws.amazon.com/ram/latest/userguide/iam-policies.html#iam-policies-condition,Filters access by permissions of specified resource type,String
554,ram:Principal,https://docs.aws.amazon.com/ram/latest/userguide/iam-policies.html#iam-policies-condition,Filters access by format of the specified principal,String
555,ram:RequestedAllowsExternalPrincipals,https://docs.aws.amazon.com/ram/latest/userguide/iam-policies.html#iam-policies-condition,Filters access by the specified value for 'allowExternalPrincipals'. External principals are AWS accounts that are outside of its AWS Organization,Bool
556,ram:RequestedResourceType,https://docs.aws.amazon.com/ram/latest/userguide/iam-policies.html#iam-policies-condition,Filters access by the specified resource type,String
557,ram:ResourceArn,https://docs.aws.amazon.com/ram/latest/userguide/iam-policies.html#iam-policies-condition,Filters access by  the specified ARN,ARN
558,ram:ResourceShareName,https://docs.aws.amazon.com/ram/latest/userguide/iam-policies.html#iam-policies-condition,Filters access by a resource share with the specified name,String
559,ram:ResourceTag/${TagKey},https://docs.aws.amazon.com/IAM/latest/UserGuide/reference_policies_condition-keys.html#condition-keys-resourcetag,Filters access by the tags associated with the resource,String
560,ram:ShareOwnerAccountId,https://docs.aws.amazon.com/ram/latest/userguide/iam-policies.html#iam-policies-condition,"Filters access by resource shares owned by a specific account. For example, you can use this condition key to specify which resource share invitations can be accepted or rejected based on the resource share owner's account ID",String
561,rbin:Attribute/ResourceType,https://docs.aws.amazon.com/AWSEC2/latest/UserGuide/recycle-bin-perms.html#rbin-condition-keys,Filters access by the resource type of the existing rule,String
562,rbin:Request/ResourceType,https://docs.aws.amazon.com/AWSEC2/latest/UserGuide/recycle-bin-perms.html#rbin-condition-keys,Filters access by the resource type in a request,String
563,rds:BackupTarget,https://docs.aws.amazon.com/AmazonRDS/latest/UserGuide/security_iam_service-with-iam.html#UsingWithRDS.IAM.Conditions,"Filters access by the type of backup target. One of: region, outposts",String
564,rds:CopyOptionGroup,https://docs.aws.amazon.com/AmazonRDS/latest/UserGuide/security_iam_service-with-iam.html#UsingWithRDS.IAM.Conditions,Filters access by the value that specifies whether the CopyDBSnapshot action requires copying the DB option group,Bool
565,rds:DatabaseClass,https://docs.aws.amazon.com/AmazonRDS/latest/UserGuide/security_iam_service-with-iam.html#UsingWithRDS.IAM.Conditions,Filters access by the type of DB instance class,String
566,rds:DatabaseEngine,https://docs.aws.amazon.com/AmazonRDS/latest/UserGuide/security_iam_service-with-iam.html#UsingWithRDS.IAM.Conditions,Filters access by the database engine. For possible values refer to the engine parameter in CreateDBInstance API,String
567,rds:DatabaseName,https://docs.aws.amazon.com/AmazonRDS/latest/UserGuide/security_iam_service-with-iam.html#UsingWithRDS.IAM.Conditions,Filters access by the user-defined name of the database on the DB instance,String
568,rds:EndpointType,https://docs.aws.amazon.com/AmazonRDS/latest/UserGuide/security_iam_service-with-iam.html#UsingWithRDS.IAM.Conditions,"Filters access by the type of the endpoint. One of: READER, WRITER, CUSTOM",String
569,rds:ManageMasterUserPassword,https://docs.aws.amazon.com/AmazonRDS/latest/UserGuide/security_iam_service-with-iam.html#UsingWithRDS.IAM.Conditions,Filters access by the value that specifies whether RDS manages master user password in AWS Secrets Manager for the DB instance or cluster,Bool
570,rds:MultiAz,https://docs.aws.amazon.com/AmazonRDS/latest/UserGuide/security_iam_service-with-iam.html#UsingWithRDS.IAM.Conditions,"Filters access by the value that specifies whether the DB instance runs in multiple Availability Zones. To indicate that the DB instance is using Multi-AZ, specify true",Bool
571,rds:Piops,https://docs.aws.amazon.com/AmazonRDS/latest/UserGuide/security_iam_service-with-iam.html#UsingWithRDS.IAM.Conditions,"Filters access by the value that contains the number of Provisioned IOPS (PIOPS) that the instance supports. To indicate a DB instance that does not have PIOPS enabled, specify 0",Numeric
572,rds:StorageEncrypted,https://docs.aws.amazon.com/AmazonRDS/latest/UserGuide/security_iam_service-with-iam.html#UsingWithRDS.IAM.Conditions,"Filters access by the value that specifies whether the DB instance storage should be encrypted. To enforce storage encryption, specify true",Bool
573,rds:StorageSize,https://docs.aws.amazon.com/AmazonRDS/latest/UserGuide/security_iam_service-with-iam.html#UsingWithRDS.IAM.Conditions,Filters access by the storage volume size (in GB),Numeric
574,rds:TenantDatabaseName,https://docs.aws.amazon.com/AmazonRDS/latest/UserGuide/security_iam_service-with-iam.html#UsingWithRDS.IAM.Conditions,Filters access by the tenant database name in CreateTenantDatabase and by the new tenant database name in ModifyTenantDatabase,String
575,rds:Vpc,https://docs.aws.amazon.com/AmazonRDS/latest/UserGuide/security_iam_service-with-iam.html#UsingWithRDS.IAM.Conditions,"Filters access by the value that specifies whether the DB instance runs in an Amazon Virtual Private Cloud (Amazon VPC). To indicate that the DB instance runs in an Amazon VPC, specify true",Bool
