condition_key_id,name,reference_url,description,type
1,a4b:amazonId,https://docs.aws.amazon.com/a4b/latest/APIReference/API_RegisterAVSDevice.html,Filters actions based on the Amazon Id in the request,String
2,a4b:filters_deviceType,https://docs.aws.amazon.com/a4b/latest/APIReference/API_SearchDevices.html,Filters actions based on the device type in the request,ArrayOfString
3,account:AccountResourceOrgPaths,https://docs.aws.amazon.com/accounts/latest/reference/security_iam_service-with-iam.html#security_iam_service-with-iam-id-based-policies-conditionkeys,Filters access by the resource path for an account in an organization,ArrayOfString
4,account:AccountResourceOrgTags/${TagKey},https://docs.aws.amazon.com/accounts/latest/reference/security_iam_service-with-iam.html#security_iam_service-with-iam-id-based-policies-conditionkeys,Filters access by resource tags for an account in an organization,String
5,account:AlternateContactTypes,https://docs.aws.amazon.com/accounts/latest/reference/security_iam_service-with-iam.html#security_iam_service-with-iam-id-based-policies-conditionkeys,Filters access by alternate contact types,ArrayOfString
6,account:EmailTargetDomain,https://docs.aws.amazon.com/accounts/latest/reference/security_iam_service-with-iam.html#security_iam_service-with-iam-id-based-policies-conditionkeys,Filters access by email domain of the target email address,String
7,account:TargetRegion,https://docs.aws.amazon.com/accounts/latest/reference/security_iam_service-with-iam.html#security_iam_service-with-iam-id-based-policies-conditionkeys,Filters access by a list of Regions. Enables or disables all the Regions specified here,String
8,accounts.google.com:aud,https://docs.aws.amazon.com/IAM/latest/UserGuide/reference_policies_iam-condition-keys.html#ck_aud,Filters access by the Google application ID,String
9,accounts.google.com:oaud,https://docs.aws.amazon.com/IAM/latest/UserGuide/reference_policies_iam-condition-keys.html#ck_oaud,Filters access by the Google audience,String
10,accounts.google.com:sub,https://docs.aws.amazon.com/IAM/latest/UserGuide/reference_policies_iam-condition-keys.html#ck_sub,Filters access by the subject of the claim (the Google user ID),String
11,acm-pca:TemplateArn,https://docs.aws.amazon.com/privateca/latest/userguide/UsingTemplates.html#template-varieties,Filters access by the arn of the certificate template used in Issue Certificate request,ARN
12,acm:CertificateAuthority,https://docs.aws.amazon.com/acm/latest/userguide/security-iam.html,Filters access by certificateAuthority in the request. Can be used to restrict which Certificate Authorites certificates can be issued from,String
13,acm:CertificateTransparencyLogging,https://docs.aws.amazon.com/acm/latest/userguide/security-iam.html,Filters access by certificateTransparencyLogging option in the request. Default 'ENABLED' if no key is present in the request,String
14,acm:DomainNames,https://docs.aws.amazon.com/acm/latest/userguide/security-iam.html,Filters access by domainNames in the request. This key can be used to restrict which domains can be in certificate requests,ArrayOfString
15,acm:KeyAlgorithm,https://docs.aws.amazon.com/acm/latest/userguide/security-iam.html,Filters access by keyAlgorithm in the request,String
16,acm:ValidationMethod,https://docs.aws.amazon.com/acm/latest/userguide/security-iam.html,Filters access by validationMethod in the request. Default 'EMAIL' if no key is present in the request,String
17,amplifyuibuilder:CodegenJobResourceAppId,https://docs.aws.amazon.com/amplify/latest/APIReference/API_App.html,Filters access by the app ID,String
18,amplifyuibuilder:CodegenJobResourceEnvironmentName,https://docs.aws.amazon.com/amplify/latest/APIReference/API_BackendEnvironment.html,Filters access by the backend environment name,String
19,amplifyuibuilder:CodegenJobResourceId,https://docs.aws.amazon.com/amplifyuibuilder/latest/APIReference/API_CodegenJob.html,Filters access by the codegen job ID,String
20,amplifyuibuilder:ComponentResourceAppId,https://docs.aws.amazon.com/amplify/latest/APIReference/API_App.html,Filters access by the app ID,String
21,amplifyuibuilder:ComponentResourceEnvironmentName,https://docs.aws.amazon.com/amplify/latest/APIReference/API_BackendEnvironment.html,Filters access by the backend environment name,String
22,amplifyuibuilder:ComponentResourceId,https://docs.aws.amazon.com/amplifyuibuilder/latest/APIReference/API_Component.html,Filters access by the component ID,String
23,amplifyuibuilder:FormResourceAppId,https://docs.aws.amazon.com/amplify/latest/APIReference/API_App.html,Filters access by the app ID,String
24,amplifyuibuilder:FormResourceEnvironmentName,https://docs.aws.amazon.com/amplify/latest/APIReference/API_BackendEnvironment.html,Filters access by the backend environment name,String
25,amplifyuibuilder:FormResourceId,https://docs.aws.amazon.com/amplifyuibuilder/latest/APIReference/API_Form.html,Filters access by the form ID,String
26,amplifyuibuilder:ThemeResourceAppId,https://docs.aws.amazon.com/amplify/latest/APIReference/API_App.html,Filters access by the app ID,String
27,amplifyuibuilder:ThemeResourceEnvironmentName,https://docs.aws.amazon.com/amplify/latest/APIReference/API_BackendEnvironment.html,Filters access by the backend environment name,String
28,amplifyuibuilder:ThemeResourceId,https://docs.aws.amazon.com/amplifyuibuilder/latest/APIReference/API_Theme.html,Filters access by the theme ID,String
29,aoss:CollectionId,https://docs.aws.amazon.com/opensearch-service/latest/developerguide/security-iam-serverless.html#security_iam_serverless-conditionkeys,Filters access by the identifier of the collection,String
30,aoss:collection,https://docs.aws.amazon.com/opensearch-service/latest/developerguide/security-iam-serverless.html#security_iam_serverless-conditionkeys,Filters access by the collection name,String
31,aoss:index,https://docs.aws.amazon.com/opensearch-service/latest/developerguide/security-iam-serverless.html#security_iam_serverless-conditionkeys,Filters access by the index,String
32,apigateway:Request/AccessAssociationSource,https://docs.aws.amazon.com/apigateway/latest/developerguide/security_iam_service-with-iam.html,Filters access by access association source. Available during the CreateDomainNameAccessAssociation operation,String
33,apigateway:Request/AccessLoggingDestination,https://docs.aws.amazon.com/apigateway/latest/developerguide/security_iam_service-with-iam.html,Filters access by access log destination. Available during the CreateStage and UpdateStage operations,String
34,apigateway:Request/AccessLoggingFormat,https://docs.aws.amazon.com/apigateway/latest/developerguide/security_iam_service-with-iam.html,Filters access by access log format. Available during the CreateStage and UpdateStage operations,String
35,apigateway:Request/ApiKeyRequired,https://docs.aws.amazon.com/apigateway/latest/developerguide/security_iam_service-with-iam.html,Filters access by the requirement of API. Available during the CreateRoute and UpdateRoute operations. Also available as a collection during import and reimport,ArrayOfBool
36,apigateway:Request/ApiName,https://docs.aws.amazon.com/apigateway/latest/developerguide/security_iam_service-with-iam.html,Filters access by API name. Available during the CreateApi and UpdateApi operations,String
37,apigateway:Request/AuthorizerType,https://docs.aws.amazon.com/apigateway/latest/developerguide/security_iam_service-with-iam.html,"Filters access by type of authorizer in the request, for example REQUEST or JWT. Available during CreateAuthorizer and UpdateAuthorizer. Also available during import and reimport as an ArrayOfString",ArrayOfString
38,apigateway:Request/AuthorizerUri,https://docs.aws.amazon.com/apigateway/latest/developerguide/security_iam_service-with-iam.html,Filters access by URI of a Lambda authorizer function. Available during CreateAuthorizer and UpdateAuthorizer. Also available during import and reimport as an ArrayOfString,ArrayOfString
39,apigateway:Request/CognitoUserPoolProviderArn,https://docs.aws.amazon.com/apigateway/latest/developerguide/security_iam_service-with-iam.html,Filters access by Cognito user pool provider ARN. Available during CreateAuthorizer and UpdateAuthorizer,ARN
40,apigateway:Request/DisableExecuteApiEndpoint,https://docs.aws.amazon.com/apigateway/latest/developerguide/security_iam_service-with-iam.html,Filters access by status of the default execute-api endpoint. Available during the CreateApi and UpdateApi operations,Bool
41,apigateway:Request/DomainNameArn,https://docs.aws.amazon.com/apigateway/latest/developerguide/security_iam_service-with-iam.html,Filters access by domain name ARN. Available during the CreateDomainNameAccessAssociation operation,ARN
42,apigateway:Request/EndpointType,https://docs.aws.amazon.com/apigateway/latest/developerguide/security_iam_service-with-iam.html,"Filters access by endpoint type. Available during the CreateDomainName, UpdateDomainName, CreateApi, and UpdateApi operations",ArrayOfString
43,apigateway:Request/MtlsTrustStoreUri,https://docs.aws.amazon.com/apigateway/latest/developerguide/security_iam_service-with-iam.html,Filters access by URI of the truststore used for mutual TLS authentication. Available during the CreateDomainName and UpdateDomainName operations,String
44,apigateway:Request/MtlsTrustStoreVersion,https://docs.aws.amazon.com/apigateway/latest/developerguide/security_iam_service-with-iam.html,Filters access by version of the truststore used for mutual TLS authentication. Available during the CreateDomainName and UpdateDomainName operations,String
45,apigateway:Request/RouteAuthorizationType,https://docs.aws.amazon.com/apigateway/latest/developerguide/security_iam_service-with-iam.html,"Filters access by authorization type, for example NONE, AWS_IAM, CUSTOM, JWT, COGNITO_USER_POOLS. Available during the CreateMethod and PutMethod operations Also available as a collection during import",ArrayOfString
46,apigateway:Request/SecurityPolicy,https://docs.aws.amazon.com/apigateway/latest/developerguide/security_iam_service-with-iam.html,Filters access by TLS version. Available during the CreateDomain and UpdateDomain operations,ArrayOfString
47,apigateway:Request/StageName,https://docs.aws.amazon.com/apigateway/latest/developerguide/security_iam_service-with-iam.html,Filters access by stage name of the deployment that you attempt to create. Available during the CreateDeployment operation,String
48,apigateway:Resource/AccessLoggingDestination,https://docs.aws.amazon.com/apigateway/latest/developerguide/security_iam_service-with-iam.html,Filters access by access log destination of the current Stage resource. Available during the UpdateStage and DeleteStage operations,String
49,apigateway:Resource/AccessLoggingFormat,https://docs.aws.amazon.com/apigateway/latest/developerguide/security_iam_service-with-iam.html,Filters access by access log format of the current Stage resource. Available during the UpdateStage and DeleteStage operations,String
50,apigateway:Resource/ApiKeyRequired,https://docs.aws.amazon.com/apigateway/latest/developerguide/security_iam_service-with-iam.html,Filters access by the requirement of API key for the existing Route resource. Available during the UpdateRoute and DeleteRoute operations. Also available as a collection during reimport,ArrayOfBool
51,apigateway:Resource/ApiName,https://docs.aws.amazon.com/apigateway/latest/developerguide/security_iam_service-with-iam.html,Filters access by API name of the existing RestApi resource. Available during UpdateRestApi and DeleteRestApi operations,String
52,apigateway:Resource/AuthorizerType,https://docs.aws.amazon.com/apigateway/latest/developerguide/security_iam_service-with-iam.html,"Filters access by the current type of authorizer, for example REQUEST or JWT. Available during UpdateAuthorizer and DeleteAuthorizer operations. Also available during import and reimport as an ArrayOfString",ArrayOfString
53,apigateway:Resource/AuthorizerUri,https://docs.aws.amazon.com/apigateway/latest/developerguide/security_iam_service-with-iam.html,Filters access by URI of a Lambda authorizer function. Available during UpdateAuthorizer and DeleteAuthorizer operations. Also available during reimport as an ArrayOfString,ArrayOfString
54,apigateway:Resource/CognitoUserPoolProviderArn,https://docs.aws.amazon.com/apigateway/latest/developerguide/security_iam_service-with-iam.html,Filters access by Cognito user pool provider ARN. Available during CreateAuthorizer and UpdateAuthorizer,ARN
55,apigateway:Resource/DisableExecuteApiEndpoint,https://docs.aws.amazon.com/apigateway/latest/developerguide/security_iam_service-with-iam.html,Filters access by status of the default execute-api endpoint of the current RestApi resource. Available during UpdateRestApi and DeleteRestApi operations,Bool
56,apigateway:Resource/EndpointType,https://docs.aws.amazon.com/apigateway/latest/developerguide/security_iam_service-with-iam.html,"Filters access by endpoint type. Available during the UpdateDomainName, DeleteDomainName, UpdateApi, and DeleteApi operations",ArrayOfString
57,apigateway:Resource/MtlsTrustStoreUri,https://docs.aws.amazon.com/apigateway/latest/developerguide/security_iam_service-with-iam.html,Filters access by URI of the truststore used for mutual TLS authentication. Available during UpdateDomainName and DeleteDomainName operations,String
58,apigateway:Resource/MtlsTrustStoreVersion,https://docs.aws.amazon.com/apigateway/latest/developerguide/security_iam_service-with-iam.html,Filters access by version of the truststore used for mutual TLS authentication. Available during UpdateDomainName and DeleteDomainName operations,String
59,apigateway:Resource/RouteAuthorizationType,https://docs.aws.amazon.com/apigateway/latest/developerguide/security_iam_service-with-iam.html,"Filters access by authorization type of the existing Method resource, for example NONE, AWS_IAM, CUSTOM, JWT, COGNITO_USER_POOLS. Available during the PutMethod and DeleteMethod operations. Also available as a collection during reimport",ArrayOfString
60,apigateway:Resource/SecurityPolicy,https://docs.aws.amazon.com/apigateway/latest/developerguide/security_iam_service-with-iam.html,Filters access by TLS version. Available during UpdateDomain and DeleteDomain operations,ArrayOfString
61,application-autoscaling:scalable-dimension,https://docs.aws.amazon.com/autoscaling/application/userguide/security_iam_service-with-iam.html#security_iam_service-with-iam-id-based-policies-conditionkeys,Filters access by the scalable dimension that is passed in the request,String
62,application-autoscaling:service-namespace,https://docs.aws.amazon.com/autoscaling/application/userguide/security_iam_service-with-iam.html#security_iam_service-with-iam-id-based-policies-conditionkeys,Filters access by the service namespace that is passed in the request,String
63,apprunner:AutoScalingConfigurationArn,${UserGuideDocPage}security_iam_service-with-iam.html#security_iam_service-with-iam-resource-based-policies,Filters access by the CreateService and UpdateService actions based on the ARN of an associated AutoScalingConfiguration resource,ARN
64,apprunner:ConnectionArn,${UserGuideDocPage}security_iam_service-with-iam.html#security_iam_service-with-iam-resource-based-policies,Filters access by the CreateService and UpdateService actions based on the ARN of an associated Connection resource,ARN
65,apprunner:ObservabilityConfigurationArn,${UserGuideDocPage}security_iam_service-with-iam.html#security_iam_service-with-iam-resource-based-policies,Filters access by the CreateService and UpdateService actions based on the ARN of an associated ObservabilityConfiguration resource,ARN
66,apprunner:ServiceArn,${UserGuideDocPage}security_iam_service-with-iam.html#security_iam_service-with-iam-resource-based-policies,Filters access by the CreateVpcIngressConnection action based on the ARN of an associated Service resource,ARN
67,apprunner:VpcConnectorArn,${UserGuideDocPage}security_iam_service-with-iam.html#security_iam_service-with-iam-resource-based-policies,Filters access by the CreateService and UpdateService actions based on the ARN of an associated VpcConnector resource,ARN
68,apprunner:VpcEndpointId,${UserGuideDocPage}security_iam_service-with-iam.html#security_iam_service-with-iam-resource-based-policies,Filters access by the CreateVpcIngressConnection and UpdateVpcIngressConnection actions based on the VPC Endpoint in the request,String
69,apprunner:VpcId,${UserGuideDocPage}security_iam_service-with-iam.html#security_iam_service-with-iam-resource-based-policies,Filters access by the CreateVpcIngressConnection and UpdateVpcIngressConnection actions based on the VPC in the request,String
70,appstream:userId,https://docs.aws.amazon.com/appstream2/latest/developerguide/external-identity-providers-setting-up-saml.html#external-identity-providers-embed-inline-policy-for-IAM-role,Filters access by the ID of the AppStream 2.0 user,String
71,appsync:Visibility,iam-policy-structure.html#amazon-appsync-keys,Filters access by the visibility of an API,String
72,arc-zonal-shift:ResourceIdentifier,https://docs.aws.amazon.com/service-authorization/latest/reference/list_amazonroute53applicationrecoverycontroller-zonalshift.html#amazonroute53applicationrecoverycontroller-zonalshift-policy-keys,Filters access by the resource identifier of the managed resource,String
73,artifact:ReportCategory,https://docs.aws.amazon.com/artifact/latest/ug/using-condition-keys.html,Filters access by which category reports are associated with,String
74,artifact:ReportSeries,https://docs.aws.amazon.com/artifact/latest/ug/using-condition-keys.html,Filters access by which series reports are associated with,String
75,autoscaling:CapacityReservationIds,https://docs.aws.amazon.com/autoscaling/latest/userguide/control-access-using-iam.html#policy-auto-scaling-condition-keys,Filters access based on the Capacity Reservation IDs,ArrayOfString
76,autoscaling:CapacityReservationResourceGroupArns,https://docs.aws.amazon.com/autoscaling/latest/userguide/control-access-using-iam.html#policy-auto-scaling-condition-keys,Filters access based on the ARN of a Capacity Reservation resource group,ArrayOfString
77,autoscaling:ImageId,https://docs.aws.amazon.com/autoscaling/latest/userguide/control-access-using-iam.html#policy-auto-scaling-condition-keys,Filters access based on the AMI ID for the launch configuration,String
78,autoscaling:InstanceType,https://docs.aws.amazon.com/autoscaling/latest/userguide/control-access-using-iam.html#policy-auto-scaling-condition-keys,Filters access based on the instance type for the launch configuration,String
79,autoscaling:InstanceTypes,https://docs.aws.amazon.com/autoscaling/latest/userguide/control-access-using-iam.html#policy-auto-scaling-condition-keys,Filters access based on the instance types present as overrides to a launch template for a mixed instances policy. Use it to qualify which instance types can be explicitly defined in the policy,String
80,autoscaling:LaunchConfigurationName,https://docs.aws.amazon.com/autoscaling/latest/userguide/control-access-using-iam.html#policy-auto-scaling-condition-keys,Filters access based on the name of a launch configuration,String
81,autoscaling:LaunchTemplateVersionSpecified,https://docs.aws.amazon.com/autoscaling/latest/userguide/control-access-using-iam.html#policy-auto-scaling-condition-keys,Filters access based on whether users can specify any version of a launch template or only the Latest or Default version,Bool
82,autoscaling:LoadBalancerNames,https://docs.aws.amazon.com/autoscaling/latest/userguide/control-access-using-iam.html#policy-auto-scaling-condition-keys,Filters access based on the name of the load balancer,ArrayOfString
83,autoscaling:MaxSize,https://docs.aws.amazon.com/autoscaling/latest/userguide/control-access-using-iam.html#policy-auto-scaling-condition-keys,Filters access based on the maximum scaling size in the request,Numeric
84,autoscaling:MetadataHttpEndpoint,https://docs.aws.amazon.com/autoscaling/latest/userguide/control-access-using-iam.html#policy-auto-scaling-condition-keys,Filters access based on whether the HTTP endpoint is enabled for the instance metadata service,String
85,autoscaling:MetadataHttpPutResponseHopLimit,https://docs.aws.amazon.com/autoscaling/latest/userguide/control-access-using-iam.html#policy-auto-scaling-condition-keys,Filters access based on the allowed number of hops when calling the instance metadata service,Numeric
86,autoscaling:MetadataHttpTokens,https://docs.aws.amazon.com/autoscaling/latest/userguide/control-access-using-iam.html#policy-auto-scaling-condition-keys,Filters access based on whether tokens are required when calling the instance metadata service (optional or required),String
87,autoscaling:MinSize,https://docs.aws.amazon.com/autoscaling/latest/userguide/control-access-using-iam.html#policy-auto-scaling-condition-keys,Filters access based on the minimum scaling size in the request,Numeric
88,autoscaling:ResourceTag/${TagKey},https://docs.aws.amazon.com/autoscaling/latest/userguide/control-access-using-iam.html#policy-auto-scaling-condition-keys,Filters access based on the tags associated with the resource,String
89,autoscaling:SpotPrice,https://docs.aws.amazon.com/autoscaling/latest/userguide/control-access-using-iam.html#policy-auto-scaling-condition-keys,Filters access based on the price for Spot Instances for the launch configuration,Numeric
90,autoscaling:TargetGroupARNs,https://docs.aws.amazon.com/autoscaling/latest/userguide/control-access-using-iam.html#policy-auto-scaling-condition-keys,Filters access based on the ARN of a target group,ArrayOfARN
91,autoscaling:TrafficSourceIdentifiers,https://docs.aws.amazon.com/autoscaling/latest/userguide/control-access-using-iam.html#policy-auto-scaling-condition-keys,Filters access based on the identifiers of the traffic sources,ArrayOfString
92,autoscaling:VPCZoneIdentifiers,https://docs.aws.amazon.com/autoscaling/latest/userguide/control-access-using-iam.html#policy-auto-scaling-condition-keys,Filters access based on the identifier of a VPC zone,ArrayOfString
93,aws-marketplace:AgreementType,https://docs.aws.amazon.com/marketplace/latest/buyerguide/buyer-iam-users-groups-policies.html,Filters access by the type of the agreement,ArrayOfString
94,aws-marketplace:Intent,https://docs.aws.amazon.com/marketplace-catalog/latest/api-reference/api-access-control.html,Filters access by the Intent parameter in the StartChangeSet request,String
95,aws-marketplace:PartyType,https://docs.aws.amazon.com/marketplace/latest/buyerguide/buyer-iam-users-groups-policies.html,Filters access by the party type of the agreement,String
96,aws-marketplace:ProductId,https://docs.aws.amazon.com/marketplace/latest/buyerguide/buyer-iam-users-groups-policies.html,Filters access by product id for AWS Marketplace RedHat OpenShift and Bedrock Products. Note: Using this condition key will not restrict access to products in AWS Marketplace,ArrayOfString
97,aws:RequestTag/${TagKey},"",Filters access based on the presence of tag key-value pairs in the request,String
98,aws:ResourceTag/${TagKey},"",Filters access based on tag key-value pairs attached to the resource,String
99,aws:TagKeys,"",Filters access based on the presence of tag keys in the request,ArrayOfString
100,backup:ChangeableForDays,https://docs.aws.amazon.com/aws-backup/latest/devguide/access-control.html#amazon-backup-keys,Filters access by the value of the ChangeableForDays parameter,Numeric
101,backup:CopyTargetOrgPaths,https://docs.aws.amazon.com/aws-backup/latest/devguide/access-control.html#amazon-backup-keys,Filters access by the organization unit,ArrayOfString
102,backup:CopyTargets,https://docs.aws.amazon.com/aws-backup/latest/devguide/access-control.html#amazon-backup-keys,Filters access by the ARN of an backup vault,ArrayOfARN
103,backup:FrameworkArns,https://docs.aws.amazon.com/aws-backup/latest/devguide/access-control.html#amazon-backup-keys,Filters access by the Framework ARNs,ArrayOfARN
104,backup:Index,https://docs.aws.amazon.com/aws-backup/latest/devguide/access-control.html#amazon-backup-keys,Filters access by the value of Index parameter,String
105,backup:MaxRetentionDays,https://docs.aws.amazon.com/aws-backup/latest/devguide/access-control.html#amazon-backup-keys,Filters access by the value of the MaxRetentionDays parameter,Numeric
106,backup:MinRetentionDays,https://docs.aws.amazon.com/aws-backup/latest/devguide/access-control.html#amazon-backup-keys,Filters access by the value of the MinRetentionDays parameter,Numeric
107,batch:AWSLogsCreateGroup,https://docs.aws.amazon.com/service-authorization/latest/reference/list_awsbatch.html#awsbatch-policy-keys,Filters access by the specified logging driver to determine whether awslogs group will be created for the logs,Bool
108,batch:AWSLogsGroup,https://docs.aws.amazon.com/service-authorization/latest/reference/list_awsbatch.html#awsbatch-policy-keys,Filters access by the awslogs group where the logs are located,String
109,batch:AWSLogsRegion,https://docs.aws.amazon.com/service-authorization/latest/reference/list_awsbatch.html#awsbatch-policy-keys,Filters access by the region where the logs are sent to,String
110,batch:AWSLogsStreamPrefix,https://docs.aws.amazon.com/service-authorization/latest/reference/list_awsbatch.html#awsbatch-policy-keys,Filters access by the awslogs log stream prefix,String
111,batch:EKSImage,https://docs.aws.amazon.com/service-authorization/latest/reference/list_awsbatch.html#awsbatch-policy-keys,Filters access by the image used to start a container for an Amazon EKS job,String
112,batch:EKSNamespace,https://docs.aws.amazon.com/service-authorization/latest/reference/list_awsbatch.html#awsbatch-policy-keys,Filters access by the namespace of a cluster used to run the pod for an Amazon EKS job,String
