condition_key_id,name,reference_url,description,type
826,sagemaker:WorkteamType,https://docs.aws.amazon.com/IAM/latest/UserGuide/list_amazonsagemaker.html#amazonsagemaker-policy-keys,"Filters access by the workteam type associated to the request. This can be public-crowd, private-crowd or vendor-crowd",String
827,saml:aud,https://docs.aws.amazon.com/IAM/latest/UserGuide/reference_policies_iam-condition-keys.html#ck_aud,Filters access by the endpoint URL to which SAML assertions are presented,String
828,saml:cn,https://docs.aws.amazon.com/IAM/latest/UserGuide/reference_policies_iam-condition-keys.html#ck_cn,Filters access by the eduOrg attribute,ArrayOfString
829,saml:commonName,https://docs.aws.amazon.com/IAM/latest/UserGuide/reference_policies_iam-condition-keys.html#ck_commonname,Filters access by the commonName attribute,String
830,saml:doc,https://docs.aws.amazon.com/IAM/latest/UserGuide/reference_policies_iam-condition-keys.html#ck_doc,Filters access by on the principal that was used to assume the role,String
831,saml:eduorghomepageuri,https://docs.aws.amazon.com/IAM/latest/UserGuide/reference_policies_iam-condition-keys.html#ck_eduorghomepageuri,Filters access by the eduOrg attribute,ArrayOfString
832,saml:eduorgidentityauthnpolicyuri,https://docs.aws.amazon.com/IAM/latest/UserGuide/reference_policies_iam-condition-keys.html#ck_aud,Filters access by the eduOrg attribute,ArrayOfString
833,saml:eduorglegalname,https://docs.aws.amazon.com/IAM/latest/UserGuide/reference_policies_iam-condition-keys.html#ck_eduorglegalname,Filters access by the eduOrg attribute,ArrayOfString
834,saml:eduorgsuperioruri,https://docs.aws.amazon.com/IAM/latest/UserGuide/reference_policies_iam-condition-keys.html#ck_eduorgsuperioruri,Filters access by the eduOrg attribute,ArrayOfString
835,saml:eduorgwhitepagesuri,https://docs.aws.amazon.com/IAM/latest/UserGuide/reference_policies_iam-condition-keys.html#ck_eduorgwhitepagesuri,Filters access by the eduOrg attribute,ArrayOfString
836,saml:edupersonaffiliation,https://docs.aws.amazon.com/IAM/latest/UserGuide/reference_policies_iam-condition-keys.html#ck_edupersonaffiliation,Filters access by the eduPerson attribute,ArrayOfString
837,saml:edupersonassurance,https://docs.aws.amazon.com/IAM/latest/UserGuide/reference_policies_iam-condition-keys.html#ck_edupersonassurance,Filters access by the eduPerson attribute,ArrayOfString
838,saml:edupersonentitlement,https://docs.aws.amazon.com/IAM/latest/UserGuide/reference_policies_iam-condition-keys.html#ck_edupersonentitlement,Filters access by the eduPerson attribute,ArrayOfString
839,saml:edupersonnickname,https://docs.aws.amazon.com/IAM/latest/UserGuide/reference_policies_iam-condition-keys.html#ck_edupersonnickname,Filters access by the eduPerson attribute,ArrayOfString
840,saml:edupersonorgdn,https://docs.aws.amazon.com/IAM/latest/UserGuide/reference_policies_iam-condition-keys.html#ck_edupersonorgdn,Filters access by the eduPerson attribute,String
841,saml:edupersonorgunitdn,https://docs.aws.amazon.com/IAM/latest/UserGuide/reference_policies_iam-condition-keys.html#ck_edupersonorgunitdn,Filters access by the eduPerson attribute,ArrayOfString
842,saml:edupersonprimaryaffiliation,https://docs.aws.amazon.com/IAM/latest/UserGuide/reference_policies_iam-condition-keys.html#ck_edupersonprimaryaffiliation,Filters access by the eduPerson attribute,String
843,saml:edupersonprimaryorgunitdn,https://docs.aws.amazon.com/IAM/latest/UserGuide/reference_policies_iam-condition-keys.html#ck_edupersonprimaryorgunitdn,Filters access by the eduPerson attribute,String
844,saml:edupersonprincipalname,https://docs.aws.amazon.com/IAM/latest/UserGuide/reference_policies_iam-condition-keys.html#ck_edupersonprincipalname,Filters access by the eduPerson attribute,String
845,saml:edupersonscopedaffiliation,https://docs.aws.amazon.com/IAM/latest/UserGuide/reference_policies_iam-condition-keys.html#ck_edupersonscopedaffiliation,Filters access by the eduPerson attribute,ArrayOfString
846,saml:edupersontargetedid,https://docs.aws.amazon.com/IAM/latest/UserGuide/reference_policies_iam-condition-keys.html#ck_edupersontargetedid,Filters access by the eduPerson attribute,ArrayOfString
847,saml:givenName,https://docs.aws.amazon.com/IAM/latest/UserGuide/reference_policies_iam-condition-keys.html#ck_givenname,Filters access by the givenName attribute,String
848,saml:iss,https://docs.aws.amazon.com/IAM/latest/UserGuide/reference_policies_iam-condition-keys.html#ck_iss,"Filters access by on the issuer, which is represented by a URN",String
849,saml:mail,https://docs.aws.amazon.com/IAM/latest/UserGuide/reference_policies_iam-condition-keys.html#ck_mail,Filters access by the mail attribute,String
850,saml:name,https://docs.aws.amazon.com/IAM/latest/UserGuide/reference_policies_iam-condition-keys.html#ck_name,Filters access by the name attribute,String
851,saml:namequalifier,https://docs.aws.amazon.com/IAM/latest/UserGuide/reference_policies_iam-condition-keys.html#ck_namequalifier,"Filters access by the hash value of the issuer, account ID, and friendly name",String
852,saml:organizationStatus,https://docs.aws.amazon.com/IAM/latest/UserGuide/reference_policies_iam-condition-keys.html#ck_organizationstatus,Filters access by the organizationStatus attribute,String
853,saml:primaryGroupSID,https://docs.aws.amazon.com/IAM/latest/UserGuide/reference_policies_iam-condition-keys.html#ck_primarygroupsid,Filters access by the primaryGroupSID attribute,String
854,saml:sub,https://docs.aws.amazon.com/IAM/latest/UserGuide/reference_policies_iam-condition-keys.html#ck_sub,Filters access by the subject of the claim (the SAML user ID),String
855,saml:sub_type,https://docs.aws.amazon.com/IAM/latest/UserGuide/reference_policies_iam-condition-keys.html#ck_subtype,"Filters access by the value persistent, transient, or the full Format URI",String
856,saml:surname,https://docs.aws.amazon.com/IAM/latest/UserGuide/reference_policies_iam-condition-keys.html#ck_surname,Filters access by the surname attribute,String
857,saml:uid,https://docs.aws.amazon.com/IAM/latest/UserGuide/reference_policies_iam-condition-keys.html#ck_uid,Filters access by the uid attribute,String
858,saml:x500UniqueIdentifier,https://docs.aws.amazon.com/IAM/latest/UserGuide/reference_policies_iam-condition-keys.html#ck_x500uniqueidentifier,Filters access by the uid attribute,String
859,secretsmanager:AddReplicaRegions,https://docs.aws.amazon.com/secretsmanager/latest/userguide/reference_iam-permissions.html#iam-contextkeys,Filters access by the list of Regions in which to replicate the secret,ArrayOfString
860,secretsmanager:BlockPublicPolicy,https://docs.aws.amazon.com/secretsmanager/latest/userguide/reference_iam-permissions.html#iam-contextkeys,Filters access by whether the resource policy blocks broad AWS account access,Bool
861,secretsmanager:Description,https://docs.aws.amazon.com/secretsmanager/latest/userguide/reference_iam-permissions.html#iam-contextkeys,Filters access by the description text in the request,String
862,secretsmanager:ForceDeleteWithoutRecovery,https://docs.aws.amazon.com/secretsmanager/latest/userguide/reference_iam-permissions.html#iam-contextkeys,Filters access by whether the secret is to be deleted immediately without any recovery window,Bool
863,secretsmanager:ForceOverwriteReplicaSecret,https://docs.aws.amazon.com/secretsmanager/latest/userguide/reference_iam-permissions.html#iam-contextkeys,Filters access by whether to overwrite a secret with the same name in the destination Region,Bool
864,secretsmanager:KmsKeyArn,https://docs.aws.amazon.com/secretsmanager/latest/userguide/reference_iam-permissions.html#iam-contextkeys,Filters access by the key ARN of the KMS key in the request,ARN
865,ecs:enable-execute-command,https://docs.aws.amazon.com/AmazonECS/latest/developerguide/security_iam_service-with-iam.html#security_iam_service-with-iam-id-based-policies-conditionkeys,Filters access by the execute-command capability of your Amazon ECS task or Amazon ECS service,String
866,secretsmanager:KmsKeyId,https://docs.aws.amazon.com/secretsmanager/latest/userguide/reference_iam-permissions.html#iam-contextkeys,Filters access by the key identifier of the KMS key in the request. Deprecated: Use secretsmanager:KmsKeyArn,String
867,secretsmanager:ModifyRotationRules,https://docs.aws.amazon.com/secretsmanager/latest/userguide/reference_iam-permissions.html#iam-contextkeys,Filters access by whether the rotation rules of the secret are to be modified,Bool
868,secretsmanager:Name,https://docs.aws.amazon.com/secretsmanager/latest/userguide/reference_iam-permissions.html#iam-contextkeys,Filters access by the friendly name of the secret in the request,String
869,secretsmanager:RecoveryWindowInDays,https://docs.aws.amazon.com/secretsmanager/latest/userguide/reference_iam-permissions.html#iam-contextkeys,Filters access by the number of days that Secrets Manager waits before it can delete the secret,Numeric
870,secretsmanager:ResourceTag/tag-key,https://docs.aws.amazon.com/secretsmanager/latest/userguide/reference_iam-permissions.html#iam-contextkeys,Filters access by a tag key and value pair,String
871,secretsmanager:RotateImmediately,https://docs.aws.amazon.com/secretsmanager/latest/userguide/reference_iam-permissions.html#iam-contextkeys,Filters access by whether the secret is to be rotated immediately,Bool
872,secretsmanager:RotationLambdaARN,https://docs.aws.amazon.com/secretsmanager/latest/userguide/reference_iam-permissions.html#iam-contextkeys,Filters access by the ARN of the rotation Lambda function in the request,ARN
873,secretsmanager:SecretId,https://docs.aws.amazon.com/secretsmanager/latest/userguide/reference_iam-permissions.html#iam-contextkeys,Filters access by the SecretID value in the request,ARN
874,ecs:enable-service-connect,https://docs.aws.amazon.com/AmazonECS/latest/developerguide/security_iam_service-with-iam.html#security_iam_service-with-iam-id-based-policies-conditionkeys,Filters access by the enable field value in the Service Connect configuration,String
875,secretsmanager:SecretPrimaryRegion,https://docs.aws.amazon.com/secretsmanager/latest/userguide/reference_iam-permissions.html#iam-contextkeys,Filters access by primary region in which the secret is created,String
876,secretsmanager:VersionId,https://docs.aws.amazon.com/secretsmanager/latest/userguide/reference_iam-permissions.html#iam-contextkeys,Filters access by the unique identifier of the version of the secret in the request,String
877,secretsmanager:VersionStage,https://docs.aws.amazon.com/secretsmanager/latest/userguide/reference_iam-permissions.html#iam-contextkeys,Filters access by the list of version stages in the request,String
878,secretsmanager:resource/AllowRotationLambdaArn,https://docs.aws.amazon.com/secretsmanager/latest/userguide/reference_iam-permissions.html#iam-contextkeys,Filters access by the ARN of the rotation Lambda function associated with the secret,ARN
879,securityhub:ASFFSyntaxPath/${ASFFSyntaxPath},https://docs.aws.amazon.com/IAM/latest/UserGuide/reference_policies_condition-keys.html#condition-keys-asffsyntaxpath,Filters access by the specified fields and values in the request,String
880,securityhub:OCSFSyntaxPath/${OCSFSyntaxPath},https://docs.aws.amazon.com/IAM/latest/UserGuide/reference_policies_condition-keys.html#condition-keys-ocsfsyntaxpath,Filters access by the specified fields and values in the request,String
881,securityhub:TargetAccount,https://docs.aws.amazon.com/securityhub/latest/userguide/securityhub-access.html#conditions,Filters access by the AwsAccountId field that is specified in the request,String
882,serverlessrepo:applicationType,https://docs.aws.amazon.com/IAM/latest/UserGuide/applications.html,Filters access by application type,String
883,ecs:enable-vpc-lattice,https://docs.aws.amazon.com/AmazonECS/latest/developerguide/security_iam_service-with-iam.html#security_iam_service-with-iam-id-based-policies-conditionkeys,Filters access by the VPC lattice capability of your Amazon ECS service,String
884,servicecatalog:Resource,,,
885,servicecatalog:ResourceType,,,
886,servicecatalog:accountLevel,,,
887,servicecatalog:roleLevel,,,
888,ecs:fargate-ephemeral-storage-kms-key,https://docs.aws.amazon.com/AmazonECS/latest/developerguide/security_iam_service-with-iam.html#security_iam_service-with-iam-id-based-policies-conditionkeys,Filters access by the AWS KMS key id provided in the request,String
889,servicecatalog:userLevel,,,
890,servicediscovery:NamespaceArn,https://docs.aws.amazon.com/cloud-map/latest/dg/access-control-overview.html#specifying-conditions,Filters access by specifying the Amazon Resource Name (ARN) for the related namespace,ARN
891,servicediscovery:NamespaceName,https://docs.aws.amazon.com/cloud-map/latest/dg/access-control-overview.html#specifying-conditions,Filters access by specifying the name of the related namespace,String
892,servicediscovery:ServiceArn,https://docs.aws.amazon.com/cloud-map/latest/dg/access-control-overview.html#specifying-conditions,Filters access by specifying the Amazon Resource Name (ARN) for the related service,ARN
893,servicediscovery:ServiceName,https://docs.aws.amazon.com/cloud-map/latest/dg/access-control-overview.html#specifying-conditions,Filters access by specifying the name of the related service,String
894,ecs:namespace,https://docs.aws.amazon.com/AmazonECS/latest/developerguide/security_iam_service-with-iam.html#security_iam_service-with-iam-id-based-policies-conditionkeys,Filters access by the ARN of AWS Cloud Map namespace which is defined in the Service Connect Configuration,ARN
895,servicequotas:service,https://docs.aws.amazon.com/servicequotas/latest/userguide/identity-access-management.html#condition-keys,Filters access by the specified AWS service,String
896,ses:AddonSubscriptionArn,https://docs.aws.amazon.com/IAM/latest/UserGuide/list_amazonsesmailmanager.html#amazonsesmailmanager-policy-keys,Filters access by SES Addon Subscription ARN,ARN
897,ecs:privileged,https://docs.aws.amazon.com/AmazonECS/latest/developerguide/security_iam_service-with-iam.html#security_iam_service-with-iam-id-based-policies-conditionkeys,Filters access by the privileged field provided in the request,String
898,ecs:propagate-tags,https://docs.aws.amazon.com/AmazonECS/latest/developerguide/security_iam_service-with-iam.html#security_iam_service-with-iam-id-based-policies-conditionkeys,Filters access by the tag propagation configuration of your Amazon ECS task or Amazon ECS service,String
899,ecs:service,https://docs.aws.amazon.com/AmazonECS/latest/developerguide/security_iam_service-with-iam.html#security_iam_service-with-iam-id-based-policies-conditionkeys,Filters access by the ARN of an Amazon ECS service,ARN
900,ecs:subnet,https://docs.aws.amazon.com/AmazonECS/latest/developerguide/security_iam_service-with-iam.html#security_iam_service-with-iam-id-based-policies-conditionkeys,Filters access by the subnet configuration of your Amazon ECS task or Amazon ECS service that uses awsvpc network mode,ArrayOfString
901,ses:ApiVersion,https://docs.aws.amazon.com/IAM/latest/UserGuide/list_amazonses.html#amazonses-policy-keys,Filters access by the SES API version,String
902,ecs:task,https://docs.aws.amazon.com/AmazonECS/latest/developerguide/security_iam_service-with-iam.html#security_iam_service-with-iam-id-based-policies-conditionkeys,Filters access by the ARN of an Amazon ECS task,ARN
903,ecs:task-cpu,https://docs.aws.amazon.com/AmazonECS/latest/developerguide/security_iam_service-with-iam.html#security_iam_service-with-iam-id-based-policies-conditionkeys,"Filters access by the task cpu, as an integer with 1024 = 1 vCPU, provided in the request",Numeric
904,ecs:task-definition,https://docs.aws.amazon.com/AmazonECS/latest/developerguide/security_iam_service-with-iam.html#security_iam_service-with-iam-id-based-policies-conditionkeys,Filters access by the ARN of an Amazon ECS task definition,ARN
905,ecs:task-memory,https://docs.aws.amazon.com/AmazonECS/latest/developerguide/security_iam_service-with-iam.html#security_iam_service-with-iam-id-based-policies-conditionkeys,"Filters access by the task memory, as an integer representing MiB, provided in the request",Numeric
906,eks:accessEntryType,https://docs.aws.amazon.com/eks/latest/userguide/security_iam_service-with-iam.html#security_iam_service-with-iam-id-based-policies,Filters access by the access entry type present in the access entry requests the user makes to the EKS service,String
907,eks:accessScope,https://docs.aws.amazon.com/eks/latest/userguide/security_iam_service-with-iam.html#security_iam_service-with-iam-id-based-policies,Filters access by the accessScope present in the associate / disassociate access policy requests the user makes to the EKS service,String
908,eks:authenticationMode,https://docs.aws.amazon.com/eks/latest/userguide/security_iam_service-with-iam.html#security_iam_service-with-iam-id-based-policies,Filters access by the authenticationMode present in the create / update cluster request,String
909,eks:blockStorageEnabled,https://docs.aws.amazon.com/eks/latest/userguide/security_iam_service-with-iam.html#security_iam_service-with-iam-id-based-policies,Filters access by the block storage enabled parameter in the create / update cluster request,Bool
910,ses:ExportSourceType,https://docs.aws.amazon.com/IAM/latest/UserGuide/list_amazonses.html#amazonses-policy-keys,Filters access by the export source type,String
911,eks:bootstrapClusterCreatorAdminPermissions,https://docs.aws.amazon.com/eks/latest/userguide/security_iam_service-with-iam.html#security_iam_service-with-iam-id-based-policies,Filters access by the bootstrapClusterCreatorAdminPermissions present in the create cluster request,Bool
912,eks:bootstrapSelfManagedAddons,https://docs.aws.amazon.com/eks/latest/userguide/security_iam_service-with-iam.html#security_iam_service-with-iam-id-based-policies,Filters access by the bootstrapSelfManagedAddons present in the create cluster request,Bool
913,eks:clientId,https://docs.aws.amazon.com/eks/latest/userguide/security_iam_service-with-iam.html#security_iam_service-with-iam-id-based-policies,Filters access by the clientId present in the associateIdentityProviderConfig request the user makes to the EKS service,String
914,eks:clusterName,https://docs.aws.amazon.com/eks/latest/userguide/security_iam_service-with-iam.html#security_iam_service-with-iam-id-based-policies,Filters access by the clusterName present in the access entry requests the user makes to the EKS service,String
915,eks:computeConfigEnabled,https://docs.aws.amazon.com/eks/latest/userguide/security_iam_service-with-iam.html#security_iam_service-with-iam-id-based-policies,Filters access by the compute config enabled parameter in the create / update cluster request,Bool
916,eks:elasticLoadBalancingEnabled,https://docs.aws.amazon.com/eks/latest/userguide/security_iam_service-with-iam.html#security_iam_service-with-iam-id-based-policies,Filters access by the elastic load balancing enabled parameter in the create / update cluster request,Bool
917,eks:issuerUrl,https://docs.aws.amazon.com/eks/latest/userguide/security_iam_service-with-iam.html#security_iam_service-with-iam-id-based-policies,Filters access by the issuerUrl present in the associateIdentityProviderConfig request the user makes to the EKS service,String
918,ses:FeedbackAddress,https://docs.aws.amazon.com/IAM/latest/UserGuide/list_amazonses.html#amazonses-policy-keys,"Filters access by the ""Return-Path"" address, which specifies where bounces and complaints are sent by email feedback forwarding",String
919,ses:FromAddress,https://docs.aws.amazon.com/IAM/latest/UserGuide/list_amazonses.html#amazonses-policy-keys,"Filters access by the ""From"" address of a message",String
920,ses:FromDisplayName,https://docs.aws.amazon.com/IAM/latest/UserGuide/list_amazonses.html#amazonses-policy-keys,"Filters access by the ""From"" address that is used as the display name of a message",String
921,ses:MailManagerIngressPointType,https://docs.aws.amazon.com/IAM/latest/UserGuide/list_amazonsesmailmanager.html#amazonsesmailmanager-policy-keys,"Filters access by SES Mail Manager ingress point type, for example OPEN or AUTH",String
922,proton:EnvironmentTemplate,https://docs.aws.amazon.com/IAM/latest/UserGuide/reference_policies_condition-keys.html,Filters access by specified environment template related to resource,String
923,proton:ServiceTemplate,https://docs.aws.amazon.com/IAM/latest/UserGuide/reference_policies_condition-keys.html,Filters access by specified service template related to resource,String
924,qapps:AppIsPublished,https://docs.aws.amazon.com/amazonq/latest/qbusiness-ug/security-iam.html,Filters access by whether Q App is published,String
925,qapps:SessionIsShared,https://docs.aws.amazon.com/amazonq/latest/qbusiness-ug/security-iam.html,Filters access by whether Q App Session is shared,String
926,qapps:UserIsAppOwner,https://docs.aws.amazon.com/amazonq/latest/qbusiness-ug/security-iam.html,Filters access by whether requester is Q App owner,String
927,qapps:UserIsSessionModerator,https://docs.aws.amazon.com/amazonq/latest/qbusiness-ug/security-iam.html,Filters access by whether requester is Q App Session moderator,String
928,qldb:Purge,https://docs.aws.amazon.com/IAM/latest/UserGuide/reference_policies_condition-keys.html#condition-keys-purge,Filters access by the value of purge that is specified in a PartiQL DROP statement,String
929,quicksight:AllowedEmbeddingDomains,https://docs.aws.amazon.com/quicksight/latest/user/embedded-dashboards-for-authenticated-users-step-1.html,Filters access by the allowed embedding domains,ArrayOfString
930,quicksight:DirectoryType,https://docs.aws.amazon.com/quicksight/latest/user/security-scp.html,Filters access by the user management options,String
931,quicksight:Edition,https://docs.aws.amazon.com/quicksight/latest/user/security-scp.html,Filters access by the edition of QuickSight,String
932,quicksight:Group,https://docs.aws.amazon.com/quicksight/latest/user/iam-actions.html,Filters access by QuickSight group ARN,ARN
933,quicksight:IamArn,https://docs.aws.amazon.com/quicksight/latest/user/iam-actions.html,Filters access by IAM user or role ARN,ARN
934,quicksight:KmsKeyArns,https://docs.aws.amazon.com/quicksight/latest/user/key-management.html,Filters access by KMS key ARNs,ArrayOfARN
935,quicksight:SessionName,https://docs.aws.amazon.com/quicksight/latest/user/iam-actions.html,Filters access by session name,String
936,quicksight:UserName,https://docs.aws.amazon.com/quicksight/latest/user/iam-actions.html,Filters access by user name,String
937,ram:AllowsExternalPrincipals,https://docs.aws.amazon.com/ram/latest/userguide/iam-policies.html#iam-policies-condition,"Filters access by resource shares that allow or deny sharing with external principals. For example, specify true if the action can only be performed on resource shares that allow sharing with external principals. External principals are AWS accounts that are outside of its AWS organization",Bool
938,ram:PermissionArn,https://docs.aws.amazon.com/ram/latest/userguide/iam-policies.html#iam-policies-condition,Filters access by the specified Permission ARN,ARN
939,ram:PermissionResourceType,https://docs.aws.amazon.com/ram/latest/userguide/iam-policies.html#iam-policies-condition,Filters access by permissions of specified resource type,String
940,ram:Principal,https://docs.aws.amazon.com/ram/latest/userguide/iam-policies.html#iam-policies-condition,Filters access by format of the specified principal,String
941,ram:RequestedAllowsExternalPrincipals,https://docs.aws.amazon.com/ram/latest/userguide/iam-policies.html#iam-policies-condition,Filters access by the specified value for 'allowExternalPrincipals'. External principals are AWS accounts that are outside of its AWS Organization,Bool
942,ram:RequestedResourceType,https://docs.aws.amazon.com/ram/latest/userguide/iam-policies.html#iam-policies-condition,Filters access by the specified resource type,String
943,ram:ResourceArn,https://docs.aws.amazon.com/ram/latest/userguide/iam-policies.html#iam-policies-condition,Filters access by  the specified ARN,ARN
944,ram:ResourceShareName,https://docs.aws.amazon.com/ram/latest/userguide/iam-policies.html#iam-policies-condition,Filters access by a resource share with the specified name,String
945,ram:ResourceTag/${TagKey},https://docs.aws.amazon.com/IAM/latest/UserGuide/reference_policies_condition-keys.html#condition-keys-resourcetag,Filters access by the tags associated with the resource,String
946,ram:ShareOwnerAccountId,https://docs.aws.amazon.com/ram/latest/userguide/iam-policies.html#iam-policies-condition,"Filters access by resource shares owned by a specific account. For example, you can use this condition key to specify which resource share invitations can be accepted or rejected based on the resource share owner's account ID",String
947,rbin:Attribute/ResourceType,https://docs.aws.amazon.com/AWSEC2/latest/UserGuide/recycle-bin-perms.html#rbin-condition-keys,Filters access by the resource type of the existing rule,String
948,rbin:Request/ResourceType,https://docs.aws.amazon.com/AWSEC2/latest/UserGuide/recycle-bin-perms.html#rbin-condition-keys,Filters access by the resource type in a request,String
949,rds:BackupTarget,https://docs.aws.amazon.com/AmazonRDS/latest/UserGuide/security_iam_service-with-iam.html#UsingWithRDS.IAM.Conditions,"Filters access by the type of backup target. One of: region, outposts",String
950,rds:CopyOptionGroup,https://docs.aws.amazon.com/AmazonRDS/latest/UserGuide/security_iam_service-with-iam.html#UsingWithRDS.IAM.Conditions,Filters access by the value that specifies whether the CopyDBSnapshot action requires copying the DB option group,Bool
951,rds:DatabaseClass,https://docs.aws.amazon.com/AmazonRDS/latest/UserGuide/security_iam_service-with-iam.html#UsingWithRDS.IAM.Conditions,Filters access by the type of DB instance class,String
