condition_key_id,name,reference_url,description,type
1,a4b:amazonId,https://docs.aws.amazon.com/a4b/latest/APIReference/API_RegisterAVSDevice.html,Filters actions based on the Amazon Id in the request,String
2,lambda:FunctionUrlAuthType,https://docs.aws.amazon.com/lambda/latest/dg/lambda-api-permissions-ref.html,"Filters access by authorization type specified in request. Available during CreateFunctionUrlConfig, UpdateFunctionUrlConfig, DeleteFunctionUrlConfig, GetFunctionUrlConfig, ListFunctionUrlConfig, AddPermission and RemovePermission operations",String
3,ec2:MetadataHttpEndpoint,https://docs.aws.amazon.com/AWSEC2/latest/UserGuide/iam-policy-structure.html#amazon-ec2-keys,Filters access by whether the HTTP endpoint is enabled for the instance metadata service,String
4,lambda:Layer,https://docs.aws.amazon.com/lambda/latest/dg/lambda-api-permissions-ref.html,Filters access by the ARN of a version of an AWS Lambda layer,ArrayOfString
5,ec2:MetadataHttpPutResponseHopLimit,https://docs.aws.amazon.com/AWSEC2/latest/UserGuide/iam-policy-structure.html#amazon-ec2-keys,Filters access by the allowed number of hops when calling the instance metadata service,Numeric
6,ec2:MetadataHttpTokens,https://docs.aws.amazon.com/AWSEC2/latest/UserGuide/iam-policy-structure.html#amazon-ec2-keys,Filters access by whether tokens are required when calling the instance metadata service (optional or required),String
7,ec2:NetworkAclID,iam-policy-structure.html#imageId-key,Filters access by the ID of a network access control list (ACL),String
8,ec2:NetworkInterfaceID,iam-policy-structure.html#imageId-key,Filters access by the ID of an elastic network interface,String
9,ec2:NewInstanceProfile,https://docs.aws.amazon.com/AWSEC2/latest/UserGuide/iam-policy-structure.html#amazon-ec2-keys,Filters access by the ARN of the instance profile being attached,ARN
10,ec2:OutpostArn,https://docs.aws.amazon.com/AWSEC2/latest/UserGuide/iam-policy-structure.html#amazon-ec2-keys,Filters access by the ARN of the Outpost,ARN
11,lambda:Principal,https://docs.aws.amazon.com/lambda/latest/dg/lambda-api-permissions-ref.html,Filters access by restricting the AWS service or account that can invoke a function,String
12,ec2:Owner,https://docs.aws.amazon.com/AWSEC2/latest/UserGuide/iam-policy-structure.html#amazon-ec2-keys,"Filters access by the owner of the resource (amazon, aws-marketplace, or an AWS account ID)",String
13,ec2:ParentSnapshot,https://docs.aws.amazon.com/AWSEC2/latest/UserGuide/iam-policy-structure.html#amazon-ec2-keys,Filters access by the ARN of the parent snapshot,ARN
14,ec2:ParentVolume,https://docs.aws.amazon.com/AWSEC2/latest/UserGuide/iam-policy-structure.html#amazon-ec2-keys,Filters access by the ARN of the parent volume from which the snapshot was created,ARN
15,ec2:Permission,https://docs.aws.amazon.com/AWSEC2/latest/UserGuide/iam-policy-structure.html#amazon-ec2-keys,Filters access by the type of permission for a resource (INSTANCE-ATTACH or EIP-ASSOCIATE),String
16,ec2:Phase1DHGroup,https://docs.aws.amazon.com/vpn/latest/s2svpn/vpn-authentication-access-control.html,Filters access by the Diffie-Hellman group numbers that are permitted for a VPN tunnel for the phase 1 IKE negotiations,ArrayOfString
17,ec2:Phase1EncryptionAlgorithms,https://docs.aws.amazon.com/vpn/latest/s2svpn/vpn-authentication-access-control.html,Filters access by the encryption algorithms that are permitted for a VPN tunnel for the phase 1 IKE negotiations,ArrayOfString
18,ec2:Phase1IntegrityAlgorithms,https://docs.aws.amazon.com/vpn/latest/s2svpn/vpn-authentication-access-control.html,Filters access by the integrity algorithms that are permitted for a VPN tunnel for the phase 1 IKE negotiations,ArrayOfString
19,lambda:SecurityGroupIds,https://docs.aws.amazon.com/lambda/latest/dg/lambda-api-permissions-ref.html,Filters access by the ID of security groups configured for the AWS Lambda function,ArrayOfString
20,lambda:SourceFunctionArn,https://docs.aws.amazon.com/lambda/latest/dg/lambda-api-permissions-ref.html,Filters access by the ARN of the AWS Lambda function from which the request originated,ARN
21,lambda:SubnetIds,https://docs.aws.amazon.com/lambda/latest/dg/lambda-api-permissions-ref.html,Filters access by the ID of subnets configured for the AWS Lambda function,ArrayOfString
22,ec2:Phase1LifetimeSeconds,https://docs.aws.amazon.com/vpn/latest/s2svpn/vpn-authentication-access-control.html,Filters access by the lifetime in seconds for phase 1 of the IKE negotiations for a VPN tunnel,Numeric
23,lambda:VpcIds,https://docs.aws.amazon.com/lambda/latest/dg/lambda-api-permissions-ref.html,Filters access by the ID of the VPC configured for the AWS Lambda function,String
24,lex:associatedIntents,https://docs.aws.amazon.com/lex/latest/dg/security_iam_service-with-iam.html,Enables you to control access based on the intents included in the request,ArrayOfString
25,lex:associatedSlotTypes,https://docs.aws.amazon.com/lex/latest/dg/security_iam_service-with-iam.html,Enables you to control access based on the slot types included in the request,ArrayOfString
26,lex:channelType,https://docs.aws.amazon.com/lex/latest/dg/security_iam_service-with-iam.html,Enables you to control access based on the channel type included in the request,String
27,license-manager:ResourceTag/${TagKey},https://docs.aws.amazon.com/license-manager/latest/userguide/identity-access-management.html,Filters access by the tag key-value pairs attached to the resource,String
28,logs:DeliveryDestinationResourceArn,https://docs.aws.amazon.com/AmazonCloudWatch/latest/logs/iam-identity-based-access-control-cwl.html,Filters access by the Log Destination ARN passed in the request,ARN
29,logs:LogGeneratingResourceArns,https://docs.aws.amazon.com/AmazonCloudWatch/latest/logs/iam-identity-based-access-control-cwl.html,Filters access by the Log Generating Resource ARNs passed in the request,ArrayOfARN
30,lookoutequipment:IsImportingData,https://docs.aws.amazon.com/IAM/latest/UserGuide/reference_policies_condition-keys.html#condition-keys-isimportingdata,Filters access by the import strategy of underlying data,Bool
31,ec2:Phase2DHGroup,https://docs.aws.amazon.com/vpn/latest/s2svpn/vpn-authentication-access-control.html,Filters access by the Diffie-Hellman group numbers that are permitted for a VPN tunnel for the phase 2 IKE negotiations,ArrayOfString
32,mediaconvert:HttpInputsAllowed,https://docs.aws.amazon.com/mediaconvert/latest/apireference/input-policies.html,Filters access by an HTTP input policy present in the account,Bool
33,mediaconvert:HttpsInputsAllowed,https://docs.aws.amazon.com/mediaconvert/latest/apireference/input-policies.html,Filters access by an HTTPS input policy present in the account,Bool
34,mediaconvert:S3InputsAllowed,https://docs.aws.amazon.com/mediaconvert/latest/apireference/input-policies.html,Filters access by an S3 input policy present in the account,Bool
35,memorydb:TLSEnabled,https://docs.aws.amazon.com/memorydb/latest/devguide/IAM.ConditionKeys.html#IAM.SpecifyingConditions,Filters access by the TLSEnabled parameter present in the request or defaults to true value if parameter is not present,Bool
36,memorydb:UserAuthenticationMode,https://docs.aws.amazon.com/memorydb/latest/devguide/IAM.ConditionKeys.html#IAM.SpecifyingConditions,Filters access by the UserAuthenticationMode.Type parameter in the request,String
37,mgn:CreateAction,https://docs.aws.amazon.com/mgn/latest/ug/supported-iam-actions-tagging.html,Filters access by the name of a resource-creating API action,String
38,neptune-db:QueryLanguage,https://docs.aws.amazon.com/neptune/latest/userguide/iam-data-condition-keys.html#iam-neptune-condition-keys,Filters access by graph model,String
39,neptune-graph:PublicConnectivity,https://docs.aws.amazon.com/neptune-analytics/latest/userguide/iam-condition-keys.html#publicconnectivity,"Filters access by the value of the public connectivity parameter provided in the request or its default value, if unspecified. All access to graphs is IAM authenticated",Bool
40,ec2:Phase2EncryptionAlgorithms,https://docs.aws.amazon.com/vpn/latest/s2svpn/vpn-authentication-access-control.html,Filters access by the encryption algorithms that are permitted for a VPN tunnel for the phase 2 IKE negotiations,ArrayOfString
41,networkmanager:cgwArn,https://docs.aws.amazon.com/vpc/latest/tgw/nm-security-iam.html,Filters access by which customer gateways can be associated or disassociated,ARN
42,networkmanager:subnetArns,https://docs.aws.amazon.com/vpc/latest/tgw/nm-security-iam.html,Filters access by which VPC subnets can be added or removed from a VPC attachment,ArrayOfARN
43,networkmanager:tgwArn,https://docs.aws.amazon.com/vpc/latest/tgw/nm-security-iam.html,"Filters access by which transit gateways can be registered, deregistered, or peered",ARN
44,networkmanager:tgwConnectPeerArn,https://docs.aws.amazon.com/vpc/latest/tgw/nm-security-iam.html,Filters access by which transit gateway connect peers can be associated or disassociated,ARN
45,networkmanager:tgwRtbArn,https://docs.aws.amazon.com/vpc/latest/tgw/nm-security-iam.html,Filters access by which Transit Gateway Route Table can be used to create an attachment,ARN
46,a4b:filters_deviceType,https://docs.aws.amazon.com/a4b/latest/APIReference/API_SearchDevices.html,Filters actions based on the device type in the request,ArrayOfString
47,ec2:Phase2IntegrityAlgorithms,https://docs.aws.amazon.com/vpn/latest/s2svpn/vpn-authentication-access-control.html,Filters access by the integrity algorithms that are permitted for a VPN tunnel for the phase 2 IKE negotiations,ArrayOfString
48,account:AccountResourceOrgPaths,https://docs.aws.amazon.com/accounts/latest/reference/security_iam_service-with-iam.html#security_iam_service-with-iam-id-based-policies-conditionkeys,Filters access by the resource path for an account in an organization,ArrayOfString
49,account:AccountResourceOrgTags/${TagKey},https://docs.aws.amazon.com/accounts/latest/reference/security_iam_service-with-iam.html#security_iam_service-with-iam-id-based-policies-conditionkeys,Filters access by resource tags for an account in an organization,String
50,account:AlternateContactTypes,https://docs.aws.amazon.com/accounts/latest/reference/security_iam_service-with-iam.html#security_iam_service-with-iam-id-based-policies-conditionkeys,Filters access by alternate contact types,ArrayOfString
51,account:EmailTargetDomain,https://docs.aws.amazon.com/accounts/latest/reference/security_iam_service-with-iam.html#security_iam_service-with-iam-id-based-policies-conditionkeys,Filters access by email domain of the target email address,String
52,account:TargetRegion,https://docs.aws.amazon.com/accounts/latest/reference/security_iam_service-with-iam.html#security_iam_service-with-iam-id-based-policies-conditionkeys,Filters access by a list of Regions. Enables or disables all the Regions specified here,String
53,accounts.google.com:aud,https://docs.aws.amazon.com/IAM/latest/UserGuide/reference_policies_iam-condition-keys.html#ck_aud,Filters access by the Google application ID,String
54,accounts.google.com:oaud,https://docs.aws.amazon.com/IAM/latest/UserGuide/reference_policies_iam-condition-keys.html#ck_oaud,Filters access by the Google audience,String
55,networkmanager:vpcArn,https://docs.aws.amazon.com/vpc/latest/tgw/nm-security-iam.html,Filters access by which VPC can be used to a create/update attachment,ARN
56,accounts.google.com:sub,https://docs.aws.amazon.com/IAM/latest/UserGuide/reference_policies_iam-condition-keys.html#ck_sub,Filters access by the subject of the claim (the Google user ID),String
57,networkmanager:vpnConnectionArn,https://docs.aws.amazon.com/vpc/latest/tgw/nm-security-iam.html,Filters access by which Site-to-Site VPN can be used to a create/update attachment,ARN
58,nimble:createdBy,https://docs.aws.amazon.com/nimble-studio/latest/userguide/security-iam-service-with-iam.html,Filters access by the createdBy request parameter or the ID of the creator of the resource,String
59,nimble:ownedBy,https://docs.aws.amazon.com/nimble-studio/latest/userguide/security-iam-service-with-iam.html,Filters access by the ownedBy request parameter or the ID of the owner of the resource,String
60,nimble:principalId,https://docs.aws.amazon.com/nimble-studio/latest/userguide/security-iam-service-with-iam.html,Filters access by the principalId request parameter,String
61,nimble:requesterPrincipalId,https://docs.aws.amazon.com/nimble-studio/latest/userguide/security-iam-service-with-iam.html,Filters access by the ID of the logged in user,String
62,nimble:studioId,https://docs.aws.amazon.com/nimble-studio/latest/userguide/security-iam-service-with-iam.html,Filters access by a specific studio,ARN
63,oam:ResourceTypes,https://docs.aws.amazon.com/IAM/latest/UserGuide/list_amazoncloudwatchobservabilityaccessmanager.html,Filters access by the presence of resource types in the request,ArrayOfString
64,omics:AnnotationImportJobJobId,https://docs.aws.amazon.com/IAM/latest/UserGuide/reference_policies_condition-keys.html#condition-annotation-import-job-id,Filters access by a unique resource identifier,String
65,omics:AnnotationStoreName,https://docs.aws.amazon.com/IAM/latest/UserGuide/reference_policies_condition-keys.html#condition-annotation-store-name,Filters access by the name of the store,String
66,omics:AnnotationStoreVersionName,https://docs.aws.amazon.com/IAM/latest/UserGuide/reference_policies_condition-keys.html#condition-annotation-store-version-name,Filters access by the name of the annotation store version,String
67,omics:VariantImportJobJobId,https://docs.aws.amazon.com/IAM/latest/UserGuide/reference_policies_condition-keys.html#condition-variant-import-job-id,Filters access by a unique resource identifier,String
68,omics:VariantStoreName,https://docs.aws.amazon.com/IAM/latest/UserGuide/reference_policies_condition-keys.html#condition-variant-store-name,Filters access by the name of the store,String
69,organizations:PolicyType,https://docs.aws.amazon.com/organizations/latest/userguide/orgs_permissions_overview.html#orgs_permissions_conditionkeys,Filters access by the specified policy type names,String
70,organizations:ServicePrincipal,https://docs.aws.amazon.com/organizations/latest/userguide/orgs_permissions_overview.html#orgs_permissions_conditionkeys,Filters access by the specified service principal names,String
71,payment-cryptography:CertificateAuthorityPublicKeyIdentifier,{ActionsDocRoot}security-iam.html,"Filters access by the CertificateAuthorityPublicKeyIdentifier specified in the request or the ImportKey, and ExportKey operations",String
72,payment-cryptography:ImportKeyMaterial,{ActionsDocRoot}security-iam.html,"Filters access by the type of key material being imported [RootCertificatePublicKey, TrustedCertificatePublicKey, Tr34KeyBlock, Tr31KeyBlock] for the ImportKey operation",String
73,saml:primaryGroupSID,https://docs.aws.amazon.com/IAM/latest/UserGuide/reference_policies_iam-condition-keys.html#ck_primarygroupsid,Filters access by the primaryGroupSID attribute,String
74,payment-cryptography:KeyAlgorithm,{ActionsDocRoot}security-iam.html,Filters access by KeyAlgorithm specified in the request for the CreateKey operation,String
75,payment-cryptography:KeyClass,{ActionsDocRoot}security-iam.html,Filters access by KeyClass specified in the request for the CreateKey operation,String
76,acm-pca:TemplateArn,https://docs.aws.amazon.com/privateca/latest/userguide/UsingTemplates.html#template-varieties,Filters access by the arn of the certificate template used in Issue Certificate request,ARN
77,saml:sub,https://docs.aws.amazon.com/IAM/latest/UserGuide/reference_policies_iam-condition-keys.html#ck_sub,Filters access by the subject of the claim (the SAML user ID),String
78,payment-cryptography:KeyUsage,{ActionsDocRoot}security-iam.html,Filters access by KeyClass specified in the request or associated with a key for the CreateKey operation,String
79,payment-cryptography:RequestAlias,{ActionsDocRoot}security-iam.html,Filters access by aliases in the request for the specified operation,String
80,payment-cryptography:ResourceAliases,{ActionsDocRoot}security-iam.html,Filters access by aliases associated with a key for the specified operation,ArrayOfString
81,payment-cryptography:WrappingKeyIdentifier,{ActionsDocRoot}security-iam.html,"Filters access by the WrappingKeyIdentifier specified in the request for the ImportKey, and ExportKey operations",String
82,pi:Dimensions,#condition-keys-dimensions,Filters access by the requested dimensions,ArrayOfString
83,proton:EnvironmentTemplate,https://docs.aws.amazon.com/IAM/latest/UserGuide/reference_policies_condition-keys.html,Filters access by specified environment template related to resource,String
84,proton:ServiceTemplate,https://docs.aws.amazon.com/IAM/latest/UserGuide/reference_policies_condition-keys.html,Filters access by specified service template related to resource,String
85,qapps:AppIsPublished,https://docs.aws.amazon.com/amazonq/latest/qbusiness-ug/security-iam.html,Filters access by whether Q App is published,String
86,qapps:SessionIsShared,https://docs.aws.amazon.com/amazonq/latest/qbusiness-ug/security-iam.html,Filters access by whether Q App Session is shared,String
87,saml:sub_type,https://docs.aws.amazon.com/IAM/latest/UserGuide/reference_policies_iam-condition-keys.html#ck_subtype,"Filters access by the value persistent, transient, or the full Format URI",String
88,saml:surname,https://docs.aws.amazon.com/IAM/latest/UserGuide/reference_policies_iam-condition-keys.html#ck_surname,Filters access by the surname attribute,String
89,saml:uid,https://docs.aws.amazon.com/IAM/latest/UserGuide/reference_policies_iam-condition-keys.html#ck_uid,Filters access by the uid attribute,String
90,saml:x500UniqueIdentifier,https://docs.aws.amazon.com/IAM/latest/UserGuide/reference_policies_iam-condition-keys.html#ck_x500uniqueidentifier,Filters access by the uid attribute,String
91,secretsmanager:AddReplicaRegions,https://docs.aws.amazon.com/secretsmanager/latest/userguide/reference_iam-permissions.html#iam-contextkeys,Filters access by the list of Regions in which to replicate the secret,ArrayOfString
92,secretsmanager:BlockPublicPolicy,https://docs.aws.amazon.com/secretsmanager/latest/userguide/reference_iam-permissions.html#iam-contextkeys,Filters access by whether the resource policy blocks broad AWS account access,Bool
93,secretsmanager:Description,https://docs.aws.amazon.com/secretsmanager/latest/userguide/reference_iam-permissions.html#iam-contextkeys,Filters access by the description text in the request,String
94,secretsmanager:ForceDeleteWithoutRecovery,https://docs.aws.amazon.com/secretsmanager/latest/userguide/reference_iam-permissions.html#iam-contextkeys,Filters access by whether the secret is to be deleted immediately without any recovery window,Bool
95,secretsmanager:ForceOverwriteReplicaSecret,https://docs.aws.amazon.com/secretsmanager/latest/userguide/reference_iam-permissions.html#iam-contextkeys,Filters access by whether to overwrite a secret with the same name in the destination Region,Bool
96,secretsmanager:KmsKeyId,https://docs.aws.amazon.com/secretsmanager/latest/userguide/reference_iam-permissions.html#iam-contextkeys,Filters access by the key identifier of the KMS key in the request,String
97,secretsmanager:ModifyRotationRules,https://docs.aws.amazon.com/secretsmanager/latest/userguide/reference_iam-permissions.html#iam-contextkeys,Filters access by whether the rotation rules of the secret are to be modified,Bool
98,secretsmanager:Name,https://docs.aws.amazon.com/secretsmanager/latest/userguide/reference_iam-permissions.html#iam-contextkeys,Filters access by the friendly name of the secret in the request,String
99,secretsmanager:RecoveryWindowInDays,https://docs.aws.amazon.com/secretsmanager/latest/userguide/reference_iam-permissions.html#iam-contextkeys,Filters access by the number of days that Secrets Manager waits before it can delete the secret,Numeric
100,secretsmanager:ResourceTag/tag-key,https://docs.aws.amazon.com/secretsmanager/latest/userguide/reference_iam-permissions.html#iam-contextkeys,Filters access by a tag key and value pair,String
101,secretsmanager:RotateImmediately,https://docs.aws.amazon.com/secretsmanager/latest/userguide/reference_iam-permissions.html#iam-contextkeys,Filters access by whether the secret is to be rotated immediately,Bool
102,ec2:Phase2LifetimeSeconds,https://docs.aws.amazon.com/vpn/latest/s2svpn/vpn-authentication-access-control.html,Filters access by the lifetime in seconds for phase 2 of the IKE negotiations for a VPN tunnel,Numeric
103,secretsmanager:RotationLambdaARN,https://docs.aws.amazon.com/secretsmanager/latest/userguide/reference_iam-permissions.html#iam-contextkeys,Filters access by the ARN of the rotation Lambda function in the request,ARN
104,secretsmanager:SecretId,https://docs.aws.amazon.com/secretsmanager/latest/userguide/reference_iam-permissions.html#iam-contextkeys,Filters access by the SecretID value in the request,ARN
105,secretsmanager:SecretPrimaryRegion,https://docs.aws.amazon.com/secretsmanager/latest/userguide/reference_iam-permissions.html#iam-contextkeys,Filters access by primary region in which the secret is created,String
106,secretsmanager:VersionId,https://docs.aws.amazon.com/secretsmanager/latest/userguide/reference_iam-permissions.html#iam-contextkeys,Filters access by the unique identifier of the version of the secret in the request,String
107,secretsmanager:VersionStage,https://docs.aws.amazon.com/secretsmanager/latest/userguide/reference_iam-permissions.html#iam-contextkeys,Filters access by the list of version stages in the request,String
108,secretsmanager:resource/AllowRotationLambdaArn,https://docs.aws.amazon.com/secretsmanager/latest/userguide/reference_iam-permissions.html#iam-contextkeys,Filters access by the ARN of the rotation Lambda function associated with the secret,ARN
109,ec2:PlacementGroup,https://docs.aws.amazon.com/AWSEC2/latest/UserGuide/iam-policy-structure.html#amazon-ec2-keys,Filters access by the ARN of the placement group,ARN
110,securityhub:ASFFSyntaxPath/${ASFFSyntaxPath},https://docs.aws.amazon.com/IAM/latest/UserGuide/reference_policies_condition-keys.html#condition-keys-asffsyntaxpath,Filters access by the specified fields and values in the request,String
111,ec2:PlacementGroupName,iam-policy-structure.html#imageId-key,Filters access by the name of a placement group,String
112,securityhub:TargetAccount,https://docs.aws.amazon.com/securityhub/latest/userguide/securityhub-access.html#conditions,Filters access by the AwsAccountId field that is specified in the request,String
113,serverlessrepo:applicationType,https://docs.aws.amazon.com/IAM/latest/UserGuide/applications.html,Filters access by application type,String
114,servicecatalog:Resource,,,
115,servicecatalog:ResourceType,,,
116,servicecatalog:accountLevel,,,
117,qapps:UserIsAppOwner,https://docs.aws.amazon.com/amazonq/latest/qbusiness-ug/security-iam.html,Filters access by whether requester is Q App owner,String
118,qapps:UserIsSessionModerator,https://docs.aws.amazon.com/amazonq/latest/qbusiness-ug/security-iam.html,Filters access by whether requester is Q App Session moderator,String
119,qldb:Purge,https://docs.aws.amazon.com/IAM/latest/UserGuide/reference_policies_condition-keys.html#condition-keys-purge,Filters access by the value of purge that is specified in a PartiQL DROP statement,String
120,quicksight:AllowedEmbeddingDomains,https://docs.aws.amazon.com/quicksight/latest/user/embedded-dashboards-for-authenticated-users-step-1.html,Filters access by the allowed embedding domains,ArrayOfString
121,quicksight:DirectoryType,https://docs.aws.amazon.com/quicksight/latest/user/security-scp.html,Filters access by the user management options,String
122,quicksight:Edition,https://docs.aws.amazon.com/quicksight/latest/user/security-scp.html,Filters access by the edition of QuickSight,String
123,quicksight:IamArn,https://docs.aws.amazon.com/quicksight/latest/user/iam-actions.html,Filters access by IAM user or role ARN,ARN
124,quicksight:KmsKeyArns,https://docs.aws.amazon.com/quicksight/latest/user/key-management.html,Filters access by KMS key ARNs,ArrayOfARN
125,quicksight:SessionName,https://docs.aws.amazon.com/quicksight/latest/user/iam-actions.html,Filters access by session name,String
126,quicksight:UserName,https://docs.aws.amazon.com/quicksight/latest/user/iam-actions.html,Filters access by user name,String
127,ram:AllowsExternalPrincipals,https://docs.aws.amazon.com/ram/latest/userguide/iam-policies.html#iam-policies-condition,"Filters access by resource shares that allow or deny sharing with external principals. For example, specify true if the action can only be performed on resource shares that allow sharing with external principals. External principals are AWS accounts that are outside of its AWS organization",Bool
128,ram:PermissionArn,https://docs.aws.amazon.com/ram/latest/userguide/iam-policies.html#iam-policies-condition,Filters access by the specified Permission ARN,ARN
129,ram:PermissionResourceType,https://docs.aws.amazon.com/ram/latest/userguide/iam-policies.html#iam-policies-condition,Filters access by permissions of specified resource type,String
130,ram:Principal,https://docs.aws.amazon.com/ram/latest/userguide/iam-policies.html#iam-policies-condition,Filters access by format of the specified principal,String
131,ram:RequestedAllowsExternalPrincipals,https://docs.aws.amazon.com/ram/latest/userguide/iam-policies.html#iam-policies-condition,Filters access by the specified value for 'allowExternalPrincipals'. External principals are AWS accounts that are outside of its AWS Organization,Bool
132,ram:RequestedResourceType,https://docs.aws.amazon.com/ram/latest/userguide/iam-policies.html#iam-policies-condition,Filters access by the specified resource type,String
