condition_key_id,name,reference_url,description,type
627,batch:Privileged,https://docs.aws.amazon.com/service-authorization/latest/reference/list_awsbatch.html#awsbatch-policy-keys,Filters access by the specified privileged parameter value that determines whether the container is given elevated privileges on the host container instance (similar to the root user),Bool
628,elasticfilesystem:Encrypted,https://docs.aws.amazon.com/efs/latest/ug/encryption.html,Filters access by whether users can create only encrypted or unencrypted file systems,Bool
629,elasticloadbalancing:CreateAction,https://docs.aws.amazon.com/elasticloadbalancing/latest/userguide/tagging-resources-during-creation.html,Filters access by the name of a resource-creating API action,String
630,elasticloadbalancing:ListenerProtocol,https://docs.aws.amazon.com/elasticloadbalancing/latest/userguide/security_iam_service-with-iam.html#listenerprotocol-condition,Filters access by the listener protocol that is allowed in the request,ArrayOfString
631,elasticloadbalancing:ResourceTag/,https://docs.aws.amazon.com/IAM/latest/UserGuide/reference_policies_condition-keys.html#condition-keys-resourcetag,Filters access by the preface string for a tag key and value pair that are attached to a resource,String
632,elasticloadbalancing:ResourceTag/${TagKey},https://docs.aws.amazon.com/IAM/latest/UserGuide/reference_policies_condition-keys.html#condition-keys-resourcetag,Filters access by the preface string for a tag key and value pair that are attached to a resource,String
633,elasticloadbalancing:Scheme,https://docs.aws.amazon.com/elasticloadbalancing/latest/userguide/security_iam_service-with-iam.html#scheme-condition,Filters access by the load balancer scheme that are allowed in the request,String
634,elasticloadbalancing:SecurityGroup,https://docs.aws.amazon.com/elasticloadbalancing/latest/userguide/security_iam_service-with-iam.html#securitygroup-condition,Filters access by the security-group IDs that are allowed in the request,ArrayOfString
635,batch:ShareIdentifier,https://docs.aws.amazon.com/service-authorization/latest/reference/list_awsbatch.html#awsbatch-policy-keys,Filters access by the shareIdentifier used inside submit job,String
636,elasticloadbalancing:SecurityPolicy,https://docs.aws.amazon.com/elasticloadbalancing/latest/userguide/security_iam_service-with-iam.html#securitypolicy-condition,Filters access by the SSL Security Policies that are allowed in the request,ArrayOfString
637,elasticloadbalancing:Subnet,https://docs.aws.amazon.com/elasticloadbalancing/latest/userguide/security_iam_service-with-iam.html#subnet-condition,Filters access by the subnet IDs that are allowed in the request,ArrayOfString
638,elasticmapreduce:ExecutionRoleArn,https://docs.aws.amazon.com/emr/latest/ManagementGuide/emr-plan-access-iam.html#emr-security,Filters access by whether the execution role ARN is provided with the action,ARN
639,elasticmapreduce:RequestTag/${TagKey},https://docs.aws.amazon.com/emr/latest/ManagementGuide/emr-plan-access-iam.html#emr-fine-grained-cluster-access,Filters access by whether the tag and value pair is provided with the action,String
640,elasticmapreduce:ResourceTag/${TagKey},https://docs.aws.amazon.com/emr/latest/ManagementGuide/emr-plan-access-iam.html#emr-fine-grained-cluster-access,Filters access by the tag and value pair associated with an Amazon EMR resource,String
641,emr-containers:ExecutionRoleArn,https://docs.aws.amazon.com/emr/latest/EMR-on-EKS-DevelopmentGuide/iam-execution-role.html,Filters access by the execution role arn present in the request,ARN
642,emr-containers:JobTemplateArn,https://docs.aws.amazon.com/emr/latest/EMR-on-EKS-DevelopmentGuide/iam-job-template.html,Filters access by the job template arn present in the request,ARN
643,events:EventBusArn,https://docs.aws.amazon.com/eventbridge/latest/userguide/policy-keys-eventbridge.html#limiting-access-to-event-buses,Filters access by the ARN of the event buses that can be associated with an endpoint to CreateEndpoint and UpdateEndpoint actions,ArrayOfARN
644,batch:User,https://docs.aws.amazon.com/service-authorization/latest/reference/list_awsbatch.html#awsbatch-policy-keys,Filters access by user name or numeric uid used inside the container,String
645,events:ManagedBy,https://docs.aws.amazon.com/eventbridge/latest/userguide/policy-keys-eventbridge.html,"Filters access by AWS services. If a rule is created by an AWS service on your behalf, the value is the principal name of the service that created the rule",String
646,events:TargetArn,https://docs.aws.amazon.com/eventbridge/latest/userguide/policy-keys-eventbridge.html#limiting-access-to-targets,Filters access by the ARN of a target that can be put to a rule to PutTargets actions. TargetARN doesn't include DeadLetterConfigArn,ArrayOfARN
647,events:creatorAccount,https://docs.aws.amazon.com/eventbridge/latest/userguide/policy-keys-eventbridge.html#events-creator-account,Filters access by the account the rule was created in to rule actions,String
648,events:detail-type,https://docs.aws.amazon.com/eventbridge/latest/userguide/policy-keys-eventbridge.html#events-pattern-detail-type,Filters access by the literal string of the detail-type of the event to PutEvents and PutRule actions,String
649,bedrock:ThirdPartyKnowledgeBaseCredentialsSecretArn,https://docs.aws.amazon.com/IAM/latest/UserGuide/reference_policies_condition-keys.html#condition-keys-globally-available,Filters access by the secretArn containing the credentials of the third party platform,ARN
650,events:detail.eventTypeCode,https://docs.aws.amazon.com/eventbridge/latest/userguide/policy-keys-eventbridge.html#limit-rule-by-type-code,Filters access by the literal string for the detail.eventTypeCode field of the event to PutRule actions,String
651,events:detail.service,https://docs.aws.amazon.com/eventbridge/latest/userguide/policy-keys-eventbridge.html#limit-rule-by-service,Filters access by the literal string for the detail.service field of the event to PutRule actions,String
652,events:detail.userIdentity.principalId,https://docs.aws.amazon.com/eventbridge/latest/userguide/policy-keys-eventbridge.html#consume-specific-events,Filters access by the literal string for the detail.useridentity.principalid field of the event to PutRule actions,String
653,events:eventBusInvocation,https://docs.aws.amazon.com/eventbridge/latest/userguide/policy-keys-eventbridge.html#events-bus-invocation,Filters access by whether the event was generated via API or cross-account bus invocation to PutEvents actions,String
654,events:source,https://docs.aws.amazon.com/eventbridge/latest/userguide/policy-keys-eventbridge.html#events-limit-access-control,Filters access by the AWS service or AWS partner event source that generated the event to PutEvents and PutRule actions. Matches the literal string of the source field of the event,ArrayOfString
655,fis:Operations,https://docs.aws.amazon.com/fis/latest/userguide/security_iam_service-with-iam.html,Filters access by the list of operations on the AWS service that is being affected by the AWS FIS action,ArrayOfString
656,fis:Percentage,https://docs.aws.amazon.com/fis/latest/userguide/security_iam_service-with-iam.html,Filters access by the percentage of calls being affected by the AWS FIS action,Numeric
657,catalog:ChangeType,https://docs.aws.amazon.com/marketplace-catalog/latest/api-reference/api-access-control.html,Filters access by the change type in the StartChangeSet request,String
658,fis:Service,https://docs.aws.amazon.com/fis/latest/userguide/security_iam_service-with-iam.html,Filters access by the AWS service that is being affected by the AWS FIS action,String
659,fis:Targets,https://docs.aws.amazon.com/fis/latest/userguide/security_iam_service-with-iam.html,Filters access by the list of resource ARNs being targeted by the AWS FIS action,ArrayOfString
660,fsx:IsBackupCopyDestination,https://docs.aws.amazon.com/fsx/latest/WindowsGuide/using-backups.html#copy-backups,Filters access by whether the backup is a destination backup for a CopyBackup operation,Bool
661,fsx:IsBackupCopySource,https://docs.aws.amazon.com/fsx/latest/WindowsGuide/using-backups.html#copy-backups,Filters access by whether the backup is a source backup for a CopyBackup operation,Bool
662,fsx:NfsDataRepositoryAuthenticationEnabled,https://docs.aws.amazon.com/fsx/latest/FileCacheGuide/encryption-in-transit.html,Filters access by NFS data repositories which support authentication,Bool
663,cleanrooms-ml:CollaborationId,https://docs.aws.amazon.com/TBD,Filters access by clean rooms collaboration id,String
664,fsx:NfsDataRepositoryEncryptionInTransitEnabled,https://docs.aws.amazon.com/fsx/latest/FileCacheGuide/encryption-in-transit.html,Filters access by NFS data repositories which support encryption-in-transit,Bool
665,fsx:ParentVolumeId,https://docs.aws.amazon.com/fsx/latest/OpenZFSGuide/creating-volumes.html,Filters access by the containing parent volume for mutating volume operations,String
666,fsx:StorageVirtualMachineId,https://docs.aws.amazon.com/fsx/latest/ONTAPGuide/creating-volumes.html,Filters access by the containing storage virtual machine for a volume for mutating volume operations,String
667,cloud9:EnvironmentId,https://docs.aws.amazon.com/IAM/latest/UserGuide/list_awscloud9.html##awscloud9-cloud9_EnvironmentId,Filters access by the AWS Cloud9 environment ID,String
668,geo:DeviceIds,https://docs.aws.amazon.com/location/latest/developerguide/security_iam_service-with-iam.html#security_iam_service-with-iam-id-based-policies-conditionkeys,Filters access by the presence of device ids in the request,ArrayOfString
669,geo:GeofenceIds,https://docs.aws.amazon.com/location/latest/developerguide/security_iam_service-with-iam.html#security_iam_service-with-iam-id-based-policies-conditionkeys,Filters access by the presence of geofence ids in the request,ArrayOfString
670,glacier:ArchiveAgeInDays,https://docs.aws.amazon.com/amazonglacier/latest/dev/access-control-overview.html#specifying-conditions,"Filters access by how long an archive has been stored in the vault, in days",String
671,glacier:ResourceTag/,https://docs.aws.amazon.com/amazonglacier/latest/dev/access-control-overview.html#specifying-conditions,Filters access by a customer-defined tag,String
672,glue:CredentialIssuingService,https://docs.aws.amazon.com/glue/latest/dg/using-identity-based-policies.html#glue-identity-based-policy-condition-keys,Filters access by the service from which the credentials of the request is issued,String
673,glue:RoleAssumedBy,https://docs.aws.amazon.com/glue/latest/dg/using-identity-based-policies.html#glue-identity-based-policy-condition-keys,Filters access by the service from which the credentials of the request is obtained by assuming the customer role,String
674,glue:SecurityGroupIds,https://docs.aws.amazon.com/glue/latest/dg/using-identity-based-policies.html#glue-identity-based-policy-condition-keys,Filters access by the ID of security groups configured for the Glue job,ArrayOfString
675,glue:SubnetIds,https://docs.aws.amazon.com/glue/latest/dg/using-identity-based-policies.html#glue-identity-based-policy-condition-keys,Filters access by the ID of subnets configured for the Glue job,ArrayOfString
676,cloud9:EnvironmentName,https://docs.aws.amazon.com/IAM/latest/UserGuide/list_awscloud9.html##awscloud9-cloud9_EnvironmentName,Filters access by the AWS Cloud9 environment name,String
677,glue:VpcIds,https://docs.aws.amazon.com/glue/latest/dg/using-identity-based-policies.html#glue-identity-based-policy-condition-keys,Filters access by the ID of the VPC configured for the Glue job,ArrayOfString
678,graph.facebook.com:app_id,https://docs.aws.amazon.com/IAM/latest/UserGuide/reference_policies_iam-condition-keys.html#ck_id,Filters access by the Facebook application ID,String
679,graph.facebook.com:id,https://docs.aws.amazon.com/IAM/latest/UserGuide/reference_policies_iam-condition-keys.html#ck_id,Filters access by the Facebook user ID,String
680,groundstation:AgentId,https://docs.aws.amazon.com/ground-station/latest/APIReference/API_RegisterAgent.html#groundstation-RegisterAgent-response-agentId,Filters access by the ID of an agent,String
681,groundstation:ConfigId,https://docs.aws.amazon.com/ground-station/latest/APIReference/API_CreateConfig.html#groundstation-CreateConfig-response-configId,Filters access by the ID of a config,String
682,groundstation:ConfigType,https://docs.aws.amazon.com/ground-station/latest/APIReference/API_CreateConfig.html#groundstation-CreateConfig-response-configType,Filters access by the type of a config,String
683,cloud9:InstanceType,https://docs.aws.amazon.com/IAM/latest/UserGuide/list_awscloud9.html##awscloud9-cloud9_InstanceType,Filters access by the instance type of the AWS Cloud9 environment's Amazon EC2 instance,String
684,groundstation:ContactId,https://docs.aws.amazon.com/ground-station/latest/APIReference/API_ReserveContact.html#groundstation-ReserveContact-response-contactId,Filters access by the ID of a contact,String
685,groundstation:DataflowEndpointGroupId,https://docs.aws.amazon.com/ground-station/latest/APIReference/API_CreateDataflowEndpointGroup.html#groundstation-CreateDataflowEndpointGroup-response-dataflowEndpointGroupId,Filters access by the ID of a dataflow endpoint group,String
686,groundstation:EphemerisId,https://docs.aws.amazon.com/ground-station/latest/APIReference/API_CreateEphemeris.html#groundstation-CreateEphemeris-response-ephemerisId,Filters access by the ID of an ephemeris,String
687,groundstation:GroundStationId,https://docs.aws.amazon.com/ground-station/latest/APIReference/API_GroundStationData.html#groundstation-Type-GroundStationData-groundStationId,Filters access by the ID of a ground station,String
688,groundstation:MissionProfileId,https://docs.aws.amazon.com/ground-station/latest/APIReference/API_CreateMissionProfile.html#groundstation-CreateMissionProfile-response-missionProfileId,Filters access by the ID of a mission profile,String
689,groundstation:SatelliteId,https://docs.aws.amazon.com/ground-station/latest/APIReference/API_SatelliteListItem.html#groundstation-Type-SatelliteListItem-satelliteId,Filters access by the ID of a satellite,String
690,health:eventTypeCode,https://docs.aws.amazon.com/health/latest/ug/controlling-access.html,Filters access by event type,String
691,cloud9:OwnerArn,https://docs.aws.amazon.com/IAM/latest/UserGuide/list_awscloud9.html##awscloud9-cloud9_OwnerArn,Filters access by the owner ARN specified,ARN
692,health:service,https://docs.aws.amazon.com/health/latest/ug/controlling-access.html,Filters access by impacted service,String
693,iam:AWSServiceName,https://docs.aws.amazon.com/IAM/latest/UserGuide/reference_policies_iam-condition-keys.html#ck_AWSServiceName,Filters access by the AWS service to which this role is attached,String
694,iam:AssociatedResourceArn,https://docs.aws.amazon.com/IAM/latest/UserGuide/reference_policies_iam-condition-keys.html#ck_AssociatedResourceArn,Filters access by the resource that the role will be used on behalf of,ARN
695,iam:FIDO-FIPS-140-2-certification,https://docs.aws.amazon.com/IAM/latest/UserGuide/reference_policies_iam-condition-keys.html#ck_FIDO-FIPS-140-2-certification,Filters access by the MFA device FIPS-140-2 validation certification level at the time of registration of a FIDO security key,String
696,iam:FIDO-FIPS-140-3-certification,https://docs.aws.amazon.com/IAM/latest/UserGuide/reference_policies_iam-condition-keys.html#ck_FIDO-FIPS-140-3-certification,Filters access by the MFA device FIPS-140-3 validation certification level at the time of registration of a FIDO security key,String
697,iam:FIDO-certification,https://docs.aws.amazon.com/IAM/latest/UserGuide/reference_policies_iam-condition-keys.html#ck_FIDO-certification,Filters access by the MFA device FIDO certification level at the time of registration of a FIDO security key,String
698,iam:OrganizationsPolicyId,https://docs.aws.amazon.com/IAM/latest/UserGuide/reference_policies_iam-condition-keys.html#ck_OrganizationsPolicyId,Filters access by the ID of an AWS Organizations policy,String
699,iam:PassedToService,https://docs.aws.amazon.com/IAM/latest/UserGuide/reference_policies_iam-condition-keys.html#ck_PassedToService,Filters access by the AWS service to which this role is passed,String
700,iam:PermissionsBoundary,https://docs.aws.amazon.com/IAM/latest/UserGuide/reference_policies_iam-condition-keys.html#ck_PermissionsBoundary,Filters access if the specified policy is set as the permissions boundary on the IAM entity (user or role),ARN
701,iam:PolicyARN,https://docs.aws.amazon.com/IAM/latest/UserGuide/reference_policies_iam-condition-keys.html#ck_PolicyARN,Filters access by the ARN of an IAM policy,ARN
702,iam:RegisterSecurityKey,https://docs.aws.amazon.com/IAM/latest/UserGuide/reference_policies_iam-condition-keys.html#ck_RegisterSecurityKey,Filters access by the current state of MFA device enablement,String
703,cloud9:Permissions,https://docs.aws.amazon.com/IAM/latest/UserGuide/list_awscloud9.html##awscloud9-cloud9_Permissions,Filters access by the type of AWS Cloud9 permissions,String
704,iam:ResourceTag/${TagKey},"",Filters access by actions based on tag-value associated with the resource,String
705,cloud9:SubnetId,https://docs.aws.amazon.com/IAM/latest/UserGuide/list_awscloud9.html##awscloud9-cloud9_SubnetId,Filters access by the subnet ID that the AWS Cloud9 environment will be created in,String
706,cloud9:UserArn,https://docs.aws.amazon.com/IAM/latest/UserGuide/list_awscloud9.html##awscloud9-cloud9_UserArn,Filters access by the user ARN specified,ARN
707,cloudformation:ChangeSetName,https://docs.aws.amazon.com/AWSCloudFormation/latest/UserGuide/using-iam-template.html#using-iam-template-conditions,Filters access by an AWS CloudFormation change set name. Use to control which change sets IAM users can execute or delete,String
708,cloudformation:ImportResourceTypes,https://docs.aws.amazon.com/AWSCloudFormation/latest/UserGuide/using-iam-template.html#using-iam-template-conditions,"Filters access by the template resource types, such as AWS::EC2::Instance. Use to control which resource types IAM users can work with when they want to import a resource into a stack",String
709,identitystore:UserId,https://docs.aws.amazon.com/singlesignon/latest/,Filters access by IAM Identity Center User ID,String
710,cloudformation:ResourceTypes,https://docs.aws.amazon.com/AWSCloudFormation/latest/UserGuide/using-iam-template.html#using-iam-template-conditions,"Filters access by the template resource types, such as AWS::EC2::Instance. Use to control which resource types IAM users can work with when they create or update a stack",ArrayOfString
711,cloudformation:RoleArn,https://docs.aws.amazon.com/AWSCloudFormation/latest/UserGuide/using-iam-template.html#using-iam-template-conditions,Filters access by the ARN of an IAM service role. Use to control which service role IAM users can use to work with stacks or change sets,ARN
712,cloudformation:StackPolicyUrl,https://docs.aws.amazon.com/AWSCloudFormation/latest/UserGuide/using-iam-template.html#using-iam-template-conditions,Filters access by an Amazon S3 stack policy URL. Use to control which stack policies IAM users can associate with a stack during a create or update stack action,String
713,cloudformation:TargetRegion,https://docs.aws.amazon.com/AWSCloudFormation/latest/UserGuide/using-iam-template.html#using-iam-template-conditions,Filters access by stack set target region. Use to control which regions IAM users can use when they create or update stack sets,ArrayOfString
714,cloudformation:TemplateUrl,https://docs.aws.amazon.com/AWSCloudFormation/latest/UserGuide/using-iam-template.html#using-iam-template-conditions,Filters access by an Amazon S3 template URL. Use to control which templates IAM users can use when they create or update stacks,String
715,cloudshell:SecurityGroupIds,https://docs.aws.amazon.com/cloudshell/latest/userguide/aws-cloudshell-vpc-permissions-1.html#vpc-condition-keys-examples-1,Filters access by security group ids. Available during CreateEnvironment operation,ArrayOfString
716,imagebuilder:CreatedResourceTag/<key>,https://docs.aws.amazon.com/imagebuilder/latest/userguide/security_iam_service-with-iam.html#image-builder-security-createdresourcetag,Filters access by the tag key-value pairs attached to the resource created by Image Builder,String
717,cloudshell:SubnetIds,https://docs.aws.amazon.com/cloudshell/latest/userguide/aws-cloudshell-vpc-permissions-1.html#vpc-condition-keys-examples-1,Filters access by subnet ids. Available during CreateEnvironment operation,ArrayOfString
718,cloudshell:VpcIds,https://docs.aws.amazon.com/cloudshell/latest/userguide/aws-cloudshell-vpc-permissions-1.html#vpc-condition-keys-examples-1,Filters access by vpc ids. Available during CreateEnvironment operation,ArrayOfString
719,cloudwatch:AlarmActions,https://docs.aws.amazon.com/AmazonCloudWatch/latest/monitoring/iam-cw-condition-keys-alarm-actions.html,Filters actions based on defined alarm actions,ArrayOfString
720,imagebuilder:CreatedResourceTagKeys,https://docs.aws.amazon.com/imagebuilder/latest/userguide/security_iam_service-with-iam.html#image-builder-security-createdresourcetagkeys,Filters access by the presence of tag keys in the request,ArrayOfString
721,imagebuilder:Ec2MetadataHttpTokens,https://docs.aws.amazon.com/imagebuilder/latest/userguide/security_iam_service-with-iam.html#image-builder-security-ec2metadatahttptokens,Filters access by the EC2 Instance Metadata HTTP Token Requirement specified in the request,String
722,imagebuilder:LifecyclePolicyResourceType,https://docs.aws.amazon.com/imagebuilder/latest/userguide/security_iam_service-with-iam.html#image-builder-security-ec2metadatahttptokens,Filters access by the Lifecycle Policy Resource Type specified in the request,String
723,imagebuilder:StatusTopicArn,https://docs.aws.amazon.com/imagebuilder/latest/userguide/security_iam_service-with-iam.html#image-builder-security-statustopicarn,Filters access by the SNS Topic Arn in the request to which terminal state notifications will be published,ARN
724,inspector2:Cis Scan Configuration,,,
725,inspector2:Filter,,,
726,iot:ClientMode,https://docs.aws.amazon.com/service-authorization/latest/reference/list_awsiot.html,Filters access by the mode of the client for IoT Tunnel,String
727,cloudwatch:namespace,https://docs.aws.amazon.com/AmazonCloudWatch/latest/monitoring/iam-cw-condition-keys-namespace.html,Filters actions based on the presence of optional namespace values,String
728,iot:Delete,https://docs.aws.amazon.com/service-authorization/latest/reference/list_awsiot.html,Filters access by a flag indicating whether or not to also delete an IoT Tunnel immediately when making iot:CloseTunnel request,Bool
729,cloudwatch:requestInsightRuleLogGroups,https://docs.aws.amazon.com/AmazonCloudWatch/latest/monitoring/iam-cw-condition-keys-contributor.html,Filters actions based on the Log Groups specified in an Insight Rule,ArrayOfString
730,cloudwatch:requestManagedResourceARNs,https://docs.aws.amazon.com/AmazonCloudWatch/latest/monitoring/iam-cw-condition-keys-contributor.html,Filters access by the Resource ARNs specified in a managed Insight Rule,ArrayOfARN
731,codecommit:References,https://docs.aws.amazon.com/codecommit/latest/userguide/how-to-conditional-branch.html,Filters access by Git reference to specified AWS CodeCommit actions,String
732,iot:DomainName,https://docs.aws.amazon.com/service-authorization/latest/reference/list_awsiot.html,Filters access by based on the domain name of an IoT DomainConfiguration,String
733,iot:JobId,https://docs.aws.amazon.com/service-authorization/latest/reference/list_awsiot.html,Filters access by jobId for iotjobsdata:DescribeJobExecution and iotjobsdata:UpdateJobExecution APIs,String
734,iot:ThingGroupArn,https://docs.aws.amazon.com/service-authorization/latest/reference/list_awsiot.html,Filters access by a list of IoT Thing Group ARNs that the destination IoT Thing belongs to for an IoT Tunnel,ArrayOfARN
735,iot:TunnelDestinationService,https://docs.aws.amazon.com/service-authorization/latest/reference/list_awsiot.html,Filters access by a list of destination services for an IoT Tunnel,ArrayOfString
736,iotanalytics:ResourceTag/${TagKey},https://docs.aws.amazon.com/iotanalytics/latest/userguide/tagging.html#tagging-iam,Filters access by the tag key-value pairs attached to the resource,String
737,iotevents:keyValue,https://docs.aws.amazon.com/iotevents/latest/developerguide/security_iam_id-based-policy-examples.html#security_iam_service-with-iam-id-based-policies-conditionkeys,Filters access by the instanceId (key-value) of the message,String
738,iotfleetwise:DestinationArn,https://docs.aws.amazon.com/service-authorization/latest/reference/list_awsiotfleetwise.html,"Filters access by campaign destination ARN, eg. an S3 bucket ARN or a Timestream ARN",ARN
739,iotfleetwise:UpdateToDecoderManifestArn,https://docs.aws.amazon.com/service-authorization/latest/reference/list_awsiotfleetwise.html,Filters access by a list of IoT FleetWise Decoder Manifest ARNs,ARN
740,codeconnections:Branch,https://docs.aws.amazon.com/dtconsole/latest/userguide/security-iam.html#permissions-reference-connections-handshake,Filters access by the branch name that is passed in the request,String
741,iotfleetwise:UpdateToModelManifestArn,https://docs.aws.amazon.com/service-authorization/latest/reference/list_awsiotfleetwise.html,Filters access by a list of IoT FleetWise Model Manifest ARNs,ARN
742,codeconnections:BranchName,https://docs.aws.amazon.com/dtconsole/latest/userguide/security-iam.html#permissions-reference-connections-use,Filters access by the branch name that is passed in the request. Applies only to UseConnection requests for access to a specific repository branch,String
