condition_key_id,name,reference_url,description,type
223,rds:BackupTarget,https://docs.aws.amazon.com/AmazonRDS/latest/UserGuide/security_iam_service-with-iam.html#UsingWithRDS.IAM.Conditions,"Filters access by the type of backup target. One of: region, outposts",String
224,rds:CopyOptionGroup,https://docs.aws.amazon.com/AmazonRDS/latest/UserGuide/security_iam_service-with-iam.html#UsingWithRDS.IAM.Conditions,Filters access by the value that specifies whether the CopyDBSnapshot action requires copying the DB option group,Bool
225,rds:DatabaseClass,https://docs.aws.amazon.com/AmazonRDS/latest/UserGuide/security_iam_service-with-iam.html#UsingWithRDS.IAM.Conditions,Filters access by the type of DB instance class,String
226,rds:DatabaseEngine,https://docs.aws.amazon.com/AmazonRDS/latest/UserGuide/security_iam_service-with-iam.html#UsingWithRDS.IAM.Conditions,Filters access by the database engine. For possible values refer to the engine parameter in CreateDBInstance API,String
227,rds:DatabaseName,https://docs.aws.amazon.com/AmazonRDS/latest/UserGuide/security_iam_service-with-iam.html#UsingWithRDS.IAM.Conditions,Filters access by the user-defined name of the database on the DB instance,String
228,rds:EndpointType,https://docs.aws.amazon.com/AmazonRDS/latest/UserGuide/security_iam_service-with-iam.html#UsingWithRDS.IAM.Conditions,"Filters access by the type of the endpoint. One of: READER, WRITER, CUSTOM",String
229,rds:ManageMasterUserPassword,https://docs.aws.amazon.com/AmazonRDS/latest/UserGuide/security_iam_service-with-iam.html#UsingWithRDS.IAM.Conditions,Filters access by the value that specifies whether RDS manages master user password in AWS Secrets Manager for the DB instance or cluster,Bool
230,rds:MultiAz,https://docs.aws.amazon.com/AmazonRDS/latest/UserGuide/security_iam_service-with-iam.html#UsingWithRDS.IAM.Conditions,"Filters access by the value that specifies whether the DB instance runs in multiple Availability Zones. To indicate that the DB instance is using Multi-AZ, specify true",Bool
231,rds:Piops,https://docs.aws.amazon.com/AmazonRDS/latest/UserGuide/security_iam_service-with-iam.html#UsingWithRDS.IAM.Conditions,"Filters access by the value that contains the number of Provisioned IOPS (PIOPS) that the instance supports. To indicate a DB instance that does not have PIOPS enabled, specify 0",Numeric
232,rds:StorageEncrypted,https://docs.aws.amazon.com/AmazonRDS/latest/UserGuide/security_iam_service-with-iam.html#UsingWithRDS.IAM.Conditions,"Filters access by the value that specifies whether the DB instance storage should be encrypted. To enforce storage encryption, specify true",Bool
233,rds:StorageSize,https://docs.aws.amazon.com/AmazonRDS/latest/UserGuide/security_iam_service-with-iam.html#UsingWithRDS.IAM.Conditions,Filters access by the storage volume size (in GB),Numeric
234,rds:TenantDatabaseName,https://docs.aws.amazon.com/AmazonRDS/latest/UserGuide/security_iam_service-with-iam.html#UsingWithRDS.IAM.Conditions,Filters access by the tenant database name in CreateTenantDatabase and by the new tenant database name in ModifyTenantDatabase,String
235,rds:Vpc,https://docs.aws.amazon.com/AmazonRDS/latest/UserGuide/security_iam_service-with-iam.html#UsingWithRDS.IAM.Conditions,"Filters access by the value that specifies whether the DB instance runs in an Amazon Virtual Private Cloud (Amazon VPC). To indicate that the DB instance runs in an Amazon VPC, specify true",Bool
236,rds:cluster-pg-tag/${TagKey},https://docs.aws.amazon.com/AmazonRDS/latest/UserGuide/security_iam_service-with-iam.html#UsingWithRDS.IAM.Conditions,Filters access by the tag attached to a DB cluster parameter group,String
237,rds:cluster-snapshot-tag/${TagKey},https://docs.aws.amazon.com/AmazonRDS/latest/UserGuide/security_iam_service-with-iam.html#UsingWithRDS.IAM.Conditions,Filters access by the tag attached to a DB cluster snapshot,String
238,rds:cluster-tag/${TagKey},https://docs.aws.amazon.com/AmazonRDS/latest/UserGuide/security_iam_service-with-iam.html#UsingWithRDS.IAM.Conditions,Filters access by the tag attached to a DB cluster,String
239,rds:db-tag/${TagKey},https://docs.aws.amazon.com/AmazonRDS/latest/UserGuide/security_iam_service-with-iam.html#UsingWithRDS.IAM.Conditions,Filters access by the tag attached to a DB instance,String
240,rds:es-tag/${TagKey},https://docs.aws.amazon.com/AmazonRDS/latest/UserGuide/security_iam_service-with-iam.html#UsingWithRDS.IAM.Conditions,Filters access by the tag attached to an event subscription,String
241,rds:og-tag/${TagKey},https://docs.aws.amazon.com/AmazonRDS/latest/UserGuide/security_iam_service-with-iam.html#UsingWithRDS.IAM.Conditions,Filters access by the tag attached to a DB option group,String
242,rds:pg-tag/${TagKey},https://docs.aws.amazon.com/AmazonRDS/latest/UserGuide/security_iam_service-with-iam.html#UsingWithRDS.IAM.Conditions,Filters access by the tag attached to a DB parameter group,String
243,rds:req-tag/${TagKey},https://docs.aws.amazon.com/AmazonRDS/latest/UserGuide/security_iam_service-with-iam.html#UsingWithRDS.IAM.Conditions,Filters access by the set of tag keys and values that can be used to tag a resource,String
244,rds:ri-tag/${TagKey},https://docs.aws.amazon.com/AmazonRDS/latest/UserGuide/security_iam_service-with-iam.html#UsingWithRDS.IAM.Conditions,Filters access by the tag attached to a reserved DB instance,String
245,rds:secgrp-tag/${TagKey},https://docs.aws.amazon.com/AmazonRDS/latest/UserGuide/security_iam_service-with-iam.html#UsingWithRDS.IAM.Conditions,Filters access by the tag attached to a DB security group,String
246,rds:snapshot-tag/${TagKey},https://docs.aws.amazon.com/AmazonRDS/latest/UserGuide/security_iam_service-with-iam.html#UsingWithRDS.IAM.Conditions,Filters access by the tag attached to a DB snapshot,String
247,rds:subgrp-tag/${TagKey},https://docs.aws.amazon.com/AmazonRDS/latest/UserGuide/security_iam_service-with-iam.html#UsingWithRDS.IAM.Conditions,Filters access by the tag attached to a DB subnet group,String
248,redshift-data:glue-catalog-arn,https://docs.aws.amazon.com/redshift/latest/mgmt/redshift-iam-access-control-overview.html#redshift-policy-resources.conditions,Filters access by glue catalog arn,ARN
249,redshift-data:session-owner-iam-userid,https://docs.aws.amazon.com/redshift/latest/mgmt/redshift-iam-access-control-overview.html#redshift-policy-resources.conditions,Filters access by session owner iam userid,String
250,redshift-data:statement-owner-iam-userid,https://docs.aws.amazon.com/redshift/latest/mgmt/redshift-iam-access-control-overview.html#redshift-policy-resources.conditions,Filters access by statement owner iam userid,String
251,redshift-serverless:endpointAccessId,https://docs.aws.amazon.com/redshift/latest/mgmt/redshift-policy-resources.resource-permissions.html,Filters access by the endpoint access identifier,String
252,redshift-serverless:managedWorkgroupName,https://docs.aws.amazon.com/redshift/latest/mgmt/redshift-policy-resources.resource-permissions.html,Filters access by the managed workgroup identifier,String
253,redshift-serverless:namespaceId,https://docs.aws.amazon.com/redshift/latest/mgmt/redshift-policy-resources.resource-permissions.html,Filters access by the namespace identifier,String
254,redshift-serverless:recoveryPointId,https://docs.aws.amazon.com/redshift/latest/mgmt/redshift-policy-resources.resource-permissions.html,Filters access by the recovery point identifier,String
255,redshift-serverless:snapshotId,https://docs.aws.amazon.com/redshift/latest/mgmt/redshift-policy-resources.resource-permissions.html,Filters access by the snapshot identifier,String
256,redshift-serverless:tableRestoreRequestId,https://docs.aws.amazon.com/redshift/latest/mgmt/redshift-policy-resources.resource-permissions.html,Filters access by the table restore request identifier,String
257,redshift-serverless:workgroupId,https://docs.aws.amazon.com/redshift/latest/mgmt/redshift-policy-resources.resource-permissions.html,Filters access by the workgroup identifier,String
258,redshift:AllowWrites,https://docs.aws.amazon.com/redshift/latest/mgmt/redshift-iam-access-control-overview.html#redshift-policy-resources.conditions,Filters access by the allowWrites input parameter,Bool
259,redshift:ConsumerArn,https://docs.aws.amazon.com/redshift/latest/mgmt/redshift-iam-access-control-overview.html#redshift-policy-resources.conditions,Filters access by the datashare consumer arn,ARN
260,redshift:ConsumerIdentifier,https://docs.aws.amazon.com/redshift/latest/mgmt/redshift-iam-access-control-overview.html#redshift-policy-resources.conditions,Filters access by the datashare consumer,String
261,redshift:DbName,https://docs.aws.amazon.com/redshift/latest/mgmt/redshift-iam-access-control-overview.html#redshift-policy-resources.conditions,Filters access by the database name,String
262,redshift:DbUser,https://docs.aws.amazon.com/redshift/latest/mgmt/redshift-iam-access-control-overview.html#redshift-policy-resources.conditions,Filters access by the database user name,String
263,redshift:DurationSeconds,https://docs.aws.amazon.com/redshift/latest/mgmt/redshift-iam-access-control-overview.html#redshift-policy-resources.conditions,Filters access by the number of seconds until a temporary credential set expires,String
264,redshift:InboundIntegrationArn,https://docs.aws.amazon.com/redshift/latest/mgmt/redshift-iam-access-control-overview.html#redshift-policy-resources.conditions,Filters access by the ARN of an inbound zero-ETL Integration resource,ARN
265,redshift:IntegrationSourceArn,https://docs.aws.amazon.com/redshift/latest/mgmt/redshift-iam-access-control-overview.html#redshift-policy-resources.conditions,Filters access by the ARN of a zero-ETL Integration source,ARN
266,redshift:IntegrationTargetArn,https://docs.aws.amazon.com/redshift/latest/mgmt/redshift-iam-access-control-overview.html#redshift-policy-resources.conditions,Filters access by the ARN of a zero-ETL Integration target,ARN
267,refactor-spaces:ApplicationCreatedByAccount,https://docs.aws.amazon.com/migrationhub-refactor-spaces/latest/userguide/security_iam_service-with-iam.html#security_iam_service-with-iam-id-based-policies-conditionkeys,Filters access by restricting the action to only those accounts that created the application within an environment,String
268,refactor-spaces:CreatedByAccountIds,https://docs.aws.amazon.com/migrationhub-refactor-spaces/latest/userguide/security_iam_service-with-iam.html#security_iam_service-with-iam-id-based-policies-conditionkeys,Filters access by the accounts that created the resource,ArrayOfString
269,refactor-spaces:RouteCreatedByAccount,https://docs.aws.amazon.com/migrationhub-refactor-spaces/latest/userguide/security_iam_service-with-iam.html#security_iam_service-with-iam-id-based-policies-conditionkeys,Filters access by restricting the action to only those accounts that created the route within an application,String
270,refactor-spaces:ServiceCreatedByAccount,https://docs.aws.amazon.com/migrationhub-refactor-spaces/latest/userguide/security_iam_service-with-iam.html#security_iam_service-with-iam-id-based-policies-conditionkeys,Filters access by restricting the action to only those accounts that created the service within an application,String
271,refactor-spaces:SourcePath,https://docs.aws.amazon.com/migrationhub-refactor-spaces/latest/userguide/security_iam_service-with-iam.html#security_iam_service-with-iam-id-based-policies-conditionkeys,Filters access by the path of the route,String
272,resource-explorer-2:Operation,https://docs.aws.amazon.com/service-authorization/latest/reference/list_awsresourceexplorer.html,"Filters access by the actual operation that is being invoked, available values: Search, ListResources",String
273,route53-recovery-cluster:AllowSafetyRulesOverrides,https://docs.aws.amazon.com/routing-control/latest/APIReference/API_UpdateRoutingControlState.html,Override safety rules to allow routing control state updates,Bool
274,route53:ChangeResourceRecordSetsActions,https://docs.aws.amazon.com/Route53/latest/DeveloperGuide/specifying-conditions-route53.html#route53_rrsetConditionKeys,"Filters access by the change actions, CREATE, UPSERT, or DELETE, in a ChangeResourceRecordSets request",ArrayOfString
275,route53:ChangeResourceRecordSetsNormalizedRecordNames,https://docs.aws.amazon.com/Route53/latest/DeveloperGuide/specifying-conditions-route53.html#route53_rrsetConditionKeys,Filters access by the normalized DNS record names in a ChangeResourceRecordSets request,ArrayOfString
276,route53:ChangeResourceRecordSetsRecordTypes,https://docs.aws.amazon.com/Route53/latest/DeveloperGuide/specifying-conditions-route53.html#route53_rrsetConditionKeys,Filters access by the DNS record types in a ChangeResourceRecordSets request,ArrayOfString
277,route53:VPCs,https://docs.aws.amazon.com/Route53/latest/DeveloperGuide/specifying-conditions-route53.html#route53_rrsetConditionKeys,Filters access by VPCs in request,ArrayOfString
278,s3-object-lambda:TlsVersion,https://docs.aws.amazon.com/AmazonS3/latest/API/bucket-policy-s3-sigv4-conditions.html,Filters access by the TLS version used by the client,Numeric
279,s3-object-lambda:authType,https://docs.aws.amazon.com/AmazonS3/latest/API/bucket-policy-s3-sigv4-conditions.html,Filters access by authentication method,String
280,s3-object-lambda:signatureAge,https://docs.aws.amazon.com/AmazonS3/latest/API/bucket-policy-s3-sigv4-conditions.html,Filters access by the age in milliseconds of the request signature,Numeric
281,s3-object-lambda:versionid,https://docs.aws.amazon.com/AmazonS3/latest/dev/amazon-s3-policy-keys.html/#getobjectversion-limit-access-to-specific-version-3,Filters access by a specific object version,String
282,s3-outposts:AccessPointNetworkOrigin,https://docs.aws.amazon.com/AmazonS3/latest/userguide/creating-access-points.html#access-points-policies,Filters access by the network origin (Internet or VPC),String
283,s3-outposts:DataAccessPointAccount,https://docs.aws.amazon.com/AmazonS3/latest/userguide/creating-access-points.html#access-points-policies,Filters access by the AWS Account ID that owns the access point,String
284,s3-outposts:DataAccessPointArn,"",Filters access by an access point Amazon Resource Name (ARN),ARN
285,s3-outposts:ExistingObjectTag/<key>,https://docs.aws.amazon.com/AmazonS3/latest/userguide/object-tagging.html#tagging-and-policies,Filters access by requiring that an existing object tag has a specific tag key and value,String
286,s3-outposts:RequestObjectTag/<key>,https://docs.aws.amazon.com/AmazonS3/latest/userguide/object-tagging.html#tagging-and-policies,Filters access by restricting the tag keys and values allowed on objects,String
287,s3-outposts:RequestObjectTagKeys,https://docs.aws.amazon.com/AmazonS3/latest/userguide/object-tagging.html#tagging-and-policies,Filters access by restricting the tag keys allowed on objects,String
288,s3-outposts:authType,https://docs.aws.amazon.com/AmazonS3/latest/API/bucket-policy-s3-sigv4-conditions.html,Filters access by restricting incoming requests to a specific authentication method,String
289,s3-outposts:delimiter,https://docs.aws.amazon.com/AmazonS3/latest/userguide/walkthrough1.html,Filters access by requiring the delimiter parameter,String
290,s3-outposts:max-keys,https://docs.aws.amazon.com/AmazonS3/latest/userguide/amazon-s3-policy-keys.html#example-numeric-condition-operators,Filters access by limiting the maximum number of keys returned in a ListBucket request,Numeric
291,s3-outposts:prefix,https://docs.aws.amazon.com/AmazonS3/latest/userguide/amazon-s3-policy-keys.html#condition-key-bucket-ops-2,Filters access by key name prefix,String
292,s3-outposts:signatureAge,https://docs.aws.amazon.com/AmazonS3/latest/API/bucket-policy-s3-sigv4-conditions.html,"Filters access by identifying the length of time, in milliseconds, that a signature is valid in an authenticated request",Numeric
293,s3-outposts:signatureversion,https://docs.aws.amazon.com/AmazonS3/latest/API/bucket-policy-s3-sigv4-conditions.html,Filters access by identifying the version of AWS Signature that is supported for authenticated requests,String
294,s3-outposts:versionid,https://docs.aws.amazon.com/AmazonS3/latest/userguide/amazon-s3-policy-keys.html#getobjectversion-limit-access-to-specific-version-3,Filters access by a specific object version,String
295,s3-outposts:x-amz-acl,https://docs.aws.amazon.com/AmazonS3/latest/userguide/acl-overview.html#permissions,Filters access by requiring the x-amz-acl header with a specific canned ACL in a request,String
296,s3-outposts:x-amz-content-sha256,https://docs.aws.amazon.com/AmazonS3/latest/API/bucket-policy-s3-sigv4-conditions.html,Filters access by disallowing unsigned content in your bucket,String
297,s3-outposts:x-amz-copy-source,https://docs.aws.amazon.com/AmazonS3/latest/userguide/amazon-s3-policy-keys.html#putobject-limit-copy-source-3,"Filters access by restricting the copy source to a specific bucket, prefix, or object",String
298,s3-outposts:x-amz-metadata-directive,https://docs.aws.amazon.com/AmazonS3/latest/API/API_CopyObject.html,Filters access by enabling enforcement of object metadata behavior (COPY or REPLACE) when objects are copied,String
299,s3-outposts:x-amz-server-side-encryption,https://docs.aws.amazon.com/AmazonS3/latest/userguide/UsingServerSideEncryption.html,Filters access by requiring server-side encryption,String
300,s3-outposts:x-amz-storage-class,https://docs.aws.amazon.com/AmazonS3/latest/userguide/storage-class-intro.html#sc-howtoset,Filters access by storage class,String
301,s3:AccessGrantsInstanceArn,https://docs.aws.amazon.com/IAM/latest/UserGuide/access-grants-instance.html,Filters access by access grants instance ARN,ARN
302,s3:AccessPointNetworkOrigin,https://docs.aws.amazon.com/AmazonS3/latest/userguide/creating-access-points.html#access-points-policies,Filters access by the network origin (Internet or VPC),String
303,s3:DataAccessPointAccount,https://docs.aws.amazon.com/AmazonS3/latest/userguide/creating-access-points.html#access-points-policies,Filters access by the AWS Account ID that owns the access point,String
304,s3:DataAccessPointArn,https://docs.aws.amazon.com/AmazonS3/latest/userguide/creating-access-points.html#access-points-policies,Filters access by an access point Amazon Resource Name (ARN),ARN
305,s3:ExistingJobOperation,https://docs.aws.amazon.com/AmazonS3/latest/userguide/batch-ops-job-tags-examples.html,Filters access by operation to updating the job priority,String
306,s3:ExistingJobPriority,https://docs.aws.amazon.com/AmazonS3/latest/userguide/batch-ops-job-tags-examples.html,Filters access by priority range to cancelling existing jobs,Numeric
307,s3:ExistingObjectTag/<key>,https://docs.aws.amazon.com/AmazonS3/latest/userguide/object-tagging.html#tagging-and-policies,Filters access by existing object tag key and value,String
308,s3:InventoryAccessibleOptionalFields,https://docs.aws.amazon.com/AmazonS3/latest/userguide/example-bucket-policies.html#example-bucket-policies-s3-inventory-2,Filters access by restricting which optional metadata fields a user can add when configuring S3 Inventory reports,ArrayOfString
309,s3:JobSuspendedCause,https://docs.aws.amazon.com/AmazonS3/latest/userguide/batch-ops-job-tags-examples.html,"Filters access by a specific job suspended cause (for example, AWAITING_CONFIRMATION) to cancelling suspended jobs",String
310,s3:ObjectCreationOperation,https://docs.aws.amazon.com/AmazonS3/latest/userguide/conditional-writes-enforce.html,Filters access by whether or not the operation creates an object,Bool
311,s3:RequestJobOperation,https://docs.aws.amazon.com/AmazonS3/latest/userguide/batch-ops-job-tags-examples.html,Filters access by operation to creating jobs,String
312,s3:RequestJobPriority,https://docs.aws.amazon.com/AmazonS3/latest/userguide/batch-ops-job-tags-examples.html,Filters access by priority range to creating new jobs,Numeric
313,s3:RequestObjectTag/<key>,https://docs.aws.amazon.com/AmazonS3/latest/userguide/object-tagging.html#tagging-and-policies,Filters access by the tag keys and values to be added to objects,String
314,s3:RequestObjectTagKeys,https://docs.aws.amazon.com/AmazonS3/latest/userguide/object-tagging.html#tagging-and-policies,Filters access by the tag keys to be added to objects,ArrayOfString
315,s3:ResourceAccount,https://docs.aws.amazon.com/AmazonS3/latest/userguide/amazon-s3-policy-keys.html#example-object-resource-account,Filters access by the resource owner AWS account ID,String
316,s3:TlsVersion,https://docs.aws.amazon.com/AmazonS3/latest/userguide/amazon-s3-policy-keys.html#example-object-tls-version,Filters access by the TLS version used by the client,Numeric
317,s3:authType,https://docs.aws.amazon.com/AmazonS3/latest/API/bucket-policy-s3-sigv4-conditions.html,Filters access by authentication method,String
318,s3:delimiter,https://docs.aws.amazon.com/AmazonS3/latest/userguide/walkthrough1.html,Filters access by delimiter parameter,String
319,s3:destinationRegion,https://docs.aws.amazon.com/AmazonS3/latest/userguide/replication.html,Filters access by a specific replication destination region for targeted buckets of the AWS FIS action aws:s3:bucket-pause-replication,String
320,s3:if-match,https://docs.aws.amazon.com/AmazonS3/latest/userguide/conditional-writes-enforce.html,Filters access by the request's 'If-Match' conditional header,String
321,s3:if-none-match,https://docs.aws.amazon.com/AmazonS3/latest/userguide/conditional-writes-enforce.html,Filters access by the request's 'If-None-Match' conditional header,String
322,s3:isReplicationPauseRequest,https://docs.aws.amazon.com/fis/latest/userguide/security_iam_id-based-policy-examples.html#security-iam-policy-examples-s3,Filters access by request made via AWS FIS action aws:s3:bucket-pause-replication,Bool
323,s3:locationconstraint,https://docs.aws.amazon.com/AmazonS3/latest/userguide/amazon-s3-policy-keys.html#condition-key-bucket-ops-1,Filters access by a specific Region,String
324,s3:max-keys,https://docs.aws.amazon.com/AmazonS3/latest/userguide/amazon-s3-policy-keys.html#example-numeric-condition-operators,Filters access by maximum number of keys returned in a ListBucket request,Numeric
325,s3:object-lock-legal-hold,https://docs.aws.amazon.com/AmazonS3/latest/userguide/object-lock-overview.html#object-lock-legal-holds,Filters access by object legal hold status,String
326,s3:object-lock-mode,https://docs.aws.amazon.com/AmazonS3/latest/userguide/object-lock-overview.html#object-lock-retention-modes,Filters access by object retention mode (COMPLIANCE or GOVERNANCE),String
327,a4b:amazonId,https://docs.aws.amazon.com/a4b/latest/APIReference/API_RegisterAVSDevice.html,Filters actions based on the Amazon Id in the request,String
328,s3:object-lock-remaining-retention-days,https://docs.aws.amazon.com/AmazonS3/latest/userguide/object-lock-managing.html#object-lock-managing-retention-limits,Filters access by remaining object retention days,Numeric
329,s3:object-lock-retain-until-date,https://docs.aws.amazon.com/AmazonS3/latest/userguide/object-lock-overview.html#object-lock-retention-periods,Filters access by object retain-until date,Date
330,s3:prefix,https://docs.aws.amazon.com/AmazonS3/latest/userguide/amazon-s3-policy-keys.html#condition-key-bucket-ops-2,Filters access by key name prefix,String
331,s3:signatureAge,https://docs.aws.amazon.com/AmazonS3/latest/API/bucket-policy-s3-sigv4-conditions.html,Filters access by the age in milliseconds of the request signature,Numeric
332,s3:signatureversion,https://docs.aws.amazon.com/AmazonS3/latest/API/bucket-policy-s3-sigv4-conditions.html,Filters access by the version of AWS Signature used on the request,String
333,s3:versionid,https://docs.aws.amazon.com/AmazonS3/latest/userguide/amazon-s3-policy-keys.html#getobjectversion-limit-access-to-specific-version-3,Filters access by a specific object version,String
334,s3:x-amz-acl,https://docs.aws.amazon.com/AmazonS3/latest/userguide/acl-overview.html#permissions,Filters access by canned ACL in the request's x-amz-acl header,String
335,s3:x-amz-content-sha256,https://docs.aws.amazon.com/AmazonS3/latest/API/bucket-policy-s3-sigv4-conditions.html,Filters access by unsigned content in your bucket,String
336,s3:x-amz-copy-source,https://docs.aws.amazon.com/AmazonS3/latest/userguide/amazon-s3-policy-keys.html#putobject-limit-copy-source-3,"Filters access by copy source bucket, prefix, or object in the copy object requests",String
337,a4b:filters_deviceType,https://docs.aws.amazon.com/a4b/latest/APIReference/API_SearchDevices.html,Filters actions based on the device type in the request,ArrayOfString
338,s3:x-amz-grant-full-control,https://docs.aws.amazon.com/AmazonS3/latest/userguide/acl-overview.html#permissions,Filters access by x-amz-grant-full-control (full control) header,String
339,account:AccountResourceOrgPaths,https://docs.aws.amazon.com/accounts/latest/reference/security_iam_service-with-iam.html#security_iam_service-with-iam-id-based-policies-conditionkeys,Filters access by the resource path for an account in an organization,ArrayOfString
340,account:AccountResourceOrgTags/${TagKey},https://docs.aws.amazon.com/accounts/latest/reference/security_iam_service-with-iam.html#security_iam_service-with-iam-id-based-policies-conditionkeys,Filters access by resource tags for an account in an organization,String
341,account:AlternateContactTypes,https://docs.aws.amazon.com/accounts/latest/reference/security_iam_service-with-iam.html#security_iam_service-with-iam-id-based-policies-conditionkeys,Filters access by alternate contact types,ArrayOfString
342,account:EmailTargetDomain,https://docs.aws.amazon.com/accounts/latest/reference/security_iam_service-with-iam.html#security_iam_service-with-iam-id-based-policies-conditionkeys,Filters access by email domain of the target email address,String
