condition_key_id,name,reference_url,description,type
606,ec2:Phase2DHGroup,https://docs.aws.amazon.com/vpn/latest/s2svpn/vpn-authentication-access-control.html,Filters access by the Diffie-Hellman group numbers that are permitted for a VPN tunnel for the phase 2 IKE negotiations,ArrayOfString
607,ec2:Phase2EncryptionAlgorithms,https://docs.aws.amazon.com/vpn/latest/s2svpn/vpn-authentication-access-control.html,Filters access by the encryption algorithms that are permitted for a VPN tunnel for the phase 2 IKE negotiations,ArrayOfString
608,ec2:Phase2IntegrityAlgorithms,https://docs.aws.amazon.com/vpn/latest/s2svpn/vpn-authentication-access-control.html,Filters access by the integrity algorithms that are permitted for a VPN tunnel for the phase 2 IKE negotiations,ArrayOfString
609,ec2:Phase2LifetimeSeconds,https://docs.aws.amazon.com/vpn/latest/s2svpn/vpn-authentication-access-control.html,Filters access by the lifetime in seconds for phase 2 of the IKE negotiations for a VPN tunnel,Numeric
610,ec2:PlacementGroup,https://docs.aws.amazon.com/AWSEC2/latest/UserGuide/iam-policies-for-amazon-ec2.html#amazon-ec2-keys,Filters access by the ARN of the placement group,ARN
611,ec2:PlacementGroupName,iam-policies-for-amazon-ec2.html#imageId-key,Filters access by the name of a placement group,String
612,ec2:PlacementGroupStrategy,https://docs.aws.amazon.com/AWSEC2/latest/UserGuide/iam-policies-for-amazon-ec2.html#amazon-ec2-keys,"Filters access by the instance placement strategy used by the placement group (cluster, spread, or partition)",String
613,ec2:ProductCode,https://docs.aws.amazon.com/AWSEC2/latest/UserGuide/iam-policies-for-amazon-ec2.html#amazon-ec2-keys,Filters access by the product code that is associated with the AMI,String
614,ec2:Public,https://docs.aws.amazon.com/AWSEC2/latest/UserGuide/iam-policies-for-amazon-ec2.html#amazon-ec2-keys,Filters access by whether the image has public launch permissions,Bool
615,ec2:PublicIpAddress,https://docs.aws.amazon.com/AWSEC2/latest/UserGuide/iam-policies-for-amazon-ec2.html#amazon-ec2-keys,Filters access by a public IP address,String
616,ec2:Quantity,https://docs.aws.amazon.com/AWSEC2/latest/UserGuide/iam-policies-for-amazon-ec2.html#amazon-ec2-keys,Filters access by the number of Dedicated Hosts in a request,Numeric
617,ec2:Region,https://docs.aws.amazon.com/AWSEC2/latest/UserGuide/iam-policies-for-amazon-ec2.html#amazon-ec2-keys,Filters access by the name of the AWS Region,String
618,ec2:RekeyFuzzPercentage,https://docs.aws.amazon.com/vpn/latest/s2svpn/vpn-authentication-access-control.html,Filters access by the percentage of increase of the rekey window (determined by the rekey margin time) within which the rekey time is randomly selected for a VPN tunnel,Numeric
619,ec2:RekeyMarginTimeSeconds,https://docs.aws.amazon.com/vpn/latest/s2svpn/vpn-authentication-access-control.html,Filters access by the margin time before the phase 2 lifetime expires for a VPN tunnel,Numeric
620,ec2:Remove/group,https://docs.aws.amazon.com/AWSEC2/latest/UserGuide/iam-policies-for-amazon-ec2.html#amazon-ec2-keys,Filters access by the group being removed from a snapshot,String
621,ec2:Remove/userId,https://docs.aws.amazon.com/AWSEC2/latest/UserGuide/iam-policies-for-amazon-ec2.html#amazon-ec2-keys,Filters access by the account id being removed from a snapshot,String
622,ec2:ReplayWindowSizePackets,iam-policies-for-amazon-ec2.html#amazon-ec2-keys,Filters access by the number of packets in an IKE replay window,String
623,ec2:RequesterVpc,https://docs.aws.amazon.com/vpc/latest/peering/security-iam.html,Filters access by the ARN of a requester VPC in a VPC peering connection,ARN
624,ec2:ReservedInstancesOfferingType,https://docs.aws.amazon.com/AWSEC2/latest/UserGuide/ec2-reserved-instances.html#ri-payment-options,"Filters access by the payment option of the Reserved Instance offering (No Upfront, Partial Upfront, or All Upfront)",String
625,ec2:ResourceTag/${TagKey},https://docs.aws.amazon.com/AWSEC2/latest/UserGuide/control-access-with-tags.html,Filters access by a tag key and value pair of a resource,String
626,ec2:RoleDelivery,https://docs.aws.amazon.com/AWSEC2/latest/UserGuide/iam-policies-for-amazon-ec2.html#amazon-ec2-keys,Filters access by the version of the instance metadata service for retrieving IAM role credentials for EC2,Numeric
627,ec2:RootDeviceType,https://docs.aws.amazon.com/AWSEC2/latest/UserGuide/iam-policies-for-amazon-ec2.html#amazon-ec2-keys,Filters access by the root device type of the instance (ebs or instance-store),String
628,ec2:RouteTableID,iam-policies-for-amazon-ec2.html#imageId-key,Filters access by the ID of a route table,String
629,ec2:RoutingType,https://docs.aws.amazon.com/vpn/latest/s2svpn/vpn-authentication-access-control.html,Filters access by the routing type for the VPN connection,String
630,ec2:SamlProviderArn,https://docs.aws.amazon.com/AWSEC2/latest/UserGuide/iam-policies-for-amazon-ec2.html#amazon-ec2-keys,Filters access by the ARN of the IAM SAML identity provider,ARN
631,ec2:SecurityGroupID,iam-policies-for-amazon-ec2.html#imageId-key,Filters access by the ID of a security group,String
632,ec2:ServerCertificateArn,https://docs.aws.amazon.com/AWSEC2/latest/UserGuide/iam-policies-for-amazon-ec2.html#amazon-ec2-keys,Filters access by the ARN of the server certificate,ARN
633,ec2:SnapshotCoolOffPeriod,https://docs.aws.amazon.com/AWSEC2/latest/UserGuide/iam-policies-for-amazon-ec2.html#amazon-ec2-keys,Filters access by the compliance mode cooling-off period,Numeric
634,ec2:SnapshotID,iam-policies-for-amazon-ec2.html#imageId-key,Filters access by the ID of a snapshot,String
635,ec2:SnapshotLockDuration,https://docs.aws.amazon.com/AWSEC2/latest/UserGuide/iam-policies-for-amazon-ec2.html#amazon-ec2-keys,Filters access by the snapshot lock duration,Numeric
636,ec2:SnapshotTime,https://docs.aws.amazon.com/AWSEC2/latest/UserGuide/iam-policies-for-amazon-ec2.html#amazon-ec2-keys,Filters access by the initiation time of a snapshot,String
637,ec2:SourceAvailabilityZone,https://docs.aws.amazon.com/AWSEC2/latest/UserGuide/iam-policies-for-amazon-ec2.html#amazon-ec2-keys,Filters access by the name of the Availability Zone from which the request originated,String
638,ec2:SourceCapacityReservationId,https://docs.aws.amazon.com/AWSEC2/latest/UserGuide/iam-policies-for-amazon-ec2.html#amazon-ec2-keys,Filters access by the ID of the Capacity Reservation from which you want to move capacity,ARN
639,ec2:SourceInstanceARN,https://docs.aws.amazon.com/AWSEC2/latest/UserGuide/iam-policies-for-amazon-ec2.html#amazon-ec2-keys,Filters access by the ARN of the instance from which the request originated,ARN
640,ec2:SourceOutpostArn,https://docs.aws.amazon.com/AWSEC2/latest/UserGuide/iam-policies-for-amazon-ec2.html#amazon-ec2-keys,Filters access by the ARN of the Outpost from which the request originated,ARN
641,ec2:Subnet,https://docs.aws.amazon.com/AWSEC2/latest/UserGuide/iam-policies-for-amazon-ec2.html#amazon-ec2-keys,Filters access by the ARN of the subnet,ARN
642,ec2:SubnetID,iam-policies-for-amazon-ec2.html#imageId-key,Filters access by the ID of a subnet,String
643,ec2:Tenancy,https://docs.aws.amazon.com/AWSEC2/latest/UserGuide/iam-policies-for-amazon-ec2.html#amazon-ec2-keys,"Filters access by the tenancy of the VPC or instance (default, dedicated, or host)",String
644,ec2:VolumeID,iam-policies-for-amazon-ec2.html#imageId-key,Filters access by the ID of a volume,String
645,ec2:VolumeInitializationRate,https://docs.aws.amazon.com/AWSEC2/latest/UserGuide/iam-policies-for-amazon-ec2.html#amazon-ec2-keys,"Filters access by the initialization rate of the volume, in MiBps",Numeric
646,ec2:VolumeIops,https://docs.aws.amazon.com/AWSEC2/latest/UserGuide/iam-policies-for-amazon-ec2.html#amazon-ec2-keys,Filters access by the the number of input/output operations per second (IOPS) provisioned for the volume,Numeric
647,ec2:VolumeSize,https://docs.aws.amazon.com/AWSEC2/latest/UserGuide/iam-policies-for-amazon-ec2.html#amazon-ec2-keys,"Filters access by the size of the volume, in GiB",Numeric
648,ec2:VolumeThroughput,https://docs.aws.amazon.com/AWSEC2/latest/UserGuide/iam-policies-for-amazon-ec2.html#amazon-ec2-keys,"Filters access by the throughput of the volume, in MiBps",Numeric
649,ec2:VolumeType,https://docs.aws.amazon.com/AWSEC2/latest/UserGuide/iam-policies-for-amazon-ec2.html#amazon-ec2-keys,"Filters access by the type of volume (gp2, gp3, io1, io2, st1, sc1, or standard)",String
650,ec2:Vpc,https://docs.aws.amazon.com/AWSEC2/latest/UserGuide/iam-policies-for-amazon-ec2.html#amazon-ec2-keys,Filters access by the ARN of the VPC,ARN
651,ec2:VpcID,iam-policies-for-amazon-ec2.html#imageId-key,Filters access by the ID of a virtual private cloud (VPC),String
652,ec2:VpcPeeringConnectionID,iam-policies-for-amazon-ec2.html#imageId-key,Filters access by the ID of a VPC peering connection,String
653,ec2:VpceServiceName,https://docs.aws.amazon.com/vpc/latest/userguide/vpc-endpoints-iam.html,Filters access by the name of the VPC endpoint service,String
654,ec2:VpceServiceOwner,https://docs.aws.amazon.com/vpc/latest/userguide/vpc-endpoints-iam.html,"Filters access by the service owner of the VPC endpoint service (amazon, aws-marketplace, or an AWS account ID)",String
655,ec2:VpceServicePrivateDnsName,https://docs.aws.amazon.com/vpc/latest/userguide/vpc-endpoints-iam.html,Filters access by the private DNS name of the VPC endpoint service,String
656,ec2:osuser,https://docs.aws.amazon.com/ec2-instance-connect/latest/APIReference/API_SendSSHPublicKey.html,Filters access by specifying the default user name for the AMI that you used to launch your instance,String
657,ec2:transitGatewayAttachmentId,iam-policies-for-amazon-ec2.html#imageId-key,Filters access by the ID of a transit gateway attachment,String
658,ec2:transitGatewayConnectPeerId,iam-policies-for-amazon-ec2.html#imageId-key,Filters access by the ID of a transit gateway connect peer,String
659,ec2:transitGatewayId,iam-policies-for-amazon-ec2.html#imageId-key,Filters access by the ID of a transit gateway,String
660,ec2:transitGatewayMulticastDomainId,iam-policies-for-amazon-ec2.html#imageId-key,Filters access by the ID of a transit gateway multicast domain,String
661,ec2:transitGatewayPolicyTableId,iam-policies-for-amazon-ec2.html#imageId-key,Filters access by the ID of a transit gateway policy table,String
662,ec2:transitGatewayRouteTableAnnouncementId,iam-policies-for-amazon-ec2.html#imageId-key,Filters access by the ID of a transit gateway route table announcement,String
663,ec2:transitGatewayRouteTableId,iam-policies-for-amazon-ec2.html#imageId-key,Filters access by the ID of a transit gateway route table,String
664,ec2:vpceMultiRegion,https://docs.aws.amazon.com/vpc/latest/userguide/vpc-endpoints-iam.html,Filters access by multi region of the VPC endpoint service,String
665,ec2:vpceServiceRegion,https://docs.aws.amazon.com/vpc/latest/userguide/vpc-endpoints-iam.html,Filters access by the region of the VPC endpoint service,String
666,ec2:vpceSupportedRegion,https://docs.aws.amazon.com/vpc/latest/userguide/vpc-endpoints-iam.html,Filters access by the supported region of the VPC endpoint service,String
667,ecr-public:ResourceTag/${TagKey},https://docs.aws.amazon.com/AmazonECR/latest/userguide/security_iam_service-with-iam.html#security_iam_service-with-iam-id-based-policies-conditionkeys,Filters actions based on tag-value associated with the resource,String
668,ecr:AccountSetting,https://docs.aws.amazon.com/AmazonECR/latest/userguide/security_iam_service-with-iam.html#security_iam_service-with-iam-id-based-policies-conditionkeys,Filters access by the ECR account setting name,String
669,ecr:ResourceTag/${TagKey},https://docs.aws.amazon.com/AmazonECR/latest/userguide/security_iam_service-with-iam.html#security_iam_service-with-iam-id-based-policies-conditionkeys,Filters access by tag-value associated with the resource,String
670,ecs:CreateAction,https://docs.aws.amazon.com/IAM/latest/UserGuide/reference_policies_condition-keys.html#condition-keys-createaction,Filters access by the name of a resource-creating API action,String
671,ecs:ResourceTag/${TagKey},https://docs.aws.amazon.com/AmazonECS/latest/developerguide/security_iam_service-with-iam.html#security_iam_service-with-iam-id-based-policies,Filters access by the tag key-value pairs attached to the resource,String
672,ecs:account-setting,https://docs.aws.amazon.com/AmazonECS/latest/developerguide/security_iam_service-with-iam.html#security_iam_service-with-iam-id-based-policies-conditionkeys,Filters access by the Amazon ECS account setting name,String
673,ecs:auto-assign-public-ip,https://docs.aws.amazon.com/AmazonECS/latest/developerguide/security_iam_service-with-iam.html#security_iam_service-with-iam-id-based-policies-conditionkeys,Filters access by the public IP assignment configuration of your Amazon ECS task or Amazon ECS service that uses awsvpc network mode,Bool
674,ecs:capacity-provider,https://docs.aws.amazon.com/AmazonECS/latest/developerguide/security_iam_service-with-iam.html#security_iam_service-with-iam-id-based-policies-conditionkeys,Filters access by the ARN of an Amazon ECS capacity provider,ArrayOfARN
675,ecs:cluster,https://docs.aws.amazon.com/AmazonECS/latest/developerguide/security_iam_service-with-iam.html#security_iam_service-with-iam-id-based-policies-conditionkeys,Filters access by the ARN of an Amazon ECS cluster,ARN
676,ecs:compute-compatibility,https://docs.aws.amazon.com/AmazonECS/latest/developerguide/security_iam_service-with-iam.html#security_iam_service-with-iam-id-based-policies-conditionkeys,Filters access by the required compatibilities field provided in the request,ArrayOfString
677,ecs:container-instances,https://docs.aws.amazon.com/AmazonECS/latest/developerguide/security_iam_service-with-iam.html#security_iam_service-with-iam-id-based-policies-conditionkeys,Filters access by the ARN of an Amazon ECS container instance,ARN
678,ecs:container-name,https://docs.aws.amazon.com/AmazonECS/latest/developerguide/security_iam_service-with-iam.html#security_iam_service-with-iam-id-based-policies-conditionkeys,Filters access by the name of an Amazon ECS container which is defined in the ECS task definition,String
679,ecs:enable-ebs-volumes,https://docs.aws.amazon.com/AmazonECS/latest/developerguide/security_iam_service-with-iam.html#security_iam_service-with-iam-id-based-policies-conditionkeys,Filters access by the Amazon ECS managed Amazon EBS volume capability of your ECS task or service,String
680,ecs:enable-ecs-managed-tags,https://docs.aws.amazon.com/AmazonECS/latest/developerguide/security_iam_service-with-iam.html#security_iam_service-with-iam-id-based-policies-conditionkeys,Filters access by the enableECSManagedTags configuration of your Amazon ECS task or Amazon ECS service,Bool
681,ecs:enable-execute-command,https://docs.aws.amazon.com/AmazonECS/latest/developerguide/security_iam_service-with-iam.html#security_iam_service-with-iam-id-based-policies-conditionkeys,Filters access by the execute-command capability of your Amazon ECS task or Amazon ECS service,String
682,ecs:enable-service-connect,https://docs.aws.amazon.com/AmazonECS/latest/developerguide/security_iam_service-with-iam.html#security_iam_service-with-iam-id-based-policies-conditionkeys,Filters access by the enable field value in the Service Connect configuration,String
683,ecs:enable-vpc-lattice,https://docs.aws.amazon.com/AmazonECS/latest/developerguide/security_iam_service-with-iam.html#security_iam_service-with-iam-id-based-policies-conditionkeys,Filters access by the VPC lattice capability of your Amazon ECS service,String
684,ecs:fargate-ephemeral-storage-kms-key,https://docs.aws.amazon.com/AmazonECS/latest/developerguide/security_iam_service-with-iam.html#security_iam_service-with-iam-id-based-policies-conditionkeys,Filters access by the AWS KMS key id provided in the request,String
685,ecs:namespace,https://docs.aws.amazon.com/AmazonECS/latest/developerguide/security_iam_service-with-iam.html#security_iam_service-with-iam-id-based-policies-conditionkeys,Filters access by the ARN of AWS Cloud Map namespace which is defined in the Service Connect Configuration,ARN
686,ecs:privileged,https://docs.aws.amazon.com/AmazonECS/latest/developerguide/security_iam_service-with-iam.html#security_iam_service-with-iam-id-based-policies-conditionkeys,Filters access by the privileged field provided in the request,String
687,ecs:propagate-tags,https://docs.aws.amazon.com/AmazonECS/latest/developerguide/security_iam_service-with-iam.html#security_iam_service-with-iam-id-based-policies-conditionkeys,Filters access by the tag propagation configuration of your Amazon ECS task or Amazon ECS service,String
688,ecs:service,https://docs.aws.amazon.com/AmazonECS/latest/developerguide/security_iam_service-with-iam.html#security_iam_service-with-iam-id-based-policies-conditionkeys,Filters access by the ARN of an Amazon ECS service,ARN
689,ecs:subnet,https://docs.aws.amazon.com/AmazonECS/latest/developerguide/security_iam_service-with-iam.html#security_iam_service-with-iam-id-based-policies-conditionkeys,Filters access by the subnet configuration of your Amazon ECS task or Amazon ECS service that uses awsvpc network mode,ArrayOfString
690,ecs:task,https://docs.aws.amazon.com/AmazonECS/latest/developerguide/security_iam_service-with-iam.html#security_iam_service-with-iam-id-based-policies-conditionkeys,Filters access by the ARN of an Amazon ECS task,ARN
691,ecs:task-cpu,https://docs.aws.amazon.com/AmazonECS/latest/developerguide/security_iam_service-with-iam.html#security_iam_service-with-iam-id-based-policies-conditionkeys,"Filters access by the task cpu, as an integer with 1024 = 1 vCPU, provided in the request",Numeric
692,ecs:task-definition,https://docs.aws.amazon.com/AmazonECS/latest/developerguide/security_iam_service-with-iam.html#security_iam_service-with-iam-id-based-policies-conditionkeys,Filters access by the ARN of an Amazon ECS task definition,ARN
693,ecs:task-memory,https://docs.aws.amazon.com/AmazonECS/latest/developerguide/security_iam_service-with-iam.html#security_iam_service-with-iam-id-based-policies-conditionkeys,"Filters access by the task memory, as an integer representing MiB, provided in the request",Numeric
694,eks:accessEntryType,https://docs.aws.amazon.com/eks/latest/userguide/security_iam_service-with-iam.html#security_iam_service-with-iam-id-based-policies,Filters access by the access entry type present in the access entry requests the user makes to the EKS service,String
695,eks:accessScope,https://docs.aws.amazon.com/eks/latest/userguide/security_iam_service-with-iam.html#security_iam_service-with-iam-id-based-policies,Filters access by the accessScope present in the associate / disassociate access policy requests the user makes to the EKS service,String
696,eks:authenticationMode,https://docs.aws.amazon.com/eks/latest/userguide/security_iam_service-with-iam.html#security_iam_service-with-iam-id-based-policies,Filters access by the authenticationMode present in the create / update cluster request,String
697,eks:blockStorageEnabled,https://docs.aws.amazon.com/eks/latest/userguide/security_iam_service-with-iam.html#security_iam_service-with-iam-id-based-policies,Filters access by the block storage enabled parameter in the create / update cluster request,Bool
698,eks:bootstrapClusterCreatorAdminPermissions,https://docs.aws.amazon.com/eks/latest/userguide/security_iam_service-with-iam.html#security_iam_service-with-iam-id-based-policies,Filters access by the bootstrapClusterCreatorAdminPermissions present in the create cluster request,Bool
699,eks:bootstrapSelfManagedAddons,https://docs.aws.amazon.com/eks/latest/userguide/security_iam_service-with-iam.html#security_iam_service-with-iam-id-based-policies,Filters access by the bootstrapSelfManagedAddons present in the create cluster request,Bool
700,eks:clientId,https://docs.aws.amazon.com/eks/latest/userguide/security_iam_service-with-iam.html#security_iam_service-with-iam-id-based-policies,Filters access by the clientId present in the associateIdentityProviderConfig request the user makes to the EKS service,String
701,eks:clusterName,https://docs.aws.amazon.com/eks/latest/userguide/security_iam_service-with-iam.html#security_iam_service-with-iam-id-based-policies,Filters access by the clusterName present in the access entry requests the user makes to the EKS service,String
702,saml:doc,https://docs.aws.amazon.com/IAM/latest/UserGuide/reference_policies_iam-condition-keys.html#ck_doc,Filters access by on the principal that was used to assume the role,String
703,eks:computeConfigEnabled,https://docs.aws.amazon.com/eks/latest/userguide/security_iam_service-with-iam.html#security_iam_service-with-iam-id-based-policies,Filters access by the compute config enabled parameter in the create / update cluster request,Bool
704,saml:eduorghomepageuri,https://docs.aws.amazon.com/IAM/latest/UserGuide/reference_policies_iam-condition-keys.html#ck_eduorghomepageuri,Filters access by the eduOrg attribute,ArrayOfString
705,saml:eduorgidentityauthnpolicyuri,https://docs.aws.amazon.com/IAM/latest/UserGuide/reference_policies_iam-condition-keys.html#ck_aud,Filters access by the eduOrg attribute,ArrayOfString
706,saml:eduorglegalname,https://docs.aws.amazon.com/IAM/latest/UserGuide/reference_policies_iam-condition-keys.html#ck_eduorglegalname,Filters access by the eduOrg attribute,ArrayOfString
707,saml:eduorgsuperioruri,https://docs.aws.amazon.com/IAM/latest/UserGuide/reference_policies_iam-condition-keys.html#ck_eduorgsuperioruri,Filters access by the eduOrg attribute,ArrayOfString
708,saml:eduorgwhitepagesuri,https://docs.aws.amazon.com/IAM/latest/UserGuide/reference_policies_iam-condition-keys.html#ck_eduorgwhitepagesuri,Filters access by the eduOrg attribute,ArrayOfString
709,saml:edupersonaffiliation,https://docs.aws.amazon.com/IAM/latest/UserGuide/reference_policies_iam-condition-keys.html#ck_edupersonaffiliation,Filters access by the eduPerson attribute,ArrayOfString
710,eks:elasticLoadBalancingEnabled,https://docs.aws.amazon.com/eks/latest/userguide/security_iam_service-with-iam.html#security_iam_service-with-iam-id-based-policies,Filters access by the elastic load balancing enabled parameter in the create / update cluster request,Bool
711,saml:edupersonassurance,https://docs.aws.amazon.com/IAM/latest/UserGuide/reference_policies_iam-condition-keys.html#ck_edupersonassurance,Filters access by the eduPerson attribute,ArrayOfString
712,eks:issuerUrl,https://docs.aws.amazon.com/eks/latest/userguide/security_iam_service-with-iam.html#security_iam_service-with-iam-id-based-policies,Filters access by the issuerUrl present in the associateIdentityProviderConfig request the user makes to the EKS service,String
713,saml:edupersonentitlement,https://docs.aws.amazon.com/IAM/latest/UserGuide/reference_policies_iam-condition-keys.html#ck_edupersonentitlement,Filters access by the eduPerson attribute,ArrayOfString
714,eks:kubernetesGroups,https://docs.aws.amazon.com/eks/latest/userguide/security_iam_service-with-iam.html#security_iam_service-with-iam-id-based-policies,Filters access by the kubernetesGroups present in the access entry requests the user makes to the EKS service,ArrayOfString
715,eks:namespaces,https://docs.aws.amazon.com/eks/latest/userguide/security_iam_service-with-iam.html#security_iam_service-with-iam-id-based-policies,Filters access by the namespaces present in the associate / disassociate access policy requests the user makes to the EKS service,ArrayOfString
716,saml:edupersonnickname,https://docs.aws.amazon.com/IAM/latest/UserGuide/reference_policies_iam-condition-keys.html#ck_edupersonnickname,Filters access by the eduPerson attribute,ArrayOfString
717,eks:policyArn,https://docs.aws.amazon.com/eks/latest/userguide/security_iam_service-with-iam.html#security_iam_service-with-iam-id-based-policies,Filters access by the policyArn present in the access entry requests the user makes to the EKS service,ARN
718,iot:ThingGroupArn,https://docs.aws.amazon.com/service-authorization/latest/reference/list_awsiot.html,Filters access by a list of IoT Thing Group ARNs that the destination IoT Thing belongs to for an IoT Tunnel,ArrayOfARN
719,eks:principalArn,https://docs.aws.amazon.com/eks/latest/userguide/security_iam_service-with-iam.html#security_iam_service-with-iam-id-based-policies,Filters access by the principalArn present in the access entry requests requests the user makes to the EKS service,ARN
720,eks:supportType,https://docs.aws.amazon.com/eks/latest/userguide/security_iam_service-with-iam.html#security_iam_service-with-iam-id-based-policies,Filters access by the supportType present in the create / update cluster request,String
721,eks:username,https://docs.aws.amazon.com/eks/latest/userguide/security_iam_service-with-iam.html#security_iam_service-with-iam-id-based-policies,Filters access by the Kubernetes username present in the access entry requests the user makes to the EKS service,String
722,elasticache:AtRestEncryptionEnabled,,,
723,elasticache:AuthTokenEnabled,,,
724,elasticache:AutomaticFailoverEnabled,,,
725,saml:edupersonorgdn,https://docs.aws.amazon.com/IAM/latest/UserGuide/reference_policies_iam-condition-keys.html#ck_edupersonorgdn,Filters access by the eduPerson attribute,String
726,elasticache:CacheNodeType,,,
727,elasticache:CacheParameterGroupName,,,
728,elasticache:ClusterModeEnabled,,,
729,elasticache:DataStorageUnit,,,
730,iot:TunnelDestinationService,https://docs.aws.amazon.com/service-authorization/latest/reference/list_awsiot.html,Filters access by a list of destination services for an IoT Tunnel,ArrayOfString
731,iot:thingArn,https://docs.aws.amazon.com/service-authorization/latest/reference/list_awsiot.html,Filters access by the ARN of an IoT Thing,ARN
