condition_key_id,name,reference_url,description,type
932,mediaconvert:HttpsInputsAllowed,https://docs.aws.amazon.com/mediaconvert/latest/apireference/input-policies.html,Filters access by an HTTPS input policy present in the account,Bool
933,mediaconvert:S3InputsAllowed,https://docs.aws.amazon.com/mediaconvert/latest/apireference/input-policies.html,Filters access by an S3 input policy present in the account,Bool
934,memorydb:TLSEnabled,https://docs.aws.amazon.com/memorydb/latest/devguide/IAM.ConditionKeys.html#IAM.SpecifyingConditions,Filters access by the TLSEnabled parameter present in the request or defaults to true value if parameter is not present,Bool
935,memorydb:UserAuthenticationMode,https://docs.aws.amazon.com/memorydb/latest/devguide/IAM.ConditionKeys.html#IAM.SpecifyingConditions,Filters access by the UserAuthenticationMode.Type parameter in the request,String
936,mgh:AutomationRunResourceRunID,https://docs.aws.amazon.com/migrationhub/latest/ug/ContextKeys_AutomationRunResourceRunID.html,AutomationRunResource resource runID identifier,String
937,mgh:AutomationUnitResourceAutomationUnitArn,https://docs.aws.amazon.com/migrationhub/latest/ug/ContextKeys_AutomationUnitResourceAutomationUnitArn.html,AutomationUnitResource resource automationUnitArn identifier,ARN
938,cloudformation:TypeArn,https://docs.aws.amazon.com/AWSCloudFormation/latest/UserGuide/using-iam-template.html#using-iam-template-conditions,Filters access by the ARN of a CloudFormation extension,ARN
939,ecs:task-memory,https://docs.aws.amazon.com/AmazonECS/latest/developerguide/security_iam_service-with-iam.html#security_iam_service-with-iam-id-based-policies-conditionkeys,"Filters access by the task memory, as an integer representing MiB, provided in the request",Numeric
940,eks:accessEntryType,https://docs.aws.amazon.com/eks/latest/userguide/security_iam_service-with-iam.html#security_iam_service-with-iam-id-based-policies,Filters access by the access entry type present in the access entry requests the user makes to the EKS service,String
941,eks:accessScope,https://docs.aws.amazon.com/eks/latest/userguide/security_iam_service-with-iam.html#security_iam_service-with-iam-id-based-policies,Filters access by the accessScope present in the associate / disassociate access policy requests the user makes to the EKS service,String
942,eks:authenticationMode,https://docs.aws.amazon.com/eks/latest/userguide/security_iam_service-with-iam.html#security_iam_service-with-iam-id-based-policies,Filters access by the authenticationMode present in the create / update cluster request,String
943,eks:blockStorageEnabled,https://docs.aws.amazon.com/eks/latest/userguide/security_iam_service-with-iam.html#security_iam_service-with-iam-id-based-policies,Filters access by the block storage enabled parameter in the create / update cluster request,Bool
944,eks:bootstrapClusterCreatorAdminPermissions,https://docs.aws.amazon.com/eks/latest/userguide/security_iam_service-with-iam.html#security_iam_service-with-iam-id-based-policies,Filters access by the bootstrapClusterCreatorAdminPermissions present in the create cluster request,Bool
945,eks:bootstrapSelfManagedAddons,https://docs.aws.amazon.com/eks/latest/userguide/security_iam_service-with-iam.html#security_iam_service-with-iam-id-based-policies,Filters access by the bootstrapSelfManagedAddons present in the create cluster request,Bool
946,eks:clientId,https://docs.aws.amazon.com/eks/latest/userguide/security_iam_service-with-iam.html#security_iam_service-with-iam-id-based-policies,Filters access by the clientId present in the associateIdentityProviderConfig request the user makes to the EKS service,String
947,eks:clusterName,https://docs.aws.amazon.com/eks/latest/userguide/security_iam_service-with-iam.html#security_iam_service-with-iam-id-based-policies,Filters access by the clusterName present in the access entry requests the user makes to the EKS service,String
948,eks:computeConfigEnabled,https://docs.aws.amazon.com/eks/latest/userguide/security_iam_service-with-iam.html#security_iam_service-with-iam-id-based-policies,Filters access by the compute config enabled parameter in the create / update cluster request,Bool
949,eks:elasticLoadBalancingEnabled,https://docs.aws.amazon.com/eks/latest/userguide/security_iam_service-with-iam.html#security_iam_service-with-iam-id-based-policies,Filters access by the elastic load balancing enabled parameter in the create / update cluster request,Bool
950,eks:issuerUrl,https://docs.aws.amazon.com/eks/latest/userguide/security_iam_service-with-iam.html#security_iam_service-with-iam-id-based-policies,Filters access by the issuerUrl present in the associateIdentityProviderConfig request the user makes to the EKS service,String
951,cloudshell:SecurityGroupIds,https://docs.aws.amazon.com/cloudshell/latest/userguide/aws-cloudshell-vpc-permissions-1.html#vpc-condition-keys-examples-1,Filters access by security group ids. Available during CreateEnvironment operation,ArrayOfString
952,mgh:ConnectionResourceConnectionArn,https://docs.aws.amazon.com/migrationhub/latest/ug/security_iam_service-with-iam-id-based-policies-conditionkeys.html#condition-connectionresourceconnectionarn,ConnectionResource resource connectionArn identifier,String
953,mgn:CreateAction,https://docs.aws.amazon.com/mgn/latest/ug/supported-iam-actions-tagging.html,Filters access by the name of a resource-creating API action,String
954,mpa:ProtectedResourceAccount,https://docs.aws.amazon.com/mpa/latest/userguide/mpa-concepts.html,Filters access by the account that owns the resource that is the target of the operation that requires approval,String
955,mpa:RequestedOperation,https://docs.aws.amazon.com/mpa/latest/userguide/mpa-concepts.html,Filters access by a requested operation that requires team approval before it can be executed,String
956,neptune-db:QueryLanguage,https://docs.aws.amazon.com/neptune/latest/userguide/iam-data-condition-keys.html#iam-neptune-condition-keys,Filters access by graph model,String
957,neptune-graph:PublicConnectivity,https://docs.aws.amazon.com/neptune-analytics/latest/userguide/iam-condition-keys.html#publicconnectivity,"Filters access by the value of the public connectivity parameter provided in the request or its default value, if unspecified. All access to graphs is IAM authenticated",Bool
958,networkmanager:cgwArn,https://docs.aws.amazon.com/vpc/latest/tgw/nm-security-iam.html,Filters access by which customer gateways can be associated or disassociated,ARN
959,networkmanager:directConnectGatewayArn,https://docs.aws.amazon.com/vpc/latest/tgw/nm-security-iam.html,Filters access by which Direct Connect gateway can be used to a create/update attachment,ARN
960,networkmanager:edgeLocations,https://docs.aws.amazon.com/vpc/latest/tgw/nm-security-iam.html,Filters access by which edge locations can be added or removed from a Direct Connect gateway attachment,ArrayOfString
961,networkmanager:subnetArns,https://docs.aws.amazon.com/vpc/latest/tgw/nm-security-iam.html,Filters access by which VPC subnets can be added or removed from a VPC attachment,ArrayOfARN
962,networkmanager:tgwArn,https://docs.aws.amazon.com/vpc/latest/tgw/nm-security-iam.html,"Filters access by which transit gateways can be registered, deregistered, or peered",ARN
963,networkmanager:tgwConnectPeerArn,https://docs.aws.amazon.com/vpc/latest/tgw/nm-security-iam.html,Filters access by which transit gateway connect peers can be associated or disassociated,ARN
964,networkmanager:tgwRtbArn,https://docs.aws.amazon.com/vpc/latest/tgw/nm-security-iam.html,Filters access by which Transit Gateway Route Table can be used to create an attachment,ARN
965,networkmanager:vpcArn,https://docs.aws.amazon.com/vpc/latest/tgw/nm-security-iam.html,Filters access by which VPC can be used to a create/update attachment,ARN
966,networkmanager:vpnConnectionArn,https://docs.aws.amazon.com/vpc/latest/tgw/nm-security-iam.html,Filters access by which Site-to-Site VPN can be used to a create/update attachment,ARN
967,nimble:createdBy,https://docs.aws.amazon.com/nimble-studio/latest/userguide/security-iam-service-with-iam.html,Filters access by the createdBy request parameter or the ID of the creator of the resource,String
968,nimble:ownedBy,https://docs.aws.amazon.com/nimble-studio/latest/userguide/security-iam-service-with-iam.html,Filters access by the ownedBy request parameter or the ID of the owner of the resource,String
969,nimble:principalId,https://docs.aws.amazon.com/nimble-studio/latest/userguide/security-iam-service-with-iam.html,Filters access by the principalId request parameter,String
970,nimble:requesterPrincipalId,https://docs.aws.amazon.com/nimble-studio/latest/userguide/security-iam-service-with-iam.html,Filters access by the ID of the logged in user,String
971,nimble:studioId,https://docs.aws.amazon.com/nimble-studio/latest/userguide/security-iam-service-with-iam.html,Filters access by a specific studio,ARN
972,oam:ResourceTypes,https://docs.aws.amazon.com/IAM/latest/UserGuide/list_amazoncloudwatchobservabilityaccessmanager.html,Filters access by the presence of resource types in the request,ArrayOfString
973,observabilityadmin:CentralizationBackupRegion,https://docs.aws.amazon.com/AmazonCloudWatch/latest/monitoring/reference_policies_condition-keys.htmlcondition-keys-observabilityadmin.html#condition-keys-centralizationbackupregion,Filters access by the backup region that is passed in the request,String
974,observabilityadmin:CentralizationDestinationRegion,https://docs.aws.amazon.com/AmazonCloudWatch/latest/monitoring/reference_policies_condition-keys.htmlcondition-keys-observabilityadmin.html#condition-keys-centralizationdestinationregion,Filters access by the destination region that is passed in the request,String
975,observabilityadmin:CentralizationSourceRegions,https://docs.aws.amazon.com/AmazonCloudWatch/latest/monitoring/reference_policies_condition-keys.htmlcondition-keys-observabilityadmin.html#condition-keys-centralizationsourceregions,Filters access by the source regions that are passed in the request,ArrayOfString
976,observabilityadmin:SourceType,https://docs.aws.amazon.com/AmazonCloudWatch/latest/monitoring/reference_policies_condition-keys.htmlcondition-keys-observabilityadmin.html#condition-keys-sourcetype,Filters access by the source type that is passed in the request,String
977,organizations:PolicyType,https://docs.aws.amazon.com/organizations/latest/userguide/orgs_permissions_overview.html#orgs_permissions_conditionkeys,Filters access by the specified policy type names,String
978,organizations:ServicePrincipal,https://docs.aws.amazon.com/organizations/latest/userguide/orgs_permissions_overview.html#orgs_permissions_conditionkeys,Filters access by the specified service principal names,String
979,organizations:TransferDirection,https://docs.aws.amazon.com/organizations/latest/userguide/orgs_permissions_overview.html#orgs_permissions_conditionkeys,Filters access by the specified responsibility transfer by the direction,String
980,organizations:TransferType,https://docs.aws.amazon.com/organizations/latest/userguide/orgs_permissions_overview.html#orgs_permissions_conditionkeys,Filters access by the specified responsibility transfer type names,String
981,partnercentral-account-management:LegacyPartnerCentralRole,https://docs.aws.amazon.com/partner-central/latest/getting-started/controlling-access-in-apc-account-management.html,Filters access by the Legacy Partner Central role,ArrayOfString
982,partnercentral-account-management:MarketingCentralRole,https://docs.aws.amazon.com/partner-central/latest/getting-started/controlling-access-in-apc-account-management.html,Filters access by Marketing Central role,ArrayOfString
983,partnercentral:Catalog,https://docs.aws.amazon.com/partner-central/latest/getting-started/controlling-access-in-aws-partner-central.html#condition-keys-for-aws-partner-central,Filters access by a specific Catalog,String
984,partnercentral:ChannelHandshakeType,https://docs.aws.amazon.com/partner-central/latest/getting-started/controlling-access-in-aws-partner-central.html#condition-keys-for-aws-partner-central,Filters access by channel handshake types,String
985,partnercentral:FulfillmentTypes,https://docs.aws.amazon.com/partner-central/latest/getting-started/controlling-access-in-aws-partner-central.html#condition-keys-for-aws-partner-central,Filters access by benefit fulfillment types,ArrayOfString
986,partnercentral:Programs,https://docs.aws.amazon.com/partner-central/latest/getting-started/controlling-access-in-aws-partner-central.html#condition-keys-for-aws-partner-central,Filters access by program,ArrayOfString
987,partnercentral:RelatedEntityType,https://docs.aws.amazon.com/partner-central/latest/getting-started/controlling-access-in-aws-partner-central.html#condition-keys-for-aws-partner-central,Filters access by entity types for Opportunity association,String
988,partnercentral:VerificationType,https://docs.aws.amazon.com/partner-central/latest/getting-started/controlling-access-in-aws-partner-central.html#condition-keys-for-aws-partner-central,Filters access by the type of verification being performed,String
989,payment-cryptography:CertificateAuthorityPublicKeyIdentifier,{ActionsDocRoot}security-iam.html,"Filters access by the CertificateAuthorityPublicKeyIdentifier specified in the request or the ImportKey, and ExportKey operations",String
990,payment-cryptography:ImportKeyMaterial,{ActionsDocRoot}security-iam.html,"Filters access by the type of key material being imported [RootCertificatePublicKey, TrustedCertificatePublicKey, Tr34KeyBlock, Tr31KeyBlock, DiffieHellmanTr31KeyBlock, As2805KeyCryptogram] for the ImportKey operation",String
991,payment-cryptography:KeyAlgorithm,{ActionsDocRoot}security-iam.html,Filters access by KeyAlgorithm specified in the request for the CreateKey operation,String
992,payment-cryptography:KeyClass,{ActionsDocRoot}security-iam.html,Filters access by KeyClass specified in the request for the CreateKey operation,String
993,payment-cryptography:KeyUsage,{ActionsDocRoot}security-iam.html,Filters access by KeyClass specified in the request or associated with a key for the CreateKey operation,String
994,payment-cryptography:RequestAlias,{ActionsDocRoot}security-iam.html,Filters access by aliases in the request for the specified operation,String
995,payment-cryptography:ResourceAliases,{ActionsDocRoot}security-iam.html,Filters access by aliases associated with a key for the specified operation,ArrayOfString
996,payment-cryptography:WrappingKeyIdentifier,{ActionsDocRoot}security-iam.html,"Filters access by the WrappingKeyIdentifier specified in the request for the ImportKey, and ExportKey operations",String
997,pi:Dimensions,#condition-keys-dimensions,Filters access by the requested dimensions,ArrayOfString
998,proton:EnvironmentTemplate,https://docs.aws.amazon.com/IAM/latest/UserGuide/reference_policies_condition-keys.html,Filters access by specified environment template related to resource,String
999,proton:ServiceTemplate,https://docs.aws.amazon.com/IAM/latest/UserGuide/reference_policies_condition-keys.html,Filters access by specified service template related to resource,String
1000,qapps:AppIsPublished,https://docs.aws.amazon.com/amazonq/latest/qbusiness-ug/security-iam.html,Filters access by whether Q App is published,String
1001,qapps:SessionIsShared,https://docs.aws.amazon.com/amazonq/latest/qbusiness-ug/security-iam.html,Filters access by whether Q App Session is shared,String
1002,qapps:UserIsAppOwner,https://docs.aws.amazon.com/amazonq/latest/qbusiness-ug/security-iam.html,Filters access by whether requester is Q App owner,String
1003,qapps:UserIsSessionModerator,https://docs.aws.amazon.com/amazonq/latest/qbusiness-ug/security-iam.html,Filters access by whether requester is Q App Session moderator,String
1004,qldb:Purge,https://docs.aws.amazon.com/IAM/latest/UserGuide/reference_policies_condition-keys.html#condition-keys-purge,Filters access by the value of purge that is specified in a PartiQL DROP statement,String
1005,quicksight:AllowedEmbeddingDomains,https://docs.aws.amazon.com/quicksight/latest/user/embedded-dashboards-for-authenticated-users-step-1.html,Filters access by the allowed embedding domains,ArrayOfString
1006,quicksight:DirectoryType,https://docs.aws.amazon.com/quicksight/latest/user/security-scp.html,Filters access by the user management options,String
1007,quicksight:Edition,https://docs.aws.amazon.com/quicksight/latest/user/security-scp.html,Filters access by the edition of QuickSight,String
1008,quicksight:Group,https://docs.aws.amazon.com/quicksight/latest/user/iam-actions.html,Filters access by QuickSight group ARN,ARN
1009,quicksight:IamArn,https://docs.aws.amazon.com/quicksight/latest/user/iam-actions.html,Filters access by IAM user or role ARN,ARN
1010,quicksight:KmsKeyArns,https://docs.aws.amazon.com/quicksight/latest/user/key-management.html,Filters access by KMS key ARNs,ArrayOfARN
1011,quicksight:SessionName,https://docs.aws.amazon.com/quicksight/latest/user/iam-actions.html,Filters access by session name,String
1012,cloudshell:SubnetIds,https://docs.aws.amazon.com/cloudshell/latest/userguide/aws-cloudshell-vpc-permissions-1.html#vpc-condition-keys-examples-1,Filters access by subnet ids. Available during CreateEnvironment operation,ArrayOfString
1013,quicksight:UserName,https://docs.aws.amazon.com/quicksight/latest/user/iam-actions.html,Filters access by user name,String
1014,ram:AllowsExternalPrincipals,https://docs.aws.amazon.com/ram/latest/userguide/iam-policies.html#iam-policies-condition,"Filters access by resource shares that allow or deny sharing with external principals. For example, specify true if the action can only be performed on resource shares that allow sharing with external principals. External principals are AWS accounts that are outside of its AWS organization",Bool
1015,ram:PermissionArn,https://docs.aws.amazon.com/ram/latest/userguide/iam-policies.html#iam-policies-condition,Filters access by the specified Permission ARN,ARN
1016,cloudshell:VpcIds,https://docs.aws.amazon.com/cloudshell/latest/userguide/aws-cloudshell-vpc-permissions-1.html#vpc-condition-keys-examples-1,Filters access by vpc ids. Available during CreateEnvironment operation,ArrayOfString
1017,ram:PermissionResourceType,https://docs.aws.amazon.com/ram/latest/userguide/iam-policies.html#iam-policies-condition,Filters access by permissions of specified resource type,String
1018,ram:Principal,https://docs.aws.amazon.com/ram/latest/userguide/iam-policies.html#iam-policies-condition,Filters access by format of the specified principal,String
1019,ram:RequestedAllowsExternalPrincipals,https://docs.aws.amazon.com/ram/latest/userguide/iam-policies.html#iam-policies-condition,Filters access by the specified value for 'allowExternalPrincipals'. External principals are AWS accounts that are outside of its AWS Organization,Bool
1020,ram:RequestedResourceType,https://docs.aws.amazon.com/ram/latest/userguide/iam-policies.html#iam-policies-condition,Filters access by the specified resource type,String
1021,ram:ResourceArn,https://docs.aws.amazon.com/ram/latest/userguide/iam-policies.html#iam-policies-condition,Filters access by  the specified ARN,ARN
1022,ram:ResourceShareName,https://docs.aws.amazon.com/ram/latest/userguide/iam-policies.html#iam-policies-condition,Filters access by a resource share with the specified name,String
1023,ram:ResourceTag/${TagKey},https://docs.aws.amazon.com/IAM/latest/UserGuide/reference_policies_condition-keys.html#condition-keys-resourcetag,Filters access by the tags associated with the resource,String
1024,ram:ShareOwnerAccountId,https://docs.aws.amazon.com/ram/latest/userguide/iam-policies.html#iam-policies-condition,"Filters access by resource shares owned by a specific account. For example, you can use this condition key to specify which resource share invitations can be accepted or rejected based on the resource share owner's account ID",String
1025,rbin:Attribute/ResourceType,https://docs.aws.amazon.com/AWSEC2/latest/UserGuide/recycle-bin-perms.html#rbin-condition-keys,Filters access by the resource type of the existing rule,String
1026,rbin:Request/ResourceType,https://docs.aws.amazon.com/AWSEC2/latest/UserGuide/recycle-bin-perms.html#rbin-condition-keys,Filters access by the resource type in a request,String
1027,rds:BackupTarget,https://docs.aws.amazon.com/AmazonRDS/latest/UserGuide/security_iam_service-with-iam.html#UsingWithRDS.IAM.Conditions,"Filters access by the type of backup target. One of: region, outposts",String
1028,rds:CopyOptionGroup,https://docs.aws.amazon.com/AmazonRDS/latest/UserGuide/security_iam_service-with-iam.html#UsingWithRDS.IAM.Conditions,Filters access by the value that specifies whether the CopyDBSnapshot action requires copying the DB option group,Bool
1029,rds:DatabaseClass,https://docs.aws.amazon.com/AmazonRDS/latest/UserGuide/security_iam_service-with-iam.html#UsingWithRDS.IAM.Conditions,Filters access by the type of DB instance class,String
1030,rds:DatabaseEngine,https://docs.aws.amazon.com/AmazonRDS/latest/UserGuide/security_iam_service-with-iam.html#UsingWithRDS.IAM.Conditions,Filters access by the database engine. For possible values refer to the engine parameter in CreateDBInstance API,String
1031,rds:DatabaseName,https://docs.aws.amazon.com/AmazonRDS/latest/UserGuide/security_iam_service-with-iam.html#UsingWithRDS.IAM.Conditions,Filters access by the user-defined name of the database on the DB instance,String
1032,eks:kubernetesGroups,https://docs.aws.amazon.com/eks/latest/userguide/security_iam_service-with-iam.html#security_iam_service-with-iam-id-based-policies,Filters access by the kubernetesGroups present in the access entry requests the user makes to the EKS service,ArrayOfString
1033,www.amazon.com:app_id,https://docs.aws.amazon.com/IAM/latest/UserGuide/reference_policies_iam-condition-keys.html#ck_id,Filters access by the Login with Amazon application ID,String
1034,cloudwatch:AlarmActions,https://docs.aws.amazon.com/AmazonCloudWatch/latest/monitoring/iam-cw-condition-keys-alarm-actions.html,Filters actions based on defined alarm actions,ArrayOfString
1035,cloudwatch:namespace,https://docs.aws.amazon.com/AmazonCloudWatch/latest/monitoring/iam-cw-condition-keys-namespace.html,Filters actions based on the presence of optional namespace values,String
1036,eks:loggingType/${type},https://docs.aws.amazon.com/eks/latest/userguide/security_iam_service-with-iam.html#security_iam_service-with-iam-id-based-policies,Filters access by the cluster logging enabled and type parameter in the create / update cluster request,Bool
1037,cloudwatch:requestInsightRuleLogGroups,https://docs.aws.amazon.com/AmazonCloudWatch/latest/monitoring/iam-cw-condition-keys-contributor.html,Filters actions based on the Log Groups specified in an Insight Rule,ArrayOfString
1038,cloudwatch:requestManagedResourceARNs,https://docs.aws.amazon.com/AmazonCloudWatch/latest/monitoring/iam-cw-condition-keys-contributor.html,Filters access by the Resource ARNs specified in a managed Insight Rule,ArrayOfARN
1039,codebuild:artifacts,https://docs.aws.amazon.com/codebuild/latest/userguide/action-context-keys.html,Filters access by the API corresponding argument value,Bool
1040,codebuild:artifacts.bucketOwnerAccess,https://docs.aws.amazon.com/codebuild/latest/userguide/action-context-keys.html,Filters access by the API corresponding argument value,String
1041,codebuild:artifacts.encryptionDisabled,https://docs.aws.amazon.com/codebuild/latest/userguide/action-context-keys.html,Filters access by the API corresponding argument value,Bool
1042,codebuild:artifacts.location,https://docs.aws.amazon.com/codebuild/latest/userguide/action-context-keys.html,Filters access by the API corresponding argument value,String
1043,codebuild:authType,https://docs.aws.amazon.com/codebuild/latest/userguide/action-context-keys.html,Filters access by the API corresponding argument value,String
1044,codebuild:autoRetryLimit,https://docs.aws.amazon.com/codebuild/latest/userguide/action-context-keys.html,Filters access by the API corresponding argument value,Numeric
1045,codebuild:buildArn,https://docs.aws.amazon.com/codebuild/latest/userguide/auth-and-access-control-permissions-reference.html,Filters access by the ARN of the AWS CodeBuild build from which the request originated,ARN
1046,codebuild:buildBatchConfig,https://docs.aws.amazon.com/codebuild/latest/userguide/action-context-keys.html,Filters access by the API corresponding argument value,Bool
1047,codebuild:buildBatchConfig.restrictions.computeTypesAllowed,https://docs.aws.amazon.com/codebuild/latest/userguide/action-context-keys.html,Filters access by the API corresponding argument value,ArrayOfString
1048,codebuild:buildBatchConfig.restrictions.fleetsAllowed,https://docs.aws.amazon.com/codebuild/latest/userguide/action-context-keys.html,Filters access by the API corresponding argument value,ArrayOfString
1049,codebuild:buildBatchConfig.serviceRole,https://docs.aws.amazon.com/codebuild/latest/userguide/action-context-keys.html,Filters access by the API corresponding argument value,String
1050,codebuild:buildType,https://docs.aws.amazon.com/codebuild/latest/userguide/action-context-keys.html,Filters access by the API corresponding argument value,String
1051,codebuild:cache,https://docs.aws.amazon.com/codebuild/latest/userguide/action-context-keys.html,Filters access by the API corresponding argument value,Bool
1052,codebuild:cache.location,https://docs.aws.amazon.com/codebuild/latest/userguide/action-context-keys.html,Filters access by the API corresponding argument value,String
1053,codebuild:cache.modes,https://docs.aws.amazon.com/codebuild/latest/userguide/action-context-keys.html,Filters access by the API corresponding argument value,ArrayOfString
