condition_key_id,name,reference_url,description,type
722,kms:RecipientAttestation:NitroTPMPCR15,https://docs.aws.amazon.com/kms/latest/developerguide/conditions-nitro-tpm.html#conditions-kms-recipient-nitro-tpm-pcrs,Filters access by the platform configuration register (PCR) 15 in the attestation document in the request. PCR15 is a contiguous measure of root file system volume encryption key,String
723,kms:RecipientAttestation:NitroTPMPCR16,https://docs.aws.amazon.com/kms/latest/developerguide/conditions-nitro-tpm.html#conditions-kms-recipient-nitro-tpm-pcrs,Filters access by the platform configuration register (PCR) 16 in the attestation document in the request. PCR16 is a custom PCR that can be defined by the user for specific use cases,String
724,kms:RecipientAttestation:NitroTPMPCR17,https://docs.aws.amazon.com/kms/latest/developerguide/conditions-nitro-tpm.html#conditions-kms-recipient-nitro-tpm-pcrs,Filters access by the platform configuration register (PCR) 17 in the attestation document in the request. PCR17 is a custom PCR that can be defined by the user for specific use cases,String
725,kms:RecipientAttestation:NitroTPMPCR18,https://docs.aws.amazon.com/kms/latest/developerguide/conditions-nitro-tpm.html#conditions-kms-recipient-nitro-tpm-pcrs,Filters access by the platform configuration register (PCR) 18 in the attestation document in the request. PCR18 is a custom PCR that can be defined by the user for specific use cases,String
726,sts:TaskPolicyArn,https://docs.aws.amazon.com/IAM/latest/UserGuide/reference_policies_iam-condition-keys.html#condition-keys-sts,Filters access by TaskPolicyARN,String
727,ecs:account-setting,https://docs.aws.amazon.com/AmazonECS/latest/developerguide/security_iam_service-with-iam.html#security_iam_service-with-iam-id-based-policies-conditionkeys,Filters access by the Amazon ECS account setting name,String
728,ecs:auto-assign-public-ip,https://docs.aws.amazon.com/AmazonECS/latest/developerguide/security_iam_service-with-iam.html#security_iam_service-with-iam-id-based-policies-conditionkeys,Filters access by the public IP assignment configuration of your Amazon ECS task or Amazon ECS service that uses awsvpc network mode,Bool
729,ecs:capacity-provider,https://docs.aws.amazon.com/AmazonECS/latest/developerguide/security_iam_service-with-iam.html#security_iam_service-with-iam-id-based-policies-conditionkeys,Filters access by the ARN of an Amazon ECS capacity provider,ArrayOfARN
730,ecs:cluster,https://docs.aws.amazon.com/AmazonECS/latest/developerguide/security_iam_service-with-iam.html#security_iam_service-with-iam-id-based-policies-conditionkeys,Filters access by the ARN of an Amazon ECS cluster,ARN
731,ecs:compute-compatibility,https://docs.aws.amazon.com/AmazonECS/latest/developerguide/security_iam_service-with-iam.html#security_iam_service-with-iam-id-based-policies-conditionkeys,Filters access by the required compatibilities field provided in the request,ArrayOfString
732,ecs:container-instances,https://docs.aws.amazon.com/AmazonECS/latest/developerguide/security_iam_service-with-iam.html#security_iam_service-with-iam-id-based-policies-conditionkeys,Filters access by the ARN of an Amazon ECS container instance,ARN
733,ecs:container-name,https://docs.aws.amazon.com/AmazonECS/latest/developerguide/security_iam_service-with-iam.html#security_iam_service-with-iam-id-based-policies-conditionkeys,Filters access by the name of an Amazon ECS container which is defined in the ECS task definition,String
734,ecs:enable-ebs-volumes,https://docs.aws.amazon.com/AmazonECS/latest/developerguide/security_iam_service-with-iam.html#security_iam_service-with-iam-id-based-policies-conditionkeys,Filters access by the Amazon ECS managed Amazon EBS volume capability of your ECS task or service,String
735,ecs:enable-ecs-managed-tags,https://docs.aws.amazon.com/AmazonECS/latest/developerguide/security_iam_service-with-iam.html#security_iam_service-with-iam-id-based-policies-conditionkeys,Filters access by the enableECSManagedTags configuration of your Amazon ECS task or Amazon ECS service,Bool
736,ecs:enable-execute-command,https://docs.aws.amazon.com/AmazonECS/latest/developerguide/security_iam_service-with-iam.html#security_iam_service-with-iam-id-based-policies-conditionkeys,Filters access by the execute-command capability of your Amazon ECS task or Amazon ECS service,String
737,ecs:enable-service-connect,https://docs.aws.amazon.com/AmazonECS/latest/developerguide/security_iam_service-with-iam.html#security_iam_service-with-iam-id-based-policies-conditionkeys,Filters access by the enable field value in the Service Connect configuration,String
738,ecs:enable-vpc-lattice,https://docs.aws.amazon.com/AmazonECS/latest/developerguide/security_iam_service-with-iam.html#security_iam_service-with-iam-id-based-policies-conditionkeys,Filters access by the VPC lattice capability of your Amazon ECS service,String
739,ecs:fargate-ephemeral-storage-kms-key,https://docs.aws.amazon.com/AmazonECS/latest/developerguide/security_iam_service-with-iam.html#security_iam_service-with-iam-id-based-policies-conditionkeys,Filters access by the AWS KMS key id provided in the request,String
740,ecs:namespace,https://docs.aws.amazon.com/AmazonECS/latest/developerguide/security_iam_service-with-iam.html#security_iam_service-with-iam-id-based-policies-conditionkeys,Filters access by the ARN of AWS Cloud Map namespace which is defined in the Service Connect Configuration,ARN
741,sts:TransitiveTagKeys,https://docs.aws.amazon.com/IAM/latest/UserGuide/reference_policies_iam-condition-keys.html#ck_TransitiveTagKeys,Filters access by the transitive tag keys that are passed in the request,ArrayOfString
742,kms:RecipientAttestation:NitroTPMPCR19,https://docs.aws.amazon.com/kms/latest/developerguide/conditions-nitro-tpm.html#conditions-kms-recipient-nitro-tpm-pcrs,Filters access by the platform configuration register (PCR) 19 in the attestation document in the request. PCR19 is a custom PCR that can be defined by the user for specific use cases,String
743,batch:EKSPrivileged,https://docs.aws.amazon.com/service-authorization/latest/reference/list_awsbatch.html#awsbatch-policy-keys,Filters access by the specified privileged parameter value that determines whether the container is given elevated privileges on the host container instance (similar to the root user) for an Amazon EKS job,Bool
744,swf:activityType.name,https://docs.aws.amazon.com/amazonswf/latest/developerguide/swf-dev-iam.html##swf-dev-iam.api,Filters access by the name of the activity type,String
745,swf:activityType.version,https://docs.aws.amazon.com/amazonswf/latest/developerguide/swf-dev-iam.html##swf-dev-iam.api,Filters access by the version of the activity type,String
746,swf:defaultTaskList.name,https://docs.aws.amazon.com/amazonswf/latest/developerguide/swf-dev-iam.html##swf-dev-iam.api,Filters access by the name of the default task list,String
747,swf:name,https://docs.aws.amazon.com/amazonswf/latest/developerguide/swf-dev-iam.html##swf-dev-iam.api,Filters access by the name of activities or workflows,String
748,swf:tagFilter.tag,https://docs.aws.amazon.com/amazonswf/latest/developerguide/swf-dev-iam.html##swf-dev-iam.api,Filters access by the value of tagFilter.tag,String
749,swf:tagList.member.0,https://docs.aws.amazon.com/amazonswf/latest/developerguide/swf-dev-iam.html##swf-dev-iam.api,Filters access by the specified tag,String
750,swf:tagList.member.1,https://docs.aws.amazon.com/amazonswf/latest/developerguide/swf-dev-iam.html##swf-dev-iam.api,Filters access by the specified tag,String
751,swf:tagList.member.2,https://docs.aws.amazon.com/amazonswf/latest/developerguide/swf-dev-iam.html##swf-dev-iam.api,Filters access by the specified tag,String
752,swf:tagList.member.3,https://docs.aws.amazon.com/amazonswf/latest/developerguide/swf-dev-iam.html##swf-dev-iam.api,Filters access by the specified tag,String
753,swf:tagList.member.4,https://docs.aws.amazon.com/amazonswf/latest/developerguide/swf-dev-iam.html##swf-dev-iam.api,Filters access by the specified tag,String
754,swf:taskList.name,https://docs.aws.amazon.com/amazonswf/latest/developerguide/swf-dev-iam.html##swf-dev-iam.api,Filters access by the name of the tasklist,String
755,batch:EKSRunAsGroup,https://docs.aws.amazon.com/service-authorization/latest/reference/list_awsbatch.html#awsbatch-policy-keys,Filters access by the specified group numeric ID (gid) used to start a container in an Amazon EKS job,Numeric
756,swf:typeFilter.name,https://docs.aws.amazon.com/amazonswf/latest/developerguide/swf-dev-iam.html##swf-dev-iam.api,Filters access by the name of the type filter,String
757,batch:EKSRunAsUser,https://docs.aws.amazon.com/service-authorization/latest/reference/list_awsbatch.html#awsbatch-policy-keys,Filters access by the specified user numeric ID (uid) used to start a a container in an Amazon EKS job,Numeric
758,swf:typeFilter.version,https://docs.aws.amazon.com/amazonswf/latest/developerguide/swf-dev-iam.html##swf-dev-iam.api,Filters access by the version of the type filter,String
759,swf:version,https://docs.aws.amazon.com/amazonswf/latest/developerguide/swf-dev-iam.html##swf-dev-iam.api,Filters access by the version of activities or workflows,String
760,swf:workflowType.name,https://docs.aws.amazon.com/amazonswf/latest/developerguide/swf-dev-iam.html##swf-dev-iam.api,Filters access by the name of the workflow type,String
761,batch:EKSServiceAccountName,https://docs.aws.amazon.com/service-authorization/latest/reference/list_awsbatch.html#awsbatch-policy-keys,Filters access by the name of the service account used to run the pod for an Amazon EKS job,String
762,batch:Image,https://docs.aws.amazon.com/service-authorization/latest/reference/list_awsbatch.html#awsbatch-policy-keys,Filters access by the image used to start a container,String
763,kms:RecipientAttestation:NitroTPMPCR2,https://docs.aws.amazon.com/kms/latest/developerguide/conditions-nitro-tpm.html#conditions-kms-recipient-nitro-tpm-pcrs,"Filters access by the platform configuration register (PCR) 2 in the attestation document in the request. PCR2 is a contiguous measure of extended or pluggable executable code, including option ROMs on pluggable hardware",String
764,batch:LogDriver,https://docs.aws.amazon.com/service-authorization/latest/reference/list_awsbatch.html#awsbatch-policy-keys,Filters access by the log driver used for the container,String
765,batch:Privileged,https://docs.aws.amazon.com/service-authorization/latest/reference/list_awsbatch.html#awsbatch-policy-keys,Filters access by the specified privileged parameter value that determines whether the container is given elevated privileges on the host container instance (similar to the root user),Bool
766,batch:ShareIdentifier,https://docs.aws.amazon.com/service-authorization/latest/reference/list_awsbatch.html#awsbatch-policy-keys,Filters access by the shareIdentifier used inside submit job,String
767,batch:User,https://docs.aws.amazon.com/service-authorization/latest/reference/list_awsbatch.html#awsbatch-policy-keys,Filters access by user name or numeric uid used inside the container,String
768,bedrock-agentcore:GatewayAuthorizerType,https://docs.aws.amazon.com/bedrock-agentcore/latest/APIReference/#condition-keys-gatewayAuthorizerType,Filters access by the authorizerType attribute on a Gateway,String
769,bedrock-agentcore:InboundJwtClaim/aud,https://docs.aws.amazon.com/bedrock-agentcore/latest/APIReference/#condition-keys-aud,Filters access by the audience claim (aud) in the JWT passed in the request,ArrayOfString
770,bedrock-agentcore:InboundJwtClaim/client_id,https://docs.aws.amazon.com/bedrock-agentcore/latest/APIReference/#condition-keys-client_id,Filters access by the client_id claim in the JWT passed in the request,String
771,bedrock-agentcore:InboundJwtClaim/iss,https://docs.aws.amazon.com/bedrock-agentcore/latest/APIReference/#condition-keys-iss,Filters access by the issuer (iss) claim present in the JWT passed in the request,String
772,bedrock-agentcore:InboundJwtClaim/scope,https://docs.aws.amazon.com/bedrock-agentcore/latest/APIReference/#condition-keys-scope,Filters access by the scope claim in the JWT passed in the request,ArrayOfString
773,bedrock-agentcore:InboundJwtClaim/sub,https://docs.aws.amazon.com/bedrock-agentcore/latest/APIReference/#condition-keys-sub,Filters access by the subject claim (sub) in the JWT passed in the request,String
774,bedrock-agentcore:KmsKeyArn,https://docs.aws.amazon.com/bedrock-agentcore/latest/APIReference/#condition-keys-kmsKeyArn,Filters access by KMS Key arn provided,String
775,bedrock-agentcore:actorId,https://docs.aws.amazon.com/bedrock-agentcore/latest/APIReference/#condition-keys-actorId,Filters access by Actor Id,String
776,bedrock-agentcore:namespace,https://docs.aws.amazon.com/bedrock-agentcore/latest/APIReference/#condition-keys-namespace,Filters access by namespace,String
777,bedrock-agentcore:securityGroups,https://docs.aws.amazon.com/bedrock-agentcore/latest/devguide/security-vpc-condition.html,Filters access by the ID of security groups configured for the AgentCore runtime,ArrayOfString
778,bedrock-agentcore:sessionId,https://docs.aws.amazon.com/bedrock-agentcore/latest/APIReference/#condition-keys-sessionId,Filters access by Session Id,String
779,swf:workflowType.version,https://docs.aws.amazon.com/amazonswf/latest/developerguide/swf-dev-iam.html##swf-dev-iam.api,Filters access by the version of the workflow type,String
780,kms:RecipientAttestation:NitroTPMPCR20,https://docs.aws.amazon.com/kms/latest/developerguide/conditions-nitro-tpm.html#conditions-kms-recipient-nitro-tpm-pcrs,Filters access by the platform configuration register (PCR) 20 in the attestation document in the request. PCR20 is a custom PCR that can be defined by the user for specific use cases,String
781,synthetics:Names,https://docs.aws.amazon.com/AmazonCloudWatch/latest/monitoring/CloudWatch_Synthetics_Canaries_Restricted.html,Filters access based on the name of the canary,ArrayOfString
782,transcribe:OutputBucketName,https://docs.aws.amazon.com/IAM/latest/UserGuide/list_amazontranscribe.html#amazontranscribe-policy-keys,Filters access based on the output bucket name included in the request,String
783,transcribe:OutputEncryptionKMSKeyId,https://docs.aws.amazon.com/IAM/latest/UserGuide/list_amazontranscribe.html#amazontranscribe-policy-keys,"Filters access based on the KMS key id included in the request, provided in the form of a KMS key ARN",String
784,transcribe:OutputKey,https://docs.aws.amazon.com/IAM/latest/UserGuide/list_amazontranscribe.html#amazontranscribe-policy-keys,Filters access based on the output key included in the request,String
785,transcribe:OutputLocation,https://docs.aws.amazon.com/IAM/latest/UserGuide/list_amazontranscribe.html#amazontranscribe-policy-keys,Filters access based on the output location included in the request,String
786,transfer:RequestConnectorProtocol,https://docs.aws.amazon.com/transfer/latest/userguide/transfer-condition-keys.html,Filters access by the connector protocol that is passed in the request,String
787,transfer:RequestServerDomain,https://docs.aws.amazon.com/transfer/latest/userguide/transfer-condition-keys.html,Filters access by the storage domain that is passed in the request,String
788,transfer:RequestServerEndpointType,https://docs.aws.amazon.com/transfer/latest/userguide/transfer-condition-keys.html,Filters access by the endpoint type that is passed in the request,String
789,transfer:RequestServerProtocols,https://docs.aws.amazon.com/transfer/latest/userguide/transfer-condition-keys.html,Filters access by the server protocols that are passed in the request,ArrayOfString
790,user-subscriptions:CreateForSelf,https://docs.aws.amazon.com/amazonq/latest/qdeveloper-ug/security-iam-service-with-iam.html#security_iam_service-with-iam-id-based-policies-conditionkeys,Filters access by only allowing creation of User subscription Claims for the caller,Bool
791,vpc-lattice-svcs:Port,https://docs.aws.amazon.com/vpc-lattice/latest/ug/auth-policies.html#auth-policies-condition-keys,Filters access by the destination port the request is made to,Numeric
792,vpc-lattice-svcs:RequestHeader/${HeaderName},https://docs.aws.amazon.com/vpc-lattice/latest/ug/auth-policies.html#auth-policies-condition-keys,Filters access by a header name-value pair in the request headers,String
793,vpc-lattice-svcs:RequestMethod,https://docs.aws.amazon.com/vpc-lattice/latest/ug/auth-policies.html#auth-policies-condition-keys,Filters access by the method of the request,String
794,vpc-lattice-svcs:RequestPath,https://docs.aws.amazon.com/vpc-lattice/latest/ug/auth-policies.html#auth-policies-condition-keys,Filters access by the path portion of the request URL,String
795,vpc-lattice-svcs:RequestQueryString/${QueryStringKey},https://docs.aws.amazon.com/vpc-lattice/latest/ug/auth-policies.html#auth-policies-condition-keys,Filters access by the query string key-value pairs in the request URL,ArrayOfString
796,vpc-lattice-svcs:ServiceArn,https://docs.aws.amazon.com/vpc-lattice/latest/ug/auth-policies.html#auth-policies-condition-keys,Filters access by the ARN of the service receiving the request,ARN
797,kms:RecipientAttestation:NitroTPMPCR21,https://docs.aws.amazon.com/kms/latest/developerguide/conditions-nitro-tpm.html#conditions-kms-recipient-nitro-tpm-pcrs,Filters access by the platform configuration register (PCR) 21 in the attestation document in the request. PCR21 is a custom PCR that can be defined by the user for specific use cases,String
798,kms:RecipientAttestation:NitroTPMPCR22,https://docs.aws.amazon.com/kms/latest/developerguide/conditions-nitro-tpm.html#conditions-kms-recipient-nitro-tpm-pcrs,Filters access by the platform configuration register (PCR) 22 in the attestation document in the request. PCR22 is a custom PCR that can be defined by the user for specific use cases,String
799,kms:RecipientAttestation:NitroTPMPCR23,https://docs.aws.amazon.com/kms/latest/developerguide/conditions-nitro-tpm.html#conditions-kms-recipient-nitro-tpm-pcrs,Filters access by the platform configuration register (PCR) 23 in the attestation document in the request. PCR23 is a custom PCR that can be defined by the user for specific use cases,String
800,kms:RecipientAttestation:NitroTPMPCR3,https://docs.aws.amazon.com/kms/latest/developerguide/conditions-nitro-tpm.html#conditions-kms-recipient-nitro-tpm-pcrs,"Filters access by the platform configuration register (PCR) 3 in the attestation document in the request. PCR3 is a contiguous measure of extended or pluggable firmware data, including information about pluggable hardware",String
801,kms:RecipientAttestation:NitroTPMPCR4,https://docs.aws.amazon.com/kms/latest/developerguide/conditions-nitro-tpm.html#conditions-kms-recipient-nitro-tpm-pcrs,"Filters access by the platform configuration register (PCR) 4 in the attestation document in the request. PCR4 is a contiguous measure of boot loader and additional drivers, including binaries and extensions loaded by the boot loader",String
802,kms:RecipientAttestation:NitroTPMPCR5,https://docs.aws.amazon.com/kms/latest/developerguide/conditions-nitro-tpm.html#conditions-kms-recipient-nitro-tpm-pcrs,Filters access by the platform configuration register (PCR) 5 in the attestation document in the request. PCR5 is a contiguous measure of GPT/Partition table,String
803,kms:RecipientAttestation:NitroTPMPCR6,https://docs.aws.amazon.com/kms/latest/developerguide/conditions-nitro-tpm.html#conditions-kms-recipient-nitro-tpm-pcrs,Filters access by the platform configuration register (PCR) 6 in the attestation document in the request. PCR6 is a custom PCR that can be defined by the user for specific use cases,String
804,kms:RecipientAttestation:NitroTPMPCR7,https://docs.aws.amazon.com/kms/latest/developerguide/conditions-nitro-tpm.html#conditions-kms-recipient-nitro-tpm-pcrs,Filters access by the platform configuration register (PCR) 7 in the attestation document in the request. PCR7 is a contiguous measure of SecureBoot state,String
805,kms:RecipientAttestation:NitroTPMPCR8,https://docs.aws.amazon.com/kms/latest/developerguide/conditions-nitro-tpm.html#conditions-kms-recipient-nitro-tpm-pcrs,Filters access by the platform configuration register (PCR) 8 in the attestation document in the request. PCR8 is a contiguous measure of commands and kernel command line,String
806,kms:RecipientAttestation:NitroTPMPCR9,https://docs.aws.amazon.com/kms/latest/developerguide/conditions-nitro-tpm.html#conditions-kms-recipient-nitro-tpm-pcrs,Filters access by the platform configuration register (PCR) 9 in the attestation document in the request. PCR9 is a contiguous measure of all files read (including kernel image),String
807,kms:RecipientAttestation:PCR0,https://docs.aws.amazon.com/kms/latest/developerguide/conditions-nitro-enclaves.html#conditions-kms-recipient-pcrs,"Filters access by the platform configuration register (PCR) 0 in the attestation document in the request. PCR0 is a contiguous measure of the contents of the enclave image file, without the section data",String
808,kms:RecipientAttestation:PCR1,https://docs.aws.amazon.com/kms/latest/developerguide/conditions-nitro-enclaves.html#conditions-kms-recipient-pcrs,Filters access by the platform configuration register (PCR) 1 in the attestation document in the request. PCR1 is a contiguous measurement of the Linux kernel and bootstrap data,String
809,kms:RecipientAttestation:PCR10,https://docs.aws.amazon.com/kms/latest/developerguide/conditions-nitro-enclaves.html#conditions-kms-recipient-pcrs,Filters access by the platform configuration register (PCR) 10 in the attestation document in the request. PCR10 is a custom PCR that can be defined by the user for specific use cases,String
810,bedrock-agentcore:strategyId,https://docs.aws.amazon.com/bedrock-agentcore/latest/APIReference/#condition-keys-strategyId,Filters access by Memory Strategy Id,String
811,ecs:privileged,https://docs.aws.amazon.com/AmazonECS/latest/developerguide/security_iam_service-with-iam.html#security_iam_service-with-iam-id-based-policies-conditionkeys,Filters access by the privileged field provided in the request,String
812,kms:RecipientAttestation:PCR11,https://docs.aws.amazon.com/kms/latest/developerguide/conditions-nitro-enclaves.html#conditions-kms-recipient-pcrs,Filters access by the platform configuration register (PCR) 11 in the attestation document in the request. PCR11 is a custom PCR that can be defined by the user for specific use cases,String
813,vpc-lattice-svcs:ServiceNetworkArn,https://docs.aws.amazon.com/vpc-lattice/latest/ug/auth-policies.html#auth-policies-condition-keys,Filters access by the ARN of the service network receiving the request,ARN
814,ecs:propagate-tags,https://docs.aws.amazon.com/AmazonECS/latest/developerguide/security_iam_service-with-iam.html#security_iam_service-with-iam-id-based-policies-conditionkeys,Filters access by the tag propagation configuration of your Amazon ECS task or Amazon ECS service,String
815,vpc-lattice-svcs:SourceVpc,https://docs.aws.amazon.com/vpc-lattice/latest/ug/auth-policies.html#auth-policies-condition-keys,Filters access by the VPC the request is made from,String
816,bedrock-agentcore:subnets,https://docs.aws.amazon.com/bedrock-agentcore/latest/devguide/security-vpc-condition.html,Filters access by the ID of subnets configured for the AgentCore runtime,ArrayOfString
817,vpc-lattice-svcs:SourceVpcOwnerAccount,https://docs.aws.amazon.com/vpc-lattice/latest/ug/auth-policies.html#auth-policies-condition-keys,Filters access by the owning account of the VPC the request is made from,String
818,bedrock-agentcore:userid,https://docs.aws.amazon.com/bedrock-agentcore/latest/APIReference/#condition-keys-userid,Filters access by the static user ID value passed in the request,String
819,vpc-lattice:AuthType,https://docs.aws.amazon.com/vpc-lattice/latest/ug/,Filters access by the auth type specified in the request,String
820,ecs:service,https://docs.aws.amazon.com/AmazonECS/latest/developerguide/security_iam_service-with-iam.html#security_iam_service-with-iam-id-based-policies-conditionkeys,Filters access by the ARN of an Amazon ECS service,ARN
821,vpc-lattice:DomainName,https://docs.aws.amazon.com/vpc-lattice/latest/ug/,Filters access by the domain name,String
822,ecs:subnet,https://docs.aws.amazon.com/AmazonECS/latest/developerguide/security_iam_service-with-iam.html#security_iam_service-with-iam-id-based-policies-conditionkeys,Filters access by the subnet configuration of your Amazon ECS task or Amazon ECS service that uses awsvpc network mode,ArrayOfString
823,vpc-lattice:PrivateDnsPreference,https://docs.aws.amazon.com/vpc-lattice/latest/ug/,Filters access by the private dns preference,String
824,bedrock-mantle:BearerTokenType,https://docs.aws.amazon.com/service-authorization/latest/reference/list_amazonbedrockmantle.html#amazonbedrockmantle-policy-keys,Filters access by the Short-term or Long-term bearer tokens,String
825,kms:RecipientAttestation:PCR12,https://docs.aws.amazon.com/kms/latest/developerguide/conditions-nitro-enclaves.html#conditions-kms-recipient-pcrs,Filters access by the platform configuration register (PCR) 12 in the attestation document in the request. PCR12 is a custom PCR that can be defined by the user for specific use cases,String
826,bedrock-mantle:Files,https://docs.aws.amazon.com/service-authorization/latest/reference/list_amazonbedrockmantle.html#amazonbedrockmantle-policy-keys,Filters access by the specified file identifiers,ArrayOfString
827,bedrock-mantle:FineTuningJob,https://docs.aws.amazon.com/service-authorization/latest/reference/list_amazonbedrockmantle.html#amazonbedrockmantle-policy-keys,Filters access by the specified fine-tuning job identifier,String
828,bedrock-mantle:Model,https://docs.aws.amazon.com/service-authorization/latest/reference/list_amazonbedrockmantle.html#amazonbedrockmantle-policy-keys,Filters access by the specified Model,String
