condition_key_id,name,reference_url,description,type
706,codestar-connections:FullRepositoryId,https://docs.aws.amazon.com/dtconsole/latest/userguide/security-iam.html#permissions-reference-connections-use,Filters access by the repository that is passed in the request. Applies only to UseConnection requests for access to a specific repository,String
707,codestar-connections:HostArn,https://docs.aws.amazon.com/dtconsole/latest/userguide/security-iam.html#permissions-reference-connections-hosts,Filters access by the host resource associated with the connection used in the request,ARN
708,codestar-connections:InstallationId,https://docs.aws.amazon.com/dtconsole/latest/userguide/security-iam.html#permissions-reference-connections-handshake,Filters access by the third-party ID (such as the Bitbucket App installation ID for CodeStar Connections) that is used to update a Connection. Allows you to restrict which third-party App installations can be used to make a Connection,String
709,codestar-connections:OwnerId,https://docs.aws.amazon.com/dtconsole/latest/userguide/security-iam.html#permissions-reference-connections-use,Filters access by the owner of the third-party repository. Applies only to UseConnection requests for access to repositories owned by a specific user,String
710,codestar-connections:PassedToService,https://docs.aws.amazon.com/dtconsole/latest/userguide/security-iam.html#permissions-reference-connections-passconnection,Filters access by the service to which the principal is allowed to pass a Connection or RepositoryLink,String
711,codestar-connections:ProviderAction,https://docs.aws.amazon.com/dtconsole/latest/userguide/security-iam.html#permissions-reference-connections-access,Filters access by the provider action in a UseConnection request such as ListRepositories. See documentation for all valid values,String
712,codestar-connections:ProviderPermissionsRequired,https://docs.aws.amazon.com/dtconsole/latest/userguide/security-iam.html#permissions-reference-connections-use,Filters access by the write permissions of a provider action in a UseConnection request. Valid types include read_only and read_write,String
713,codestar-connections:ProviderType,https://docs.aws.amazon.com/dtconsole/latest/userguide/security-iam.html#permissions-reference-connections-managing,Filters access by the type of third-party provider passed in the request,String
714,codestar-connections:ProviderTypeFilter,https://docs.aws.amazon.com/dtconsole/latest/userguide/security-iam.html#permissions-reference-connections-managing,Filters access by the type of third-party provider used to filter results,String
715,codestar-connections:RepositoryName,https://docs.aws.amazon.com/dtconsole/latest/userguide/security-iam.html#permissions-reference-connections-use,Filters access by the repository name that is passed in the request. Applies only to UseConnection requests for access to repositories owned by a specific user,String
716,codestar-connections:VpcId,https://docs.aws.amazon.com/dtconsole/latest/userguide/security-iam.html#permissions-reference-connections-hosts,Filters access by the VpcId passed in the request,String
717,codestar-notifications:NotificationsForResource,https://docs.aws.amazon.com/codestar-notifications/latest/userguide/security_iam_id-based-policy-examples.html,Filters access based on the ARN of the resource for which notifications are configured,ARN
718,cognito-identity.amazonaws.com:amr,https://docs.aws.amazon.com/IAM/latest/UserGuide/reference_policies_iam-condition-keys.html#ck_amr,Filters access by the login information for Amazon Cognito,String
719,cognito-identity.amazonaws.com:aud,https://docs.aws.amazon.com/IAM/latest/UserGuide/reference_policies_iam-condition-keys.html#ck_aud,Filters access by the Amazon Cognito identity pool ID,String
720,elasticbeanstalk:FromPlatform,https://docs.aws.amazon.com/elasticbeanstalk/latest/dg/AWSHowTo.iam.policies.actions.html#AWSHowTo.iam.policies.conditions,Filters access by a platform as a dependency or a constraint on an input parameter,ARN
721,elasticbeanstalk:FromSolutionStack,https://docs.aws.amazon.com/elasticbeanstalk/latest/dg/AWSHowTo.iam.policies.actions.html#AWSHowTo.iam.policies.conditions,Filters access by a solution stack as a dependency or a constraint on an input parameter,ARN
722,cognito-identity.amazonaws.com:sub,https://docs.aws.amazon.com/IAM/latest/UserGuide/reference_policies_iam-condition-keys.html#ck_sub,Filters access by the subject of the claim (the Amazon Cognito user ID),String
723,elasticbeanstalk:InApplication,https://docs.aws.amazon.com/elasticbeanstalk/latest/dg/AWSHowTo.iam.policies.actions.html#AWSHowTo.iam.policies.conditions,Filters access by the application that contains the resource that the action operates on,ARN
724,elasticfilesystem:AccessPointArn,https://docs.aws.amazon.com/efs/latest/ug/efs-access-points.html,Filters access by the ARN of the access point used to mount the file system,ARN
725,elasticfilesystem:AccessedViaMountTarget,https://docs.aws.amazon.com/efs/latest/ug/mounting-fs.html,Filters access by whether the file system is accessed via mount targets,Bool
726,elasticfilesystem:CreateAction,https://docs.aws.amazon.com/efs/latest/ug/using-tags-efs.html,Filters access by the name of a resource-creating API action,String
727,elasticfilesystem:Encrypted,https://docs.aws.amazon.com/efs/latest/ug/encryption.html,Filters access by whether users can create only encrypted or unencrypted file systems,Bool
728,elasticloadbalancing:CreateAction,https://docs.aws.amazon.com/elasticloadbalancing/latest/userguide/tagging-resources-during-creation.html,Filters access by the name of a resource-creating API action,String
729,elasticloadbalancing:ListenerProtocol,https://docs.aws.amazon.com/elasticloadbalancing/latest/userguide/security_iam_service-with-iam.html#listenerprotocol-condition,Filters access by the listener protocol that is allowed in the request,ArrayOfString
730,elasticloadbalancing:ResourceTag/,https://docs.aws.amazon.com/IAM/latest/UserGuide/reference_policies_condition-keys.html#condition-keys-resourcetag,Filters access by the preface string for a tag key and value pair that are attached to a resource,String
731,securityhub:ASFFSyntaxPath/${ASFFSyntaxPath},https://docs.aws.amazon.com/IAM/latest/UserGuide/reference_policies_condition-keys.html#condition-keys-asffsyntaxpath,Filters access by the specified fields and values in the request,String
732,elasticloadbalancing:ResourceTag/${TagKey},https://docs.aws.amazon.com/IAM/latest/UserGuide/reference_policies_condition-keys.html#condition-keys-resourcetag,Filters access by the preface string for a tag key and value pair that are attached to a resource,String
733,elasticloadbalancing:Scheme,https://docs.aws.amazon.com/elasticloadbalancing/latest/userguide/security_iam_service-with-iam.html#scheme-condition,Filters access by the load balancer scheme that are allowed in the request,String
734,elasticloadbalancing:SecurityGroup,https://docs.aws.amazon.com/elasticloadbalancing/latest/userguide/security_iam_service-with-iam.html#securitygroup-condition,Filters access by the security-group IDs that are allowed in the request,ArrayOfString
735,elasticloadbalancing:SecurityPolicy,https://docs.aws.amazon.com/elasticloadbalancing/latest/userguide/security_iam_service-with-iam.html#securitypolicy-condition,Filters access by the SSL Security Policies that are allowed in the request,ArrayOfString
736,elasticloadbalancing:Subnet,https://docs.aws.amazon.com/elasticloadbalancing/latest/userguide/security_iam_service-with-iam.html#subnet-condition,Filters access by the subnet IDs that are allowed in the request,ArrayOfString
737,elasticmapreduce:ExecutionRoleArn,https://docs.aws.amazon.com/emr/latest/ManagementGuide/emr-plan-access-iam.html#emr-security,Filters access by whether the execution role ARN is provided with the action,ARN
738,elasticmapreduce:RequestTag/${TagKey},https://docs.aws.amazon.com/emr/latest/ManagementGuide/emr-plan-access-iam.html#emr-fine-grained-cluster-access,Filters access by whether the tag and value pair is provided with the action,String
739,elasticmapreduce:ResourceTag/${TagKey},https://docs.aws.amazon.com/emr/latest/ManagementGuide/emr-plan-access-iam.html#emr-fine-grained-cluster-access,Filters access by the tag and value pair associated with an Amazon EMR resource,String
740,emr-containers:ExecutionRoleArn,https://docs.aws.amazon.com/emr/latest/EMR-on-EKS-DevelopmentGuide/iam-execution-role.html,Filters access by the execution role arn present in the request,ARN
741,emr-containers:JobTemplateArn,https://docs.aws.amazon.com/emr/latest/EMR-on-EKS-DevelopmentGuide/iam-job-template.html,Filters access by the job template arn present in the request,ARN
742,events:EventBusArn,https://docs.aws.amazon.com/eventbridge/latest/userguide/policy-keys-eventbridge.html#limiting-access-to-event-buses,Filters access by the ARN of the event buses that can be associated with an endpoint to CreateEndpoint and UpdateEndpoint actions,ArrayOfARN
743,events:ManagedBy,https://docs.aws.amazon.com/eventbridge/latest/userguide/policy-keys-eventbridge.html,"Filters access by AWS services. If a rule is created by an AWS service on your behalf, the value is the principal name of the service that created the rule",String
744,events:TargetArn,https://docs.aws.amazon.com/eventbridge/latest/userguide/policy-keys-eventbridge.html#limiting-access-to-targets,Filters access by the ARN of a target that can be put to a rule to PutTargets actions. TargetARN doesn't include DeadLetterConfigArn,ArrayOfARN
745,events:creatorAccount,https://docs.aws.amazon.com/eventbridge/latest/userguide/policy-keys-eventbridge.html#events-creator-account,Filters access by the account the rule was created in to rule actions,String
746,events:detail-type,https://docs.aws.amazon.com/eventbridge/latest/userguide/policy-keys-eventbridge.html#events-pattern-detail-type,Filters access by the literal string of the detail-type of the event to PutEvents and PutRule actions,String
747,events:detail.eventTypeCode,https://docs.aws.amazon.com/eventbridge/latest/userguide/policy-keys-eventbridge.html#limit-rule-by-type-code,Filters access by the literal string for the detail.eventTypeCode field of the event to PutRule actions,String
748,events:detail.service,https://docs.aws.amazon.com/eventbridge/latest/userguide/policy-keys-eventbridge.html#limit-rule-by-service,Filters access by the literal string for the detail.service field of the event to PutRule actions,String
749,events:detail.userIdentity.principalId,https://docs.aws.amazon.com/eventbridge/latest/userguide/policy-keys-eventbridge.html#consume-specific-events,Filters access by the literal string for the detail.useridentity.principalid field of the event to PutRule actions,String
750,events:eventBusInvocation,https://docs.aws.amazon.com/eventbridge/latest/userguide/policy-keys-eventbridge.html#events-bus-invocation,Filters access by whether the event was generated via API or cross-account bus invocation to PutEvents actions,String
751,events:source,https://docs.aws.amazon.com/eventbridge/latest/userguide/policy-keys-eventbridge.html#events-limit-access-control,Filters access by the AWS service or AWS partner event source that generated the event to PutEvents and PutRule actions. Matches the literal string of the source field of the event,ArrayOfString
752,execute-api:viaDomainArn,https://docs.aws.amazon.com/apigateway/latest/developerguide/security_iam_service-with-iam.html,Filters access by the domain name ARN the API is called from,String
753,fis:Operations,https://docs.aws.amazon.com/fis/latest/userguide/security_iam_service-with-iam.html,Filters access by the list of operations on the AWS service that is being affected by the AWS FIS action,ArrayOfString
754,fis:Percentage,https://docs.aws.amazon.com/fis/latest/userguide/security_iam_service-with-iam.html,Filters access by the percentage of calls being affected by the AWS FIS action,Numeric
755,fis:Service,https://docs.aws.amazon.com/fis/latest/userguide/security_iam_service-with-iam.html,Filters access by the AWS service that is being affected by the AWS FIS action,String
756,fis:Targets,https://docs.aws.amazon.com/fis/latest/userguide/security_iam_service-with-iam.html,Filters access by the list of resource ARNs being targeted by the AWS FIS action,ArrayOfString
757,fsx:IsBackupCopyDestination,https://docs.aws.amazon.com/fsx/latest/WindowsGuide/using-backups.html#copy-backups,Filters access by whether the backup is a destination backup for a CopyBackup operation,Bool
758,fsx:IsBackupCopySource,https://docs.aws.amazon.com/fsx/latest/WindowsGuide/using-backups.html#copy-backups,Filters access by whether the backup is a source backup for a CopyBackup operation,Bool
759,fsx:NfsDataRepositoryAuthenticationEnabled,https://docs.aws.amazon.com/fsx/latest/FileCacheGuide/encryption-in-transit.html,Filters access by NFS data repositories which support authentication,Bool
760,fsx:NfsDataRepositoryEncryptionInTransitEnabled,https://docs.aws.amazon.com/fsx/latest/FileCacheGuide/encryption-in-transit.html,Filters access by NFS data repositories which support encryption-in-transit,Bool
761,fsx:ParentVolumeId,https://docs.aws.amazon.com/fsx/latest/OpenZFSGuide/creating-volumes.html,Filters access by the containing parent volume for mutating volume operations,String
762,fsx:StorageVirtualMachineId,https://docs.aws.amazon.com/fsx/latest/ONTAPGuide/creating-volumes.html,Filters access by the containing storage virtual machine for a volume for mutating volume operations,String
763,geo:DeviceIds,https://docs.aws.amazon.com/location/latest/developerguide/security_iam_service-with-iam.html#security_iam_service-with-iam-id-based-policies-conditionkeys,Filters access by the presence of device ids in the request,ArrayOfString
764,geo:GeofenceIds,https://docs.aws.amazon.com/location/latest/developerguide/security_iam_service-with-iam.html#security_iam_service-with-iam-id-based-policies-conditionkeys,Filters access by the presence of geofence ids in the request,ArrayOfString
765,glacier:ArchiveAgeInDays,https://docs.aws.amazon.com/amazonglacier/latest/dev/access-control-overview.html#specifying-conditions,"Filters access by how long an archive has been stored in the vault, in days",String
766,glacier:ResourceTag/,https://docs.aws.amazon.com/amazonglacier/latest/dev/access-control-overview.html#specifying-conditions,Filters access by a customer-defined tag,String
767,glue:CredentialIssuingService,https://docs.aws.amazon.com/glue/latest/dg/using-identity-based-policies.html#glue-identity-based-policy-condition-keys,Filters access by the service from which the credentials of the request is issued,String
768,glue:EnabledForRedshiftAutoDiscovery,https://docs.aws.amazon.com/glue/latest/dg/using-identity-based-policies.html#glue-identity-based-policy-condition-keys,Filters access by the presence of the key configured for role's identity-based policy,Bool
769,glue:RoleAssumedBy,https://docs.aws.amazon.com/glue/latest/dg/using-identity-based-policies.html#glue-identity-based-policy-condition-keys,Filters access by the service from which the credentials of the request is obtained by assuming the customer role,String
770,glue:SecurityGroupIds,https://docs.aws.amazon.com/glue/latest/dg/using-identity-based-policies.html#glue-identity-based-policy-condition-keys,Filters access by the ID of security groups configured for the Glue job,ArrayOfString
771,glue:SubnetIds,https://docs.aws.amazon.com/glue/latest/dg/using-identity-based-policies.html#glue-identity-based-policy-condition-keys,Filters access by the ID of subnets configured for the Glue job,ArrayOfString
772,glue:VpcIds,https://docs.aws.amazon.com/glue/latest/dg/using-identity-based-policies.html#glue-identity-based-policy-condition-keys,Filters access by the ID of the VPC configured for the Glue job,ArrayOfString
773,graph.facebook.com:app_id,https://docs.aws.amazon.com/IAM/latest/UserGuide/reference_policies_iam-condition-keys.html#ck_id,Filters access by the Facebook application ID,String
774,graph.facebook.com:id,https://docs.aws.amazon.com/IAM/latest/UserGuide/reference_policies_iam-condition-keys.html#ck_id,Filters access by the Facebook user ID,String
775,groundstation:AgentId,https://docs.aws.amazon.com/ground-station/latest/APIReference/API_RegisterAgent.html#groundstation-RegisterAgent-response-agentId,Filters access by the ID of an agent,String
776,groundstation:ConfigId,https://docs.aws.amazon.com/ground-station/latest/APIReference/API_CreateConfig.html#groundstation-CreateConfig-response-configId,Filters access by the ID of a config,String
777,groundstation:ConfigType,https://docs.aws.amazon.com/ground-station/latest/APIReference/API_CreateConfig.html#groundstation-CreateConfig-response-configType,Filters access by the type of a config,String
778,groundstation:ContactId,https://docs.aws.amazon.com/ground-station/latest/APIReference/API_ReserveContact.html#groundstation-ReserveContact-response-contactId,Filters access by the ID of a contact,String
779,groundstation:DataflowEndpointGroupId,https://docs.aws.amazon.com/ground-station/latest/APIReference/API_CreateDataflowEndpointGroup.html#groundstation-CreateDataflowEndpointGroup-response-dataflowEndpointGroupId,Filters access by the ID of a dataflow endpoint group,String
780,groundstation:EphemerisId,https://docs.aws.amazon.com/ground-station/latest/APIReference/API_CreateEphemeris.html#groundstation-CreateEphemeris-response-ephemerisId,Filters access by the ID of an ephemeris,String
781,groundstation:GroundStationId,https://docs.aws.amazon.com/ground-station/latest/APIReference/API_GroundStationData.html#groundstation-Type-GroundStationData-groundStationId,Filters access by the ID of a ground station,String
782,groundstation:MissionProfileId,https://docs.aws.amazon.com/ground-station/latest/APIReference/API_CreateMissionProfile.html#groundstation-CreateMissionProfile-response-missionProfileId,Filters access by the ID of a mission profile,String
783,groundstation:SatelliteId,https://docs.aws.amazon.com/ground-station/latest/APIReference/API_SatelliteListItem.html#groundstation-Type-SatelliteListItem-satelliteId,Filters access by the ID of a satellite,String
784,health:eventTypeCode,https://docs.aws.amazon.com/health/latest/ug/controlling-access.html,Filters access by event type,String
785,health:service,https://docs.aws.amazon.com/health/latest/ug/controlling-access.html,Filters access by impacted service,String
786,iam:AWSServiceName,https://docs.aws.amazon.com/IAM/latest/UserGuide/reference_policies_iam-condition-keys.html#ck_AWSServiceName,Filters access by the AWS service to which this role is attached,String
787,iam:AssociatedResourceArn,https://docs.aws.amazon.com/IAM/latest/UserGuide/reference_policies_iam-condition-keys.html#ck_AssociatedResourceArn,Filters access by the resource that the role will be used on behalf of,ARN
788,iam:FIDO-FIPS-140-2-certification,https://docs.aws.amazon.com/IAM/latest/UserGuide/reference_policies_iam-condition-keys.html#ck_FIDO-FIPS-140-2-certification,Filters access by the MFA device FIPS-140-2 validation certification level at the time of registration of a FIDO security key,String
789,iam:FIDO-FIPS-140-3-certification,https://docs.aws.amazon.com/IAM/latest/UserGuide/reference_policies_iam-condition-keys.html#ck_FIDO-FIPS-140-3-certification,Filters access by the MFA device FIPS-140-3 validation certification level at the time of registration of a FIDO security key,String
790,securityhub:TargetAccount,https://docs.aws.amazon.com/securityhub/latest/userguide/securityhub-access.html#conditions,Filters access by the AwsAccountId field that is specified in the request,String
791,iam:FIDO-certification,https://docs.aws.amazon.com/IAM/latest/UserGuide/reference_policies_iam-condition-keys.html#ck_FIDO-certification,Filters access by the MFA device FIDO certification level at the time of registration of a FIDO security key,String
792,iam:OrganizationsPolicyId,https://docs.aws.amazon.com/IAM/latest/UserGuide/reference_policies_iam-condition-keys.html#ck_OrganizationsPolicyId,Filters access by the ID of an AWS Organizations policy,String
793,serverlessrepo:applicationType,https://docs.aws.amazon.com/IAM/latest/UserGuide/applications.html,Filters access by application type,String
794,iam:PassedToService,https://docs.aws.amazon.com/IAM/latest/UserGuide/reference_policies_iam-condition-keys.html#ck_PassedToService,Filters access by the AWS service to which this role is passed,String
795,iam:PermissionsBoundary,https://docs.aws.amazon.com/IAM/latest/UserGuide/reference_policies_iam-condition-keys.html#ck_PermissionsBoundary,Filters access if the specified policy is set as the permissions boundary on the IAM entity (user or role),ARN
796,iam:PolicyARN,https://docs.aws.amazon.com/IAM/latest/UserGuide/reference_policies_iam-condition-keys.html#ck_PolicyARN,Filters access by the ARN of an IAM policy,ARN
797,iam:RegisterSecurityKey,https://docs.aws.amazon.com/IAM/latest/UserGuide/reference_policies_iam-condition-keys.html#ck_RegisterSecurityKey,Filters access by the current state of MFA device enablement,String
798,redshift-serverless:workgroupId,https://docs.aws.amazon.com/redshift/latest/mgmt/redshift-policy-resources.resource-permissions.html,Filters access by the workgroup identifier,String
799,redshift:AllowWrites,https://docs.aws.amazon.com/redshift/latest/mgmt/redshift-iam-access-control-overview.html#redshift-policy-resources.conditions,Filters access by the allowWrites input parameter,Bool
800,redshift:ConsumerArn,https://docs.aws.amazon.com/redshift/latest/mgmt/redshift-iam-access-control-overview.html#redshift-policy-resources.conditions,Filters access by the datashare consumer arn,ARN
801,redshift:ConsumerIdentifier,https://docs.aws.amazon.com/redshift/latest/mgmt/redshift-iam-access-control-overview.html#redshift-policy-resources.conditions,Filters access by the datashare consumer,String
802,redshift:DbName,https://docs.aws.amazon.com/redshift/latest/mgmt/redshift-iam-access-control-overview.html#redshift-policy-resources.conditions,Filters access by the database name,String
803,redshift:DbUser,https://docs.aws.amazon.com/redshift/latest/mgmt/redshift-iam-access-control-overview.html#redshift-policy-resources.conditions,Filters access by the database user name,String
804,redshift:DurationSeconds,https://docs.aws.amazon.com/redshift/latest/mgmt/redshift-iam-access-control-overview.html#redshift-policy-resources.conditions,Filters access by the number of seconds until a temporary credential set expires,String
805,redshift:InboundIntegrationArn,https://docs.aws.amazon.com/redshift/latest/mgmt/redshift-iam-access-control-overview.html#redshift-policy-resources.conditions,Filters access by the ARN of an inbound zero-ETL Integration resource,ARN
806,redshift:IntegrationSourceArn,https://docs.aws.amazon.com/redshift/latest/mgmt/redshift-iam-access-control-overview.html#redshift-policy-resources.conditions,Filters access by the ARN of a zero-ETL Integration source,ARN
807,redshift:IntegrationTargetArn,https://docs.aws.amazon.com/redshift/latest/mgmt/redshift-iam-access-control-overview.html#redshift-policy-resources.conditions,Filters access by the ARN of a zero-ETL Integration target,ARN
808,refactor-spaces:ApplicationCreatedByAccount,https://docs.aws.amazon.com/migrationhub-refactor-spaces/latest/userguide/security_iam_service-with-iam.html#security_iam_service-with-iam-id-based-policies-conditionkeys,Filters access by restricting the action to only those accounts that created the application within an environment,String
809,refactor-spaces:CreatedByAccountIds,https://docs.aws.amazon.com/migrationhub-refactor-spaces/latest/userguide/security_iam_service-with-iam.html#security_iam_service-with-iam-id-based-policies-conditionkeys,Filters access by the accounts that created the resource,ArrayOfString
810,refactor-spaces:RouteCreatedByAccount,https://docs.aws.amazon.com/migrationhub-refactor-spaces/latest/userguide/security_iam_service-with-iam.html#security_iam_service-with-iam-id-based-policies-conditionkeys,Filters access by restricting the action to only those accounts that created the route within an application,String
811,refactor-spaces:ServiceCreatedByAccount,https://docs.aws.amazon.com/migrationhub-refactor-spaces/latest/userguide/security_iam_service-with-iam.html#security_iam_service-with-iam-id-based-policies-conditionkeys,Filters access by restricting the action to only those accounts that created the service within an application,String
812,refactor-spaces:SourcePath,https://docs.aws.amazon.com/migrationhub-refactor-spaces/latest/userguide/security_iam_service-with-iam.html#security_iam_service-with-iam-id-based-policies-conditionkeys,Filters access by the path of the route,String
813,resource-explorer-2:Operation,https://docs.aws.amazon.com/service-authorization/latest/reference/list_awsresourceexplorer.html,"Filters access by the actual operation that is being invoked, available values: Search, ListResources",String
814,route53-recovery-cluster:AllowSafetyRulesOverrides,https://docs.aws.amazon.com/routing-control/latest/APIReference/API_UpdateRoutingControlState.html,Override safety rules to allow routing control state updates,Bool
815,route53:ChangeResourceRecordSetsActions,https://docs.aws.amazon.com/Route53/latest/DeveloperGuide/specifying-conditions-route53.html#route53_rrsetConditionKeys,"Filters access by the change actions, CREATE, UPSERT, or DELETE, in a ChangeResourceRecordSets request",ArrayOfString
816,route53:ChangeResourceRecordSetsNormalizedRecordNames,https://docs.aws.amazon.com/Route53/latest/DeveloperGuide/specifying-conditions-route53.html#route53_rrsetConditionKeys,Filters access by the normalized DNS record names in a ChangeResourceRecordSets request,ArrayOfString
