condition_key_id,name,reference_url,description,type
494,eks:username,https://docs.aws.amazon.com/eks/latest/userguide/security_iam_service-with-iam.html#security_iam_service-with-iam-id-based-policies,Filters access by the Kubernetes username present in the access entry requests the user makes to the EKS service,String
495,elasticache:AtRestEncryptionEnabled,,,
496,elasticache:AuthTokenEnabled,,,
497,elasticache:AutomaticFailoverEnabled,,,
498,elasticache:CacheNodeType,,,
499,elasticache:CacheParameterGroupName,,,
500,sagemaker:FeatureGroupOfflineStoreKmsKey,https://docs.aws.amazon.com/IAM/latest/UserGuide/list_amazonsagemaker.html#amazonsagemaker-policy-keys,Filters access by the offline store kms key associated with the feature group resource in the request,ARN
501,elasticache:ClusterModeEnabled,,,
502,sagemaker:FeatureGroupOfflineStoreS3Uri,https://docs.aws.amazon.com/IAM/latest/UserGuide/list_amazonsagemaker.html#amazonsagemaker-policy-keys,Filters access by the offline store s3 uri associated with the feature group resource in the request,String
503,sagemaker:FeatureGroupOnlineStoreKmsKey,https://docs.aws.amazon.com/IAM/latest/UserGuide/list_amazonsagemaker.html#amazonsagemaker-policy-keys,Filters access by the online store kms key associated with the feature group resource in the request,ARN
504,sagemaker:FileSystemAccessMode,https://docs.aws.amazon.com/IAM/latest/UserGuide/list_amazonsagemaker.html#amazonsagemaker-policy-keys,Filters access by a file system access mode associated with the resource in the request,String
505,sagemaker:FileSystemDirectoryPath,https://docs.aws.amazon.com/IAM/latest/UserGuide/list_amazonsagemaker.html#amazonsagemaker-policy-keys,Filters access by a file system directory path associated with the resource in the request,String
506,sagemaker:FileSystemId,https://docs.aws.amazon.com/IAM/latest/UserGuide/list_amazonsagemaker.html#amazonsagemaker-policy-keys,Filters access by a file system ID associated with the resource in the request,String
507,sagemaker:FileSystemType,https://docs.aws.amazon.com/IAM/latest/UserGuide/list_amazonsagemaker.html#amazonsagemaker-policy-keys,Filters access by a file system type associated with the resource in the request,String
508,sagemaker:HomeEfsFileSystemKmsKey,https://docs.aws.amazon.com/IAM/latest/UserGuide/list_amazonsagemaker.html#amazonsagemaker-policy-keys,Filters access by a key that is present in the request the user makes to the SageMaker service. This key is deprecated. It has been replaced by sagemaker:VolumeKmsKey,ARN
509,sagemaker:ImageArns,https://docs.aws.amazon.com/IAM/latest/UserGuide/list_amazonsagemaker.html#amazonsagemaker-policy-keys,Filters access by the list of all image arns associated with the resource in the request,ArrayOfARN
510,sagemaker:ImageVersionArns,https://docs.aws.amazon.com/IAM/latest/UserGuide/list_amazonsagemaker.html#amazonsagemaker-policy-keys,Filters access by the list of all image version arns associated with the resource in the request,ArrayOfARN
511,sagemaker:InstanceTypes,https://docs.aws.amazon.com/IAM/latest/UserGuide/list_amazonsagemaker.html#amazonsagemaker-policy-keys,Filters access by the list of all instance types associated with the resource in the request,ArrayOfString
512,appsync:Visibility,iam-policy-structure.html#amazon-appsync-keys,Filters access by the visibility of an API,String
513,sagemaker:InterContainerTrafficEncryption,https://docs.aws.amazon.com/IAM/latest/UserGuide/list_amazonsagemaker.html#amazonsagemaker-policy-keys,Filters access by the inter container traffic encryption associated with the resource in the request,Bool
514,elasticache:DataStorageUnit,,,
515,artifact:ReportCategory,https://docs.aws.amazon.com/artifact/latest/ug/using-condition-keys.html,Filters access by which category reports are associated with,String
516,artifact:ReportSeries,https://docs.aws.amazon.com/artifact/latest/ug/using-condition-keys.html,Filters access by which series reports are associated with,String
517,autoscaling:ImageId,https://docs.aws.amazon.com/autoscaling/latest/userguide/control-access-using-iam.html#policy-auto-scaling-condition-keys,Filters access based on the AMI ID for the launch configuration,String
518,sagemaker:KeepAlivePeriod,https://docs.aws.amazon.com/IAM/latest/UserGuide/list_amazonsagemaker.html#amazonsagemaker-policy-keys,Filters access by the keep-alive period associated with the resource in the request,Numeric
519,autoscaling:InstanceType,https://docs.aws.amazon.com/autoscaling/latest/userguide/control-access-using-iam.html#policy-auto-scaling-condition-keys,Filters access based on the instance type for the launch configuration,String
520,autoscaling:InstanceTypes,https://docs.aws.amazon.com/autoscaling/latest/userguide/control-access-using-iam.html#policy-auto-scaling-condition-keys,Filters access based on the instance types present as overrides to a launch template for a mixed instances policy. Use it to qualify which instance types can be explicitly defined in the policy,String
521,autoscaling:LaunchConfigurationName,https://docs.aws.amazon.com/autoscaling/latest/userguide/control-access-using-iam.html#policy-auto-scaling-condition-keys,Filters access based on the name of a launch configuration,String
522,autoscaling:LaunchTemplateVersionSpecified,https://docs.aws.amazon.com/autoscaling/latest/userguide/control-access-using-iam.html#policy-auto-scaling-condition-keys,Filters access based on whether users can specify any version of a launch template or only the Latest or Default version,Bool
523,autoscaling:LoadBalancerNames,https://docs.aws.amazon.com/autoscaling/latest/userguide/control-access-using-iam.html#policy-auto-scaling-condition-keys,Filters access based on the name of the load balancer,ArrayOfString
524,autoscaling:MaxSize,https://docs.aws.amazon.com/autoscaling/latest/userguide/control-access-using-iam.html#policy-auto-scaling-condition-keys,Filters access based on the maximum scaling size in the request,Numeric
525,autoscaling:MetadataHttpEndpoint,https://docs.aws.amazon.com/autoscaling/latest/userguide/control-access-using-iam.html#policy-auto-scaling-condition-keys,Filters access based on whether the HTTP endpoint is enabled for the instance metadata service,String
526,autoscaling:MetadataHttpPutResponseHopLimit,https://docs.aws.amazon.com/autoscaling/latest/userguide/control-access-using-iam.html#policy-auto-scaling-condition-keys,Filters access based on the allowed number of hops when calling the instance metadata service,Numeric
527,autoscaling:MetadataHttpTokens,https://docs.aws.amazon.com/autoscaling/latest/userguide/control-access-using-iam.html#policy-auto-scaling-condition-keys,Filters access based on whether tokens are required when calling the instance metadata service (optional or required),String
528,autoscaling:MinSize,https://docs.aws.amazon.com/autoscaling/latest/userguide/control-access-using-iam.html#policy-auto-scaling-condition-keys,Filters access based on the minimum scaling size in the request,Numeric
529,autoscaling:ResourceTag/${TagKey},https://docs.aws.amazon.com/autoscaling/latest/userguide/control-access-using-iam.html#policy-auto-scaling-condition-keys,Filters access based on the tags associated with the resource,String
530,autoscaling:SpotPrice,https://docs.aws.amazon.com/autoscaling/latest/userguide/control-access-using-iam.html#policy-auto-scaling-condition-keys,Filters access based on the price for Spot Instances for the launch configuration,Numeric
531,autoscaling:TargetGroupARNs,https://docs.aws.amazon.com/autoscaling/latest/userguide/control-access-using-iam.html#policy-auto-scaling-condition-keys,Filters access based on the ARN of a target group,ArrayOfARN
532,autoscaling:TrafficSourceIdentifiers,https://docs.aws.amazon.com/autoscaling/latest/userguide/control-access-using-iam.html#policy-auto-scaling-condition-keys,Filters access based on the identifiers of the traffic sources,ArrayOfString
533,autoscaling:VPCZoneIdentifiers,https://docs.aws.amazon.com/autoscaling/latest/userguide/control-access-using-iam.html#policy-auto-scaling-condition-keys,Filters access based on the identifier of a VPC zone,ArrayOfString
534,aws-marketplace:AgreementType,https://docs.aws.amazon.com/marketplace/latest/buyerguide/buyer-iam-users-groups-policies.html,Filters access by the type of the agreement,ArrayOfString
535,aws-marketplace:Intent,https://docs.aws.amazon.com/marketplace-catalog/latest/api-reference/api-access-control.html,Filters access by the Intent parameter in the StartChangeSet request,String
536,aws-marketplace:PartyType,https://docs.aws.amazon.com/marketplace/latest/buyerguide/buyer-iam-users-groups-policies.html,Filters access by the party type of the agreement,String
537,aws-marketplace:ProductId,https://docs.aws.amazon.com/marketplace/latest/buyerguide/buyer-iam-users-groups-policies.html,Filters access by product id for AWS Marketplace RedHat OpenShift and Bedrock Products. Note: Using this condition key will not restrict access to products in AWS Marketplace,ArrayOfString
538,aws:RequestTag/${TagKey},"",Filters access based on the presence of tag key-value pairs in the request,String
539,aws:ResourceTag/${TagKey},"",Filters access based on tag key-value pairs attached to the resource,String
540,aws:TagKeys,"",Filters access based on the presence of tag keys in the request,ArrayOfString
541,backup:ChangeableForDays,https://docs.aws.amazon.com/aws-backup/latest/devguide/access-control.html#amazon-backup-keys,Filters access by the value of the ChangeableForDays parameter,Numeric
542,backup:CopyTargetOrgPaths,https://docs.aws.amazon.com/aws-backup/latest/devguide/access-control.html#amazon-backup-keys,Filters access by the organization unit,ArrayOfString
543,backup:CopyTargets,https://docs.aws.amazon.com/aws-backup/latest/devguide/access-control.html#amazon-backup-keys,Filters access by the ARN of an backup vault,ArrayOfARN
544,backup:FrameworkArns,https://docs.aws.amazon.com/aws-backup/latest/devguide/access-control.html#amazon-backup-keys,Filters access by the Framework ARNs,ArrayOfARN
545,backup:MaxRetentionDays,https://docs.aws.amazon.com/aws-backup/latest/devguide/access-control.html#amazon-backup-keys,Filters access by the value of the MaxRetentionDays parameter,Numeric
546,sagemaker:MaxRuntimeInSeconds,https://docs.aws.amazon.com/IAM/latest/UserGuide/list_amazonsagemaker.html#amazonsagemaker-policy-keys,Filters access by the max runtime in seconds associated with the resource in the request,Numeric
547,sagemaker:MinimumInstanceMetadataServiceVersion,https://docs.aws.amazon.com/IAM/latest/UserGuide/list_amazonsagemaker.html#amazonsagemaker-policy-keys,Filters access by the minimum instance metadata service version used by the resource in the request,String
548,sagemaker:ModelApprovalStatus,https://docs.aws.amazon.com/IAM/latest/UserGuide/list_amazonsagemaker.html#amazonsagemaker-policy-keys,Filters access by the model approval status with the model-package in the request,String
549,sagemaker:ModelArn,https://docs.aws.amazon.com/IAM/latest/UserGuide/list_amazonsagemaker.html#amazonsagemaker-policy-keys,Filters access by the model arn associated with the resource in the request,ARN
550,sagemaker:NetworkIsolation,https://docs.aws.amazon.com/IAM/latest/UserGuide/list_amazonsagemaker.html#amazonsagemaker-policy-keys,Filters access by the network isolation associated with the resource in the request,Bool
551,sagemaker:OutputKmsKey,https://docs.aws.amazon.com/IAM/latest/UserGuide/list_amazonsagemaker.html#amazonsagemaker-policy-keys,Filters access by the output kms key associated with the resource in the request,ARN
552,sagemaker:OwnerUserProfileArn,https://docs.aws.amazon.com/IAM/latest/UserGuide/list_amazonsagemaker.html#amazonsagemaker-policy-keys,Filters access by the OwnerUserProfile arn associated with the space in the request,ARN
553,sagemaker:ResourceTag/,https://docs.aws.amazon.com/IAM/latest/UserGuide/list_amazonsagemaker.html#amazonsagemaker-policy-keys,Filters access by the preface string for a tag key and value pair attached to a resource,String
554,sagemaker:ResourceTag/${TagKey},https://docs.aws.amazon.com/IAM/latest/UserGuide/list_amazonsagemaker.html#amazonsagemaker-policy-keys,Filters access by a tag key and value pair,String
555,sagemaker:RootAccess,https://docs.aws.amazon.com/IAM/latest/UserGuide/list_amazonsagemaker.html#amazonsagemaker-policy-keys,Filters access by the root access associated with the resource in the request,String
556,sagemaker:SearchVisibilityCondition/${FilterKey},https://docs.aws.amazon.com/IAM/latest/UserGuide/list_amazonsagemaker.html#amazonsagemaker-policy-keys,Limits the results of your search request to the resources that you can access. ${FilterKey} is a key that the VisibilityConditions configuration presents in the Search request,String
557,sagemaker:ServerlessMaxConcurrency,https://docs.aws.amazon.com/IAM/latest/UserGuide/list_amazonsagemaker.html#amazonsagemaker-policy-keys,Filters access by limiting maximum concurrency used for Serverless inference in the request,Numeric
558,sagemaker:ServerlessMemorySize,https://docs.aws.amazon.com/IAM/latest/UserGuide/list_amazonsagemaker.html#amazonsagemaker-policy-keys,Filters access by limiting memory size used for Serverless inference in the request,Numeric
559,sagemaker:SpaceSharingType,https://docs.aws.amazon.com/IAM/latest/UserGuide/list_amazonsagemaker.html#amazonsagemaker-policy-keys,Filters access by the sharing type associated with the space in the request,String
560,sagemaker:TaggingAction,https://docs.aws.amazon.com/IAM/latest/UserGuide/list_amazonsagemaker.html#amazonsagemaker-policy-keys,Filters access by the API actions to which a user can apply tags. Uses the name of the API operation that creates a taggable resource to filter access,String
561,sagemaker:TargetModel,https://docs.aws.amazon.com/IAM/latest/UserGuide/list_amazonsagemaker.html#amazonsagemaker-policy-keys,Filters access by the target model associated with the Multi-Model Endpoint in the request,String
562,sagemaker:UserProfileName,https://docs.aws.amazon.com/IAM/latest/UserGuide/list_amazonsagemaker.html#amazonsagemaker-policy-keys,You can use the UserProfileName as a policy variable to filter requests from specific user profiles within a SageMaker Domain. This context key is not applicable to user profiles within shared spaces,String
563,sagemaker:VolumeKmsKey,https://docs.aws.amazon.com/IAM/latest/UserGuide/list_amazonsagemaker.html#amazonsagemaker-policy-keys,Filters access by the volume kms key associated with the resource in the request,ARN
564,sagemaker:VpcSecurityGroupIds,https://docs.aws.amazon.com/IAM/latest/UserGuide/list_amazonsagemaker.html#amazonsagemaker-policy-keys,Filters access by the list of all VPC security group ids associated with the resource in the request,ArrayOfString
565,sagemaker:VpcSubnets,https://docs.aws.amazon.com/IAM/latest/UserGuide/list_amazonsagemaker.html#amazonsagemaker-policy-keys,Filters access by the list of all VPC subnets associated with the resource in the request,ArrayOfString
566,sagemaker:WorkteamArn,https://docs.aws.amazon.com/IAM/latest/UserGuide/list_amazonsagemaker.html#amazonsagemaker-policy-keys,Filters access by the workteam arn associated to the request,ARN
567,sagemaker:WorkteamType,https://docs.aws.amazon.com/IAM/latest/UserGuide/list_amazonsagemaker.html#amazonsagemaker-policy-keys,"Filters access by the workteam type associated to the request. This can be public-crowd, private-crowd or vendor-crowd",String
568,saml:aud,https://docs.aws.amazon.com/IAM/latest/UserGuide/reference_policies_iam-condition-keys.html#ck_aud,Filters access by the endpoint URL to which SAML assertions are presented,String
569,saml:cn,https://docs.aws.amazon.com/IAM/latest/UserGuide/reference_policies_iam-condition-keys.html#ck_cn,Filters access by the eduOrg attribute,ArrayOfString
570,saml:commonName,https://docs.aws.amazon.com/IAM/latest/UserGuide/reference_policies_iam-condition-keys.html#ck_commonname,Filters access by the commonName attribute,String
571,saml:doc,https://docs.aws.amazon.com/IAM/latest/UserGuide/reference_policies_iam-condition-keys.html#ck_doc,Filters access by on the principal that was used to assume the role,String
572,saml:eduorghomepageuri,https://docs.aws.amazon.com/IAM/latest/UserGuide/reference_policies_iam-condition-keys.html#ck_eduorghomepageuri,Filters access by the eduOrg attribute,ArrayOfString
573,saml:eduorgidentityauthnpolicyuri,https://docs.aws.amazon.com/IAM/latest/UserGuide/reference_policies_iam-condition-keys.html#ck_aud,Filters access by the eduOrg attribute,ArrayOfString
574,saml:eduorglegalname,https://docs.aws.amazon.com/IAM/latest/UserGuide/reference_policies_iam-condition-keys.html#ck_eduorglegalname,Filters access by the eduOrg attribute,ArrayOfString
575,saml:eduorgsuperioruri,https://docs.aws.amazon.com/IAM/latest/UserGuide/reference_policies_iam-condition-keys.html#ck_eduorgsuperioruri,Filters access by the eduOrg attribute,ArrayOfString
576,saml:eduorgwhitepagesuri,https://docs.aws.amazon.com/IAM/latest/UserGuide/reference_policies_iam-condition-keys.html#ck_eduorgwhitepagesuri,Filters access by the eduOrg attribute,ArrayOfString
577,saml:edupersonaffiliation,https://docs.aws.amazon.com/IAM/latest/UserGuide/reference_policies_iam-condition-keys.html#ck_edupersonaffiliation,Filters access by the eduPerson attribute,ArrayOfString
578,saml:edupersonassurance,https://docs.aws.amazon.com/IAM/latest/UserGuide/reference_policies_iam-condition-keys.html#ck_edupersonassurance,Filters access by the eduPerson attribute,ArrayOfString
579,saml:edupersonentitlement,https://docs.aws.amazon.com/IAM/latest/UserGuide/reference_policies_iam-condition-keys.html#ck_edupersonentitlement,Filters access by the eduPerson attribute,ArrayOfString
580,saml:edupersonnickname,https://docs.aws.amazon.com/IAM/latest/UserGuide/reference_policies_iam-condition-keys.html#ck_edupersonnickname,Filters access by the eduPerson attribute,ArrayOfString
581,saml:edupersonorgdn,https://docs.aws.amazon.com/IAM/latest/UserGuide/reference_policies_iam-condition-keys.html#ck_edupersonorgdn,Filters access by the eduPerson attribute,String
582,saml:edupersonorgunitdn,https://docs.aws.amazon.com/IAM/latest/UserGuide/reference_policies_iam-condition-keys.html#ck_edupersonorgunitdn,Filters access by the eduPerson attribute,ArrayOfString
583,saml:edupersonprimaryaffiliation,https://docs.aws.amazon.com/IAM/latest/UserGuide/reference_policies_iam-condition-keys.html#ck_edupersonprimaryaffiliation,Filters access by the eduPerson attribute,String
584,saml:edupersonprimaryorgunitdn,https://docs.aws.amazon.com/IAM/latest/UserGuide/reference_policies_iam-condition-keys.html#ck_edupersonprimaryorgunitdn,Filters access by the eduPerson attribute,String
585,saml:edupersonprincipalname,https://docs.aws.amazon.com/IAM/latest/UserGuide/reference_policies_iam-condition-keys.html#ck_edupersonprincipalname,Filters access by the eduPerson attribute,String
586,saml:edupersonscopedaffiliation,https://docs.aws.amazon.com/IAM/latest/UserGuide/reference_policies_iam-condition-keys.html#ck_edupersonscopedaffiliation,Filters access by the eduPerson attribute,ArrayOfString
587,saml:edupersontargetedid,https://docs.aws.amazon.com/IAM/latest/UserGuide/reference_policies_iam-condition-keys.html#ck_edupersontargetedid,Filters access by the eduPerson attribute,ArrayOfString
588,saml:givenName,https://docs.aws.amazon.com/IAM/latest/UserGuide/reference_policies_iam-condition-keys.html#ck_givenname,Filters access by the givenName attribute,String
589,saml:iss,https://docs.aws.amazon.com/IAM/latest/UserGuide/reference_policies_iam-condition-keys.html#ck_iss,"Filters access by on the issuer, which is represented by a URN",String
590,saml:mail,https://docs.aws.amazon.com/IAM/latest/UserGuide/reference_policies_iam-condition-keys.html#ck_mail,Filters access by the mail attribute,String
591,saml:name,https://docs.aws.amazon.com/IAM/latest/UserGuide/reference_policies_iam-condition-keys.html#ck_name,Filters access by the name attribute,String
592,saml:namequalifier,https://docs.aws.amazon.com/IAM/latest/UserGuide/reference_policies_iam-condition-keys.html#ck_namequalifier,"Filters access by the hash value of the issuer, account ID, and friendly name",String
593,saml:organizationStatus,https://docs.aws.amazon.com/IAM/latest/UserGuide/reference_policies_iam-condition-keys.html#ck_organizationstatus,Filters access by the organizationStatus attribute,String
594,backup:MinRetentionDays,https://docs.aws.amazon.com/aws-backup/latest/devguide/access-control.html#amazon-backup-keys,Filters access by the value of the MinRetentionDays parameter,Numeric
595,batch:AWSLogsCreateGroup,https://docs.aws.amazon.com/service-authorization/latest/reference/list_awsbatch.html#awsbatch-policy-keys,Filters access by the specified logging driver to determine whether awslogs group will be created for the logs,Bool
596,batch:AWSLogsGroup,https://docs.aws.amazon.com/service-authorization/latest/reference/list_awsbatch.html#awsbatch-policy-keys,Filters access by the awslogs group where the logs are located,String
597,batch:AWSLogsRegion,https://docs.aws.amazon.com/service-authorization/latest/reference/list_awsbatch.html#awsbatch-policy-keys,Filters access by the region where the logs are sent to,String
598,batch:AWSLogsStreamPrefix,https://docs.aws.amazon.com/service-authorization/latest/reference/list_awsbatch.html#awsbatch-policy-keys,Filters access by the awslogs log stream prefix,String
599,elasticache:EngineType,,,
600,batch:EKSImage,https://docs.aws.amazon.com/service-authorization/latest/reference/list_awsbatch.html#awsbatch-policy-keys,Filters access by the image used to start a container for an Amazon EKS job,String
601,elasticache:EngineVersion,,,
602,elasticache:KmsKeyId,,,
603,elasticache:MaximumDataStorage,,,
604,elasticache:MaximumECPUPerSecond,,,
605,elasticache:MultiAZEnabled,,,
606,elasticache:NumNodeGroups,,,
607,elasticache:ReplicasPerNodeGroup,,,
608,elasticache:SnapshotRetentionLimit,,,
609,batch:EKSPrivileged,https://docs.aws.amazon.com/service-authorization/latest/reference/list_awsbatch.html#awsbatch-policy-keys,Filters access by the specified privileged parameter value that determines whether the container is given elevated privileges on the host container instance (similar to the root user) for an Amazon EKS job,Bool
610,batch:EKSRunAsGroup,https://docs.aws.amazon.com/service-authorization/latest/reference/list_awsbatch.html#awsbatch-policy-keys,Filters access by the specified group numeric ID (gid) used to start a container in an Amazon EKS job,Numeric
611,batch:EKSRunAsUser,https://docs.aws.amazon.com/service-authorization/latest/reference/list_awsbatch.html#awsbatch-policy-keys,Filters access by the specified user numeric ID (uid) used to start a a container in an Amazon EKS job,Numeric
612,batch:EKSServiceAccountName,https://docs.aws.amazon.com/service-authorization/latest/reference/list_awsbatch.html#awsbatch-policy-keys,Filters access by the name of the service account used to run the pod for an Amazon EKS job,String
613,elasticache:TransitEncryptionEnabled,,,
614,batch:Image,https://docs.aws.amazon.com/service-authorization/latest/reference/list_awsbatch.html#awsbatch-policy-keys,Filters access by the image used to start a container,String
615,elasticache:UserAuthenticationMode,,,
616,elasticbeanstalk:FromApplication,https://docs.aws.amazon.com/elasticbeanstalk/latest/dg/AWSHowTo.iam.policies.actions.html#AWSHowTo.iam.policies.conditions,Filters access by an application as a dependency or a constraint on an input parameter,ARN
617,elasticbeanstalk:FromApplicationVersion,https://docs.aws.amazon.com/elasticbeanstalk/latest/dg/AWSHowTo.iam.policies.actions.html#AWSHowTo.iam.policies.conditions,Filters access by an application version as a dependency or a constraint on an input parameter,ARN
618,elasticbeanstalk:FromConfigurationTemplate,https://docs.aws.amazon.com/elasticbeanstalk/latest/dg/AWSHowTo.iam.policies.actions.html#AWSHowTo.iam.policies.conditions,Filters access by a configuration template as a dependency or a constraint on an input parameter,ARN
619,elasticbeanstalk:FromEnvironment,https://docs.aws.amazon.com/elasticbeanstalk/latest/dg/AWSHowTo.iam.policies.actions.html#AWSHowTo.iam.policies.conditions,Filters access by an environment as a dependency or a constraint on an input parameter,ARN
620,batch:LogDriver,https://docs.aws.amazon.com/service-authorization/latest/reference/list_awsbatch.html#awsbatch-policy-keys,Filters access by the log driver used for the container,String
621,elasticbeanstalk:FromPlatform,https://docs.aws.amazon.com/elasticbeanstalk/latest/dg/AWSHowTo.iam.policies.actions.html#AWSHowTo.iam.policies.conditions,Filters access by a platform as a dependency or a constraint on an input parameter,ARN
622,elasticbeanstalk:FromSolutionStack,https://docs.aws.amazon.com/elasticbeanstalk/latest/dg/AWSHowTo.iam.policies.actions.html#AWSHowTo.iam.policies.conditions,Filters access by a solution stack as a dependency or a constraint on an input parameter,ARN
623,elasticbeanstalk:InApplication,https://docs.aws.amazon.com/elasticbeanstalk/latest/dg/AWSHowTo.iam.policies.actions.html#AWSHowTo.iam.policies.conditions,Filters access by the application that contains the resource that the action operates on,ARN
624,elasticfilesystem:AccessPointArn,https://docs.aws.amazon.com/efs/latest/ug/efs-access-points.html,Filters access by the ARN of the access point used to mount the file system,ARN
625,elasticfilesystem:AccessedViaMountTarget,https://docs.aws.amazon.com/efs/latest/ug/mounting-fs.html,Filters access by whether the file system is accessed via mount targets,Bool
626,elasticfilesystem:CreateAction,https://docs.aws.amazon.com/efs/latest/ug/using-tags-efs.html,Filters access by the name of a resource-creating API action,String
