condition_key_id,name,reference_url,description,type
358,apigateway:Resource/MtlsTrustStoreUri,https://docs.aws.amazon.com/apigateway/latest/developerguide/security_iam_service-with-iam.html,Filters access by URI of the truststore used for mutual TLS authentication. Available during UpdateDomainName and DeleteDomainName operations,String
359,apigateway:Resource/MtlsTrustStoreVersion,https://docs.aws.amazon.com/apigateway/latest/developerguide/security_iam_service-with-iam.html,Filters access by version of the truststore used for mutual TLS authentication. Available during UpdateDomainName and DeleteDomainName operations,String
360,deadline:JobMembershipLevels,https://docs.aws.amazon.com/deadline-cloud/latest/userguide/security-iam-service-with-iam.html,Filters access by membership levels on the job,ArrayOfString
361,kms:BypassPolicyLockoutSafetyCheck,https://docs.aws.amazon.com/kms/latest/developerguide/conditions-kms.html#conditions-kms-bypass-policy-lockout-safety-check,Filters access to the CreateKey and PutKeyPolicy operations based on the value of the BypassPolicyLockoutSafetyCheck parameter in the request,Bool
362,deadline:MembershipLevel,https://docs.aws.amazon.com/deadline-cloud/latest/userguide/security-iam-service-with-iam.html,Filters access by the membership level passed in the request,String
363,deadline:PrincipalId,https://docs.aws.amazon.com/deadline-cloud/latest/userguide/security-iam-service-with-iam.html,Filters access by the principle ID provided in the request,String
364,deadline:QueueMembershipLevels,https://docs.aws.amazon.com/deadline-cloud/latest/userguide/security-iam-service-with-iam.html,Filters access by membership levels on the queue,ArrayOfString
365,deadline:RequesterPrincipalId,https://docs.aws.amazon.com/deadline-cloud/latest/userguide/security-iam-service-with-iam.html,Filters access by the user calling the Deadline Cloud API,String
366,devops-guru:ServiceNames,https://docs.aws.amazon.com/devops-guru/latest/APIReference/API_ServiceCollection.html,Filters access by API to restrict access to given AWS service names,ArrayOfString
367,dms:assessment-run-tag/${TagKey},https://docs.aws.amazon.com/service-authorization/latest/reference/list_awsdatabasemigrationservice.html#awsdatabasemigrationservice-dms_assessment-run-tag___TagKey_,Filters access by the presence of tag key-value pairs in the request for AssessmentRun,String
368,dms:cert-tag/${TagKey},https://docs.aws.amazon.com/service-authorization/latest/reference/list_awsdatabasemigrationservice.html#awsdatabasemigrationservice--dms_cert-tag___TagKey_,Filters access by the presence of tag key-value pairs in the request for Certificate,String
369,dms:data-migration-tag/${TagKey},https://docs.aws.amazon.com/service-authorization/latest/reference/list_awsdatabasemigrationservice.html#awsdatabasemigrationservice--dms_data-migration-tag___TagKey_,Filters access by the presence of tag key-value pairs in the request for DataMigration,String
370,dms:data-provider-tag/${TagKey},https://docs.aws.amazon.com/service-authorization/latest/reference/list_awsdatabasemigrationservice.html#awsdatabasemigrationservice--dms_dp-tag___TagKey_,Filters access by the presence of tag key-value pairs in the request for DataProvider,String
371,dms:endpoint-tag/${TagKey},https://docs.aws.amazon.com/service-authorization/latest/reference/list_awsdatabasemigrationservice.html#awsdatabasemigrationservice-dms_endpoint-tag___TagKey_,Filters access by the presence of tag key-value pairs in the request for Endpoint,String
372,dms:es-tag/${TagKey},https://docs.aws.amazon.com/service-authorization/latest/reference/list_awsdatabasemigrationservice.html#awsdatabasemigrationservice-dms_es-tag___TagKey_,Filters access by the presence of tag key-value pairs in the request for EventSubscription,String
373,dms:individual-assessment-tag/${TagKey},https://docs.aws.amazon.com/service-authorization/latest/reference/list_awsdatabasemigrationservice.html#awsdatabasemigrationservice-dms_individual-assessment-tag___TagKey_,Filters access by the presence of tag key-value pairs in the request for IndividualAssessment,String
374,dms:instance-profile-tag/${TagKey},https://docs.aws.amazon.com/service-authorization/latest/reference/list_awsdatabasemigrationservice.html#awsdatabasemigrationservice--dms_ip-tag___TagKey_,Filters access by the presence of tag key-value pairs in the request for InstanceProfile,String
375,dms:migration-project-tag/${TagKey},https://docs.aws.amazon.com/service-authorization/latest/reference/list_awsdatabasemigrationservice.html#awsdatabasemigrationservice--dms_mp-tag___TagKey_,Filters access by the presence of tag key-value pairs in the request for MigrationProject,String
376,dms:rep-tag/${TagKey},https://docs.aws.amazon.com/service-authorization/latest/reference/list_awsdatabasemigrationservice.html#awsdatabasemigrationservice-dms_rep-tag___TagKey_,Filters access by the presence of tag key-value pairs in the request for ReplicationInstance,String
377,dms:replication-config-tag/${TagKey},https://docs.aws.amazon.com/service-authorization/latest/reference/list_awsdatabasemigrationservice.html#awsdatabasemigrationservice-dms_replication-config-tag___TagKey_,Filters access by the presence of tag key-value pairs in the request for ReplicationConfig,String
378,dms:req-tag/${TagKey},https://docs.aws.amazon.com/service-authorization/latest/reference/list_awsdatabasemigrationservice.html#awsdatabasemigrationservice-dms_req-tag___TagKey_,Filters access by the presence of tag key-value pairs in the given request,String
379,dms:subgrp-tag/${TagKey},https://docs.aws.amazon.com/service-authorization/latest/reference/list_awsdatabasemigrationservice.html#awsdatabasemigrationservice-dms_subgrp-tag___TagKey_,Filters access by the presence of tag key-value pairs in the request for ReplicationSubnetGroup,String
380,dms:task-tag/${TagKey},https://docs.aws.amazon.com/service-authorization/latest/reference/list_awsdatabasemigrationservice.html#awsdatabasemigrationservice-dms_task-tag___TagKey_,Filters access by the presence of tag key-value pairs in the request for ReplicationTask,String
381,drs:CreateAction,https://docs.aws.amazon.com/drs/latest/userguide/supported-iam-actions-tagging.html,Filters access by the name of a resource-creating API action,String
382,drs:EC2InstanceARN,https://docs.aws.amazon.com/drs/latest/userguide/security_iam_authentication.html,Filters access by the EC2 instance the request originated from,ARN
383,ds-data:Identifier,https://docs.aws.amazon.com/directoryservice/latest/admin-guide/iam_dsdata-condition-keys.html#dsdata_condition-Identifier,Filters access by the type of identifier provided in the request (i.e. SAM Account Name),String
384,ds-data:MemberName,https://docs.aws.amazon.com/directoryservice/latest/admin-guide/iam_dsdata-condition-keys.html#dsdata_condition-MemberName,Filters access by the directory SAM Account Name included in the MemberName input of the request,String
385,ds-data:MemberRealm,https://docs.aws.amazon.com/directoryservice/latest/admin-guide/iam_dsdata-condition-keys.html#dsdata_condition-MemberRealm,Filters access by the directory realm name included in the MemberRealm input of the request,String
386,ds-data:Realm,https://docs.aws.amazon.com/directoryservice/latest/admin-guide/iam_dsdata-condition-keys.html#dsdata_condition-Realm,Filters access by the directory realm name for the request,String
387,ds-data:SAMAccountName,https://docs.aws.amazon.com/directoryservice/latest/admin-guide/iam_dsdata-condition-keys.html#dsdata_condition-SAMAccountName,Filters access by the directory SAM Account Name included in the SAMAccountName input of the request,String
388,dsql:FisActionId,https://docs.aws.amazon.com/fis/latest/userguide/fis-actions-reference.html,Filters access by the ID of an AWS FIS action,String
389,dsql:FisTargetArns,https://docs.aws.amazon.com/fis/latest/userguide/fis-actions-reference.html,Filters access by the ARN of an AWS FIS target,ArrayOfARN
390,dsql:WitnessRegion,https://docs.aws.amazon.com/aurora-dsql/latest/userguide/using-iam-condition-keys.html#using-iam-condition-keys-create-mr-cluster-witness,Filters access by the witness region of multi-Region clusters,String
391,dynamodb:Attributes,,,
392,dynamodb:EnclosingOperation,,,
393,dynamodb:FisActionId,,,
394,dynamodb:FisTargetArns,,,
395,dynamodb:FullTableScan,,,
396,dynamodb:LeadingKeys,,,
397,dynamodb:ReturnConsumedCapacity,,,
398,dynamodb:ReturnValues,,,
399,dynamodb:Select,,,
400,ebs:Description,https://docs.aws.amazon.com/IAM/latest/UserGuide/list_amazonelasticblockstore.html#amazonelasticblockstore-policy-keys,Filters access by the description of the snapshot being created,String
401,ebs:ParentSnapshot,https://docs.aws.amazon.com/IAM/latest/UserGuide/list_amazonelasticblockstore.html#amazonelasticblockstore-policy-keys,Filters access by the ARN of the parent snapshot,ARN
402,ebs:VolumeSize,https://docs.aws.amazon.com/IAM/latest/UserGuide/list_amazonelasticblockstore.html#amazonelasticblockstore-policy-keys,"Filters access by the size of the volume for the snapshot being created, in GiB",Numeric
403,ec2-instance-connect:MaxTunnelDuration,,,
404,ec2-instance-connect:maxTunnelDuration,https://docs.aws.amazon.com/AWSEC2/latest/UserGuide/permissions-for-ec2-instance-connect-endpoint.html#iam-OpenTunnel,Filters access by maximum session duration associated with the instance,Numeric
405,ec2-instance-connect:privateIpAddress,https://docs.aws.amazon.com/AWSEC2/latest/UserGuide/permissions-for-ec2-instance-connect-endpoint.html#iam-OpenTunnel,Filters access by private IP Address associated with the instance,IPAddress
406,ec2-instance-connect:remotePort,https://docs.aws.amazon.com/AWSEC2/latest/UserGuide/permissions-for-ec2-instance-connect-endpoint.html#iam-OpenTunnel,Filters access by port number associated with the instance,Numeric
407,ec2:AccepterVpc,https://docs.aws.amazon.com/vpc/latest/peering/security-iam.html,Filters access by the ARN of an accepter VPC in a VPC peering connection,ARN
408,ec2:Add/group,https://docs.aws.amazon.com/AWSEC2/latest/UserGuide/iam-policies-for-amazon-ec2.html#amazon-ec2-keys,Filters access by the group being added to a snapshot,String
409,ec2:Add/userId,https://docs.aws.amazon.com/AWSEC2/latest/UserGuide/iam-policies-for-amazon-ec2.html#amazon-ec2-keys,Filters access by the account id being added to a snapshot,String
410,ec2:AllocationId,https://docs.aws.amazon.com/AWSEC2/latest/UserGuide/iam-policies-for-amazon-ec2.html#amazon-ec2-keys,Filters access by the allocation ID of the Elastic IP address,String
411,ec2:AssociatePublicIpAddress,https://docs.aws.amazon.com/AWSEC2/latest/UserGuide/iam-policies-for-amazon-ec2.html#amazon-ec2-keys,Filters access by whether the user wants to associate a public IP address with the instance,Bool
412,ec2:Attribute,https://docs.aws.amazon.com/AWSEC2/latest/UserGuide/iam-policies-for-amazon-ec2.html#attribute-key,Filters access by an attribute of a resource,String
413,ec2:Attribute/${AttributeName},https://docs.aws.amazon.com/AWSEC2/latest/UserGuide/iam-policies-for-amazon-ec2.html#attribute-key,Filters access by an attribute being set on a resource,String
414,ec2:AuthenticationType,https://docs.aws.amazon.com/vpn/latest/s2svpn/vpn-authentication-access-control.html,Filters access by the authentication type for the VPN tunnel endpoints,String
415,ec2:AuthorizedService,https://docs.aws.amazon.com/AWSEC2/latest/UserGuide/iam-policies-for-amazon-ec2.html#amazon-ec2-keys,Filters access by the AWS service that has permission to use a resource,String
416,ec2:AuthorizedUser,https://docs.aws.amazon.com/AWSEC2/latest/UserGuide/iam-policies-for-amazon-ec2.html#amazon-ec2-keys,Filters access by an IAM principal that has permission to use a resource,String
417,ec2:AutoPlacement,https://docs.aws.amazon.com/AWSEC2/latest/UserGuide/iam-policies-for-amazon-ec2.html#amazon-ec2-keys,Filters access by the Auto Placement properties of a Dedicated Host,String
418,ec2:AvailabilityZone,https://docs.aws.amazon.com/AWSEC2/latest/UserGuide/iam-policies-for-amazon-ec2.html#amazon-ec2-keys,Filters access by the name of an Availability Zone in an AWS Region,String
419,ec2:AvailabilityZoneId,https://docs.aws.amazon.com/AWSEC2/latest/UserGuide/iam-policies-for-amazon-ec2.html#amazon-ec2-keys,Filters access by the ID of an Availability Zone in an AWS Region,String
420,ec2:CapacityReservationFleet,https://docs.aws.amazon.com/AWSEC2/latest/UserGuide/iam-policies-for-amazon-ec2.html#amazon-ec2-keys,Filters access by the ARN of the Capacity Reservation Fleet,ARN
421,ec2:ClientRootCertificateChainArn,https://docs.aws.amazon.com/AWSEC2/latest/UserGuide/iam-policies-for-amazon-ec2.html#amazon-ec2-keys,Filters access by the ARN of the client root certificate chain,ARN
422,ec2:CloudwatchLogGroupArn,https://docs.aws.amazon.com/AWSEC2/latest/UserGuide/iam-policies-for-amazon-ec2.html#amazon-ec2-keys,Filters access by the ARN of the CloudWatch Logs log group,ARN
423,ec2:CloudwatchLogStreamArn,https://docs.aws.amazon.com/AWSEC2/latest/UserGuide/iam-policies-for-amazon-ec2.html#amazon-ec2-keys,Filters access by the ARN of the CloudWatch Logs log stream,ARN
424,ec2:CommitmentDuration,https://docs.aws.amazon.com/AWSEC2/latest/UserGuide/iam-policies-for-amazon-ec2.html#amazon-ec2-keys,Filters access by commitment duration of the Capacity Reservation,Numeric
425,ec2:CpuOptionsAmdSevSnp,https://docs.aws.amazon.com/AWSEC2/latest/UserGuide/sev-snp.html,"Filters access by the state of AMD SEV-SNP CPU Options. Currently, only US East (Ohio) and Europe (Ireland) are supported",String
426,ec2:CreateAction,https://docs.aws.amazon.com/AWSEC2/latest/UserGuide/supported-iam-actions-tagging.html,Filters access by the name of a resource-creating API action,String
427,ec2:CreateDate,https://docs.aws.amazon.com/AWSEC2/latest/UserGuide/iam-policies-for-amazon-ec2.html#amazon-ec2-keys,Filters access by the date and time at which the Capacity Reservation was created,Date
428,ec2:DPDTimeoutSeconds,https://docs.aws.amazon.com/vpn/latest/s2svpn/vpn-authentication-access-control.html,Filters access by the duration after which DPD timeout occurs on a VPN tunnel,Numeric
429,ec2:DestinationCapacityReservationId,https://docs.aws.amazon.com/AWSEC2/latest/UserGuide/iam-policies-for-amazon-ec2.html#amazon-ec2-keys,Filters access by the ID of the Capacity Reservation that you want to move capacity into,ARN
430,ec2:DhcpOptionsID,iam-policies-for-amazon-ec2.html#imageId-key,Filters access by the ID of a dynamic host configuration protocol (DHCP) options set,String
431,ec2:DirectoryArn,https://docs.aws.amazon.com/AWSEC2/latest/UserGuide/iam-policies-for-amazon-ec2.html#amazon-ec2-keys,Filters access by the ARN of the directory,ARN
432,ec2:Domain,https://docs.aws.amazon.com/AWSEC2/latest/UserGuide/iam-policies-for-amazon-ec2.html#amazon-ec2-keys,Filters access by the domain of the Elastic IP address,String
433,ec2:EbsOptimized,https://docs.aws.amazon.com/AWSEC2/latest/UserGuide/iam-policies-for-amazon-ec2.html#amazon-ec2-keys,Filters access by whether the instance is enabled for EBS optimization,Bool
434,ec2:ElasticGpuType,https://docs.aws.amazon.com/AWSEC2/latest/UserGuide/iam-policies-for-amazon-ec2.html#amazon-ec2-keys,Filters access by the type of Elastic Graphics accelerator,String
435,ec2:Encrypted,https://docs.aws.amazon.com/AWSEC2/latest/UserGuide/iam-policies-for-amazon-ec2.html#amazon-ec2-keys,Filters access by whether the EBS volume is encrypted,Bool
436,ec2:EndDate,https://docs.aws.amazon.com/AWSEC2/latest/UserGuide/iam-policies-for-amazon-ec2.html#amazon-ec2-keys,Filters access by the date and time at which the Capacity Reservation ends,Date
437,ec2:EndDateType,https://docs.aws.amazon.com/AWSEC2/latest/UserGuide/iam-policies-for-amazon-ec2.html#amazon-ec2-keys,Filters access by the way in which the Capacity Reservation ends,String
438,ec2:EphemeralStorage,https://docs.aws.amazon.com/AWSEC2/latest/UserGuide/iam-policies-for-amazon-ec2.html#amazon-ec2-keys,Filters access by whether the instance is enabled for ephemeral storage,Bool
439,ec2:FisActionId,https://docs.aws.amazon.com/fis/latest/userguide/fis-actions-reference.html,Filters access by the ID of an AWS FIS action,String
440,ec2:FisTargetArns,https://docs.aws.amazon.com/fis/latest/userguide/fis-actions-reference.html,Filters access by the ARN of an AWS FIS target,ArrayOfARN
441,ec2:GatewayType,https://docs.aws.amazon.com/vpn/latest/s2svpn/vpn-authentication-access-control.html,Filters access by the gateway type for a VPN endpoint on the AWS side of a VPN connection,String
442,ec2:HostRecovery,https://docs.aws.amazon.com/AWSEC2/latest/UserGuide/iam-policies-for-amazon-ec2.html#amazon-ec2-keys,Filters access by whether host recovery is enabled for a Dedicated Host,String
443,ec2:IKEVersions,https://docs.aws.amazon.com/vpn/latest/s2svpn/vpn-authentication-access-control.html,Filters access by the internet key exchange (IKE) versions that are permitted for a VPN tunnel,ArrayOfString
444,ec2:ImageID,iam-policies-for-amazon-ec2.html#imageId-key,Filters access by the ID of an image,String
445,ec2:ImageType,https://docs.aws.amazon.com/AWSEC2/latest/UserGuide/iam-policies-for-amazon-ec2.html#amazon-ec2-keys,"Filters access by the type of image (machine, aki, or ari)",String
446,ec2:InsideTunnelCidr,https://docs.aws.amazon.com/vpn/latest/s2svpn/vpn-authentication-access-control.html,Filters access by the range of inside IP addresses for a VPN tunnel,String
447,ec2:InsideTunnelIpv6Cidr,https://docs.aws.amazon.com/vpn/latest/s2svpn/vpn-authentication-access-control.html,Filters access by a range of inside IPv6 addresses for a VPN tunnel,String
448,ec2:InstanceAutoRecovery,https://docs.aws.amazon.com/AWSEC2/latest/UserGuide/iam-policies-for-amazon-ec2.html#amazon-ec2-keys,Filters access by whether the instance type supports auto recovery,String
449,ec2:InstanceBandwidthWeighting,iam-policies-for-amazon-ec2.html#imageId-key,Filters access by the bandwidth weighting of an instance,String
450,ec2:InstanceCount,https://docs.aws.amazon.com/AWSEC2/latest/UserGuide/iam-policies-for-amazon-ec2.html#amazon-ec2-keys,Filters access by the number of instances,Numeric
451,kms:CallerAccount,https://docs.aws.amazon.com/kms/latest/developerguide/conditions-kms.html#conditions-kms-caller-account,Filters access to specified AWS KMS operations based on the AWS account ID of the caller. You can use this condition key to allow or deny access to all IAM users and roles in an AWS account in a single policy statement,String
452,ec2:InstanceID,iam-policies-for-amazon-ec2.html#imageId-key,Filters access by the ID of an instance,String
453,kms:CustomerMasterKeySpec,https://docs.aws.amazon.com/kms/latest/developerguide/conditions-kms.html#conditions-kms-key-spec-replaced,"The kms:CustomerMasterKeySpec condition key is deprecated. Instead, use the kms:KeySpec condition key",String
454,kms:CustomerMasterKeyUsage,https://docs.aws.amazon.com/kms/latest/developerguide/conditions-kms.html#conditions-kms-key-usage-replaced,"The kms:CustomerMasterKeyUsage condition key is deprecated. Instead, use the kms:KeyUsage condition key",String
455,kms:DataKeyPairSpec,https://docs.aws.amazon.com/kms/latest/developerguide/conditions-kms.html#conditions-kms-data-key-pair-spec,Filters access to GenerateDataKeyPair and GenerateDataKeyPairWithoutPlaintext operations based on the value of the KeyPairSpec parameter in the request,String
456,kms:EncryptionAlgorithm,https://docs.aws.amazon.com/kms/latest/developerguide/conditions-kms.html#conditions-kms-encryption-algorithm,Filters access to encryption operations based on the value of the encryption algorithm in the request,String
457,kms:EncryptionContext:${EncryptionContextKey},https://docs.aws.amazon.com/kms/latest/developerguide/conditions-kms.html#conditions-kms-encryption-context,Filters access to a symmetric AWS KMS key based on the encryption context in a cryptographic operation. This condition evaluates the key and value in each key-value encryption context pair,String
458,kms:EncryptionContextKeys,https://docs.aws.amazon.com/kms/latest/developerguide/conditions-kms.html#conditions-kms-encryption-context-keys,Filters access to a symmetric AWS KMS key based on the encryption context in a cryptographic operation. This condition key evaluates only the key in each key-value encryption context pair,ArrayOfString
459,kms:ExpirationModel,https://docs.aws.amazon.com/kms/latest/developerguide/conditions-kms.html#conditions-kms-expiration-model,Filters access to the ImportKeyMaterial operation based on the value of the ExpirationModel parameter in the request,String
460,kms:GrantConstraintType,https://docs.aws.amazon.com/kms/latest/developerguide/conditions-kms.html#conditions-kms-grant-constraint-type,Filters access to the CreateGrant operation based on the grant constraint in the request,String
461,kms:GrantIsForAWSResource,https://docs.aws.amazon.com/kms/latest/developerguide/conditions-kms.html#conditions-kms-grant-is-for-aws-resource,Filters access to the CreateGrant operation when the request comes from a specified AWS service,Bool
462,kms:GrantOperations,https://docs.aws.amazon.com/kms/latest/developerguide/conditions-kms.html#conditions-kms-grant-operations,Filters access to the CreateGrant operation based on the operations in the grant,ArrayOfString
463,kms:GranteePrincipal,https://docs.aws.amazon.com/kms/latest/developerguide/conditions-kms.html#conditions-kms-grantee-principal,Filters access to the CreateGrant operation based on the grantee principal in the grant,String
464,kms:KeyAgreementAlgorithm,https://docs.aws.amazon.com/kms/latest/developerguide/conditions-kms.html#conditions-kms-key-agreement-algorithm,Filters access to the DeriveSharedSecret operation based on the value of the KeyAgreementAlgorithm parameter in the request,String
465,secretsmanager:RotateImmediately,https://docs.aws.amazon.com/IAM/latest/UserGuide/reference_policies_condition-keys.html,Filters access by whether the secret is to be rotated immediately,Bool
466,ec2:InstanceMarketType,https://docs.aws.amazon.com/AWSEC2/latest/UserGuide/iam-policies-for-amazon-ec2.html#amazon-ec2-keys,"Filters access by the market or purchasing option of an instance (capacity-block, on-demand, or spot)",String
467,ec2:InstanceMatchCriteria,https://docs.aws.amazon.com/AWSEC2/latest/UserGuide/iam-policies-for-amazon-ec2.html#amazon-ec2-keys,Filters access by the type of instance launches that the Capacity Reservation accepts,String
468,ec2:InstanceMetadataTags,https://docs.aws.amazon.com/AWSEC2/latest/UserGuide/iam-policies-for-amazon-ec2.html#amazon-ec2-keys,Filters access by whether the instance allows access to instance tags from the instance metadata,String
469,ec2:InstancePlatform,https://docs.aws.amazon.com/AWSEC2/latest/UserGuide/iam-policies-for-amazon-ec2.html#amazon-ec2-keys,Filters access by the type of operating system for which the Capacity Reservation reserves capacity,ARN
470,ec2:InstanceProfile,https://docs.aws.amazon.com/AWSEC2/latest/UserGuide/iam-policies-for-amazon-ec2.html#amazon-ec2-keys,Filters access by the ARN of an instance profile,ARN
471,ec2:InstanceType,https://docs.aws.amazon.com/AWSEC2/latest/UserGuide/iam-policies-for-amazon-ec2.html#amazon-ec2-keys,Filters access by the type of instance,String
472,ec2:InternetGatewayID,iam-policies-for-amazon-ec2.html#imageId-key,Filters access by the ID of an internet gateway,String
473,ec2:InterruptibleCapacityReservationId,https://docs.aws.amazon.com/AWSEC2/latest/UserGuide/iam-policies-for-amazon-ec2.html#amazon-ec2-keys,Filters access by the ID of an interruptible Capacity Reservation,String
474,ec2:InterruptionType,https://docs.aws.amazon.com/AWSEC2/latest/UserGuide/iam-policies-for-amazon-ec2.html#amazon-ec2-keys,Filters access by the type of interruption,String
475,ec2:IpamPrefixListResolverTargetId,https://docs.aws.amazon.com/AWSEC2/latest/UserGuide/iam-policies-for-amazon-ec2.html#amazon-ec2-keys,Filters access by the IPAM prefix list resolver target ID that is syncing CIDRs to a managed prefix list,String
476,ec2:Ipv4IpamPoolId,iam-policies-for-amazon-ec2.html#amazon-ec2-keys,Filters access by the ID of an IPAM pool provided for IPv4 CIDR block allocation,String
477,ec2:Ipv6IpamPoolId,iam-policies-for-amazon-ec2.html#amazon-ec2-keys,Filters access by the ID of an IPAM pool provided for IPv6 CIDR block allocation,String
478,ec2:IsInterruptible,https://docs.aws.amazon.com/AWSEC2/latest/UserGuide/iam-policies-for-amazon-ec2.html#amazon-ec2-keys,Filters access by whether Capacity Reservations are interruptible,Bool
479,ec2:IsLaunchTemplateResource,https://docs.aws.amazon.com/AWSEC2/latest/UserGuide/iam-policies-for-amazon-ec2.html#amazon-ec2-keys,Filters access by whether users are able to override resources that are specified in the launch template,Bool
480,secretsmanager:RotationLambdaARN,https://docs.aws.amazon.com/IAM/latest/UserGuide/reference_policies_condition-keys.html,Filters access by the ARN of the rotation Lambda function in the request,ARN
481,ec2:KeyPairName,https://docs.aws.amazon.com/AWSEC2/latest/UserGuide/iam-policies-for-amazon-ec2.html#amazon-ec2-keys,Filters access by the name of a key pair,String
482,ec2:KeyPairType,https://docs.aws.amazon.com/AWSEC2/latest/UserGuide/iam-policies-for-amazon-ec2.html#amazon-ec2-keys,Filters access by the type of a key pair,String
483,ec2:KmsKeyId,https://docs.aws.amazon.com/AWSEC2/latest/UserGuide/iam-policies-for-amazon-ec2.html#amazon-ec2-keys,Filters access by the ID of an AWS KMS key provided in the request,String
484,ec2:LaunchTemplate,https://docs.aws.amazon.com/AWSEC2/latest/UserGuide/iam-policies-for-amazon-ec2.html#amazon-ec2-keys,Filters access by the ARN of a launch template,ARN
485,ec2:Location,https://docs.aws.amazon.com/AWSEC2/latest/UserGuide/iam-policies-for-amazon-ec2.html#amazon-ec2-keys,Filters access by the destination for the snapshot copy,String
