condition_key_id,name,reference_url,description,type
447,kms:WrappingAlgorithm,https://docs.aws.amazon.com/kms/latest/developerguide/conditions-kms.html#conditions-kms-wrapping-algorithm,Filters access to the GetParametersForImport operation based on the value of the WrappingAlgorithm parameter in the request,String
448,kms:WrappingKeySpec,https://docs.aws.amazon.com/kms/latest/developerguide/conditions-kms.html#conditions-kms-wrapping-key-spec,Filters access to the GetParametersForImport operation based on the value of the WrappingKeySpec parameter in the request,String
449,lakeformation:EnabledOnlyForMetaDataAccess,https://docs.aws.amazon.com/service-authorization/latest/reference/list_awslakeformation.html#awslakeformation-policy-keys,Filters access by the presence of the key configured for role's identity-based policy,Bool
450,lambda:CodeSigningConfigArn,https://docs.aws.amazon.com/lambda/latest/dg/lambda-api-permissions-ref.html,Filters access by the ARN of an AWS Lambda code signing config,ARN
451,lambda:EventSourceToken,https://docs.aws.amazon.com/lambda/latest/dg/lambda-api-permissions-ref.html,Filters access by the ID from a non-AWS event source configured for the AWS Lambda function,String
452,lambda:FunctionArn,https://docs.aws.amazon.com/lambda/latest/dg/lambda-api-permissions-ref.html,Filters access by the ARN of an AWS Lambda function,ARN
453,lambda:FunctionUrlAuthType,https://docs.aws.amazon.com/lambda/latest/dg/lambda-api-permissions-ref.html,"Filters access by authorization type specified in request. Available during CreateFunctionUrlConfig, UpdateFunctionUrlConfig, DeleteFunctionUrlConfig, GetFunctionUrlConfig, ListFunctionUrlConfig, AddPermission and RemovePermission operations",String
454,lambda:Layer,https://docs.aws.amazon.com/lambda/latest/dg/lambda-api-permissions-ref.html,Filters access by the ARN of a version of an AWS Lambda layer,ArrayOfString
455,lambda:Principal,https://docs.aws.amazon.com/lambda/latest/dg/lambda-api-permissions-ref.html,Filters access by restricting the AWS service or account that can invoke a function,String
456,lambda:SecurityGroupIds,https://docs.aws.amazon.com/lambda/latest/dg/lambda-api-permissions-ref.html,Filters access by the ID of security groups configured for the AWS Lambda function,ArrayOfString
457,lambda:SourceFunctionArn,https://docs.aws.amazon.com/lambda/latest/dg/lambda-api-permissions-ref.html,Filters access by the ARN of the AWS Lambda function from which the request originated,ARN
458,lambda:SubnetIds,https://docs.aws.amazon.com/lambda/latest/dg/lambda-api-permissions-ref.html,Filters access by the ID of subnets configured for the AWS Lambda function,ArrayOfString
459,lambda:VpcIds,https://docs.aws.amazon.com/lambda/latest/dg/lambda-api-permissions-ref.html,Filters access by the ID of the VPC configured for the AWS Lambda function,String
460,lex:associatedIntents,https://docs.aws.amazon.com/lex/latest/dg/security_iam_service-with-iam.html,Enables you to control access based on the intents included in the request,ArrayOfString
461,lex:associatedSlotTypes,https://docs.aws.amazon.com/lex/latest/dg/security_iam_service-with-iam.html,Enables you to control access based on the slot types included in the request,ArrayOfString
462,lex:channelType,https://docs.aws.amazon.com/lex/latest/dg/security_iam_service-with-iam.html,Enables you to control access based on the channel type included in the request,String
463,license-manager:ResourceTag/${TagKey},https://docs.aws.amazon.com/license-manager/latest/userguide/identity-access-management.html,Filters access by the tag key-value pairs attached to the resource,String
464,logs:DeliveryDestinationResourceArn,https://docs.aws.amazon.com/AmazonCloudWatch/latest/logs/iam-identity-based-access-control-cwl.html,Filters access by the Log Destination ARN passed in the request,ARN
465,logs:LogGeneratingResourceArns,https://docs.aws.amazon.com/AmazonCloudWatch/latest/logs/iam-identity-based-access-control-cwl.html,Filters access by the Log Generating Resource ARNs passed in the request,ArrayOfARN
466,lookoutequipment:IsImportingData,https://docs.aws.amazon.com/IAM/latest/UserGuide/reference_policies_condition-keys.html#condition-keys-isimportingdata,Filters access by the import strategy of underlying data,Bool
467,mediaconvert:HttpInputsAllowed,https://docs.aws.amazon.com/mediaconvert/latest/apireference/input-policies.html,Filters access by an HTTP input policy present in the account,Bool
468,mediaconvert:HttpsInputsAllowed,https://docs.aws.amazon.com/mediaconvert/latest/apireference/input-policies.html,Filters access by an HTTPS input policy present in the account,Bool
469,mediaconvert:S3InputsAllowed,https://docs.aws.amazon.com/mediaconvert/latest/apireference/input-policies.html,Filters access by an S3 input policy present in the account,Bool
470,memorydb:TLSEnabled,https://docs.aws.amazon.com/memorydb/latest/devguide/IAM.ConditionKeys.html#IAM.SpecifyingConditions,Filters access by the TLSEnabled parameter present in the request or defaults to true value if parameter is not present,Bool
471,memorydb:UserAuthenticationMode,https://docs.aws.amazon.com/memorydb/latest/devguide/IAM.ConditionKeys.html#IAM.SpecifyingConditions,Filters access by the UserAuthenticationMode.Type parameter in the request,String
472,mgh:AutomationRunResourceRunID,https://docs.aws.amazon.com/migrationhub/latest/ug/ContextKeys_AutomationRunResourceRunID.html,AutomationRunResource resource runID identifier,String
473,mgh:AutomationUnitResourceAutomationUnitArn,https://docs.aws.amazon.com/migrationhub/latest/ug/ContextKeys_AutomationUnitResourceAutomationUnitArn.html,AutomationUnitResource resource automationUnitArn identifier,ARN
474,mgh:ConnectionResourceConnectionArn,https://docs.aws.amazon.com/migrationhub/latest/ug/security_iam_service-with-iam-id-based-policies-conditionkeys.html#condition-connectionresourceconnectionarn,ConnectionResource resource connectionArn identifier,String
475,mgn:CreateAction,https://docs.aws.amazon.com/mgn/latest/ug/supported-iam-actions-tagging.html,Filters access by the name of a resource-creating API action,String
476,mpa:ProtectedResourceAccount,https://docs.aws.amazon.com/mpa/latest/userguide/mpa-concepts.html,Filters access by the account that owns the resource that is the target of the operation that requires approval,String
477,mpa:RequestedOperation,https://docs.aws.amazon.com/mpa/latest/userguide/mpa-concepts.html,Filters access by a requested operation that requires team approval before it can be executed,String
478,neptune-db:QueryLanguage,https://docs.aws.amazon.com/neptune/latest/userguide/iam-data-condition-keys.html#iam-neptune-condition-keys,Filters access by graph model,String
479,neptune-graph:PublicConnectivity,https://docs.aws.amazon.com/neptune-analytics/latest/userguide/iam-condition-keys.html#publicconnectivity,"Filters access by the value of the public connectivity parameter provided in the request or its default value, if unspecified. All access to graphs is IAM authenticated",Bool
480,networkmanager:cgwArn,https://docs.aws.amazon.com/vpc/latest/tgw/nm-security-iam.html,Filters access by which customer gateways can be associated or disassociated,ARN
481,networkmanager:directConnectGatewayArn,https://docs.aws.amazon.com/vpc/latest/tgw/nm-security-iam.html,Filters access by which Direct Connect gateway can be used to a create/update attachment,ARN
482,networkmanager:edgeLocations,https://docs.aws.amazon.com/vpc/latest/tgw/nm-security-iam.html,Filters access by which edge locations can be added or removed from a Direct Connect gateway attachment,ArrayOfString
483,networkmanager:subnetArns,https://docs.aws.amazon.com/vpc/latest/tgw/nm-security-iam.html,Filters access by which VPC subnets can be added or removed from a VPC attachment,ArrayOfARN
484,networkmanager:tgwArn,https://docs.aws.amazon.com/vpc/latest/tgw/nm-security-iam.html,"Filters access by which transit gateways can be registered, deregistered, or peered",ARN
485,networkmanager:tgwConnectPeerArn,https://docs.aws.amazon.com/vpc/latest/tgw/nm-security-iam.html,Filters access by which transit gateway connect peers can be associated or disassociated,ARN
486,networkmanager:tgwRtbArn,https://docs.aws.amazon.com/vpc/latest/tgw/nm-security-iam.html,Filters access by which Transit Gateway Route Table can be used to create an attachment,ARN
487,networkmanager:vpcArn,https://docs.aws.amazon.com/vpc/latest/tgw/nm-security-iam.html,Filters access by which VPC can be used to a create/update attachment,ARN
488,networkmanager:vpnConnectionArn,https://docs.aws.amazon.com/vpc/latest/tgw/nm-security-iam.html,Filters access by which Site-to-Site VPN can be used to a create/update attachment,ARN
489,nimble:createdBy,https://docs.aws.amazon.com/nimble-studio/latest/userguide/security-iam-service-with-iam.html,Filters access by the createdBy request parameter or the ID of the creator of the resource,String
490,nimble:ownedBy,https://docs.aws.amazon.com/nimble-studio/latest/userguide/security-iam-service-with-iam.html,Filters access by the ownedBy request parameter or the ID of the owner of the resource,String
491,nimble:principalId,https://docs.aws.amazon.com/nimble-studio/latest/userguide/security-iam-service-with-iam.html,Filters access by the principalId request parameter,String
492,nimble:requesterPrincipalId,https://docs.aws.amazon.com/nimble-studio/latest/userguide/security-iam-service-with-iam.html,Filters access by the ID of the logged in user,String
493,nimble:studioId,https://docs.aws.amazon.com/nimble-studio/latest/userguide/security-iam-service-with-iam.html,Filters access by a specific studio,ARN
494,oam:ResourceTypes,https://docs.aws.amazon.com/IAM/latest/UserGuide/list_amazoncloudwatchobservabilityaccessmanager.html,Filters access by the presence of resource types in the request,ArrayOfString
495,organizations:PolicyType,https://docs.aws.amazon.com/organizations/latest/userguide/orgs_permissions_overview.html#orgs_permissions_conditionkeys,Filters access by the specified policy type names,String
496,organizations:ServicePrincipal,https://docs.aws.amazon.com/organizations/latest/userguide/orgs_permissions_overview.html#orgs_permissions_conditionkeys,Filters access by the specified service principal names,String
497,partnercentral:Catalog,https://docs.aws.amazon.com/partner-central/latest/APIReference/access-control.html#managing-permissions-with-condition-keyspage.html#Catalog,"Filters access by a specific Catalog. Accepted values: [AWS, Sandbox]",String
498,partnercentral:RelatedEntityType,https://docs.aws.amazon.com/partner-central/latest/APIReference/access-control.html#managing-permissions-with-condition-keyspage.html#RelatedEntityType,"Filters access by entity types for Opportunity association. Accepted values: [Solutions, AwsProducts, AwsMarketplaceOffers]",String
499,payment-cryptography:CertificateAuthorityPublicKeyIdentifier,{ActionsDocRoot}security-iam.html,"Filters access by the CertificateAuthorityPublicKeyIdentifier specified in the request or the ImportKey, and ExportKey operations",String
500,payment-cryptography:ImportKeyMaterial,{ActionsDocRoot}security-iam.html,"Filters access by the type of key material being imported [RootCertificatePublicKey, TrustedCertificatePublicKey, Tr34KeyBlock, Tr31KeyBlock] for the ImportKey operation",String
501,payment-cryptography:KeyAlgorithm,{ActionsDocRoot}security-iam.html,Filters access by KeyAlgorithm specified in the request for the CreateKey operation,String
502,payment-cryptography:KeyClass,{ActionsDocRoot}security-iam.html,Filters access by KeyClass specified in the request for the CreateKey operation,String
503,payment-cryptography:KeyUsage,{ActionsDocRoot}security-iam.html,Filters access by KeyClass specified in the request or associated with a key for the CreateKey operation,String
504,payment-cryptography:RequestAlias,{ActionsDocRoot}security-iam.html,Filters access by aliases in the request for the specified operation,String
505,payment-cryptography:ResourceAliases,{ActionsDocRoot}security-iam.html,Filters access by aliases associated with a key for the specified operation,ArrayOfString
506,payment-cryptography:WrappingKeyIdentifier,{ActionsDocRoot}security-iam.html,"Filters access by the WrappingKeyIdentifier specified in the request for the ImportKey, and ExportKey operations",String
507,pi:Dimensions,#condition-keys-dimensions,Filters access by the requested dimensions,ArrayOfString
508,proton:EnvironmentTemplate,https://docs.aws.amazon.com/IAM/latest/UserGuide/reference_policies_condition-keys.html,Filters access by specified environment template related to resource,String
509,proton:ServiceTemplate,https://docs.aws.amazon.com/IAM/latest/UserGuide/reference_policies_condition-keys.html,Filters access by specified service template related to resource,String
510,qapps:AppIsPublished,https://docs.aws.amazon.com/amazonq/latest/qbusiness-ug/security-iam.html,Filters access by whether Q App is published,String
511,qapps:SessionIsShared,https://docs.aws.amazon.com/amazonq/latest/qbusiness-ug/security-iam.html,Filters access by whether Q App Session is shared,String
512,qapps:UserIsAppOwner,https://docs.aws.amazon.com/amazonq/latest/qbusiness-ug/security-iam.html,Filters access by whether requester is Q App owner,String
513,qapps:UserIsSessionModerator,https://docs.aws.amazon.com/amazonq/latest/qbusiness-ug/security-iam.html,Filters access by whether requester is Q App Session moderator,String
514,qldb:Purge,https://docs.aws.amazon.com/IAM/latest/UserGuide/reference_policies_condition-keys.html#condition-keys-purge,Filters access by the value of purge that is specified in a PartiQL DROP statement,String
515,quicksight:AllowedEmbeddingDomains,https://docs.aws.amazon.com/quicksight/latest/user/embedded-dashboards-for-authenticated-users-step-1.html,Filters access by the allowed embedding domains,ArrayOfString
516,quicksight:DirectoryType,https://docs.aws.amazon.com/quicksight/latest/user/security-scp.html,Filters access by the user management options,String
517,quicksight:Edition,https://docs.aws.amazon.com/quicksight/latest/user/security-scp.html,Filters access by the edition of QuickSight,String
518,quicksight:Group,https://docs.aws.amazon.com/quicksight/latest/user/iam-actions.html,Filters access by QuickSight group ARN,ARN
519,quicksight:IamArn,https://docs.aws.amazon.com/quicksight/latest/user/iam-actions.html,Filters access by IAM user or role ARN,ARN
520,quicksight:KmsKeyArns,https://docs.aws.amazon.com/quicksight/latest/user/key-management.html,Filters access by KMS key ARNs,ArrayOfARN
521,quicksight:SessionName,https://docs.aws.amazon.com/quicksight/latest/user/iam-actions.html,Filters access by session name,String
522,quicksight:UserName,https://docs.aws.amazon.com/quicksight/latest/user/iam-actions.html,Filters access by user name,String
523,ram:AllowsExternalPrincipals,https://docs.aws.amazon.com/ram/latest/userguide/iam-policies.html#iam-policies-condition,"Filters access by resource shares that allow or deny sharing with external principals. For example, specify true if the action can only be performed on resource shares that allow sharing with external principals. External principals are AWS accounts that are outside of its AWS organization",Bool
524,ram:PermissionArn,https://docs.aws.amazon.com/ram/latest/userguide/iam-policies.html#iam-policies-condition,Filters access by the specified Permission ARN,ARN
525,ram:PermissionResourceType,https://docs.aws.amazon.com/ram/latest/userguide/iam-policies.html#iam-policies-condition,Filters access by permissions of specified resource type,String
526,ram:Principal,https://docs.aws.amazon.com/ram/latest/userguide/iam-policies.html#iam-policies-condition,Filters access by format of the specified principal,String
527,ram:RequestedAllowsExternalPrincipals,https://docs.aws.amazon.com/ram/latest/userguide/iam-policies.html#iam-policies-condition,Filters access by the specified value for 'allowExternalPrincipals'. External principals are AWS accounts that are outside of its AWS Organization,Bool
528,ram:RequestedResourceType,https://docs.aws.amazon.com/ram/latest/userguide/iam-policies.html#iam-policies-condition,Filters access by the specified resource type,String
529,ram:ResourceArn,https://docs.aws.amazon.com/ram/latest/userguide/iam-policies.html#iam-policies-condition,Filters access by  the specified ARN,ARN
530,ram:ResourceShareName,https://docs.aws.amazon.com/ram/latest/userguide/iam-policies.html#iam-policies-condition,Filters access by a resource share with the specified name,String
531,ram:ResourceTag/${TagKey},https://docs.aws.amazon.com/IAM/latest/UserGuide/reference_policies_condition-keys.html#condition-keys-resourcetag,Filters access by the tags associated with the resource,String
532,ram:ShareOwnerAccountId,https://docs.aws.amazon.com/ram/latest/userguide/iam-policies.html#iam-policies-condition,"Filters access by resource shares owned by a specific account. For example, you can use this condition key to specify which resource share invitations can be accepted or rejected based on the resource share owner's account ID",String
533,rbin:Attribute/ResourceType,https://docs.aws.amazon.com/AWSEC2/latest/UserGuide/recycle-bin-perms.html#rbin-condition-keys,Filters access by the resource type of the existing rule,String
534,rbin:Request/ResourceType,https://docs.aws.amazon.com/AWSEC2/latest/UserGuide/recycle-bin-perms.html#rbin-condition-keys,Filters access by the resource type in a request,String
535,rds:BackupTarget,https://docs.aws.amazon.com/AmazonRDS/latest/UserGuide/security_iam_service-with-iam.html#UsingWithRDS.IAM.Conditions,"Filters access by the type of backup target. One of: region, outposts",String
536,rds:CopyOptionGroup,https://docs.aws.amazon.com/AmazonRDS/latest/UserGuide/security_iam_service-with-iam.html#UsingWithRDS.IAM.Conditions,Filters access by the value that specifies whether the CopyDBSnapshot action requires copying the DB option group,Bool
537,rds:DatabaseClass,https://docs.aws.amazon.com/AmazonRDS/latest/UserGuide/security_iam_service-with-iam.html#UsingWithRDS.IAM.Conditions,Filters access by the type of DB instance class,String
538,rds:DatabaseEngine,https://docs.aws.amazon.com/AmazonRDS/latest/UserGuide/security_iam_service-with-iam.html#UsingWithRDS.IAM.Conditions,Filters access by the database engine. For possible values refer to the engine parameter in CreateDBInstance API,String
539,rds:DatabaseName,https://docs.aws.amazon.com/AmazonRDS/latest/UserGuide/security_iam_service-with-iam.html#UsingWithRDS.IAM.Conditions,Filters access by the user-defined name of the database on the DB instance,String
540,rds:EndpointType,https://docs.aws.amazon.com/AmazonRDS/latest/UserGuide/security_iam_service-with-iam.html#UsingWithRDS.IAM.Conditions,"Filters access by the type of the endpoint. One of: READER, WRITER, CUSTOM",String
541,rds:ManageMasterUserPassword,https://docs.aws.amazon.com/AmazonRDS/latest/UserGuide/security_iam_service-with-iam.html#UsingWithRDS.IAM.Conditions,Filters access by the value that specifies whether RDS manages master user password in AWS Secrets Manager for the DB instance or cluster,Bool
542,rds:MultiAz,https://docs.aws.amazon.com/AmazonRDS/latest/UserGuide/security_iam_service-with-iam.html#UsingWithRDS.IAM.Conditions,"Filters access by the value that specifies whether the DB instance runs in multiple Availability Zones. To indicate that the DB instance is using Multi-AZ, specify true",Bool
543,rds:Piops,https://docs.aws.amazon.com/AmazonRDS/latest/UserGuide/security_iam_service-with-iam.html#UsingWithRDS.IAM.Conditions,"Filters access by the value that contains the number of Provisioned IOPS (PIOPS) that the instance supports. To indicate a DB instance that does not have PIOPS enabled, specify 0",Numeric
544,rds:StorageEncrypted,https://docs.aws.amazon.com/AmazonRDS/latest/UserGuide/security_iam_service-with-iam.html#UsingWithRDS.IAM.Conditions,"Filters access by the value that specifies whether the DB instance storage should be encrypted. To enforce storage encryption, specify true",Bool
545,rds:StorageSize,https://docs.aws.amazon.com/AmazonRDS/latest/UserGuide/security_iam_service-with-iam.html#UsingWithRDS.IAM.Conditions,Filters access by the storage volume size (in GB),Numeric
546,rds:TenantDatabaseName,https://docs.aws.amazon.com/AmazonRDS/latest/UserGuide/security_iam_service-with-iam.html#UsingWithRDS.IAM.Conditions,Filters access by the tenant database name in CreateTenantDatabase and by the new tenant database name in ModifyTenantDatabase,String
547,rds:Vpc,https://docs.aws.amazon.com/AmazonRDS/latest/UserGuide/security_iam_service-with-iam.html#UsingWithRDS.IAM.Conditions,"Filters access by the value that specifies whether the DB instance runs in an Amazon Virtual Private Cloud (Amazon VPC). To indicate that the DB instance runs in an Amazon VPC, specify true",Bool
548,s3:ExistingObjectTag/<key>,https://docs.aws.amazon.com/AmazonS3/latest/userguide/object-tagging.html#tagging-and-policies,Filters access by existing object tag key and value,String
549,s3:InventoryAccessibleOptionalFields,https://docs.aws.amazon.com/AmazonS3/latest/userguide/example-bucket-policies.html#example-bucket-policies-s3-inventory-2,Filters access by restricting which optional metadata fields a user can add when configuring S3 Inventory reports,ArrayOfString
550,s3:JobSuspendedCause,https://docs.aws.amazon.com/AmazonS3/latest/userguide/batch-ops-job-tags-examples.html,"Filters access by a specific job suspended cause (for example, AWAITING_CONFIRMATION) to cancelling suspended jobs",String
551,s3:ObjectCreationOperation,https://docs.aws.amazon.com/AmazonS3/latest/userguide/conditional-writes-enforce.html,Filters access by whether or not the operation creates an object,Bool
552,s3:RequestJobOperation,https://docs.aws.amazon.com/AmazonS3/latest/userguide/batch-ops-job-tags-examples.html,Filters access by operation to creating jobs,String
553,s3:RequestJobPriority,https://docs.aws.amazon.com/AmazonS3/latest/userguide/batch-ops-job-tags-examples.html,Filters access by priority range to creating new jobs,Numeric
554,s3:RequestObjectTag/<key>,https://docs.aws.amazon.com/AmazonS3/latest/userguide/object-tagging.html#tagging-and-policies,Filters access by the tag keys and values to be added to objects,String
555,s3:RequestObjectTagKeys,https://docs.aws.amazon.com/AmazonS3/latest/userguide/object-tagging.html#tagging-and-policies,Filters access by the tag keys to be added to objects,ArrayOfString
556,s3:ResourceAccount,https://docs.aws.amazon.com/AmazonS3/latest/userguide/amazon-s3-policy-keys.html#example-object-resource-account,Filters access by the resource owner AWS account ID,String
557,s3:TlsVersion,https://docs.aws.amazon.com/AmazonS3/latest/userguide/amazon-s3-policy-keys.html#example-object-tls-version,Filters access by the TLS version used by the client,Numeric
558,s3:authType,https://docs.aws.amazon.com/AmazonS3/latest/API/bucket-policy-s3-sigv4-conditions.html,Filters access by authentication method,String
559,s3:delimiter,https://docs.aws.amazon.com/AmazonS3/latest/userguide/walkthrough1.html,Filters access by delimiter parameter,String
560,s3:destinationRegion,https://docs.aws.amazon.com/AmazonS3/latest/userguide/replication.html,Filters access by a specific replication destination region for targeted buckets of the AWS FIS action aws:s3:bucket-pause-replication,String
561,s3:if-match,https://docs.aws.amazon.com/AmazonS3/latest/userguide/conditional-writes-enforce.html,Filters access by the request's 'If-Match' conditional header,String
562,s3:if-none-match,https://docs.aws.amazon.com/AmazonS3/latest/userguide/conditional-writes-enforce.html,Filters access by the request's 'If-None-Match' conditional header,String
563,s3:isReplicationPauseRequest,https://docs.aws.amazon.com/fis/latest/userguide/security_iam_id-based-policy-examples.html#security-iam-policy-examples-s3,Filters access by request made via AWS FIS action aws:s3:bucket-pause-replication,Bool
564,s3:locationconstraint,https://docs.aws.amazon.com/AmazonS3/latest/userguide/amazon-s3-policy-keys.html#condition-key-bucket-ops-1,Filters access by a specific Region,String
565,s3:max-keys,https://docs.aws.amazon.com/AmazonS3/latest/userguide/amazon-s3-policy-keys.html#example-numeric-condition-operators,Filters access by maximum number of keys returned in a ListBucket request,Numeric
566,s3:object-lock-legal-hold,https://docs.aws.amazon.com/AmazonS3/latest/userguide/object-lock-overview.html#object-lock-legal-holds,Filters access by object legal hold status,String
567,s3:object-lock-mode,https://docs.aws.amazon.com/AmazonS3/latest/userguide/object-lock-overview.html#object-lock-retention-modes,Filters access by object retention mode (COMPLIANCE or GOVERNANCE),String
568,s3:object-lock-remaining-retention-days,https://docs.aws.amazon.com/AmazonS3/latest/userguide/object-lock-managing.html#object-lock-managing-retention-limits,Filters access by remaining object retention days,Numeric
569,s3:object-lock-retain-until-date,https://docs.aws.amazon.com/AmazonS3/latest/userguide/object-lock-overview.html#object-lock-retention-periods,Filters access by object retain-until date,Date
570,s3:prefix,https://docs.aws.amazon.com/AmazonS3/latest/userguide/amazon-s3-policy-keys.html#condition-key-bucket-ops-2,Filters access by key name prefix,String
571,s3:signatureAge,https://docs.aws.amazon.com/AmazonS3/latest/API/bucket-policy-s3-sigv4-conditions.html,Filters access by the age in milliseconds of the request signature,Numeric
572,s3:signatureversion,https://docs.aws.amazon.com/AmazonS3/latest/API/bucket-policy-s3-sigv4-conditions.html,Filters access by the version of AWS Signature used on the request,String
573,s3:versionid,https://docs.aws.amazon.com/AmazonS3/latest/userguide/amazon-s3-policy-keys.html#getobjectversion-limit-access-to-specific-version-3,Filters access by a specific object version,String
