condition_key_id,name,reference_url,description,type
465,saml:edupersonscopedaffiliation,https://docs.aws.amazon.com/IAM/latest/UserGuide/reference_policies_iam-condition-keys.html#ck_edupersonscopedaffiliation,Filters access by the eduPerson attribute,ArrayOfString
466,saml:edupersontargetedid,https://docs.aws.amazon.com/IAM/latest/UserGuide/reference_policies_iam-condition-keys.html#ck_edupersontargetedid,Filters access by the eduPerson attribute,ArrayOfString
467,apigateway:Request/AccessAssociationSource,https://docs.aws.amazon.com/apigateway/latest/developerguide/security_iam_service-with-iam.html,Filters access by access association source. Available during the CreateDomainNameAccessAssociation operation,String
468,apigateway:Request/AccessLoggingDestination,https://docs.aws.amazon.com/apigateway/latest/developerguide/security_iam_service-with-iam.html,Filters access by access log destination. Available during the CreateStage and UpdateStage operations,String
469,apigateway:Request/AccessLoggingFormat,https://docs.aws.amazon.com/apigateway/latest/developerguide/security_iam_service-with-iam.html,Filters access by access log format. Available during the CreateStage and UpdateStage operations,String
470,apigateway:Request/ApiKeyRequired,https://docs.aws.amazon.com/apigateway/latest/developerguide/security_iam_service-with-iam.html,Filters access by the requirement of API. Available during the CreateRoute and UpdateRoute operations. Also available as a collection during import and reimport,ArrayOfBool
471,apigateway:Request/ApiName,https://docs.aws.amazon.com/apigateway/latest/developerguide/security_iam_service-with-iam.html,Filters access by API name. Available during the CreateApi and UpdateApi operations,String
472,apigateway:Request/AuthorizerType,https://docs.aws.amazon.com/apigateway/latest/developerguide/security_iam_service-with-iam.html,"Filters access by type of authorizer in the request, for example REQUEST or JWT. Available during CreateAuthorizer and UpdateAuthorizer. Also available during import and reimport as an ArrayOfString",ArrayOfString
473,apigateway:Request/AuthorizerUri,https://docs.aws.amazon.com/apigateway/latest/developerguide/security_iam_service-with-iam.html,Filters access by URI of a Lambda authorizer function. Available during CreateAuthorizer and UpdateAuthorizer. Also available during import and reimport as an ArrayOfString,ArrayOfString
474,saml:givenName,https://docs.aws.amazon.com/IAM/latest/UserGuide/reference_policies_iam-condition-keys.html#ck_givenname,Filters access by the givenName attribute,String
475,apigateway:Request/CognitoUserPoolProviderArn,https://docs.aws.amazon.com/apigateway/latest/developerguide/security_iam_service-with-iam.html,Filters access by Cognito user pool provider ARN. Available during CreateAuthorizer and UpdateAuthorizer,ARN
476,saml:iss,https://docs.aws.amazon.com/IAM/latest/UserGuide/reference_policies_iam-condition-keys.html#ck_iss,"Filters access by on the issuer, which is represented by a URN",String
477,saml:mail,https://docs.aws.amazon.com/IAM/latest/UserGuide/reference_policies_iam-condition-keys.html#ck_mail,Filters access by the mail attribute,String
478,saml:name,https://docs.aws.amazon.com/IAM/latest/UserGuide/reference_policies_iam-condition-keys.html#ck_name,Filters access by the name attribute,String
479,saml:namequalifier,https://docs.aws.amazon.com/IAM/latest/UserGuide/reference_policies_iam-condition-keys.html#ck_namequalifier,"Filters access by the hash value of the issuer, account ID, and friendly name",String
480,saml:organizationStatus,https://docs.aws.amazon.com/IAM/latest/UserGuide/reference_policies_iam-condition-keys.html#ck_organizationstatus,Filters access by the organizationStatus attribute,String
481,saml:primaryGroupSID,https://docs.aws.amazon.com/IAM/latest/UserGuide/reference_policies_iam-condition-keys.html#ck_primarygroupsid,Filters access by the primaryGroupSID attribute,String
482,saml:sub,https://docs.aws.amazon.com/IAM/latest/UserGuide/reference_policies_iam-condition-keys.html#ck_sub,Filters access by the subject of the claim (the SAML user ID),String
483,apigateway:Request/DisableExecuteApiEndpoint,https://docs.aws.amazon.com/apigateway/latest/developerguide/security_iam_service-with-iam.html,Filters access by status of the default execute-api endpoint. Available during the CreateApi and UpdateApi operations,Bool
484,apigateway:Request/DomainNameArn,https://docs.aws.amazon.com/apigateway/latest/developerguide/security_iam_service-with-iam.html,Filters access by domain name ARN. Available during the CreateDomainNameAccessAssociation operation,ARN
485,apigateway:Request/EndpointType,https://docs.aws.amazon.com/apigateway/latest/developerguide/security_iam_service-with-iam.html,"Filters access by endpoint type. Available during the CreateDomainName, UpdateDomainName, CreateApi, and UpdateApi operations",ArrayOfString
486,apigateway:Request/MtlsTrustStoreUri,https://docs.aws.amazon.com/apigateway/latest/developerguide/security_iam_service-with-iam.html,Filters access by URI of the truststore used for mutual TLS authentication. Available during the CreateDomainName and UpdateDomainName operations,String
487,saml:sub_type,https://docs.aws.amazon.com/IAM/latest/UserGuide/reference_policies_iam-condition-keys.html#ck_subtype,"Filters access by the value persistent, transient, or the full Format URI",String
488,saml:surname,https://docs.aws.amazon.com/IAM/latest/UserGuide/reference_policies_iam-condition-keys.html#ck_surname,Filters access by the surname attribute,String
489,saml:uid,https://docs.aws.amazon.com/IAM/latest/UserGuide/reference_policies_iam-condition-keys.html#ck_uid,Filters access by the uid attribute,String
490,saml:x500UniqueIdentifier,https://docs.aws.amazon.com/IAM/latest/UserGuide/reference_policies_iam-condition-keys.html#ck_x500uniqueidentifier,Filters access by the uid attribute,String
491,secretsmanager:AddReplicaRegions,https://docs.aws.amazon.com/secretsmanager/latest/userguide/reference_iam-permissions.html#iam-contextkeys,Filters access by the list of Regions in which to replicate the secret,ArrayOfString
492,secretsmanager:BlockPublicPolicy,https://docs.aws.amazon.com/secretsmanager/latest/userguide/reference_iam-permissions.html#iam-contextkeys,Filters access by whether the resource policy blocks broad AWS account access,Bool
493,secretsmanager:Description,https://docs.aws.amazon.com/secretsmanager/latest/userguide/reference_iam-permissions.html#iam-contextkeys,Filters access by the description text in the request,String
494,secretsmanager:ForceDeleteWithoutRecovery,https://docs.aws.amazon.com/secretsmanager/latest/userguide/reference_iam-permissions.html#iam-contextkeys,Filters access by whether the secret is to be deleted immediately without any recovery window,Bool
495,secretsmanager:ForceOverwriteReplicaSecret,https://docs.aws.amazon.com/secretsmanager/latest/userguide/reference_iam-permissions.html#iam-contextkeys,Filters access by whether to overwrite a secret with the same name in the destination Region,Bool
496,secretsmanager:KmsKeyArn,https://docs.aws.amazon.com/secretsmanager/latest/userguide/reference_iam-permissions.html#iam-contextkeys,Filters access by the key ARN of the KMS key in the request,ARN
497,secretsmanager:KmsKeyId,https://docs.aws.amazon.com/secretsmanager/latest/userguide/reference_iam-permissions.html#iam-contextkeys,Filters access by the key identifier of the KMS key in the request. Deprecated: Use secretsmanager:KmsKeyArn,String
498,secretsmanager:ModifyRotationRules,https://docs.aws.amazon.com/secretsmanager/latest/userguide/reference_iam-permissions.html#iam-contextkeys,Filters access by whether the rotation rules of the secret are to be modified,Bool
499,secretsmanager:Name,https://docs.aws.amazon.com/secretsmanager/latest/userguide/reference_iam-permissions.html#iam-contextkeys,Filters access by the friendly name of the secret in the request,String
500,secretsmanager:RecoveryWindowInDays,https://docs.aws.amazon.com/secretsmanager/latest/userguide/reference_iam-permissions.html#iam-contextkeys,Filters access by the number of days that Secrets Manager waits before it can delete the secret,Numeric
501,secretsmanager:ResourceTag/tag-key,https://docs.aws.amazon.com/secretsmanager/latest/userguide/reference_iam-permissions.html#iam-contextkeys,Filters access by a tag key and value pair,String
502,secretsmanager:RotateImmediately,https://docs.aws.amazon.com/secretsmanager/latest/userguide/reference_iam-permissions.html#iam-contextkeys,Filters access by whether the secret is to be rotated immediately,Bool
503,secretsmanager:RotationLambdaARN,https://docs.aws.amazon.com/secretsmanager/latest/userguide/reference_iam-permissions.html#iam-contextkeys,Filters access by the ARN of the rotation Lambda function in the request,ARN
504,secretsmanager:SecretId,https://docs.aws.amazon.com/secretsmanager/latest/userguide/reference_iam-permissions.html#iam-contextkeys,Filters access by the SecretID value in the request,ARN
505,secretsmanager:SecretPrimaryRegion,https://docs.aws.amazon.com/secretsmanager/latest/userguide/reference_iam-permissions.html#iam-contextkeys,Filters access by primary region in which the secret is created,String
506,secretsmanager:VersionId,https://docs.aws.amazon.com/secretsmanager/latest/userguide/reference_iam-permissions.html#iam-contextkeys,Filters access by the unique identifier of the version of the secret in the request,String
507,secretsmanager:VersionStage,https://docs.aws.amazon.com/secretsmanager/latest/userguide/reference_iam-permissions.html#iam-contextkeys,Filters access by the list of version stages in the request,String
508,secretsmanager:resource/AllowRotationLambdaArn,https://docs.aws.amazon.com/secretsmanager/latest/userguide/reference_iam-permissions.html#iam-contextkeys,Filters access by the ARN of the rotation Lambda function associated with the secret,ARN
509,securityhub:ASFFSyntaxPath/${ASFFSyntaxPath},https://docs.aws.amazon.com/IAM/latest/UserGuide/reference_policies_condition-keys.html#condition-keys-asffsyntaxpath,Filters access by the specified fields and values in the request,String
510,securityhub:TargetAccount,https://docs.aws.amazon.com/securityhub/latest/userguide/securityhub-access.html#conditions,Filters access by the AwsAccountId field that is specified in the request,String
511,serverlessrepo:applicationType,https://docs.aws.amazon.com/IAM/latest/UserGuide/applications.html,Filters access by application type,String
512,servicecatalog:Resource,,,
513,servicecatalog:ResourceType,,,
514,servicecatalog:accountLevel,,,
515,apigateway:Request/MtlsTrustStoreVersion,https://docs.aws.amazon.com/apigateway/latest/developerguide/security_iam_service-with-iam.html,Filters access by version of the truststore used for mutual TLS authentication. Available during the CreateDomainName and UpdateDomainName operations,String
516,servicecatalog:roleLevel,,,
517,servicecatalog:userLevel,,,
518,servicediscovery:NamespaceArn,https://docs.aws.amazon.com/cloud-map/latest/dg/access-control-overview.html#specifying-conditions,Filters access by specifying the Amazon Resource Name (ARN) for the related namespace,ARN
519,servicediscovery:NamespaceName,https://docs.aws.amazon.com/cloud-map/latest/dg/access-control-overview.html#specifying-conditions,Filters access by specifying the name of the related namespace,String
520,servicediscovery:ServiceArn,https://docs.aws.amazon.com/cloud-map/latest/dg/access-control-overview.html#specifying-conditions,Filters access by specifying the Amazon Resource Name (ARN) for the related service,ARN
521,servicediscovery:ServiceName,https://docs.aws.amazon.com/cloud-map/latest/dg/access-control-overview.html#specifying-conditions,Filters access by specifying the name of the related service,String
522,servicequotas:service,https://docs.aws.amazon.com/servicequotas/latest/userguide/identity-access-management.html#condition-keys,Filters access by the specified AWS service,String
523,apigateway:Request/RouteAuthorizationType,https://docs.aws.amazon.com/apigateway/latest/developerguide/security_iam_service-with-iam.html,"Filters access by authorization type, for example NONE, AWS_IAM, CUSTOM, JWT, COGNITO_USER_POOLS. Available during the CreateMethod and PutMethod operations Also available as a collection during import",ArrayOfString
524,apigateway:Request/SecurityPolicy,https://docs.aws.amazon.com/apigateway/latest/developerguide/security_iam_service-with-iam.html,Filters access by TLS version. Available during the CreateDomain and UpdateDomain operations,ArrayOfString
525,apigateway:Request/StageName,https://docs.aws.amazon.com/apigateway/latest/developerguide/security_iam_service-with-iam.html,Filters access by stage name of the deployment that you attempt to create. Available during the CreateDeployment operation,String
526,apigateway:Resource/AccessLoggingDestination,https://docs.aws.amazon.com/apigateway/latest/developerguide/security_iam_service-with-iam.html,Filters access by access log destination of the current Stage resource. Available during the UpdateStage and DeleteStage operations,String
527,ses:AddonSubscriptionArn,https://docs.aws.amazon.com/IAM/latest/UserGuide/list_amazonsesmailmanager.html#amazonsesmailmanager-policy-keys,Filters access by SES Addon Subscription ARN,ARN
528,ses:ApiVersion,https://docs.aws.amazon.com/IAM/latest/UserGuide/list_amazonses.html#amazonses-policy-keys,Filters access by the SES API version,String
529,ses:ExportSourceType,https://docs.aws.amazon.com/IAM/latest/UserGuide/list_amazonses.html#amazonses-policy-keys,Filters access by the export source type,String
530,ses:FeedbackAddress,https://docs.aws.amazon.com/IAM/latest/UserGuide/list_amazonses.html#amazonses-policy-keys,"Filters access by the ""Return-Path"" address, which specifies where bounces and complaints are sent by email feedback forwarding",String
531,ses:FromAddress,https://docs.aws.amazon.com/IAM/latest/UserGuide/list_amazonses.html#amazonses-policy-keys,"Filters access by the ""From"" address of a message",String
532,ses:FromDisplayName,https://docs.aws.amazon.com/IAM/latest/UserGuide/list_amazonses.html#amazonses-policy-keys,"Filters access by the ""From"" address that is used as the display name of a message",String
533,ses:MailManagerIngressPointType,https://docs.aws.amazon.com/IAM/latest/UserGuide/list_amazonsesmailmanager.html#amazonsesmailmanager-policy-keys,"Filters access by SES Mail Manager ingress point type, for example OPEN or AUTH",String
534,ses:MailManagerRuleSetArn,https://docs.aws.amazon.com/IAM/latest/UserGuide/list_amazonsesmailmanager.html#amazonsesmailmanager-policy-keys,Filters access by SES Mail Manager rule set ARN,ARN
535,ses:MailManagerTrafficPolicyArn,https://docs.aws.amazon.com/IAM/latest/UserGuide/list_amazonsesmailmanager.html#amazonsesmailmanager-policy-keys,Filters access by SES Mail Manager traffic policy ARN,ARN
536,ses:MultiRegionEndpointId,https://docs.aws.amazon.com/IAM/latest/UserGuide/list_amazonses.html#amazonses-policy-keys,Filters access by the multi-region endpoint ID that is used to send email,String
537,ses:Recipients,https://docs.aws.amazon.com/IAM/latest/UserGuide/list_amazonses.html#amazonses-policy-keys,"Filters access by the recipient addresses of a message, which include the ""To"", ""CC"", and ""BCC"" addresses",ArrayOfString
538,ses:ReplicaRegion,https://docs.aws.amazon.com/IAM/latest/UserGuide/list_amazonses.html#amazonses-policy-keys,Filters access by the replica regions for Replicating domain DKIM signing key,ArrayOfString
539,signer:ProfileVersion,https://docs.aws.amazon.com/signer/latest/developerguide/authen-apipermissions.html,Filters access by version of the Signing Profile,String
540,apigateway:Resource/AccessLoggingFormat,https://docs.aws.amazon.com/apigateway/latest/developerguide/security_iam_service-with-iam.html,Filters access by access log format of the current Stage resource. Available during the UpdateStage and DeleteStage operations,String
541,sns:Endpoint,https://docs.aws.amazon.com/sns/latest/dg/UsingIAMwithSNS.html#w2ab1c11c23c19,"Filters access by the URL, email address, or ARN from a Subscribe request or a previously confirmed subscription",String
542,apigateway:Resource/ApiKeyRequired,https://docs.aws.amazon.com/apigateway/latest/developerguide/security_iam_service-with-iam.html,Filters access by the requirement of API key for the existing Route resource. Available during the UpdateRoute and DeleteRoute operations. Also available as a collection during reimport,ArrayOfBool
543,apigateway:Resource/ApiName,https://docs.aws.amazon.com/apigateway/latest/developerguide/security_iam_service-with-iam.html,Filters access by API name of the existing RestApi resource. Available during UpdateRestApi and DeleteRestApi operations,String
544,apigateway:Resource/AuthorizerType,https://docs.aws.amazon.com/apigateway/latest/developerguide/security_iam_service-with-iam.html,"Filters access by the current type of authorizer, for example REQUEST or JWT. Available during UpdateAuthorizer and DeleteAuthorizer operations. Also available during import and reimport as an ArrayOfString",ArrayOfString
545,apigateway:Resource/AuthorizerUri,https://docs.aws.amazon.com/apigateway/latest/developerguide/security_iam_service-with-iam.html,Filters access by URI of a Lambda authorizer function. Available during UpdateAuthorizer and DeleteAuthorizer operations. Also available during reimport as an ArrayOfString,ArrayOfString
546,apigateway:Resource/CognitoUserPoolProviderArn,https://docs.aws.amazon.com/apigateway/latest/developerguide/security_iam_service-with-iam.html,Filters access by Cognito user pool provider ARN. Available during CreateAuthorizer and UpdateAuthorizer,ARN
547,apigateway:Resource/DisableExecuteApiEndpoint,https://docs.aws.amazon.com/apigateway/latest/developerguide/security_iam_service-with-iam.html,Filters access by status of the default execute-api endpoint of the current RestApi resource. Available during UpdateRestApi and DeleteRestApi operations,Bool
548,apigateway:Resource/EndpointType,https://docs.aws.amazon.com/apigateway/latest/developerguide/security_iam_service-with-iam.html,"Filters access by endpoint type. Available during the UpdateDomainName, DeleteDomainName, UpdateApi, and DeleteApi operations",ArrayOfString
549,sns:Protocol,https://docs.aws.amazon.com/sns/latest/dg/UsingIAMwithSNS.html#w2ab1c11c23c19,Filters access by the protocol value from a Subscribe request or a previously confirmed subscription,String
550,ssm:AccessRequestId,https://docs.aws.amazon.com/systems-manager/latest/userguide/auth-and-access-control-iam-access-control-identity-based.html#policy-conditions,Filters access by verifying that a user has access to the access request ID specified in the request,String
551,ssm:AutoApprove,https://docs.aws.amazon.com/systems-manager/latest/userguide/change-manager-auto-approval-access.html,Filters access by verifying that a user has permission to start Change Manager workflows without a review step (with the exception of change freeze events),Bool
552,ssm:DocumentCategories,https://docs.aws.amazon.com/systems-manager/latest/userguide/auth-and-access-control-iam-access-control-identity-based.html#policy-conditions,Filters access by verifying that a user has permission to access a document belonging to a specific category enum,ArrayOfString
553,apigateway:Resource/MtlsTrustStoreUri,https://docs.aws.amazon.com/apigateway/latest/developerguide/security_iam_service-with-iam.html,Filters access by URI of the truststore used for mutual TLS authentication. Available during UpdateDomainName and DeleteDomainName operations,String
554,ssm:DocumentType,https://docs.aws.amazon.com/systems-manager/latest/userguide/auth-and-access-control-iam-access-control-identity-based.html#policy-conditions,"Filters access by verifying that a user has permission to access a document belonging to a specific document type. Only available in ""aws"", ""aws-cn"", and ""aws-us-gov"" partitions",String
555,ssm:Overwrite,https://docs.aws.amazon.com/systems-manager/latest/userguide/parameter-store-policy-conditions.html#overwrite-condition,Filters access by controling whether Systems Manager parameters can be overwritten,String
556,ssm:Policies,https://docs.aws.amazon.com/systems-manager/latest/userguide/parameter-store-policy-conditions.html#parameter-policies-condition,Filters access by controlling whether an IAM Entity (user or role) can create or update a parameter that includes a parameter policy,String
557,ssm:Recursive,https://docs.aws.amazon.com/systems-manager/latest/userguide/parameter-store-policy-conditions.html#recursive-condition,Filters access by Systems Manager parameters created in a hierarchical structure,String
558,ssm:SourceInstanceARN,https://docs.aws.amazon.com/service-authorization/latest/reference/list_awssystemsmanager.html#awssystemsmanager-policy-keys,Filters access by verifying the Amazon Resource Name (ARN) of the AWS Systems Manager's managed instance from which the request is made. This key is not present when the request comes from the managed instance authenticated with an IAM role associated with EC2 instance profile,ARN
559,ssm:SyncType,https://docs.aws.amazon.com/systems-manager/latest/userguide/auth-and-access-control-iam-access-control-identity-based.html#policy-conditions,Filters access by verifying that a user also has access to the ResourceDataSync SyncType specified in the request,String
560,ssm:resourceTag/${TagKey},https://docs.aws.amazon.com/systems-manager/latest/userguide/security_iam_service-with-iam.html#policy-conditions,Filters access by a tag key-value pair assigned to the Systems Manager resource,String
561,ssm:resourceTag/aws:ssmmessages:session-id,https://docs.aws.amazon.com/systems-manager/latest/userguide/auth-and-access-control-iam-access-control-identity-based.html#policy-conditions,Filters access by based on a tag key-value pair assigned to the Systems Manager session resource,String
562,apigateway:Resource/MtlsTrustStoreVersion,https://docs.aws.amazon.com/apigateway/latest/developerguide/security_iam_service-with-iam.html,Filters access by version of the truststore used for mutual TLS authentication. Available during UpdateDomainName and DeleteDomainName operations,String
563,ssm:resourceTag/aws:ssmmessages:target-id,https://docs.aws.amazon.com/systems-manager/latest/userguide/auth-and-access-control-iam-access-control-identity-based.html#policy-conditions,Filters access by based on a tag key-value pair assigned to the Systems Manager session resource,String
564,ssm:resourceTag/tag-key,https://docs.aws.amazon.com/systems-manager/latest/userguide/auth-and-access-control-iam-access-control-identity-based.html#policy-conditions,Filters access by based on a tag key-value pair assigned to the Systems Manager resource,String
565,sso:ApplicationAccount,https://docs.aws.amazon.com/singlesignon/latest/userguide/API_Application.html,Filters access by the account which creates the application,String
566,states:HTTPEndpoint,https://docs.aws.amazon.com/step-functions/latest/dg/connect-third-party-apis.html,Filters access by the endpoint that the HTTP Task state allows in the request,String
567,states:HTTPMethod,https://docs.aws.amazon.com/step-functions/latest/dg/connect-third-party-apis.html,Filters access by the method that the HTTP Task state allows in the request,String
568,apigateway:Resource/RouteAuthorizationType,https://docs.aws.amazon.com/apigateway/latest/developerguide/security_iam_service-with-iam.html,"Filters access by authorization type of the existing Method resource, for example NONE, AWS_IAM, CUSTOM, JWT, COGNITO_USER_POOLS. Available during the PutMethod and DeleteMethod operations. Also available as a collection during reimport",ArrayOfString
569,states:StateMachineQualifier,https://docs.aws.amazon.com/step-functions/latest/dg/auth-version-alias.html,Filters access by the qualifier of a state machine ARN,ArrayOfString
570,apigateway:Resource/SecurityPolicy,https://docs.aws.amazon.com/apigateway/latest/developerguide/security_iam_service-with-iam.html,Filters access by TLS version. Available during UpdateDomain and DeleteDomain operations,ArrayOfString
571,application-autoscaling:scalable-dimension,https://docs.aws.amazon.com/autoscaling/application/userguide/security_iam_service-with-iam.html#security_iam_service-with-iam-id-based-policies-conditionkeys,Filters access by the scalable dimension that is passed in the request,String
572,sts:AWSServiceName,https://docs.aws.amazon.com/IAM/latest/UserGuide/reference_policies_iam-condition-keys.html#ck_awsservicename,Filters access by the service that is obtaining a bearer token,String
573,application-autoscaling:service-namespace,https://docs.aws.amazon.com/autoscaling/application/userguide/security_iam_service-with-iam.html#security_iam_service-with-iam-id-based-policies-conditionkeys,Filters access by the service namespace that is passed in the request,String
574,apprunner:AutoScalingConfigurationArn,${UserGuideDocPage}security_iam_service-with-iam.html#security_iam_service-with-iam-resource-based-policies,Filters access by the CreateService and UpdateService actions based on the ARN of an associated AutoScalingConfiguration resource,ARN
575,apprunner:ConnectionArn,${UserGuideDocPage}security_iam_service-with-iam.html#security_iam_service-with-iam-resource-based-policies,Filters access by the CreateService and UpdateService actions based on the ARN of an associated Connection resource,ARN
576,apprunner:ObservabilityConfigurationArn,${UserGuideDocPage}security_iam_service-with-iam.html#security_iam_service-with-iam-resource-based-policies,Filters access by the CreateService and UpdateService actions based on the ARN of an associated ObservabilityConfiguration resource,ARN
