condition_key_id,name,reference_url,description,type
683,ecs:CreateAction,https://docs.aws.amazon.com/IAM/latest/UserGuide/reference_policies_condition-keys.html#condition-keys-createaction,Filters access by the name of a resource-creating API action,String
684,ecs:ResourceTag/${TagKey},https://docs.aws.amazon.com/AmazonECS/latest/developerguide/security_iam_service-with-iam.html#security_iam_service-with-iam-id-based-policies,Filters access by the tag key-value pairs attached to the resource,String
685,ecs:account-setting,https://docs.aws.amazon.com/AmazonECS/latest/developerguide/security_iam_service-with-iam.html#security_iam_service-with-iam-id-based-policies-conditionkeys,Filters access by the Amazon ECS account setting name,String
686,ecs:auto-assign-public-ip,https://docs.aws.amazon.com/AmazonECS/latest/developerguide/security_iam_service-with-iam.html#security_iam_service-with-iam-id-based-policies-conditionkeys,Filters access by the public IP assignment configuration of your Amazon ECS task or Amazon ECS service that uses awsvpc network mode,Bool
687,ecs:capacity-provider,https://docs.aws.amazon.com/AmazonECS/latest/developerguide/security_iam_service-with-iam.html#security_iam_service-with-iam-id-based-policies-conditionkeys,Filters access by the ARN of an Amazon ECS capacity provider,ArrayOfARN
688,ecs:cluster,https://docs.aws.amazon.com/AmazonECS/latest/developerguide/security_iam_service-with-iam.html#security_iam_service-with-iam-id-based-policies-conditionkeys,Filters access by the ARN of an Amazon ECS cluster,ARN
689,ecs:compute-compatibility,https://docs.aws.amazon.com/AmazonECS/latest/developerguide/security_iam_service-with-iam.html#security_iam_service-with-iam-id-based-policies-conditionkeys,Filters access by the required compatibilities field provided in the request,ArrayOfString
690,ecs:container-instances,https://docs.aws.amazon.com/AmazonECS/latest/developerguide/security_iam_service-with-iam.html#security_iam_service-with-iam-id-based-policies-conditionkeys,Filters access by the ARN of an Amazon ECS container instance,ARN
691,ecs:container-name,https://docs.aws.amazon.com/AmazonECS/latest/developerguide/security_iam_service-with-iam.html#security_iam_service-with-iam-id-based-policies-conditionkeys,Filters access by the name of an Amazon ECS container which is defined in the ECS task definition,String
692,ecs:enable-ebs-volumes,https://docs.aws.amazon.com/AmazonECS/latest/developerguide/security_iam_service-with-iam.html#security_iam_service-with-iam-id-based-policies-conditionkeys,Filters access by the Amazon ECS managed Amazon EBS volume capability of your ECS task or service,String
693,ecs:enable-ecs-managed-tags,https://docs.aws.amazon.com/AmazonECS/latest/developerguide/security_iam_service-with-iam.html#security_iam_service-with-iam-id-based-policies-conditionkeys,Filters access by the enableECSManagedTags configuration of your Amazon ECS task or Amazon ECS service,Bool
694,ecs:enable-execute-command,https://docs.aws.amazon.com/AmazonECS/latest/developerguide/security_iam_service-with-iam.html#security_iam_service-with-iam-id-based-policies-conditionkeys,Filters access by the execute-command capability of your Amazon ECS task or Amazon ECS service,String
695,ecs:enable-service-connect,https://docs.aws.amazon.com/AmazonECS/latest/developerguide/security_iam_service-with-iam.html#security_iam_service-with-iam-id-based-policies-conditionkeys,Filters access by the enable field value in the Service Connect configuration,String
696,ecs:enable-vpc-lattice,https://docs.aws.amazon.com/AmazonECS/latest/developerguide/security_iam_service-with-iam.html#security_iam_service-with-iam-id-based-policies-conditionkeys,Filters access by the VPC lattice capability of your Amazon ECS service,String
697,ecs:fargate-ephemeral-storage-kms-key,https://docs.aws.amazon.com/AmazonECS/latest/developerguide/security_iam_service-with-iam.html#security_iam_service-with-iam-id-based-policies-conditionkeys,Filters access by the AWS KMS key id provided in the request,String
698,ecs:namespace,https://docs.aws.amazon.com/AmazonECS/latest/developerguide/security_iam_service-with-iam.html#security_iam_service-with-iam-id-based-policies-conditionkeys,Filters access by the ARN of AWS Cloud Map namespace which is defined in the Service Connect Configuration,ARN
699,ecs:privileged,https://docs.aws.amazon.com/AmazonECS/latest/developerguide/security_iam_service-with-iam.html#security_iam_service-with-iam-id-based-policies-conditionkeys,Filters access by the privileged field provided in the request,String
700,ecs:propagate-tags,https://docs.aws.amazon.com/AmazonECS/latest/developerguide/security_iam_service-with-iam.html#security_iam_service-with-iam-id-based-policies-conditionkeys,Filters access by the tag propagation configuration of your Amazon ECS task or Amazon ECS service,String
701,ecs:service,https://docs.aws.amazon.com/AmazonECS/latest/developerguide/security_iam_service-with-iam.html#security_iam_service-with-iam-id-based-policies-conditionkeys,Filters access by the ARN of an Amazon ECS service,ARN
702,ecs:subnet,https://docs.aws.amazon.com/AmazonECS/latest/developerguide/security_iam_service-with-iam.html#security_iam_service-with-iam-id-based-policies-conditionkeys,Filters access by the subnet configuration of your Amazon ECS task or Amazon ECS service that uses awsvpc network mode,ArrayOfString
703,ecs:task,https://docs.aws.amazon.com/AmazonECS/latest/developerguide/security_iam_service-with-iam.html#security_iam_service-with-iam-id-based-policies-conditionkeys,Filters access by the ARN of an Amazon ECS task,ARN
704,ecs:task-cpu,https://docs.aws.amazon.com/AmazonECS/latest/developerguide/security_iam_service-with-iam.html#security_iam_service-with-iam-id-based-policies-conditionkeys,"Filters access by the task cpu, as an integer with 1024 = 1 vCPU, provided in the request",Numeric
705,ecs:task-definition,https://docs.aws.amazon.com/AmazonECS/latest/developerguide/security_iam_service-with-iam.html#security_iam_service-with-iam-id-based-policies-conditionkeys,Filters access by the ARN of an Amazon ECS task definition,ARN
706,ecs:task-memory,https://docs.aws.amazon.com/AmazonECS/latest/developerguide/security_iam_service-with-iam.html#security_iam_service-with-iam-id-based-policies-conditionkeys,"Filters access by the task memory, as an integer representing MiB, provided in the request",Numeric
707,eks:accessEntryType,https://docs.aws.amazon.com/eks/latest/userguide/security_iam_service-with-iam.html#security_iam_service-with-iam-id-based-policies,Filters access by the access entry type present in the access entry requests the user makes to the EKS service,String
708,eks:accessScope,https://docs.aws.amazon.com/eks/latest/userguide/security_iam_service-with-iam.html#security_iam_service-with-iam-id-based-policies,Filters access by the accessScope present in the associate / disassociate access policy requests the user makes to the EKS service,String
709,eks:authenticationMode,https://docs.aws.amazon.com/eks/latest/userguide/security_iam_service-with-iam.html#security_iam_service-with-iam-id-based-policies,Filters access by the authenticationMode present in the create / update cluster request,String
710,eks:blockStorageEnabled,https://docs.aws.amazon.com/eks/latest/userguide/security_iam_service-with-iam.html#security_iam_service-with-iam-id-based-policies,Filters access by the block storage enabled parameter in the create / update cluster request,Bool
711,eks:bootstrapClusterCreatorAdminPermissions,https://docs.aws.amazon.com/eks/latest/userguide/security_iam_service-with-iam.html#security_iam_service-with-iam-id-based-policies,Filters access by the bootstrapClusterCreatorAdminPermissions present in the create cluster request,Bool
712,eks:bootstrapSelfManagedAddons,https://docs.aws.amazon.com/eks/latest/userguide/security_iam_service-with-iam.html#security_iam_service-with-iam-id-based-policies,Filters access by the bootstrapSelfManagedAddons present in the create cluster request,Bool
713,eks:clientId,https://docs.aws.amazon.com/eks/latest/userguide/security_iam_service-with-iam.html#security_iam_service-with-iam-id-based-policies,Filters access by the clientId present in the associateIdentityProviderConfig request the user makes to the EKS service,String
714,eks:clusterName,https://docs.aws.amazon.com/eks/latest/userguide/security_iam_service-with-iam.html#security_iam_service-with-iam-id-based-policies,Filters access by the clusterName present in the access entry requests the user makes to the EKS service,String
715,eks:computeConfigEnabled,https://docs.aws.amazon.com/eks/latest/userguide/security_iam_service-with-iam.html#security_iam_service-with-iam-id-based-policies,Filters access by the compute config enabled parameter in the create / update cluster request,Bool
716,eks:elasticLoadBalancingEnabled,https://docs.aws.amazon.com/eks/latest/userguide/security_iam_service-with-iam.html#security_iam_service-with-iam-id-based-policies,Filters access by the elastic load balancing enabled parameter in the create / update cluster request,Bool
717,eks:issuerUrl,https://docs.aws.amazon.com/eks/latest/userguide/security_iam_service-with-iam.html#security_iam_service-with-iam-id-based-policies,Filters access by the issuerUrl present in the associateIdentityProviderConfig request the user makes to the EKS service,String
718,eks:kubernetesGroups,https://docs.aws.amazon.com/eks/latest/userguide/security_iam_service-with-iam.html#security_iam_service-with-iam-id-based-policies,Filters access by the kubernetesGroups present in the access entry requests the user makes to the EKS service,ArrayOfString
719,eks:loggingType/${type},https://docs.aws.amazon.com/eks/latest/userguide/security_iam_service-with-iam.html#security_iam_service-with-iam-id-based-policies,Filters access by the cluster logging enabled and type parameter in the create / update cluster request,Bool
720,saml:edupersonassurance,https://docs.aws.amazon.com/IAM/latest/UserGuide/reference_policies_iam-condition-keys.html#ck_edupersonassurance,Filters access by the eduPerson attribute,ArrayOfString
721,eks:namespaces,https://docs.aws.amazon.com/eks/latest/userguide/security_iam_service-with-iam.html#security_iam_service-with-iam-id-based-policies,Filters access by the namespaces present in the associate / disassociate access policy requests the user makes to the EKS service,ArrayOfString
722,eks:policyArn,https://docs.aws.amazon.com/eks/latest/userguide/security_iam_service-with-iam.html#security_iam_service-with-iam-id-based-policies,Filters access by the policyArn present in the access entry requests the user makes to the EKS service,ARN
723,saml:edupersonentitlement,https://docs.aws.amazon.com/IAM/latest/UserGuide/reference_policies_iam-condition-keys.html#ck_edupersonentitlement,Filters access by the eduPerson attribute,ArrayOfString
724,saml:edupersonnickname,https://docs.aws.amazon.com/IAM/latest/UserGuide/reference_policies_iam-condition-keys.html#ck_edupersonnickname,Filters access by the eduPerson attribute,ArrayOfString
725,saml:edupersonorgdn,https://docs.aws.amazon.com/IAM/latest/UserGuide/reference_policies_iam-condition-keys.html#ck_edupersonorgdn,Filters access by the eduPerson attribute,String
726,saml:edupersonorgunitdn,https://docs.aws.amazon.com/IAM/latest/UserGuide/reference_policies_iam-condition-keys.html#ck_edupersonorgunitdn,Filters access by the eduPerson attribute,ArrayOfString
727,saml:edupersonprimaryaffiliation,https://docs.aws.amazon.com/IAM/latest/UserGuide/reference_policies_iam-condition-keys.html#ck_edupersonprimaryaffiliation,Filters access by the eduPerson attribute,String
728,license-manager:ResourceTag/${TagKey},https://docs.aws.amazon.com/license-manager/latest/userguide/identity-access-management.html,Filters access by the tag key-value pairs attached to the resource,String
729,eks:principalArn,https://docs.aws.amazon.com/eks/latest/userguide/security_iam_service-with-iam.html#security_iam_service-with-iam-id-based-policies,Filters access by the principalArn present in the access entry requests requests the user makes to the EKS service,ARN
730,logs:DeliveryDestinationResourceArn,https://docs.aws.amazon.com/AmazonCloudWatch/latest/logs/iam-identity-based-access-control-cwl.html,Filters access by the Log Destination ARN passed in the request,ARN
731,eks:supportType,https://docs.aws.amazon.com/eks/latest/userguide/security_iam_service-with-iam.html#security_iam_service-with-iam-id-based-policies,Filters access by the supportType present in the create / update cluster request,String
732,logs:LogGeneratingResourceArns,https://docs.aws.amazon.com/AmazonCloudWatch/latest/logs/iam-identity-based-access-control-cwl.html,Filters access by LogGeneratingResourceArn in the request,ArrayOfARN
733,saml:edupersonprimaryorgunitdn,https://docs.aws.amazon.com/IAM/latest/UserGuide/reference_policies_iam-condition-keys.html#ck_edupersonprimaryorgunitdn,Filters access by the eduPerson attribute,String
734,lookoutequipment:IsImportingData,https://docs.aws.amazon.com/IAM/latest/UserGuide/reference_policies_condition-keys.html#condition-keys-isimportingdata,Filters access by the import strategy of underlying data,Bool
735,mediaconvert:HttpInputsAllowed,https://docs.aws.amazon.com/mediaconvert/latest/apireference/input-policies.html,Filters access by an HTTP input policy present in the account,Bool
736,mediaconvert:HttpsInputsAllowed,https://docs.aws.amazon.com/mediaconvert/latest/apireference/input-policies.html,Filters access by an HTTPS input policy present in the account,Bool
737,mediaconvert:S3InputsAllowed,https://docs.aws.amazon.com/mediaconvert/latest/apireference/input-policies.html,Filters access by an S3 input policy present in the account,Bool
738,memorydb:TLSEnabled,https://docs.aws.amazon.com/memorydb/latest/devguide/IAM.ConditionKeys.html#IAM.SpecifyingConditions,Filters access by the TLSEnabled parameter present in the request or defaults to true value if parameter is not present,Bool
739,eks:username,https://docs.aws.amazon.com/eks/latest/userguide/security_iam_service-with-iam.html#security_iam_service-with-iam-id-based-policies,Filters access by the Kubernetes username present in the access entry requests the user makes to the EKS service,String
740,memorydb:UserAuthenticationMode,https://docs.aws.amazon.com/memorydb/latest/devguide/IAM.ConditionKeys.html#IAM.SpecifyingConditions,Filters access by the UserAuthenticationMode.Type parameter in the request,String
741,mgh:AutomationRunResourceRunID,https://docs.aws.amazon.com/migrationhub/latest/ug/ContextKeys_AutomationRunResourceRunID.html,AutomationRunResource resource runID identifier,String
742,saml:edupersonprincipalname,https://docs.aws.amazon.com/IAM/latest/UserGuide/reference_policies_iam-condition-keys.html#ck_edupersonprincipalname,Filters access by the eduPerson attribute,String
743,elasticache:AtRestEncryptionEnabled,,,
744,elasticache:AuthTokenEnabled,,,
745,elasticache:AutomaticFailoverEnabled,,,
746,saml:edupersonscopedaffiliation,https://docs.aws.amazon.com/IAM/latest/UserGuide/reference_policies_iam-condition-keys.html#ck_edupersonscopedaffiliation,Filters access by the eduPerson attribute,ArrayOfString
747,elasticache:CacheNodeType,,,
748,mgh:AutomationUnitResourceAutomationUnitArn,https://docs.aws.amazon.com/migrationhub/latest/ug/ContextKeys_AutomationUnitResourceAutomationUnitArn.html,AutomationUnitResource resource automationUnitArn identifier,ARN
749,elasticache:CacheParameterGroupName,,,
750,elasticache:ClusterModeEnabled,,,
751,elasticache:DataStorageUnit,,,
752,elasticache:EngineType,,,
753,elasticache:EngineVersion,,,
754,elasticache:KmsKeyId,,,
755,elasticache:MaximumDataStorage,,,
756,elasticache:MaximumECPUPerSecond,,,
757,elasticache:MinimumDataStorage,,,
758,elasticache:MinimumECPUPerSecond,,,
759,elasticache:MultiAZEnabled,,,
760,elasticache:NumNodeGroups,,,
761,elasticache:ReplicasPerNodeGroup,,,
762,elasticache:SnapshotRetentionLimit,,,
763,elasticache:TransitEncryptionEnabled,,,
764,elasticache:UserAuthenticationMode,,,
765,elasticbeanstalk:FromApplication,https://docs.aws.amazon.com/elasticbeanstalk/latest/dg/AWSHowTo.iam.policies.actions.html#AWSHowTo.iam.policies.conditions,Filters access by an application as a dependency or a constraint on an input parameter,ARN
766,elasticbeanstalk:FromApplicationVersion,https://docs.aws.amazon.com/elasticbeanstalk/latest/dg/AWSHowTo.iam.policies.actions.html#AWSHowTo.iam.policies.conditions,Filters access by an application version as a dependency or a constraint on an input parameter,ARN
767,elasticbeanstalk:FromConfigurationTemplate,https://docs.aws.amazon.com/elasticbeanstalk/latest/dg/AWSHowTo.iam.policies.actions.html#AWSHowTo.iam.policies.conditions,Filters access by a configuration template as a dependency or a constraint on an input parameter,ARN
768,elasticbeanstalk:FromEnvironment,https://docs.aws.amazon.com/elasticbeanstalk/latest/dg/AWSHowTo.iam.policies.actions.html#AWSHowTo.iam.policies.conditions,Filters access by an environment as a dependency or a constraint on an input parameter,ARN
769,elasticbeanstalk:FromPlatform,https://docs.aws.amazon.com/elasticbeanstalk/latest/dg/AWSHowTo.iam.policies.actions.html#AWSHowTo.iam.policies.conditions,Filters access by a platform as a dependency or a constraint on an input parameter,ARN
770,elasticbeanstalk:FromSolutionStack,https://docs.aws.amazon.com/elasticbeanstalk/latest/dg/AWSHowTo.iam.policies.actions.html#AWSHowTo.iam.policies.conditions,Filters access by a solution stack as a dependency or a constraint on an input parameter,ARN
771,elasticbeanstalk:InApplication,https://docs.aws.amazon.com/elasticbeanstalk/latest/dg/AWSHowTo.iam.policies.actions.html#AWSHowTo.iam.policies.conditions,Filters access by the application that contains the resource that the action operates on,ARN
772,elasticfilesystem:AccessPointArn,https://docs.aws.amazon.com/efs/latest/ug/efs-access-points.html,Filters access by the ARN of the access point used to mount the file system,ARN
773,elasticfilesystem:AccessedViaMountTarget,https://docs.aws.amazon.com/efs/latest/ug/mounting-fs.html,Filters access by whether the file system is accessed via mount targets,Bool
774,elasticfilesystem:CreateAction,https://docs.aws.amazon.com/efs/latest/ug/using-tags-efs.html,Filters access by the name of a resource-creating API action,String
775,elasticfilesystem:Encrypted,https://docs.aws.amazon.com/efs/latest/ug/encryption.html,Filters access by whether users can create only encrypted or unencrypted file systems,Bool
776,elasticloadbalancing:CreateAction,https://docs.aws.amazon.com/elasticloadbalancing/latest/userguide/tagging-resources-during-creation.html,Filters access by the name of a resource-creating API action,String
777,elasticloadbalancing:ListenerProtocol,https://docs.aws.amazon.com/elasticloadbalancing/latest/userguide/security_iam_service-with-iam.html#listenerprotocol-condition,Filters access by the listener protocol that is allowed in the request,ArrayOfString
778,elasticloadbalancing:ResourceTag/,https://docs.aws.amazon.com/IAM/latest/UserGuide/reference_policies_condition-keys.html#condition-keys-resourcetag,Filters access by the preface string for a tag key and value pair that are attached to a resource,String
779,elasticloadbalancing:ResourceTag/${TagKey},https://docs.aws.amazon.com/IAM/latest/UserGuide/reference_policies_condition-keys.html#condition-keys-resourcetag,Filters access by the preface string for a tag key and value pair that are attached to a resource,String
780,elasticloadbalancing:Scheme,https://docs.aws.amazon.com/elasticloadbalancing/latest/userguide/security_iam_service-with-iam.html#scheme-condition,Filters access by the load balancer scheme that are allowed in the request,String
781,elasticloadbalancing:SecurityGroup,https://docs.aws.amazon.com/elasticloadbalancing/latest/userguide/security_iam_service-with-iam.html#securitygroup-condition,Filters access by the security-group IDs that are allowed in the request,ArrayOfString
782,elasticloadbalancing:SecurityPolicy,https://docs.aws.amazon.com/elasticloadbalancing/latest/userguide/security_iam_service-with-iam.html#securitypolicy-condition,Filters access by the SSL Security Policies that are allowed in the request,ArrayOfString
783,elasticloadbalancing:Subnet,https://docs.aws.amazon.com/elasticloadbalancing/latest/userguide/security_iam_service-with-iam.html#subnet-condition,Filters access by the subnet IDs that are allowed in the request,ArrayOfString
784,elasticmapreduce:ExecutionRoleArn,https://docs.aws.amazon.com/emr/latest/ManagementGuide/emr-plan-access-iam.html#emr-security,Filters access by whether the execution role ARN is provided with the action,ARN
785,elasticmapreduce:RequestTag/${TagKey},https://docs.aws.amazon.com/emr/latest/ManagementGuide/emr-plan-access-iam.html#emr-fine-grained-cluster-access,Filters access by whether the tag and value pair is provided with the action,String
786,elasticmapreduce:ResourceTag/${TagKey},https://docs.aws.amazon.com/emr/latest/ManagementGuide/emr-plan-access-iam.html#emr-fine-grained-cluster-access,Filters access by the tag and value pair associated with an Amazon EMR resource,String
787,emr-containers:ExecutionRoleArn,https://docs.aws.amazon.com/emr/latest/EMR-on-EKS-DevelopmentGuide/iam-execution-role.html,Filters access by the execution role arn present in the request,ARN
788,emr-containers:JobTemplateArn,https://docs.aws.amazon.com/emr/latest/EMR-on-EKS-DevelopmentGuide/iam-job-template.html,Filters access by the job template arn present in the request,ARN
789,events:EventBusArn,https://docs.aws.amazon.com/eventbridge/latest/userguide/policy-keys-eventbridge.html#limiting-access-to-event-buses,Filters access by the ARN of the event buses that can be associated with an endpoint to CreateEndpoint and UpdateEndpoint actions,ArrayOfARN
790,events:ManagedBy,https://docs.aws.amazon.com/eventbridge/latest/userguide/policy-keys-eventbridge.html,"Filters access by AWS services. If a rule is created by an AWS service on your behalf, the value is the principal name of the service that created the rule",String
791,events:TargetArn,https://docs.aws.amazon.com/eventbridge/latest/userguide/policy-keys-eventbridge.html#limiting-access-to-targets,Filters access by the ARN of a target that can be put to a rule to PutTargets actions. TargetARN doesn't include DeadLetterConfigArn,ArrayOfARN
792,events:creatorAccount,https://docs.aws.amazon.com/eventbridge/latest/userguide/policy-keys-eventbridge.html#events-creator-account,Filters access by the account the rule was created in to rule actions,String
793,events:detail-type,https://docs.aws.amazon.com/eventbridge/latest/userguide/policy-keys-eventbridge.html#events-pattern-detail-type,Filters access by the literal string of the detail-type of the event to PutEvents and PutRule actions,ArrayOfString
794,events:detail.eventTypeCode,https://docs.aws.amazon.com/eventbridge/latest/userguide/policy-keys-eventbridge.html#limit-rule-by-type-code,Filters access by the literal string for the detail.eventTypeCode field of the event to PutRule actions,String
795,events:detail.service,https://docs.aws.amazon.com/eventbridge/latest/userguide/policy-keys-eventbridge.html#limit-rule-by-service,Filters access by the literal string for the detail.service field of the event to PutRule actions,String
796,events:detail.userIdentity.principalId,https://docs.aws.amazon.com/eventbridge/latest/userguide/policy-keys-eventbridge.html#consume-specific-events,Filters access by the literal string for the detail.useridentity.principalid field of the event to PutRule actions,String
797,events:eventBusInvocation,https://docs.aws.amazon.com/eventbridge/latest/userguide/policy-keys-eventbridge.html#events-bus-invocation,Filters access by whether the event was generated via API or cross-account bus invocation to PutEvents actions,String
798,events:source,https://docs.aws.amazon.com/eventbridge/latest/userguide/policy-keys-eventbridge.html#events-limit-access-control,Filters access by the AWS service or AWS partner event source that generated the event to PutEvents and PutRule actions. Matches the literal string of the source field of the event,ArrayOfString
799,execute-api:viaDomainArn,https://docs.aws.amazon.com/apigateway/latest/developerguide/security_iam_service-with-iam.html,Filters access by the DomainName ARN the API is called from,ARN
800,fis:Operations,https://docs.aws.amazon.com/fis/latest/userguide/security_iam_service-with-iam.html,Filters access by the list of operations on the AWS service that is being affected by the AWS FIS action,ArrayOfString
801,fis:Percentage,https://docs.aws.amazon.com/fis/latest/userguide/security_iam_service-with-iam.html,Filters access by the percentage of calls being affected by the AWS FIS action,Numeric
802,fis:Service,https://docs.aws.amazon.com/fis/latest/userguide/security_iam_service-with-iam.html,Filters access by the AWS service that is being affected by the AWS FIS action,String
803,fis:Targets,https://docs.aws.amazon.com/fis/latest/userguide/security_iam_service-with-iam.html,Filters access by the list of resource ARNs being targeted by the AWS FIS action,ArrayOfString
804,fsx:IsBackupCopyDestination,https://docs.aws.amazon.com/fsx/latest/WindowsGuide/using-backups.html#copy-backups,Filters access by whether the backup is a destination backup for a CopyBackup operation,Bool
805,fsx:IsBackupCopySource,https://docs.aws.amazon.com/fsx/latest/WindowsGuide/using-backups.html#copy-backups,Filters access by whether the backup is a source backup for a CopyBackup operation,Bool
806,fsx:NfsDataRepositoryAuthenticationEnabled,https://docs.aws.amazon.com/fsx/latest/FileCacheGuide/encryption-in-transit.html,Filters access by NFS data repositories which support authentication,Bool
